site,rank,title,link
Al Jazeera,1,Gunfight in Baghdad kills one as paramilitary group storms ministry,https://www.aljazeera.com/news/2025/7/27/gunfight-in-baghdad-leaves-one-dead-as-paramilitary-group-storms-ministry?traffic_source=rss
Al Jazeera,2,Countries denounce Israel but keep trading with it,https://www.aljazeera.com/news/2025/7/27/countries-denounce-israel-but-keep-trading-with-it?traffic_source=rss
Al Jazeera,3,Has the US cancelled free speech?,https://www.aljazeera.com/video/the-bottom-line/2025/7/27/has-the-us-cancelled-free-speech?traffic_source=rss
Al Jazeera,4,Iran’s plan to abandon GPS is about much more than technology,https://www.aljazeera.com/opinions/2025/7/27/irans-plan-to-abandon-gps-is-about-much-more-than-technology?traffic_source=rss
Al Jazeera,5,Israeli forces storm Gaza-bound aid ship Handala in international waters,https://www.aljazeera.com/video/newsfeed/2025/7/27/israeli-forces-storm-gaza-bound-aid-ship-handala-in-international-waters?traffic_source=rss
Al Jazeera,6,Video: Israel drops aid on Gaza after months of forced starvation,https://www.aljazeera.com/video/newsfeed/2025/7/27/video-israel-drops-aid-on-gaza-after-months-of-forced-starvation?traffic_source=rss
Al Jazeera,7,‘Apocalypse’: Turkiye wildfires reach key northwest city as hundreds flee,https://www.aljazeera.com/news/2025/7/27/apocalypse-turkey-wildfires-reach-key-northwest-city-as-hundreds-flee?traffic_source=rss
Al Jazeera,8,Sabina Tanovic: How architecture shapes memory and justice,https://www.aljazeera.com/video/talk-to-al-jazeera/2025/7/27/sabina-tanovic-how-architecture-shapes-memory-and-justice?traffic_source=rss
Al Jazeera,9,At least 38 killed in church attack in eastern DR Congo,https://www.aljazeera.com/news/2025/7/27/at-least-38-killed-in-church-attack-in-eastern-dr-congo?traffic_source=rss
Al Jazeera,10,US-EU trade talks: Will Ursula von der Leyen clinch a deal with Trump?,https://www.aljazeera.com/news/2025/7/27/us-eu-trade-talks-will-ursula-von-der-leyen-clinch-a-deal-with-trump?traffic_source=rss
Al Jazeera,11,The Mom Who Fought a Cartel | True Crime Reports,https://www.aljazeera.com/video/true-crime-reports/2025/7/27/the-mom-who-fought-a-cartel-true-crime-reports?traffic_source=rss
Al Jazeera,12,"Two friends, one war and the RSF’s reign of terror in Khartoum",https://www.aljazeera.com/news/2025/7/27/two-friends-one-war-and-the-rsfs-reign-of-terror-in-khartoum?traffic_source=rss
Al Jazeera,13,‘Not eating for days’: Gaza’s worsening starvation crisis,https://www.aljazeera.com/gallery/2025/7/27/not-eating-for-days-gazas-worsening-starvation-crisis?traffic_source=rss
Al Jazeera,14,Trump’s ceasefire push fails to stop Thailand-Cambodia border clashes,https://www.aljazeera.com/news/2025/7/27/trumps-ceasefire-push-fails-to-stop-thailand-cambodia-border-clashes?traffic_source=rss
Al Jazeera,15,Israeli aid airdrop injures Palestinians in north Gaza; Hamas condemns move,https://www.aljazeera.com/news/2025/7/27/israeli-aid-airdrop-injures-palestinians-in-north-gaza-hamas-condemns-move?traffic_source=rss
Al Jazeera,16,Israeli military begins daily ‘tactical pause’ in parts of starving Gaza,https://www.aljazeera.com/news/2025/7/27/israeli-military-begins-daily-tactical-pause-in-parts-of-starving-gaza?traffic_source=rss
Al Jazeera,17,Week in Pictures: From Gaza starvation deaths to Thailand-Cambodia clashes,https://www.aljazeera.com/gallery/2025/7/27/week-in-pictures-from-gaza-starvation-deaths-to-thailand-cambodia-clashes?traffic_source=rss
Al Jazeera,18,Chaotic scenes as desperately-hungry Palestinians scramble for aid in Gaza,https://www.aljazeera.com/video/newsfeed/2025/7/27/chaotic-scenes-as-desperately-hungry-palestinians-scramble-for-aid-in-gaza?traffic_source=rss
Al Jazeera,19,Activist confronts Israeli Navy before soldiers raid Handala aid ship,https://www.aljazeera.com/video/newsfeed/2025/7/27/activist-confronts-israeli-navy-before-soldiers-raid-handala-aid-ship?traffic_source=rss
Al Jazeera,20,Greece battles major wildfires amid persistent heatwave,https://www.aljazeera.com/gallery/2025/7/27/greece-battles-major-wildfires-amid-persistent-heatwave?traffic_source=rss
