site,rank,title,link
Al Jazeera,1,Iranian drone strikes US military facility in Kuwait,https://www.aljazeera.com/video/newsfeed/2026/3/1/iranian-drone-strikes-us-military-facility-in-kuwait?traffic_source=rss
Al Jazeera,2,US confirms three soldiers killed in Iran attacks,https://www.aljazeera.com/video/newsfeed/2026/3/1/us-confirms-three-soldiers-killed-in-iran-attacks?traffic_source=rss
Al Jazeera,3,Missile strikes continue as Iranian leaders project defiance after Khamenei,https://www.aljazeera.com/news/2026/3/1/missile-strikes-continue-as-iranian-leaders-project-defiance-after-khamenei?traffic_source=rss
Al Jazeera,4,Iran after Ayatollah Ali Khamenei,https://www.aljazeera.com/opinions/2026/3/1/iran-after-ayatollah-ali-khamenei?traffic_source=rss
Al Jazeera,5,Arsenal restore five-point lead at top of table with 2-1 win over Chelsea,https://www.aljazeera.com/sports/2026/3/1/arsenal-restore-five-point-lead-at-top-of-table-with-2-1-win-over-chelsea?traffic_source=rss
Al Jazeera,6,Iran foreign minister suggests new supreme leader may be chosen within days,https://www.aljazeera.com/news/2026/3/1/iran-foreign-minister-suggests-new-supreme-leader-may-be-chosen-within-days?traffic_source=rss
Al Jazeera,7,India beat West Indies by five wickets to enter T20 World Cup semifinals,https://www.aljazeera.com/sports/2026/3/1/india-beat-west-indies-by-five-wickets-to-enter-t20-world-cup-semifinals?traffic_source=rss
Al Jazeera,8,Black smoke pours from oil tanker near Strait of Hormuz,https://www.aljazeera.com/video/newsfeed/2026/3/1/black-smoke-pours-from-oil-tanker-near-strait-of-hormuz?traffic_source=rss
Al Jazeera,9,“Trump chose an avoidable war over a good deal.”,https://www.aljazeera.com/video/newsfeed/2026/3/1/trump-chose-an-avoidable-war-over-a-good-deal?traffic_source=rss
Al Jazeera,10,Moment Iranian drone hits UAE naval base,https://www.aljazeera.com/video/newsfeed/2026/3/1/moment-iranian-drone-hits-uae-naval-base?traffic_source=rss
Al Jazeera,11,Who are the council members temporarily in charge of Iran?,https://www.aljazeera.com/news/2026/3/1/who-are-the-council-members-temporarily-in-charge-of-iran?traffic_source=rss
Al Jazeera,12,At least three US service members killed during Iran operation: CENTCOM,https://www.aljazeera.com/news/2026/3/1/at-least-three-us-service-members-killed-during-iran-operation-centcom?traffic_source=rss
Al Jazeera,13,Iranian missile strike on Israel’s Beit Shemesh kills nine people,https://www.aljazeera.com/gallery/2026/3/1/iranian-missile-strike-on-israels-beit-shemesh-kills-nine-people?traffic_source=rss
Al Jazeera,14,Who are Iran’s senior figures killed in US-Israeli attacks?,https://www.aljazeera.com/news/2026/3/1/who-are-irans-senior-figures-killed-in-us-israeli-attacks?traffic_source=rss
Al Jazeera,15,US-Israel attacks on Iran: Death toll and injuries live tracker,https://www.aljazeera.com/news/2026/3/1/us-israel-attacks-on-iran-death-toll-and-injuries-live-tracker?traffic_source=rss
Al Jazeera,16,Iranian attack on Beit Shemesh kills several in Israel,https://www.aljazeera.com/video/newsfeed/2026/3/1/iranian-attack-on-beit-shemesh-kills-several-in-israel?traffic_source=rss
Al Jazeera,17,How did air traffic change in the last 48 hours?,https://www.aljazeera.com/video/newsfeed/2026/3/1/how-did-air-traffic-change-in-the-last-48-hours?traffic_source=rss
Al Jazeera,18,"Who was Iran’s supreme leader, Ayatollah Ali Khamenei?",https://www.aljazeera.com/video/newsfeed/2026/3/1/who-was-irans-supreme-leader-ayatollah-ali-khamenei?traffic_source=rss
Al Jazeera,19,At least nine killed after Iranian strike on Israel’s Beit Shemesh,https://www.aljazeera.com/news/2026/3/1/at-least-nine-killed-after-iranian-strike-on-israels-beit-shemesh?traffic_source=rss
Al Jazeera,20,Has Trump misunderstood Iran’s IRGC and the Basij forces?,https://www.aljazeera.com/features/2026/3/1/has-trump-misunderstood-irans-irgc-and-the-basij-forces?traffic_source=rss
Associated Press,1,"Iran’s Supreme Leader Ayatollah Ali Khamenei, who led the Islamic Republic since 1989, is dead at 86",https://apnews.com/article/iran-supreme-leader-ayatollah-ali-khamenei-dead-5b13b69b708c4ed38e8f95f5fb41a597
Associated Press,2,How succession works in Iran and who could be the country's next supreme leader,https://apnews.com/article/iran-supreme-leader-khamenei-succession-c1d1505581d36ffc84d3ededcb10a7d5
Associated Press,3,"Suspect in Texas shooting wore 'Property of Allah' clothing and Iranian flag emblem, AP source says",https://apnews.com/article/austin-texas-bar-shooting-7690f931ba00f950c1828cef25399bb6
Associated Press,4,Cher's son charged with simple assault and trespassing at New Hampshire private school,https://apnews.com/article/cher-gregg-allman-son-arrested-new-hampshire-975457d435c40ca0275f28d3a53fd6d7
Associated Press,5,Actor Shia LaBeouf arrested again on battery charge in New Orleans,https://apnews.com/article/shia-lebeouf-arrest-new-orleans-d235179ef6572526c98f37f248b2410c
Associated Press,6,Trump was once wary of ordering regime change in Iran. Here's what made him change his mind,https://apnews.com/article/trump-iran-ayatollah-khamenei-ad853dc1d5606fd9202b65a75bdbfc2f
Associated Press,7,War powers debate intensifies after Trump orders attack on Iran without approval by Congress,https://apnews.com/article/congress-war-powers-trump-iran-constitution-37ec6685d9ded1d467a719f91e537487
Associated Press,8,Trump's 'America First' campaign battle cry gives way to military strikes abroad,https://apnews.com/article/trump-iran-strike-conflict-us-war-opposition-8fa7a441a4a696a8562de583395ab0bf
Associated Press,9,Knight delivers joke during 'SNL' appearance featuring US men and women hockey gold medal winners,https://apnews.com/article/olympic-hockey-knight-hughes-snl-55581da304e9b969eca54c4a309ab571
Associated Press,10,LeBron James' 11-year-old daughter Zhuri has a fun shootaround with father before game with Warriors,https://apnews.com/article/lebron-james-daughter-warmup-30a7ac119985c1e702a07dd3b3c754e7
Associated Press,11,Chris Gabehart shows up in Spire gear as a lawsuit court deadline looms,https://apnews.com/article/nascar-indycar-gibbs-spire-gabehart-lawsuit-84740bfd1539aebd87b619f48f9c3363
Associated Press,12,Viola Davis receives prestigious Chairman's prize at NAACP Image Awards,https://apnews.com/article/naacp-image-awards-c566bbd335a22ad9b228a0102f57c9ab
Associated Press,13,"Olivia Dean wins 4 Brit Awards, taking artist of the year and song of the year",https://apnews.com/article/brit-awards-2026-olivia-dean-49c1d9979e848372cc7de5fadb45c249
Associated Press,14,Stranded travelers scramble to make new connections as war shuts much of Middle East to air travel,https://apnews.com/article/iran-israel-us-flights-03-01-2026-037e2570049a1b34b52a13427e491547
Associated Press,15,What to know about the clash between the Pentagon and Anthropic over military's AI use,https://apnews.com/article/anthropic-pentagon-ai-dario-amodei-hegseth-0c464a054359b9fdc80cf18b0d4f690c
Associated Press,16,Oil prices set for swings next week as US-Israel strikes raise supply uncertainty,https://apnews.com/article/iran-israel-iran-strikes-oil-prices-4a4a800739e53a30ff63b5e89e84ad71
Associated Press,17,Viral phenomenon in Argentina has young people identifying themselves as animals,https://apnews.com/article/argentina-teenagers-identifying-as-animals-therians-tiktok-54d158c4842f6515e31d83a260cdf31f
Associated Press,18,Otters enjoy a snow day in Maryland during winter storm,https://apnews.com/article/otters-video-snow-storm-slides-baltimore-aquarium-97c075e88a33789e9bf54257eb150f8d
Associated Press,19,Injured mother manatee and calf are rescued in Florida and taken to SeaWorld,https://apnews.com/article/manatee-rescue-florida-orange-river-89d431ad669f3559d30aa25a9b83d027
Associated Press,20,Toucan seen flying around Sin City has been rescued,https://apnews.com/article/las-vegas-toucan-flying-caught-rescue-ffb7646519535114b98b5f9a5108c6e4
