site,rank,title,link
Al Jazeera,1,Flash flooding kills hundreds in northern Pakistan,https://www.aljazeera.com/video/newsfeed/2025/8/17/flash-flooding-kills-hundreds-in-northern-pakistan?traffic_source=rss
Al Jazeera,2,How much aid actually reaches Gaza?,https://www.aljazeera.com/video/by-the-numbers-3/2025/8/17/how-much-aid-actually-reaches-gaza?traffic_source=rss
Al Jazeera,3,The Alaska summit was a spectacular distraction,https://www.aljazeera.com/opinions/2025/8/17/the-alaska-summit-was-a-spectacular-distraction?traffic_source=rss
Al Jazeera,4,Israeli military bombs power plant near Yemeni capital Sanaa,https://www.aljazeera.com/news/2025/8/17/israeli-military-bombs-power-plant-near-yemeni-capital-sanaa?traffic_source=rss
Al Jazeera,5,Antigovernment protesters clash with police in several Serbian cities,https://www.aljazeera.com/gallery/2025/8/17/antigovernment-protesters-clash-with-police-in-several-serbian-cities?traffic_source=rss
Al Jazeera,6,Week in Pictures: From Trump-Putin meeting to flash floods in Pakistan,https://www.aljazeera.com/gallery/2025/8/17/week-in-pictures-from-trump-putin-meeting-to-flash-floods-in-pakistan?traffic_source=rss
Al Jazeera,7,"Erin downgraded to Category 3 hurricane, NHC says",https://www.aljazeera.com/news/2025/8/17/erin-downgraded-to-category-3-hurricane-nhc-says?traffic_source=rss
Al Jazeera,8,Israel bombs Gaza City as part of takeover plan,https://www.aljazeera.com/video/newsfeed/2025/8/17/israel-bombs-gaza-city-as-part-of-takeover-plan?traffic_source=rss
Al Jazeera,9,UFC 319: Chimaev dominates Du Plessis to win middleweight championship,https://www.aljazeera.com/sports/2025/8/17/ufc-319-chimaev-dominates-du-plessis-to-win-middleweight-championship?traffic_source=rss
Al Jazeera,10,Luis Diaz scores for Bayern Munich to win German Supercup on debut,https://www.aljazeera.com/sports/2025/8/17/luis-diaz-scores-for-bayern-munich-to-win-german-supercup-on-debut?traffic_source=rss
Al Jazeera,11,"Russia-Ukraine war: List of key events, day 1,270",https://www.aljazeera.com/news/2025/8/17/russia-ukraine-war-list-of-key-events-day-1270?traffic_source=rss
Al Jazeera,12,Lionel Messi scores as Inter Miami wins late against LA Galaxy,https://www.aljazeera.com/sports/2025/8/17/lionel-messi-scores-as-inter-miami-wins-late-against-la-galaxy?traffic_source=rss
Al Jazeera,13,"Manchester United vs Arsenal: Premier League – teams, start, lineups",https://www.aljazeera.com/sports/2025/8/16/manchester-united-vs-arsenal-premier-league-teams-start-lineups?traffic_source=rss
Al Jazeera,14,Barcelona begin La Liga title defence with win at Mallorca,https://www.aljazeera.com/sports/2025/8/16/yamal-and-raphinha-fire-barcelona-to-la-liga-opening-win-in-mallorca?traffic_source=rss
Al Jazeera,15,France says Mali’s arrest of embassy worker on coup charges ‘unfounded’,https://www.aljazeera.com/news/2025/8/16/france-says-malis-arrest-of-embassy-worker-on-coup-charges-unfounded?traffic_source=rss
Al Jazeera,16,Israel preparing to forcibly displace Palestinians to southern Gaza,https://www.aljazeera.com/news/2025/8/16/israeli-attack-kills-baby-girl-in-gaza-as-more-palestinians-die-of-hunger?traffic_source=rss
Al Jazeera,17,US suspends visas for Gaza residents after right-wing social media storm,https://www.aljazeera.com/news/2025/8/16/us-suspends-visas-for-gaza-residents-after-right-wing-social-media-storm?traffic_source=rss
Al Jazeera,18,African courts may pave the way for holding social media giants to account,https://www.aljazeera.com/opinions/2025/8/16/african-courts-may-pave-the-way-for-holding-social-media-giants-to-account?traffic_source=rss
Al Jazeera,19,"The Alaska summit was not a ‘new Munich’, but it could be a ‘new Yalta’",https://www.aljazeera.com/opinions/2025/8/16/the-alaska-summit-was-not-a-new-munich-but-it-could-be-a-new?traffic_source=rss
Al Jazeera,20,‘Will I make it back alive?’: Gaza journalists fear targeting by Israel,https://www.aljazeera.com/news/2025/8/16/will-i-make-it-back-alive-gaza-journalists-fear-targeting-by-israel?traffic_source=rss
