site,rank,title,link
Al Jazeera,1,Video: Deadly ‘terrorist attack’ in Ukraine’s Lviv,https://www.aljazeera.com/video/newsfeed/2026/2/22/video-deadly-terrorist-attack-in-ukraines-lviv?traffic_source=rss
Al Jazeera,2,"DHS agent killed US citizen in March last year, records reveal",https://www.aljazeera.com/news/2026/2/22/dhs-agent-killed-us-citizen-in-march-last-year-records-reveal?traffic_source=rss
Al Jazeera,3,"Lionel Messi, Inter Miami routed by LAFC in MLS season opener",https://www.aljazeera.com/sports/2026/2/22/lionel-messi-inter-miami-routed-by-lafc-in-mls-season-opener?traffic_source=rss
Al Jazeera,4,"Modi’s Israel visit: Timeline of India’s relations with Israel, Palestine",https://www.aljazeera.com/news/2026/2/22/modis-israel-visit-timeline-of-indias-relations-with-israel-palestine?traffic_source=rss
Al Jazeera,5,"Rondale Moore, Vikings NFL receiver, dies aged 25",https://www.aljazeera.com/sports/2026/2/22/rondale-moore-vikings-nfl-receiver-dies-at-25?traffic_source=rss
Al Jazeera,6,Iran’s president says his country will not bow to US pressure,https://www.aljazeera.com/video/newsfeed/2026/2/22/irans-president-says-his-country-will-not-bow-to-us-pressure?traffic_source=rss
Al Jazeera,7,"Attacked in India, Kashmiri shawl sellers choose between safety, livelihood",https://www.aljazeera.com/news/2026/2/22/attacked-in-india-kashmiri-shawl-sellers-choose-between-safety-livelihood?traffic_source=rss
Al Jazeera,8,How Russia has weaponised winter against people in Ukraine,https://www.aljazeera.com/video/by-the-numbers-3/2026/2/22/how-russia-has-weaponised-winter-against-people-in-ukraine?traffic_source=rss
Al Jazeera,9,"Iran will not bow down to US pressure in nuclear talks, Pezeshkian says",https://www.aljazeera.com/news/2026/2/22/iran-will-not-bow-down-to-us-pressure-in-nuclear-talks-pezeshkian-says?traffic_source=rss
Al Jazeera,10,"Eight bodies recovered in Libya, Greece as Mediterranean death toll rises",https://www.aljazeera.com/news/2026/2/22/eight-bodies-found-in-libya-and-greece-as-mediterranean-crossings-continue?traffic_source=rss
Al Jazeera,11,"Russia-Ukraine war: List of key events, day 1,459",https://www.aljazeera.com/news/2026/2/22/russia-ukraine-war-list-of-key-events-day-1459?traffic_source=rss
Al Jazeera,12,Trump to raise US global tariff to 15% after Supreme Court ruling,https://www.aljazeera.com/news/2026/2/22/trump-to-raise-us-global-tariff-from-ten-to-fifteen-percent-after-supreme-court-ruling?traffic_source=rss
Al Jazeera,13,"Pakistan carries out strikes in Afghanistan, ‘killing and wounding dozens’",https://www.aljazeera.com/news/2026/2/22/pakistan-carries-out-strikes-in-afghanistan-after-islamabad-suicide-attack?traffic_source=rss
Al Jazeera,14,Nico O’Reilly double seals key 2-1 win for Man City over Newcastle United,https://www.aljazeera.com/sports/2026/2/21/nico-oreilly-double-seals-key-2-1-win-for-man-city-over-newcastle-united?traffic_source=rss
Al Jazeera,15,Trump’s tariff regime has been ruled unlawful. What are the implications?,https://www.aljazeera.com/video/inside-story/2026/2/21/trumps-tariff-regime-ruled-unlawful-what-are-the-implications?traffic_source=rss
Al Jazeera,16,"Venezuela receives more than 1,500 amnesty requests under new law",https://www.aljazeera.com/news/2026/2/21/venezuela-receives-more-than-1500-amnesty-requests-under-new-law?traffic_source=rss
Al Jazeera,17,‘Absurd and provocative’: Huckabee faces firestorm for Israel border stance,https://www.aljazeera.com/news/2026/2/21/absurd-and-provocative-huckabee-faces-firestorm-for-israel-border-stance?traffic_source=rss
Al Jazeera,18,Slovakia threatens to cut electricity to Ukraine over Russian oil spat,https://www.aljazeera.com/news/2026/2/21/slovakia-threatens-to-cut-electricity-to-ukraine-over-russian-oil-spat?traffic_source=rss
Al Jazeera,19,NASA rules out March launch for manned moon mission over technical issues,https://www.aljazeera.com/news/2026/2/21/nasa-rules-out-march-launch-for-manned-moon-mission-over-technical-issues?traffic_source=rss
Al Jazeera,20,Far-right anti-Islam march sparks counterprotests in Manchester,https://www.aljazeera.com/news/2026/2/21/far-right-anti-islam-march-sparks-counter-protests-in-manchester?traffic_source=rss
Associated Press,1,US ambassador causes uproar by claiming Israel has a right to much of the Middle East,https://apnews.com/article/israel-ambassador-huckabee-middle-east-arab-muslim-e88a235c48bfb904f0ee7f8a72edf250
Associated Press,2,Ex-UK Prime Minister Johnson calls on allies to send noncombat troops to Ukraine ahead of ceasefire,https://apnews.com/article/boris-johnson-ukraine-russia-war-uk-troops-5081f86f749c885205e0f723f2490703
Associated Press,3,Hungary says it will block a key EU loan to Ukraine until Russian oil shipments resume,https://apnews.com/article/hungary-eu-ukraine-loan-russian-oil-83ee301ec3f84fb823f936d49067c0f9
Associated Press,4,Homeland Security suspends TSA PreCheck and Global Entry airport security programs,https://apnews.com/article/homeland-security-tsa-precheck-global-entry-dc1d2ccd913a74fa2c8b91dad340a3b3
Associated Press,5,"ICE's purchases for big detention centers are marked by secrecy, frustrating towns",https://apnews.com/article/immigration-detention-centers-pushback-24e702da67281a672b0f77287aaa87ba
Associated Press,6,"ICE begins to purchase warehouses, but some owners are backing out of deals",https://apnews.com/article/immigrant-detention-warehouses-ice-trump-a4a71226409cd9fedc9aa5de5ec90654
Associated Press,7,Trump says he'll raise tariffs to 15 percent after Supreme Court ruling,https://apnews.com/article/trump-tariff-truth-social-872c8f04112a8991d8aa6ae5005767b6
Associated Press,8,US military airlifts small reactor as Trump pushes to quickly deploy nuclear power,https://apnews.com/article/nuclear-power-microreactor-energy-pentagon-9b4bf19cfc38560ca14cf652fa9a3806
Associated Press,9,White House dinner closes a turbulent week for governors in Washington,https://apnews.com/article/trump-wes-moore-kevin-stitt-governors-dinner-58d6381ed18334e8c35af35ef2ce4122
Associated Press,10,Canada's curling skip tells cheating accusers to get Olympic celebration 'burned into your brain',https://apnews.com/article/curling-olympics-milan-cortina-690d62ca682a54334c6ec26f2bcef6dc
Associated Press,11,US wins its record 11th gold medal at the Winter Olympics,https://apnews.com/article/olympics-us-gold-medal-record-0790effb956f009dce0f87acf8f36c83
Associated Press,12,"Willie Colón, architect of urban salsa music, dies at 75",https://apnews.com/article/willie-colon-salsa-musician-death-66ecf4eeec614e156d0c88382aec64b7
Associated Press,13,JPMorgan concedes it closed Trump's accounts after Jan. 6 attack,https://apnews.com/article/trump-jpmorgan-dimon-debanking-2e0db127f360e5dbe1d3cc975dd73703
Associated Press,14,The Supreme Court struck down Trump's tariffs. Now comes the hard work of issuing refunds,https://apnews.com/article/trump-tariff-refunds-supreme-court-b7e9fe351468a1f31974fb27a4e4d44a
Associated Press,15,Global leaders and businesses pore over fallout of more US tariff swoons,https://apnews.com/article/trump-tariffs-court-france-korea-mexico-5269dba3c94ef58e57ff533a7527a74d
Associated Press,16,NASA delays astronaut moon mission again after new rocket problem,https://apnews.com/article/nasa-artemis-moon-astronauts-1e02b236e110e02c0241a581a311bb25
Associated Press,17,Cohete lunar de NASA enfrenta otro problema; se prevé que viaje de astronautas se retrase a abril,https://apnews.com/article/nasa-artemis-mision-lunar-1507ce63fca15122984b526b9353b0e4
Associated Press,18,Raccoon goes on drunken rampage in Virginia liquor store and passes out on bathroom floor,https://apnews.com/article/drunk-raccoon-liquor-store-bandit-virginia-5109feb2ea9ab9bf8954ec3798689fd0
Associated Press,19,Freezing reptile dubbed 'Lizard in a blizzard' is rescued after being buried in Rhode Island snow,https://apnews.com/article/lizard-rhode-island-weather-snowstorm-df6f03781484eab4797e1b8a4fdf44a7
Associated Press,20,Viral '6-7' tops 2025 list of overused words and phrases,https://apnews.com/article/2025-words-slang-phrases-list-university-67-59f896e28b7b16edfdfcc453a8af388a
