site,rank,title,link
Al Jazeera,1,Spain’s train drivers call for strike as deadly derailments fuel concern,https://www.aljazeera.com/news/2026/1/21/spains-train-drivers-call-for-strike-as-deadly-derailments-fuel-concern?traffic_source=rss
Al Jazeera,2,"Qatar, Saudi Arabia among eight countries joining Trump’s ‘board of peace’",https://www.aljazeera.com/news/2026/1/21/qatar-saudi-arabia-among-eight-countries-joining-trumps-board-of-peace?traffic_source=rss
Al Jazeera,3,‘The end of the world as we know it’: Is the rules-based order finished?,https://www.aljazeera.com/news/2026/1/21/the-end-of-the-world-as-we-know-it-is-the-rules-based-order-finished?traffic_source=rss
Al Jazeera,4,Super Saliha,https://www.aljazeera.com/video/al-jazeera-world/2026/1/21/super-saliha?traffic_source=rss
Al Jazeera,5,"Trump rules out using force to take over Greenland, calls for negotiations",https://www.aljazeera.com/news/2026/1/21/trump-rules-out-using-force-to-take-over-greenland-calls-for-negotiations?traffic_source=rss
Al Jazeera,6,LIVE: Marseille vs Liverpool – UEFA Champions League,https://www.aljazeera.com/sports/liveblog/2026/1/21/live-marseille-vs-liverpool-uefa-champions-league?traffic_source=rss
Al Jazeera,7,Canada detains Israeli ex-soldier and comedian over Gaza complaint,https://www.aljazeera.com/video/newsfeed/2026/1/21/canada-detains-israeli-ex-soldier-and-comedian-over-gaza-complaint?traffic_source=rss
Al Jazeera,8,"Who was Rifaat al-Assad, commander of Syria’s 1982 Hama massacre?",https://www.aljazeera.com/features/2026/1/21/who-was-rifaat-al-assad-commander-of-syrias-1982-hama-massacre?traffic_source=rss
Al Jazeera,9,Palestinians react to Netanyahu joining Gaza ‘Board of Peace’,https://www.aljazeera.com/video/newsfeed/2026/1/21/palestinians-react-to-netanyahu-joining-gaza-board-of-peace?traffic_source=rss
Al Jazeera,10,Trump: Hamas will be ‘blown away’ if they don’t give up their weapons,https://www.aljazeera.com/video/newsfeed/2026/1/21/trump-hamas-will-be-blown-away-if-they-dont-give-up-their-weapons?traffic_source=rss
Al Jazeera,11,"Trump’s ‘board of peace’: Who has joined, who hasn’t – and why",https://www.aljazeera.com/news/2026/1/21/trumps-board-of-peace-who-has-joined-who-hasnt-and-why?traffic_source=rss
Al Jazeera,12,Three Palestinian journalists killed in Israeli air strike,https://www.aljazeera.com/video/newsfeed/2026/1/21/three-palestinian-journalists-killed-in-israeli-air-strike?traffic_source=rss
Al Jazeera,13,‘Stripped naked’: Yemeni detainee recounts torture in UAE-run prison,https://www.aljazeera.com/features/2026/1/21/stripped-naked-yemeni-detainee-recounts-torture-in-uae-run-prison?traffic_source=rss
Al Jazeera,14,"Trump says he wants ‘ownership’ of Greenland, but ‘won’t use force’",https://www.aljazeera.com/video/newsfeed/2026/1/21/trump-says-he-wants-ownership-of-greenland-but-wont-use?traffic_source=rss
Al Jazeera,15,Fact-checking US President Trump’s speech marking one year in office,https://www.aljazeera.com/news/2026/1/21/fact-checking-us-president-trumps-speech-marking-one-year-in-office?traffic_source=rss
Al Jazeera,16,Three journalists among 11 Palestinians killed in Israel’s attacks on Gaza,https://www.aljazeera.com/news/2026/1/21/three-journalists-among-11-palestinians-killed-in-israels-attacks-on-gaza?traffic_source=rss
Al Jazeera,17,Greenland’s strategic position in seven maps: Why Trump wants the island,https://www.aljazeera.com/news/2026/1/21/greenlands-strategic-position-in-seven-maps-why-trump-wants-the-island?traffic_source=rss
Al Jazeera,18,EU parliament refers Mercosur free trade deal to bloc’s top court,https://www.aljazeera.com/news/2026/1/21/eu-parliament-refers-mercosur-free-trade-deal-to-blocs-top-court?traffic_source=rss
Al Jazeera,19,Syrian army takes control of camp holding thousands linked to ISIL,https://www.aljazeera.com/news/2026/1/21/syria-takes-control-of-camp-holding-thousands-linked-to-isil?traffic_source=rss
Al Jazeera,20,"Can Europe break with Trump? A tale of energy, defence, economic dependence",https://www.aljazeera.com/economy/2026/1/21/can-europe-break-with-trump-a-tale-of-energy-defence-economic-dependence?traffic_source=rss
Associated Press,1,In their words: Trump’s threats over Greenland draw warnings and profanities at global forum,https://apnews.com/article/davos-greenland-trump-macron-newsom-wef-leyen-ee1791fd72153cef9bd428e2d37cc354
Associated Press,2,Trump's Board of Peace is dividing countries in Europe and the Middle East,https://apnews.com/article/mideast-wars-gaza-board-of-peace-trump-1-21-2026-2f0e063d03babbd3276f31289ba5f2a2
Associated Press,3,Forecasters warn of a 'potentially catastrophic' storm from Texas to the Carolinas,https://apnews.com/article/winter-weather-snow-ice-weekend-storm-ba67d30f05cbe14e9568907f09d2f13f
Associated Press,4,"A former flight attendant posed as a pilot and received hundreds of free flights, US authorities say",https://apnews.com/article/fake-airline-pilot-fraud-58a2d18d66aabe462e11c3d72002c8ec
Associated Press,5,'West Wing' actor Timothy Busfield released from New Mexico jail pending trial,https://apnews.com/article/timothy-busfield-child-sex-abuse-charges-d35a83ab57dc0e7a37c25a92ffc63a11
Associated Press,6,"Air Force One returns to Washington area due to minor electrical issue, White House says",https://apnews.com/article/trump-air-force-one-electrical-issue-c3044b52b792a8c12f6211718d94f8fe
Associated Press,7,IRS head announces a shake-up on eve of 2026 tax season,https://apnews.com/article/treasury-irs-tax-season-fd379f43d501d064cdad046eb32fb9f6
Associated Press,8,Trump-appointed prosecutor who pursued indictments against the president's foes is leaving post,https://apnews.com/article/justice-department-halligan-bondi-blanche-comey-077e5d184351b021e8621d218a395719
Associated Press,9,Alberto Mendoza announces transfer from Indiana to Georgia Tech following national title,https://apnews.com/article/mendoza-indiana-georgia-tech-transfer-portal-ce7f9089350c95e21f1be77429215c08
Associated Press,10,No. 1 Indiana tops final AP Top 25 football poll of season as Big Ten's title run reaches 3 straight,https://apnews.com/article/ap-top-25-college-football-d20d33aecbec2021a90e1f8ce8eead7c
Associated Press,11,Baker Mayfield slams Kevin Stefanski over trade: 'Can't wait to see you twice a year',https://apnews.com/article/baker-mayfield-kevin-stefanski-buccaneers-falcons-755095cb9563953516d91f7bdc426304
Associated Press,12,Brooklyn Beckham accuses David and Victoria of putting branding before family and sabotaging wedding,https://apnews.com/article/brooklyn-beckham-david-victoria-feud-fb386d4ef5cde9fa55b97604482e8ff0
Associated Press,13,Music Review: Megadeth is going out on top with ferocious self-titled final album,https://apnews.com/article/megadeth-dave-mustaine-music-review-eefefa8a64f89d6ad6c8f1123642c559
Associated Press,14,"Taylor Swift, Kenny Loggins, members of Kiss and more get into Songwriters Hall of Fame",https://apnews.com/article/songwriters-hall-fame-2026-taylor-swift-a80065ab7e78fce95b6eeafeabe45bbb
Associated Press,15,Wall Street steadies after Trump says he won't use force to take Greenland,https://apnews.com/article/stocks-markets-trump-bonds-gold-82e0341ef60b2719d79e1631e006bfed
Associated Press,16,"China meets initial soybean purchase goal, but Trump's shifting trade policy could disrupt deal",https://apnews.com/article/trump-china-soybeans-trade-war-tariffs-xi-b973ce99802403b7c1759320c225a524
Associated Press,17,Iconic Coney Island hot dog hawker Nathan's Famous is sold for $450 million,https://apnews.com/article/nathans-famous-hot-dogs-smithfield-merger-9927a1f0fde1ff32c2f95dc4949d3dfd
Associated Press,18,NASA astronaut who was stuck at the space station for months retires within a year of returning,https://apnews.com/article/stuck-astronaut-nasa-suni-williams-59b361c3a823ac0dbbf6c63eb403776e
Associated Press,19,A set of handprints on cave walls represent the oldest rock art uncovered yet,https://apnews.com/article/oldest-cave-art-indonesia-sulawesi-dda02b8f8aa0b72e99e2bd6146c500df
Associated Press,20,FACT FOCUS: Trump highlights familiar false claims as he reviews his first year back in office,https://apnews.com/article/fact-check-trump-rigged-election-eight-wars-inflation-220f515728383d5205c3748259b2cc0f
