site,rank,title,link
Al Jazeera,1,Europe’s Israel policy faces a democratic test,https://www.aljazeera.com/opinions/2026/2/16/europes-israel-policy-faces-a-democratic-test?traffic_source=rss
Al Jazeera,2,Dozens of Australian ISIL relatives freed from Syria’s Roj camp,https://www.aljazeera.com/news/2026/2/16/dozens-of-australian-isil-relatives-freed-from-syrias-roj-camp?traffic_source=rss
Al Jazeera,3,"UN staffers back Francesca Albanese, condemn European ministers for attacks",https://www.aljazeera.com/news/2026/2/16/un-staffers-back-francesca-albanese-condemn-european-ministers-for-attacks?traffic_source=rss
Al Jazeera,4,Israel to restart land registration in West Bank. What that means,https://www.aljazeera.com/news/2026/2/16/israel-to-restart-land-registration-in-west-bank-what-that-means?traffic_source=rss
Al Jazeera,5,Real Madrid play Benfica in Champions League playoff: Team news and lineups,https://www.aljazeera.com/sports/2026/2/16/real-madrid-play-benfica-in-champions-league-playoff-team-news-and-lineups?traffic_source=rss
Al Jazeera,6,Savannah Guthrie appeals to mom’s abductor: ‘It’s not too late’,https://www.aljazeera.com/video/newsfeed/2026/2/16/savannah-guthrie-appeals-to-moms-abductor-its-not-too?traffic_source=rss
Al Jazeera,7,How shipping company MSC facilitates trade from Israeli settlements through,https://www.aljazeera.com/video/newsfeed/2026/2/16/how-shipping-company-msc-facilitates-trade-from-israeli-settlements-through?traffic_source=rss
Al Jazeera,8,‘Rats run over our faces’: Gaza’s displaced forced to live on infested land,https://www.aljazeera.com/features/2026/2/16/rats-run-over-our-faces-gazas-displaced-forced-to-live-on-infested-land?traffic_source=rss
Al Jazeera,9,The Epstein files cover-up: Botched or calculated?,https://www.aljazeera.com/video/the-listening-post/2026/2/16/the-epstein-files-cover-up-botched-or-calculated?traffic_source=rss
Al Jazeera,10,Rights groups condemn Israeli plan for ‘de facto annexation’ of West Bank,https://www.aljazeera.com/video/newsfeed/2026/2/16/rights-groups-condemn-israeli-plan-for-de-facto-annexation-of-west-bank?traffic_source=rss
Al Jazeera,11,15-day-old baby loses father in Israeli strike on Gaza,https://www.aljazeera.com/video/newsfeed/2026/2/16/15-day-old-baby-loses-father-in-israeli-strike-on-gaza?traffic_source=rss
Al Jazeera,12,Russia rejects claims of poisoning Navalny with dart frog toxin,https://www.aljazeera.com/news/2026/2/16/russia-rejects-claims-of-poisoning-navalny-with-dart-frog-toxin?traffic_source=rss
Al Jazeera,13,‘Dangerous escalation’: Nations condemn Israel over occupied West Bank move,https://www.aljazeera.com/news/2026/2/16/dangerous-escalation-nations-condemn-israel-over-occupied-west-bank-move?traffic_source=rss
Al Jazeera,14,‘No evidence’ of human contact with aliens: Obama clarifies podcast remarks,https://www.aljazeera.com/news/2026/2/16/no-evidence-of-human-contact-with-aliens-obama-clarifies-podcast-remarks?traffic_source=rss
Al Jazeera,15,"Ukraine team heads for Geneva talks as Moscow, Kyiv build military pressure",https://www.aljazeera.com/news/2026/2/16/ukraine-team-heads-for-geneva-talks-as-moscow-kyiv-build-military-pressure?traffic_source=rss
Al Jazeera,16,‘Baby boxes’ for surrendering newborns on rise in US,https://www.aljazeera.com/video/newsfeed/2026/2/16/baby-boxes-for-surrendering-newborns-on-rise-in-us?traffic_source=rss
Al Jazeera,17,Epstein ties cast shadow over legacy of Oslo’s Palestine peace efforts,https://www.aljazeera.com/video/newsfeed/2026/2/16/epstein-ties-cast-shadow-over-legacy-of-oslos-palestine-peace-efforts?traffic_source=rss
Al Jazeera,18,Israeli police clash with ultra-Orthodox protesters over army enlistment,https://www.aljazeera.com/video/newsfeed/2026/2/16/israeli-police-clash-with-ultra-orthodox-protesters-over-army-enlistment?traffic_source=rss
Al Jazeera,19,Manchester’s Muslim voters pivotal in UK election showdown,https://www.aljazeera.com/features/2026/2/16/manchesters-muslim-voters-pivotal-in-uk-election-showdown?traffic_source=rss
Al Jazeera,20,"Which teams can qualify for the T20 World Cup Super Eights, and how?",https://www.aljazeera.com/sports/2026/2/16/which-teams-can-qualify-for-the-t20-world-cup-super-eights-and-how?traffic_source=rss
Associated Press,1,Europeans push back at US over claim they face 'civilizational erasure',https://apnews.com/article/munich-conference-europe-trump-rubio-kallas-0efc0b3d464f118e3e5d6748113c9271
Associated Press,2,North Korea opens a housing district for families of its soldiers killed in Russia-Ukraine war,https://apnews.com/article/north-korea-ukraine-war-dead-kim-jong-un-b589285d79f66900fbc30f9243383cfe
Associated Press,3,Hungarian opposition leader Magyar vows to pull Hungary back toward the West in campaign launch,https://apnews.com/article/hungary-opposition-campaign-orban-f4e2d7a7cc73a19cc0dbb18a7286835d
Associated Press,4,"DNA recovered from glove found near Guthrie home that appears to match glove worn by suspect, FBI says",https://apnews.com/article/savannah-guthrie-mom-missing-710d3acdef86d1c3935b94f58f763d72
Associated Press,5,Searchers find wreck of luxury steamer lost in Lake Michigan more than 150 years ago,https://apnews.com/article/shipwreck-lake-michigan-c9736b35a5671979b6a0603c46be9020
Associated Press,6,What to know about the investigation into Nancy Guthrie's disappearance and the search for clues,https://apnews.com/article/savannah-guthrie-mother-nancy-04be2a6d555109113f525aab0321dfc8
Associated Press,7,Derek Dooley didn't vote for years. Now he wants Georgia voters to send him to Washington,https://apnews.com/article/derek-dooley-georgia-football-republican-senate-trump-79206ea3f3150a1441c940c4b390b1a4
Associated Press,8,Trump's border czar says 'small' security force will remain in Minnesota after enforcement drawdown,https://apnews.com/article/homan-immigration-agents-minnesota-enforcement-operation-drawdown-5a7940eb9b5100d46efc33a97f524da0
Associated Press,9,US military boards another oil tanker in Indian Ocean after tracking it from the Caribbean,https://apnews.com/article/venezuela-oil-tanker-boarded-sanctions-pentagon-quarantine-682ddfc053bbd54ba3c477929c5b13f2
Associated Press,10,Jutta Leerdam and Jordan Stolz turn an Olympic rumor into reality by skating together,https://apnews.com/article/leerdam-stolz-olympics-speedskating-247c287585a24e4977f34c5a0f3ce3f8
Associated Press,11,Inside the widening Olympic curling controversy and allegations of cheating,https://apnews.com/article/winter-olympics-curling-controversy-8b7acc54e259344fb3fcfa68343af5ec
Associated Press,12,Curling controversy widens as Britain is accused of the same infraction as Canada,https://apnews.com/article/curling-controversy-winter-games-4ceb52bf313a0ce7c2d6ca34e542542e
Associated Press,13,"Powered by women, ‘Wuthering Heights’ digs up $34.8 million at the box office for a No. 1 debut",https://apnews.com/article/wuthering-heights-box-office-d10e1c446826f2ef7b7029953d468875
Associated Press,14,"What to Stream: Emma Thompson, Jennifer Garner, 'The Night Agent,' Dove Cameron and Hilary Duff",https://apnews.com/article/stream-tv-movies-music-feb-2026-agent-594847af5a5d8122f262fd53c204f9fd
Associated Press,15,Tax season is underway. Here's what to know for stress-free filing with the IRS,https://apnews.com/article/tax-season-returns-irs-3392b432dafba153142f6dc3b5b9eab9
Associated Press,16,Presidents Day 2026: Here's what's open and closed on the holiday,https://apnews.com/article/presidents-day-holiday-stores-open-closed-4f4955a83d4b04a3e49078ebc0b95b50
Associated Press,17,"Hollywood groups condemn ByteDance's AI video generator, claiming copyright infringement",https://apnews.com/article/ai-seedance-bytedance-hollywood-copyright-7e445388401d172c6bf51d0d42aa4f24
Associated Press,18,Raccoon goes on drunken rampage in Virginia liquor store and passes out on bathroom floor,https://apnews.com/article/drunk-raccoon-liquor-store-bandit-virginia-5109feb2ea9ab9bf8954ec3798689fd0
Associated Press,19,Freezing reptile dubbed 'Lizard in a blizzard' is rescued after being buried in Rhode Island snow,https://apnews.com/article/lizard-rhode-island-weather-snowstorm-df6f03781484eab4797e1b8a4fdf44a7
Associated Press,20,"Chicken wings advertised as 'boneless' can have bones, Ohio Supreme Court decides",https://apnews.com/article/boneless-chicken-wings-lawsuit-ohio-supreme-court-231002ea50d8157aeadf093223d539f8
