site,rank,title,link
Al Jazeera,1,Deadly explosion rocks Russian military site near St Petersburg,https://www.aljazeera.com/news/2026/2/17/deadly-explosion-rocks-russian-military-site-near-st-petersburg?traffic_source=rss
Al Jazeera,2,LIVE: Benfica vs Real Madrid – Champions League playoff,https://www.aljazeera.com/sports/liveblog/2026/2/17/live-benfica-vs-real-madrid-champions-league-playoff?traffic_source=rss
Al Jazeera,3,Iran’s Khamenei maintains tough rhetoric with US despite nuclear talks,https://www.aljazeera.com/news/2026/2/17/irans-khamenei-maintains-tough-rhetoric-with-us-despite-nuclear-talks?traffic_source=rss
Al Jazeera,4,Latin America: In the Shadow of the US | Ep 2 – Wars,https://www.aljazeera.com/video/featured-documentaries/2026/2/17/latin-america-in-the-shadow-of-the-us-ep-2-wars?traffic_source=rss
Al Jazeera,5,EU opens probe into online global retailer Shein after sex-doll scandal,https://www.aljazeera.com/news/2026/2/17/eu-opens-probe-into-online-global-retailer-shein-after-sex-doll-scandal?traffic_source=rss
Al Jazeera,6,Glacier grafting: How an Indigenous art is countering water scarcity,https://www.aljazeera.com/news/2026/2/17/glacier-grafting-how-an-indigenous-art-is-countering-water-scarcity?traffic_source=rss
Al Jazeera,7,Has Bangladesh’s new PM named student leaders to his cabinet?,https://www.aljazeera.com/news/2026/2/17/has-bangladeshs-new-pm-named-student-leaders-to-his-cabinet?traffic_source=rss
Al Jazeera,8,"Jesse Jackson, civil rights icon, dies at age 84",https://www.aljazeera.com/video/newsfeed/2026/2/17/jesse-jackson-civil-rights-icon-dies-at-age-84?traffic_source=rss
Al Jazeera,9,Missiles fly as 3rd round of Russia-Ukraine peace talks kicks off in Geneva,https://www.aljazeera.com/news/2026/2/17/missiles-fly-as-3rd-round-of-russia-ukraine-peace-talks-kick-off-in-geneva?traffic_source=rss
Al Jazeera,10,Ramadan Mubarak 2026: Hear greetings in different languages,https://www.aljazeera.com/news/2026/2/17/ramadan-mubarak-2026-hear-greetings-in-different-languages?traffic_source=rss
Al Jazeera,11,Who are Bangladesh’s new cabinet members?,https://www.aljazeera.com/news/2026/2/17/who-are-bangladeshs-new-cabinet-members?traffic_source=rss
Al Jazeera,12,"After dozens died in Israeli jails, death penalty law rattles Palestinians",https://www.aljazeera.com/features/2026/2/17/after-dozens-died-in-israeli-jails-death-penalty-law-rattles-palestinians?traffic_source=rss
Al Jazeera,13,The injustice in Chagos continues,https://www.aljazeera.com/opinions/2026/2/17/the-injustice-in-chagos-continues?traffic_source=rss
Al Jazeera,14,Swiss commentator slams ‘Zionist’ Israeli bobsleigh team at Winter Olympics,https://www.aljazeera.com/sports/2026/2/17/swiss-commentator-slams-zionist-israeli-bobsleigh-team-at-winter-olympics?traffic_source=rss
Al Jazeera,15,Settlers repeatedly chasing Palestinians out of occupied West Bank homes,https://www.aljazeera.com/video/newsfeed/2026/2/17/settlers-repeatedly-chasing-palestinians-out-of-occupied-west-bank-homes?traffic_source=rss
Al Jazeera,16,Video: Humanoid robots take centre stage at China’s Lunar New Year show,https://www.aljazeera.com/video/newsfeed/2026/2/17/video-humanoid-robots-take-centre-stage-at-chinas-lunar-new-year-show?traffic_source=rss
Al Jazeera,17,Israeli settlers displace 15 Palestinian families in West Bank: Official,https://www.aljazeera.com/news/2026/2/17/israeli-settlers-displace-15-palestinian-families-in-west-bank-official?traffic_source=rss
Al Jazeera,18,Iran’s Khamenei says US will not be able to destroy government,https://www.aljazeera.com/video/newsfeed/2026/2/17/irans-khamenei-says-us-will-not-be-able-to-destroy-government?traffic_source=rss
Al Jazeera,19,"Imran Khan must be given immediate medical attention, cricket legends say",https://www.aljazeera.com/sports/2026/2/17/imran-khan-must-be-given-immediate-medical-attention-cricket-legends-say?traffic_source=rss
Al Jazeera,20,Australia refuses to repatriate ISIL relatives from Syrian camp,https://www.aljazeera.com/video/newsfeed/2026/2/17/australia-refuses-to-repatriate-isil-relatives-from-syrian-camp?traffic_source=rss
Associated Press,1,Iran says it temporarily closed the Strait of Hormuz as it held more indirect talks with the US,https://apnews.com/article/iran-us-nuclear-talks-iaea-dbed41b78ce2ddabc8a04349e72abeba
Associated Press,2,"More third-country nationals have been deported by the US to Cameroon, lawyers tell AP",https://apnews.com/article/us-africa-cameroon-deportations-immigration-96aead5c5adb30bf34b1ad03ca314763
Associated Press,3,Taylor Swift concert attack plot leads to terrorism charges against 21-year-old man,https://apnews.com/article/taylor-swift-concerts-terrorism-vienna-islamic-state-plot-202b552f90fd58d4102bf266337b7ab7
Associated Press,4,"Shooting at Rhode Island youth hockey game leaves 3 dead, including shooter, and 3 more wounded",https://apnews.com/article/pawtucket-hockey-rink-shooting-rhode-island-c8ac3e8067ce2f2ce07e4d98009ecdaa
Associated Press,5,"The Rev. Jesse Jackson, who led the Civil Rights Movement for decades after King, has died at 84",https://apnews.com/article/jesse-jackson-dies-43abb84d2ffc76d967f9a5596ebd0be1
Associated Press,6,Trump administration ordered to restore George Washington slavery exhibit it removed in Philadelphia,https://apnews.com/article/george-washington-slavery-exhibit-restored-trump-2a32236320f280ba3e647d900c1301b4
Associated Press,7,Trump and Maryland governor Wes Moore battle over Potomac River sewage spill response,https://apnews.com/article/trump-wes-moore-potomac-sewage-spill-bc43a446ea2db477501d90f1725a8935
Associated Press,8,Stephen Colbert says CBS lawyers pulled James Talarico interview as early voting begins in Texas,https://apnews.com/article/stephen-colbert-james-talarico-donald-trump-fcc-806845facffd3ab3e30142971be16add
Associated Press,9,"Olympic meltdown: Norway's Atle Lie McGrath loses gold medal in slalom, then control of emotions",https://apnews.com/article/atle-lie-mcgrath-dnf-milan-cortina-games-2d4ac3376f808c8f14ad46eedc5899f1
Associated Press,10,The France player who fought Tom Wilson has been suspended for the rest of the Olympics,https://apnews.com/article/winter-olympics-tom-wilson-crinon-hockey-fight-34cf27a6267a632f7a4d175cde57f9ee
Associated Press,11,"Trying to tame the Olympic controversy, World Curling sent in the umps. Then it sent them away",https://apnews.com/article/curling-controversy-winter-olympics-50f7aa33d76407a1f3a06e69623cfd44
Associated Press,12,"Robert Duvall, Oscar-winning actor and ‘Godfather’ star, dies at 95",https://apnews.com/article/robert-duvall-dead-6ddb67ba5e2242ba9dd96f29b4ce242a
Associated Press,13,Logan Paul’s Pikachu Illustrator Pokémon card sells for record $16.5M at auction,https://apnews.com/article/logan-paul-pokemon-record-auction-e4f17184466589e7313b58de734a06ad
Associated Press,14,"Al Pacino, Francis Ford Coppola and others pay tribute to Robert Duvall, who died at age 95",https://apnews.com/article/robert-duvall-dies-reaction-254f61631993b95a9063be031eac1c3a
Associated Press,15,How the rich pass on their wealth. And how you can too,https://apnews.com/article/estate-planning-taxes-trusts-wealthy-93a579250e0af7962d08c6bbad8f7312
Associated Press,16,Warner Bros reopens takeover talks with Paramount after receiving a waiver from Netflix,https://apnews.com/article/netflix-warner-bros-paramount-skydance-fb7d13e9adc09b82da0332d6278c9b96
Associated Press,17,Trump family business files for trademark rights on any airports using the president's name,https://apnews.com/article/trump-family-trademark-airports-d636dc340af72e6f2c8997b83745ff1d
Associated Press,18,Freezing reptile dubbed 'Lizard in a blizzard' is rescued after being buried in Rhode Island snow,https://apnews.com/article/lizard-rhode-island-weather-snowstorm-df6f03781484eab4797e1b8a4fdf44a7
Associated Press,19,Raccoon goes on drunken rampage in Virginia liquor store and passes out on bathroom floor,https://apnews.com/article/drunk-raccoon-liquor-store-bandit-virginia-5109feb2ea9ab9bf8954ec3798689fd0
Associated Press,20,"Chicken wings advertised as 'boneless' can have bones, Ohio Supreme Court decides",https://apnews.com/article/boneless-chicken-wings-lawsuit-ohio-supreme-court-231002ea50d8157aeadf093223d539f8
