site,rank,title,link
Al Jazeera,1,How are killer drones reshaping the conflict in Sudan,https://www.aljazeera.com/video/the-take-2/2026/2/20/aje-onl-aj_tt_sdn_alfashir_av_v1-200226?traffic_source=rss
Al Jazeera,2,Hungary to block 90 billion euro EU loan to Ukraine in Russian oil dispute,https://www.aljazeera.com/news/2026/2/20/hungary-to-block-90-billion-euro-eu-loan-to-ukraine-in-russian-oil-dispute?traffic_source=rss
Al Jazeera,3,"Tariff refunds could take years amid US Supreme Court ruling, experts warn",https://www.aljazeera.com/economy/2026/2/20/tariff-refunds-could-take-years-amid-us-supreme-court-ruling-experts-warn?traffic_source=rss
Al Jazeera,4,"US President Trump promises new tariffs, slams Supreme Court decision",https://www.aljazeera.com/news/2026/2/20/us-president-trump-promises-new-tariffs-slams-supreme-court-decision?traffic_source=rss
Al Jazeera,5,More than 37 days of heavy rain brings disastrous flooding to France,https://www.aljazeera.com/video/newsfeed/2026/2/20/more-than-37-days-of-heavy-rain-brings-disastrous-flooding-to-france?traffic_source=rss
Al Jazeera,6,Israeli attacks across Lebanon kill at least eight people,https://www.aljazeera.com/news/2026/2/20/one-killed-in-israeli-strike-on-largest-palestinian-refugee-camp-in-lebanon?traffic_source=rss
Al Jazeera,7,The truth behind wildlife tourism,https://www.aljazeera.com/video/the-stream/2026/2/20/the-truth-behind-wildlife-tourism?traffic_source=rss
Al Jazeera,8,Trump suggests he won’t refund tariffs after Supreme Court ruling,https://www.aljazeera.com/video/newsfeed/2026/2/20/trump-suggests-he-wont-refund-tariffs-after-supreme-court-ruling?traffic_source=rss
Al Jazeera,9,Trump ‘considering’ limited strikes on Iran,https://www.aljazeera.com/video/newsfeed/2026/2/20/trump-considering-limited-strikes-on-iran?traffic_source=rss
Al Jazeera,10,Trump: Supreme Court’s rejection of tariffs ‘deeply disappointing’,https://www.aljazeera.com/video/newsfeed/2026/2/20/trump-supreme-courts-rejection-of-tariffs-deeply?traffic_source=rss
Al Jazeera,11,Argentina’s Chamber of Deputies passes controversial labour reform bill,https://www.aljazeera.com/news/2026/2/20/argentinas-chamber-of-deputies-passes-controversial-labour-reform-bill?traffic_source=rss
Al Jazeera,12,Why did the US Supreme Court strike down Trump’s global tariff policy?,https://www.aljazeera.com/video/newsfeed/2026/2/20/why-did-the-us-supreme-court-strike-down-trumps-global-tariff-policy?traffic_source=rss
Al Jazeera,13,Inside Israel’s plan to turn West Bank land into ‘state property’,https://www.aljazeera.com/video/the-take-2/2026/2/20/aje-onl-pal_wblandregistration_av_v3-1-180226?traffic_source=rss
Al Jazeera,14,Who made the cut on Trump’s ‘Board of Peace’ and what they want,https://www.aljazeera.com/video/the-take-2/2026/2/20/aje-onl-glb_boardofpeacemeeting_av_v1-190226?traffic_source=rss
Al Jazeera,15,Man Utd owner Ratcliffe avoids charge by FA for ‘colonised’ comment,https://www.aljazeera.com/sports/2026/2/20/man-utd-owner-ratcliffe-avoids-charge-by-fa-for-colonized-comment?traffic_source=rss
Al Jazeera,16,Police search ex-Prince Andrew’s former home a day after his arrest,https://www.aljazeera.com/news/2026/2/20/police-search-ex-prince-andrews-home-a-day-after-his-arrest?traffic_source=rss
Al Jazeera,17,Senegal football federation denounces verdict in Morocco against fans,https://www.aljazeera.com/sports/2026/2/20/senegal-football-federation-denounces-verdict-in-morocco-against-fans?traffic_source=rss
Al Jazeera,18,"Iran says US military build-up ‘unnecessary and unhelpful’, deal achievable",https://www.aljazeera.com/news/2026/2/20/iran-says-us-military-build-up-unnecessary-and-unhelpful-deal-achievable?traffic_source=rss
Al Jazeera,19,A fragile freedom for Venezuela’s released political prisoners,https://www.aljazeera.com/news/longform/2026/2/20/a-fragile-freedom-for-venezuelas-released-political-prisoners?traffic_source=rss
Al Jazeera,20,Residents in northern Lebanon terrified their buildings will collapse,https://www.aljazeera.com/video/newsfeed/2026/2/20/residents-in-northern-lebanon-terrified-their-buildings-will-collapse?traffic_source=rss
Associated Press,1,"Saudi Arabia may have uranium enrichment under proposed deal with US, arms control experts warn",https://apnews.com/article/saudi-arabia-us-nuclear-enrichment-bomb-proliferation-18cb979f0abf5f0d81c1c91f45d6a6ef
Associated Press,2,Countries that attended Trump's first Board of Peace meeting in Washington,https://apnews.com/article/trump-board-of-peace-participants-b9b7e438caeca308c153b60c032895b9
Associated Press,3,Cuban families receive 'Made in Mexico' essentials as crisis worsens,https://apnews.com/article/cuba-mexico-aid-sheinbaum-4e5732a8acf0905340821716c2ff397f
Associated Press,4,Federal judge accuses Trump administration of 'terror' against immigrants in scathing ruling,https://apnews.com/article/immigration-trump-detention-bond-judge-50a5da122aa51eed77cace0830548df3
Associated Press,5,Texas' Senate primary race between Crockett and Talarico ramps up after pulled Colbert interview,https://apnews.com/article/colbert-talarico-crockett-senate-texas-trump-1135c821aece1a1023c48272ddf0e8c3
Associated Press,6,Texas congressman claims he's being 'blackmailed' over alleged affair with staffer who later died,https://apnews.com/article/tony-gonzales-blackmail-allegation-ce31ebb350599731f2e833db1e9bf0d3
Associated Press,7,FCC chairman says the agency is investigating ABC's 'The View' over equal time rule,https://apnews.com/article/view-fcc-stephen-colbert-abc-cbs-4fd679462e08de2cdc340071f48a83a9
Associated Press,8,"Supreme Court strikes down Trump’s sweeping tariffs, upending central plank of his economic agenda",https://apnews.com/article/supreme-court-tariffs-trump-0485fcda30a7310501123e4931dba3f9
Associated Press,9,"Olympic freeskier Hunter Hess flashes an 'L' sign, says he stands by his statement and loves the USA",https://apnews.com/article/olympics-hunter-hess-trump-b2fb244d2169ca742859a5120eb95831
Associated Press,10,"If you've gotten tired of watching curling, imagine how the athletes feel",https://apnews.com/article/curling-olympics-cortina-milan-canada-3754a4f00b4ea5415b2fb9a6422f4bcf
Associated Press,11,"Eric Dane, 'Grey's Anatomy' star and ALS awareness advocate, dies at 53",https://apnews.com/article/eric-dane-dead-a2eaf3916d047c038ac1121af9a99f17
Associated Press,12,"Shia LaBeouf used homophobic slurs while assaulting New Orleans bar patrons, police say",https://apnews.com/article/what-shia-labeouf-said-new-orleans-arrest-a9b94613d0cca3684710d8f09d8f1fda
Associated Press,13,Music Review: Hilary Duff is a pop star reincarnate on 'Luck... or Something',https://apnews.com/article/hilary-duff-luck-or-something-album-review-e31006401688e11d74dd20ef110bcdd7
Associated Press,14,US civil rights agency sues Coca-Cola distributor for excluding men from casino work trip,https://apnews.com/article/dei-coca-cola-eeoc-lawsuit-andrea-lucas-867fd98ec6d05ab52e7e0a3711e9d492
Associated Press,15,Modi’s AI summit turns awkward as tech leaders Sam Altman and Dario Amodei dodge contact,https://apnews.com/article/altman-amodei-india-ai-summit-photo-9067be4a101fcc710b09e297f4879c01
Associated Press,16,Trump has other tariff options after Supreme Court strikes down his worldwide import taxes,https://apnews.com/article/trump-tariffs-supreme-court-ieepa-a3e43fe91fa8335eac383921bed55f7e
Associated Press,17,NASA boss blasts Boeing and space agency managers for Starliner's botched astronaut flight,https://apnews.com/article/boeing-starliner-nasa-space-station-d9cc3e080dc71df39992f186ce1fbefe
Associated Press,18,NASA targets March for first moon mission by Artemis astronauts after fueling test success,https://apnews.com/article/nasa-artemis-moon-launch-astronauts-446d72be9dca1b28f441d761bd97ee17
Associated Press,19,Raccoon goes on drunken rampage in Virginia liquor store and passes out on bathroom floor,https://apnews.com/article/drunk-raccoon-liquor-store-bandit-virginia-5109feb2ea9ab9bf8954ec3798689fd0
Associated Press,20,"Chicken wings advertised as 'boneless' can have bones, Ohio Supreme Court decides",https://apnews.com/article/boneless-chicken-wings-lawsuit-ohio-supreme-court-231002ea50d8157aeadf093223d539f8
