site,rank,title,link
Al Jazeera,1,“Obligation”: Reactions as Nawrocki wins Poland’s presidential election,https://www.aljazeera.com/news/2025/6/2/obligation-reactions-as-nawrocki-wins-polands-presidential-election?traffic_source=rss
Al Jazeera,2,The genocide of the Palestinian people “starts with words”,https://www.aljazeera.com/program/quotable/2025/6/2/the-genocide-of-the-palestinian-people-starts-with?traffic_source=rss
Al Jazeera,3,Video: Right-wing Polish opposition candidate narrowly wins election,https://www.aljazeera.com/video/newsfeed/2025/6/2/video-right-wing-polish-opposition-candidate-narrowly-wins-election?traffic_source=rss
Al Jazeera,4,Tourists flee as Italy’s Mount Etna erupts,https://www.aljazeera.com/video/newsfeed/2025/6/2/tourists-flee-as-italys-mount-etna-erupts?traffic_source=rss
Al Jazeera,5,Ukraine hits Russian airbases with smuggled drones in major operation,https://www.aljazeera.com/video/newsfeed/2025/6/2/ukraine-hits-russian-airbases-with-smuggled-drones-in-major?traffic_source=rss
Al Jazeera,6,How will Ukraine’s attack on Russian bombers affect the war?,https://www.aljazeera.com/news/2025/6/2/how-will-ukraines-attack-on-russian-bombers-affect-the-war?traffic_source=rss
Al Jazeera,7,"In Gaza, aid kills",https://www.aljazeera.com/opinions/2025/6/2/in-gaza-aid-kills?traffic_source=rss
Al Jazeera,8,Poland’s foreign policy “will be hampered” by new president,https://www.aljazeera.com/video/quotable/2025/6/2/polands-foreign-policy-will-be-hampered-by-new-president?traffic_source=rss
Al Jazeera,9,Iraq probes fish die-off in marshes,https://www.aljazeera.com/gallery/2025/6/2/iraq-probes-fish-die-off-in-marshes?traffic_source=rss
Al Jazeera,10,Iran demands sanctions relief guarantee in nuclear talks with US,https://www.aljazeera.com/news/2025/6/2/iran-demands-sanctions-relief-guarantee-in-nuclear-talks-with-us?traffic_source=rss
Al Jazeera,11,Attack at Colorado rally for Israeli captives leaves six wounded,https://www.aljazeera.com/video/newsfeed/2025/6/2/attack-at-colorado-rally-for-israeli-captives-leaves-six-wounded?traffic_source=rss
Al Jazeera,12,Video: Israel demolishes the only kidney dialysis centre in Gaza,https://www.aljazeera.com/video/newsfeed/2025/6/2/video-israel-demolishes-the-only-kidney-dialysis-centre-in-gaza?traffic_source=rss
Al Jazeera,13,People in Burundi struggle amid Lake Tanganyika’s endless flooding,https://www.aljazeera.com/gallery/2025/6/2/people-in-burundi-struggle-amid-lake-tanganyikas-endless-flooding?traffic_source=rss
Al Jazeera,14,Russia and Ukraine swap fire as they head to Istanbul peace talks,https://www.aljazeera.com/news/2025/6/2/russia-and-ukraine-swap-fire-as-they-head-to-istanbul-peace-talks?traffic_source=rss
Al Jazeera,15,Turnout low as Mexico votes in controversial judicial election,https://www.aljazeera.com/news/2025/6/2/turnout-low-as-mexico-votes-in-controversial-judicial-election?traffic_source=rss
Al Jazeera,16,Glenn Maxwell retires from ODI cricket but T20 World Cup in his sights,https://www.aljazeera.com/sports/2025/6/2/glenn-maxwell-retires-from-odi-cricket-but-t20-world-cup-in-his-sights?traffic_source=rss
Al Jazeera,17,"Boulder, Colorado attack: What we know, who are the suspect and victims?",https://www.aljazeera.com/news/2025/6/2/boulder-colorado-attack-what-we-know-who-are-the-suspect-and-victims?traffic_source=rss
Al Jazeera,18,Israel bombs displaced Palestinians in al-Mawasi,https://www.aljazeera.com/program/newsfeed/2025/6/2/israel-bombs-displaced-palestinians-in-al-mawasi?traffic_source=rss
Al Jazeera,19,US urges Australia to increase defence spending to 3.5% of GDP,https://www.aljazeera.com/news/2025/6/2/us-urges-australia-to-increase-defence-spending-to-3-5-of-gdp?traffic_source=rss
Al Jazeera,20,Israel dares the world to intervene in new settlement project | #AJOPINION,https://www.aljazeera.com/video/newsfeed/2025/6/2/israel-dares-the-world-to-intervene-in-new-settlement-project-ajopinion?traffic_source=rss
