site,rank,title,link
Al Jazeera,1,Four killed as man detonates explosive device at Ukraine train station,https://www.aljazeera.com/news/2025/10/24/four-killed-as-man-detonates-explosive-device-at-ukraine-train-station?traffic_source=rss
Al Jazeera,2,"Returning to Gaza City, a family finds bulldozed graves and little hope",https://www.aljazeera.com/features/2025/10/24/returning-to-gaza-city-a-family-finds-bulldozed-graves-and-little-hope?traffic_source=rss
Al Jazeera,3,Is Trump’s pardon of Binance boss Changpeng Zhao a conflict of interest?,https://www.aljazeera.com/news/2025/10/24/is-trumps-pardon-of-binance-boss-changpeng-zhao-a-conflict-of-interest?traffic_source=rss
Al Jazeera,4,Europe is not “off the hook” on pressuring Israel,https://www.aljazeera.com/video/quotable/2025/10/24/europe-is-not-off-the-hook-on-pressuring-israel?traffic_source=rss
Al Jazeera,5,Ivorians protest ‘flawed and rigged’ system as pivotal election looms,https://www.aljazeera.com/news/2025/10/24/ivorians-protest-flawed-and-rigged-system-as-pivotal-election-looms?traffic_source=rss
Al Jazeera,6,High stakes for Javier Milei as midterm elections loom in Argentina,https://www.aljazeera.com/news/longform/2025/10/24/high-stakes-for-javier-milei-as-midterm-elections-loom-in-argentina?traffic_source=rss
Al Jazeera,7,Aspinall attempts to shut out noise ahead of Gane bout at UFC 321,https://www.aljazeera.com/sports/2025/10/24/aspinall-attempts-to-shut-out-noise-ahead-of-gane-bout-at-ufc-321?traffic_source=rss
Al Jazeera,8,Freed Palestinian mother recounts torture in Israeli prison,https://www.aljazeera.com/video/newsfeed/2025/10/24/freed-palestinian-mother-recounts-torture-in-israeli-prison?traffic_source=rss
Al Jazeera,9,Can Israel annex the West Bank if the US says no?,https://www.aljazeera.com/news/2025/10/24/can-israel-annex-the-west-bank-if-the-us-says-no?traffic_source=rss
Al Jazeera,10,"Refugee boat sinks off western Turkiye, killing at least 14",https://www.aljazeera.com/news/2025/10/24/refugee-boat-sinks-off-western-turkiye-killing-at-least-14?traffic_source=rss
Al Jazeera,11,Israeli strikes in southern Lebanon kill two in latest truce violation,https://www.aljazeera.com/news/2025/10/24/israeli-strikes-in-southern-lebanon-kill-two-in-latest-truce-violation?traffic_source=rss
Al Jazeera,12,Knesset bill to annex occupied West Bank “a symbolic move”,https://www.aljazeera.com/video/quotable/2025/10/24/knesset-bill-to-annex-occupied-west-bank-a-symbolic?traffic_source=rss
Al Jazeera,13,Bloody Sunday families condemn British soldier’s acquittal,https://www.aljazeera.com/video/newsfeed/2025/10/24/bloody-sunday-families-condemn-british-soldiers-acquittal?traffic_source=rss
Al Jazeera,14,Why has Trump ended trade talks with Canada over a Reagan advertisement?,https://www.aljazeera.com/news/2025/10/24/why-has-trump-ended-trade-talks-with-canada-over-a-reagan-advertisement?traffic_source=rss
Al Jazeera,15,"Ireland picks new president, polls indicate win for pro-Palestine candidate",https://www.aljazeera.com/news/2025/10/24/ireland-voting-for-new-president-in-hotly-contested-election?traffic_source=rss
Al Jazeera,16,Terror-free Turkiye: A homegrown peace reshaping the region,https://www.aljazeera.com/opinions/2025/10/24/terror-free-turkiye-a-homegrown-peace-reshaping-the-region?traffic_source=rss
Al Jazeera,17,US allies seek to keep Trump “invested” in Asia trip talks,https://www.aljazeera.com/video/quotable/2025/10/24/us-allies-seek-to-keep-trump-invested-in-asia-trip-talks?traffic_source=rss
Al Jazeera,18,Ukraine’s Zelenskyy to meet European leaders in London over military aid,https://www.aljazeera.com/news/2025/10/24/ukraines-zelenskyy-to-meet-european-leaders-in-london-over-military-aid?traffic_source=rss
Al Jazeera,19,The US warships off Venezuela aren’t there to fight drugs,https://www.aljazeera.com/opinions/2025/10/24/the-us-warships-off-venezuela-arent-there-to-fight-drugs?traffic_source=rss
Al Jazeera,20,FBI’s NBA probe puts booming business of sports betting in the spotlight,https://www.aljazeera.com/sports/2025/10/24/fbis-nba-probe-puts-booming-business-of-sports-betting-in-the-spotlight?traffic_source=rss
Associated Press,1,Lithuanian president says Russian military planes violated the Baltic country's airspace,https://apnews.com/article/lithuania-russia-military-planes-airspace-f9d31aa920ee91c95103d902967d3b24
Associated Press,2,Ousted Bangladesh leader's son says only an inclusive election could stabilize the country,https://apnews.com/article/bangladesh-hasina-son-wazed-joy-interview-fc2480f5583210bf293c0f40f5f0bdbd
Associated Press,3,A Florida teenager is in an Israeli prison. Why his family and advocates say he should be released,https://apnews.com/article/florida-teen-israeli-prison-west-bank-4b7c68a26e73e0efcf40ff7fce60fde3
Associated Press,4,NBA head coach and player charged in sprawling sports betting and Mafia-backed poker schemes,https://apnews.com/article/miami-heat-terry-rozier-gambling-probe-de98ecb76bb8f13b85f4c5ac62f66221
Associated Press,5,"4 family members of Illinois governor candidate killed in Montana helicopter crash, campaign says",https://apnews.com/article/darren-bailey-family-helicopter-crash-75826f7a22c45f6e948f4f2200596462
Associated Press,6,What lawmakers are saying about Trump's demolition of the East Wing,https://apnews.com/article/east-wing-white-house-ballroom-demolition-b60fcfb6dae74bea1654ccd3baad188b
Associated Press,7,Trump says he's ending trade talks with Canada over TV ads,https://apnews.com/article/trump-canada-trade-tariffs-a0cfd202ef6f22052827b784be708fd6
Associated Press,8,"White House East Wing demolished as Trump moves forward with ballroom construction, AP photos show",https://apnews.com/article/trump-white-house-ballroom-57512e0d91432f75529946fddfbfe2c5
Associated Press,9,Satellite images show before and after of demolition of White House East Wing,https://apnews.com/article/satellite-images-white-house-east-wing-fdceec4fcc5b7cb605f176bf7dd10d6a
Associated Press,10,Blue Jays manager to Shohei Ohtani: We want our hat back — and your dog's jacket,https://apnews.com/article/ohtani-blue-jays-cap-decoy-43556decfe503dc9e0df328ab60aa816
Associated Press,11,"Who are Chauncey Billups, Terry Rozier and Damon Jones? A look at arrested NBA player and coaches",https://apnews.com/article/rozier-billups-jones-betting-arrests-4241238cb43d998f1b9eac47b8d326a7
Associated Press,12,"Black Sox, Ohtani's interpreter and more: A look at notable sports betting scandals",https://apnews.com/article/biggest-sports-betting-scandals-0098b62195eab133d4d03f143db42445
Associated Press,13,Bestselling author Jodi Picoult pushes back after her musical is canceled by Indiana high school,https://apnews.com/article/jodi-picoult-between-lines-musical-banned-3eff9a30aed283c10a80c6590f1f3496
Associated Press,14,Emma Stone and Jesse Plemons make the case for the wild ride that is ‘Bugonia’,https://apnews.com/article/bugonia-interview-emma-stone-jesse-plemons-609aecc044987e8f258ddf377ca93c25
Associated Press,15,"Taylor Swift, LL Cool J, Kenny Loggins and David Byrne are among Songwriters Hall of Fame nominees",https://apnews.com/article/songwriters-hall-taylor-swift-ll-cool-j-7eece792aef4245434353fcaa8c5e5c9
Associated Press,16,"Target is eliminating 1,800 corporate jobs as it looks to reclaim its lost luster",https://apnews.com/article/target-corporate-layoffs-minneapolis-india-f4d8100fa2bf4af67e4fb4e388cedf50
Associated Press,17,Alaska Airlines resumes operations after an IT outage grounded its flights for hours,https://apnews.com/article/alaska-airlines-flights-grounded-information-technology-00d9e88694ac850cd568d8ccb67decf5
Associated Press,18,Wedding etiquette includes being mindful of how much it costs guests to attend,https://apnews.com/article/wedding-guests-bride-costs-finances-party-efba62ab8cc90afd61790e0685ffe4cd
Associated Press,19,Rare dinosaur mummies help scientists recreate their prehistoric lives,https://apnews.com/article/dinosaur-mummy-wyoming-767580229ba73b0e07cf08c593d87225
Associated Press,20,"Dinosaurs were thriving in North America before the mass-extinction asteroid strike, study suggests",https://apnews.com/article/dinosaur-asteroid-mass-extinction-55cb47773edd0061572cbaac51929ffa
