site,rank,title,link
Al Jazeera,1,UK moves to reinstate extradition deal with Hong Kong despite concerns,https://www.aljazeera.com/news/2025/7/25/uk-moves-to-reinstate-extradition-deal-with-hong-kong-despite-concerns?traffic_source=rss
Al Jazeera,2,"Death toll in Thai-Cambodia clashes rises to 16 as 120,000 flee border area",https://www.aljazeera.com/news/2025/7/25/death-toll-in-thai-cambodia-clashes-rises-to-16-as-120000-flee-border-area?traffic_source=rss
Al Jazeera,3,Why is Taiwan holding a ‘Great Recall’ vote?,https://www.aljazeera.com/news/2025/7/25/why-is-taiwan-holding-a-great-recall-vote?traffic_source=rss
Al Jazeera,4,"US, Israel condemn France’s move to recognise Palestinian state",https://www.aljazeera.com/news/2025/7/25/us-israel-condemn-frances-move-to-recognise-palestinian-state?traffic_source=rss
Al Jazeera,5,US State Department approves $4.7bn surface-to-air missile package to Egypt,https://www.aljazeera.com/news/2025/7/25/us-state-department-approves-4-7bn-surface-to-air-missile-package-to-egypt?traffic_source=rss
Al Jazeera,6,Elon Musk ‘sorry’ after Starlink satellite internet suffers global outage,https://www.aljazeera.com/news/2025/7/25/elon-musk-sorry-after-starlink-satellite-internet-suffers-global?traffic_source=rss
Al Jazeera,7,"Russia-Ukraine war: List of key events, day 1,247",https://www.aljazeera.com/news/2025/7/25/russia-ukraine-war-list-of-key-events-day-1247?traffic_source=rss
Al Jazeera,8,Death toll from starvation in Gaza rises to 115 as Israeli attacks continue,https://www.aljazeera.com/news/2025/7/24/death-toll-from-starvation-in-gaza-rises-to-115-as-israeli-attacks-continue?traffic_source=rss
Al Jazeera,9,Deported Venezuelan man files abuse complaint against the US government,https://www.aljazeera.com/news/2025/7/24/deported-venezuelan-man-files-abuse-complaint-against-the-us-government?traffic_source=rss
Al Jazeera,10,Judge rules former Canadian hockey players not guilty of sexual assault,https://www.aljazeera.com/news/2025/7/24/judge-rules-former-canadian-hockey-players-not-guilty-of-sexual-assault?traffic_source=rss
Al Jazeera,11,Has Donald Trump’s policy of imposing trade tariffs worked?,https://www.aljazeera.com/video/inside-story/2025/7/24/has-donald-trumps-policy-of-imposing-trade-tariffs-worked?traffic_source=rss
Al Jazeera,12,Could Israel be planning a second war on Iran?,https://www.aljazeera.com/news/2025/7/24/could-israel-be-planning-a-second-war-on-iran?traffic_source=rss
Al Jazeera,13,Iran reaffirms right to enrich uranium ahead of key talks in Turkiye,https://www.aljazeera.com/news/2025/7/24/iran-reaffirms-right-to-enrich-uranium-ahead-of-key-talks-in-turkiye?traffic_source=rss
Al Jazeera,14,Trump visits US Federal Reserve HQ amid feud with Chairman Powell,https://www.aljazeera.com/economy/2025/7/24/trump-visits-us-federal-reserve-hq-amid-feud-with-chairman-powell?traffic_source=rss
Al Jazeera,15,"US doctors, veterans urge Trump to end Israel support as hunger grips Gaza",https://www.aljazeera.com/news/2025/7/24/us-doctors-veterans-urge-trump-to-end-israel-support-as-hunger-grips-gaza?traffic_source=rss
Al Jazeera,16,Macron says France will recognise Palestinian state in September,https://www.aljazeera.com/news/2025/7/24/macron-says-france-will-recognise-palestinian-state-in-september?traffic_source=rss
Al Jazeera,17,US considering ‘alternative options’ after leaving Gaza talks,https://www.aljazeera.com/video/newsfeed/2025/7/24/us-considering-alternative-options-after-leaving-gaza-talks?traffic_source=rss
Al Jazeera,18,Gaza artist destroys art to turn frames into firewood,https://www.aljazeera.com/video/newsfeed/2025/7/24/gaza-artist-destroys-art-to-turn-frames-into-firewood?traffic_source=rss
Al Jazeera,19,"US, Israel recall teams from Gaza ceasefire talks after Hamas proposal",https://www.aljazeera.com/news/2025/7/24/us-israel-recall-teams-from-gaza-ceasefire-talks-after-hamas-proposal?traffic_source=rss
Al Jazeera,20,"Israeli settler attacks show new level of violence, organisation",https://www.aljazeera.com/video/newsfeed/2025/7/24/israeli-settler-attacks-show-new-level-of-violence-organisation?traffic_source=rss
