site,rank,title,link
Al Jazeera,1,‘Opening Strait of Hormuz will probably require US boots on the ground’,https://www.aljazeera.com/video/quotable/2026/3/22/opening-strait-of-hormuz-will-probably-require-us-boots-on-the?traffic_source=rss
Al Jazeera,2,‘Colonialism did its job of isolating us’ – Colombia VP,https://www.aljazeera.com/video/newsfeed/2026/3/22/colonialism-did-its-job-of-isolating-us-colombia-vp?traffic_source=rss
Al Jazeera,3,Latin American presidents criticise US actions,https://www.aljazeera.com/video/newsfeed/2026/3/22/latin-american-presidents-criticise-us-actions?traffic_source=rss
Al Jazeera,4,Iran war is creating ‘heightened risks of instability across countries in A,https://www.aljazeera.com/video/quotable/2026/3/22/iran-war-is-creating-heightened-risks-of-instability-across-countries-in-a?traffic_source=rss
Al Jazeera,5,Aftermath of Iranian missile strikes near Israel’s nuclear facility,https://www.aljazeera.com/gallery/2026/3/22/aftermath-of-iranian-missiles-strikes-near-israels-nuclear-centre?traffic_source=rss
Al Jazeera,6,Lebanese nurse refuses to leave her post at hospital despite losses,https://www.aljazeera.com/video/newsfeed/2026/3/22/lebanese-nurse-refuses-to-leave-her-post-at-hospital-despite-loses?traffic_source=rss
Al Jazeera,7,‘The United States doesn’t even pretend to be within international law’,https://www.aljazeera.com/video/quotable/2026/3/22/the-united-states-doesnt-even-pretend-to-be-within-international?traffic_source=rss
Al Jazeera,8,Italians vote in high-stakes justice referendum in key test for Meloni,https://www.aljazeera.com/news/2026/3/22/italians-vote-in-high-stakes-justice-referendum-in-key-test-for-meloni?traffic_source=rss
Al Jazeera,9,Israeli firefighters battle vehicles blaze after missile attack from Lebano,https://www.aljazeera.com/video/newsfeed/2026/3/22/israeli-firefighters-battle-vehicles-blaze-after-missile-attack-from-lebano?traffic_source=rss
Al Jazeera,10,Woman confronts Ben-Gvir at site of Iranian missile strike,https://www.aljazeera.com/video/newsfeed/2026/3/22/woman-confronts-ben-gvir-at-site-of-iranian-missile-strike?traffic_source=rss
Al Jazeera,11,Why the world should worry about Israel’s nuclear doctrine,https://www.aljazeera.com/opinions/2026/3/22/why-the-world-should-worry-about-israels-nuclear-doctrine?traffic_source=rss
Al Jazeera,12,Slovenia’s governing liberals face right-wing populists in tight election,https://www.aljazeera.com/news/2026/3/22/slovenias-governing-liberals-face-right-wing-populists-in-tight-election?traffic_source=rss
Al Jazeera,13,Iran war: What’s happening on day 23 of US-Israel attacks?,https://www.aljazeera.com/news/2026/3/22/iran-war-whats-happening-on-day-23-of-us-israel-attacks?traffic_source=rss
Al Jazeera,14,All seven on board Qatar military helicopter killed in crash,https://www.aljazeera.com/news/2026/3/22/six-killed-as-qatar-army-helicopter-crashes-due-to-technical-malfunction-2?traffic_source=rss
Al Jazeera,15,Ghana pushes for slave trade to be declared a crime against Humanity,https://www.aljazeera.com/video/newsfeed/2026/3/22/ghana-pushes-for-slave-trade-to-be-declared-a-crime-against-humanity?traffic_source=rss
Al Jazeera,16,‘I count their breaths’: A homeless mother protects her children in Delhi,https://www.aljazeera.com/features/longform/2026/3/22/i-count-their-breaths-a-homeless-mother-protects-her-children-in-delhi?traffic_source=rss
Al Jazeera,17,Drone footage shows damage in Arad after overnight Iranian missile attack,https://www.aljazeera.com/video/newsfeed/2026/3/22/drone-footage-shows-damage-in-arad-after-overnight-iranian-missile-attack?traffic_source=rss
Al Jazeera,18,‘Can’t live like this’: Cuba hit by second nationwide blackout in a week,https://www.aljazeera.com/news/2026/3/22/cant-live-like-this-cuba-hit-by-second-nationwide-blackout-in-a-week?traffic_source=rss
Al Jazeera,19,"Drone footage captures flooding across Oahu, Hawaii",https://www.aljazeera.com/video/newsfeed/2026/3/22/drone-footage-captures-flooding-across-oahu-hawaii?traffic_source=rss
Al Jazeera,20,"Evloev upsets Murphy, sets up featherweight title shot against Volkanovski",https://www.aljazeera.com/sports/2026/3/22/evloev-upsets-murphy-sets-up-featherweight-title-shot-against-volkanovski?traffic_source=rss
Associated Press,1,"Surprise, embarrassment, unease in Japan after Trump uses Pearl Harbor to defend Iran war",https://apnews.com/article/tokyo-us-trump-takaichi-japan-pearl-harbor-iran-war-9b3a60e02d384d1e024094e49c1e7f5e
Associated Press,2,What to know about Diego Garcia after Iran targets the remote island's key US military base,https://apnews.com/article/diego-garcia-iran-missiles-what-to-know-d51bd9c3bcd83ee0300288221bff5614
Associated Press,3,Trump threatens attacks on Iranian power plants if Tehran fails to open the Strait of Hormuz,https://apnews.com/article/iran-us-israel-trump-lebanon-march-22-2026-16cc60862529b873666ce4c1f6529d78
Associated Press,4,"For airline travelers, the shutdown answer is simple: Pay TSA officers",https://apnews.com/article/government-shutdown-tsa-workers-920577c153ffd1877f59dfb8f8efed39
Associated Press,5,Extreme heat continues to strike Southwest US and even Nebraska needs a cold drink,https://apnews.com/article/extreme-heat-arizona-southwest-nebraska-23f776d71f1b46f20cdbe251a61456cb
Associated Press,6,Six people injured after floor collapses at New Hampshire wedding venue,https://apnews.com/article/floor-collapse-wedding-new-hampshire-27a1b72327e3d696b32a6cdd9c1e7782
Associated Press,7,"Former FBI Director Robert Mueller, who investigated Russia-Trump campaign ties, dies",https://apnews.com/article/robert-mueller-fbi-director-trump-russia-investigation-7aca939dc25d4652815376f73e0f9aaf
Associated Press,8,Trump's mixed messages on Iran: 'Winding down' the war and easing sanctions but adding more troops,https://apnews.com/article/trump-iran-war-oil-sanctions-troops-contradictions-eb10ac163be642ad4d738bab9f0ae2a6
Associated Press,9,Congress looks for Trump's exit plan as the Iran war drags on,https://apnews.com/article/iran-war-powers-exit-strategy-congress-trump-781ef538fbb493cf0973c6a89698f36e
Associated Press,10,Clemson women's shining March moment wiped out because clock started late ahead of buzzer-beater,https://apnews.com/article/clemson-women-march-madness-buzzer-beater-clock-review-c45a136dd480b092f4a95be05ff18014
Associated Press,11,Paul Mainieri out as South Carolina's baseball coach after 1 1/2 seasons,https://apnews.com/article/south-carolina-baseball-mainieri-4f873861c96d4b966a4b9318a60226c8
Associated Press,12,March Madness spotlight shines on Florida's 7-foot-9 center Olivier Rioux,https://apnews.com/article/florida-iowa-south-preview-march-madness-ncaa-tournament-09e2ed63e1f0227d52b48daa54ad9043
Associated Press,13,The media may have unmasked Banksy — again. That's angered some art fans but not ruffled dealers,https://apnews.com/article/banksy-art-gunningham-identity-bca10c147d7ea97bdbb23058cfd613b5
Associated Press,14,'Buffy the Vampire Slayer' actor Nicholas Brendon dies at 54,https://apnews.com/article/nicholas-brendon-buffy-vampire-slayer-obit-ccda54d8385010587f7fb5eef7c52b82
Associated Press,15,Spiking gas prices tied to Iran war are set to eat up tax refunds touted by Trump,https://apnews.com/article/trump-tax-refunds-gas-prices-859494e746561a3343dcd57836c3dc83
Associated Press,16,"Nonprofits, unions and airports rally to feed TSA officers as shutdown drags",https://apnews.com/article/tsa-lines-airport-shutdown-food-banks-a1e52ca10557f4f70c1360e878567b4b
Associated Press,17,Newly discovered photos show astronaut Neil Armstrong after the Gemini 8 emergency,https://apnews.com/article/neil-armstrong-museum-gemini-8-4fb53a2c8b4735c6262313edd7a63348
Associated Press,18,Viral phenomenon in Argentina has young people identifying themselves as animals,https://apnews.com/article/argentina-teenagers-identifying-as-animals-therians-tiktok-54d158c4842f6515e31d83a260cdf31f
Associated Press,19,"A red fox stows away on a cargo ship, traveling from England to the US",https://apnews.com/article/fox-stowaway-ship-england-us-bronx-zoo-fd4c5eaef207d8fffc6408f7671867c0
Associated Press,20,Raccoon goes on drunken rampage in Virginia liquor store and passes out on bathroom floor,https://apnews.com/article/drunk-raccoon-liquor-store-bandit-virginia-5109feb2ea9ab9bf8954ec3798689fd0
