site,rank,title,link
Al Jazeera,1,Yemen’s Houthis mull how they can help ally Iran against Israel,https://www.aljazeera.com/news/2025/6/20/yemen-houthis-mull-over-help-ally-iran-israel?traffic_source=rss
Al Jazeera,2,British parliament votes in favour of assisted dying law,https://www.aljazeera.com/news/2025/6/20/british-parliament-votes-in-favour-of-assisted-dying-law?traffic_source=rss
Al Jazeera,3,Iranian missile strikes building in Israel’s Haifa,https://www.aljazeera.com/video/newsfeed/2025/6/20/iranian-missile-strikes-building-in-israels-haifa?traffic_source=rss
Al Jazeera,4,Has Trump put off joining the Israel-Iran conflict for two weeks?,https://www.aljazeera.com/news/2025/6/20/has-trump-put-off-joining-the-israel-iran-conflict-for-two-weeks?traffic_source=rss
Al Jazeera,5,Armenian PM in Turkiye for ‘historic’ visit aimed at normalising ties,https://www.aljazeera.com/news/2025/6/20/armenian-pm-in-turkiye-for-historic-visit-aimed-at-normalising-ties?traffic_source=rss
Al Jazeera,6,"Iran, Israel trade air attacks as conflict enters second week",https://www.aljazeera.com/news/2025/6/20/iran-israel-trade-air-attacks-as-conflict-enters-second-week?traffic_source=rss
Al Jazeera,7,Trump now finds himself “hostage to Netanyahu’s agenda”,https://www.aljazeera.com/video/quotable/2025/6/20/trump-now-finds-himself-hostage-to-netanyahus?traffic_source=rss
Al Jazeera,8,African manhood is broken – and it’s costing women their lives,https://www.aljazeera.com/opinions/2025/6/20/african-manhood-is-broken-and-its-costing-women-their-lives?traffic_source=rss
Al Jazeera,9,Project 2025: Governance reform or Culture War battle plan?,https://www.aljazeera.com/video/upfront/2025/6/20/project-2025-governance-reform-or-culture-war-battle-plan?traffic_source=rss
Al Jazeera,10,Pro-Palestine activists spray red paint on military plane at UK airbase,https://www.aljazeera.com/video/newsfeed/2025/6/20/pro-palestine-activists-spray-red-paint-on-military-plane-at-uk-airbase?traffic_source=rss
Al Jazeera,11,At least 35 killed in new Israeli attack on Gaza aid seekers,https://www.aljazeera.com/news/2025/6/20/at-least-35-killed-in-new-israeli-attack-on-gaza-aid-seekers?traffic_source=rss
Al Jazeera,12,‘Thithi president!’: Supporters rally for banned Ivorian opposition hopeful,https://www.aljazeera.com/news/2025/6/20/thithi-president-supporters-rally-for-banned-ivorian-presidential-candidate?traffic_source=rss
Al Jazeera,13,EU squeezes Russia financially to reach ‘peace through strength’ in Ukraine,https://www.aljazeera.com/news/2025/6/20/eu-squeezes-russia-financially-to-reach-peace-through-strength-in-ukraine?traffic_source=rss
Al Jazeera,14,Pro-Palestinian activists break into UK military base,https://www.aljazeera.com/news/2025/6/20/pro-palestinian-activists-break-into-uk-military-base?traffic_source=rss
Al Jazeera,15,Is Trump planning an ‘Africa visa ban’?,https://www.aljazeera.com/news/2025/6/20/is-trump-planning-an-africa-visa-ban?traffic_source=rss
Al Jazeera,16,Fires and destruction after Iranian attack in southern Israel,https://www.aljazeera.com/video/newsfeed/2025/6/20/fires-and-destruction-after-iranian-attack-in-southern-israel?traffic_source=rss
Al Jazeera,17,See inside newly found smuggling tunnel under Mexico-US border,https://www.aljazeera.com/video/newsfeed/2025/6/20/see-inside-newly-found-smuggling-tunnel-under-mexico-us-border?traffic_source=rss
Al Jazeera,18,US appeals court rules Trump can keep control of California National Guard,https://www.aljazeera.com/news/2025/6/20/us-appeals-court-rules-trump-can-keep-control-of-california-national-guard?traffic_source=rss
Al Jazeera,19,US police use tear gas on protesters at immigration facility,https://www.aljazeera.com/video/newsfeed/2025/6/20/us-police-use-tear-gas-on-protesters-at-immigration-facility?traffic_source=rss
Al Jazeera,20,Taiwan detects dozens of Chinese aircraft near island after UK ship patrol,https://www.aljazeera.com/news/2025/6/20/taiwan-detects-dozens-of-chinese-aircraft-near-island-after-uk-ship-patrol?traffic_source=rss
