site,rank,title,link
Al Jazeera,1,Powerful magnitude 6.3 quake hits north Afghanistan’s Hindu Kush region,https://www.aljazeera.com/news/2025/11/2/powerful-magnitude-6-3-quake-hits-north-afghanistans-hindu-kush-region?traffic_source=rss
Al Jazeera,2,Colombia’s ELN rebels face US drug threats amid push for peace talks,https://www.aljazeera.com/news/2025/11/2/colombias-eln-rebels-face-us-drug-threats-amid-push-for-peace-talks?traffic_source=rss
Al Jazeera,3,"Palestinians face hunger, cold and loss amid ongoing Israeli siege on Gaza",https://www.aljazeera.com/news/2025/11/2/palestinians-face-hunger-cold-and-loss-amid-ongoing-israeli-siege-on-gaza?traffic_source=rss
Al Jazeera,4,Trump says Xi assured him China won’t take action on Taiwan,https://www.aljazeera.com/news/2025/11/2/trump-says-xi-assured-him-china-wont-take-action-on-taiwan?traffic_source=rss
Al Jazeera,5,Barcelona beat Elche 3-1 to stay in touch with La Liga leaders Real Madrid,https://www.aljazeera.com/sports/2025/11/2/barcelona-beat-elche-3-1-to-stay-in-touch-with-la-liga-leaders-real-madrid?traffic_source=rss
Al Jazeera,6,"Drinking water in Tehran could run dry in two weeks, Iranian official says",https://www.aljazeera.com/news/2025/11/2/drinking-water-in-tehran-could-run-dry-in-two-weeks-iranian-official-says?traffic_source=rss
Al Jazeera,7,India’s women beat South Africa to claim first Cricket World Cup,https://www.aljazeera.com/sports/2025/11/2/indias-women-defeat-south-africa-to-seal-first-cricket-world-cup?traffic_source=rss
Al Jazeera,8,China-US relations: ‘Somewhere between a ceasefire and a truce’,https://www.aljazeera.com/video/the-bottom-line/2025/11/2/china-us-relations-somewhere-between-a-ceasefire-and-a?traffic_source=rss
Al Jazeera,9,Briahna Joy Gray: Is Zohran Mamdani the future of the Democrats?,https://www.aljazeera.com/video/upfront/2025/11/2/briahna-joy-gray-is-zohran-mamdani-the-future-of-the-democrats?traffic_source=rss
Al Jazeera,10,"Canada, Philippines sign defence pact to deter Beijing in South China Sea",https://www.aljazeera.com/news/2025/11/2/canada-philippines-sign-defence-pact-to-deter-beijing-in-south-china-sea?traffic_source=rss
Al Jazeera,11,Who killed Shireen?,https://www.aljazeera.com/video/featured-documentaries/2025/11/2/who-killed-shireen?traffic_source=rss
Al Jazeera,12,Humanitarian disaster worsens across Sudan after RSF takes over el-Fasher,https://www.aljazeera.com/news/2025/11/2/humanitarian-disaster-worsens-across-sudan-after-rsf-takes-over-el-fasher?traffic_source=rss
Al Jazeera,13,How can the US government shutdown be brought to an end?,https://www.aljazeera.com/video/inside-story/2025/11/2/how-can-the-us-government-shutdown-be-brought-to-an?traffic_source=rss
Al Jazeera,14,How labour unions in Europe can help end Israel’s genocide in Gaza,https://www.aljazeera.com/opinions/2025/11/2/how-labour-unions-in-europe-can-help-end-israels-genocide-in-gaza?traffic_source=rss
Al Jazeera,15,Hamas rejects US accusation it looted aid trucks in Gaza,https://www.aljazeera.com/news/2025/11/2/hamas-rejects-us-accusation-it-looted-aid-trucks-in-gaza?traffic_source=rss
Al Jazeera,16,Barcelona vs Elche 3-1: La Liga – as it happened,https://www.aljazeera.com/sports/liveblog/2025/11/2/live-barcelona-vs-elche-la-liga?traffic_source=rss
Al Jazeera,17,Nigeria rejects claims of Christian genocide as Trump mulls military action,https://www.aljazeera.com/news/2025/11/2/nigeria-welcomes-us-assistance-to-fight-terrorism-after-trumps-threats?traffic_source=rss
Al Jazeera,18,Moroccans celebrate UN support for Rabat’s Western Sahara autonomy plan,https://www.aljazeera.com/video/newsfeed/2025/11/2/moroccans-celebrate-un-support-for-rabats-western-sahara-autonomy-plan?traffic_source=rss
Al Jazeera,19,Israeli settlers intensify attacks on Palestinian farmers and livestock,https://www.aljazeera.com/video/newsfeed/2025/11/2/israeli-settlers-intensify-attacks-on-palestinian-farmers-and-livestock?traffic_source=rss
Al Jazeera,20,US federal agent in Chicago punches restrained man’s head on the ground,https://www.aljazeera.com/video/newsfeed/2025/11/2/us-federal-agent-in-chicago-punches-restrained-mans-head-on-the-ground?traffic_source=rss
Associated Press,1,What to know about the British king's remote private estate that will be Andrew's new home,https://apnews.com/article/britain-andrew-sandringham-king-charles-3ce1576fd3156112c0734755a0d5d854
Associated Press,2,UK police release 1 of 2 men arrested over train stabbings and laud 'heroic' rail worker,https://apnews.com/article/britain-train-stabbings-victims-investigation-2493176af723564c142fb5b9f1e9a10c
Associated Press,3,"UK police say 10 people in hospital after train stabbing attack, 9 with life-threatening injuries",https://apnews.com/article/britain-train-stabbing-arrests-a3de4c7dffe4e27a89470f885a0917f7
Associated Press,4,Michigan lawyer says a Halloween terror plot that FBI Director Kash Patel described never existed,https://apnews.com/article/detroit-michigan-halloween-terror-plot-fbi-patel-d4758edbde0b18c19ca7b38f9e836904
Associated Press,5,"SNAP benefits cut off during shutdown, driving long lines at food pantries",https://apnews.com/article/government-shutdown-food-lines-snap-6b55e2c21c0198f3309f3a45a55f33b6
Associated Press,6,"Explosion at Harvard Medical School appears to have been intentional, authorities say. No one hurt",https://apnews.com/article/harvard-medical-explosion-boston-a72804f99ba68661eb0460ad97fcbc21
Associated Press,7,Tariffs are Trump's favorite foreign policy tool. The Supreme Court could change how he uses them,https://apnews.com/article/trump-tariffs-supreme-court-foreign-policy-21337d2c11e629da3f187cdeb381d58b
Associated Press,8,East Wing ballroom donations by corporate owners create awkward moments for news outlets,https://apnews.com/article/white-house-media-east-wing-renovation-donors-b019e9077c60a3adbdd2037cc3c49270
Associated Press,9,Trump says China's Xi has assured him that he won't take action on Taiwan during Republican's term,https://apnews.com/article/trump-xi-china-taiwan-853adf6a760375dc2dfc66ea59c8d60c
Associated Press,10,Dodgers great Clayton Kershaw ends his career unaware at first that he won the World Series again,https://apnews.com/article/clayton-kershaw-dodgers-blue-jays-world-series-e060434c39bab8f54bb00affad0666cd
Associated Press,11,"Dodgers beat Blue Jays in epic, extra-innings Game 7 to repeat as World Series champions",https://apnews.com/article/world-series-dodgers-blue-jays-score-a9daf1f7ebdd75d5e7bf85d5e7ba22b9
Associated Press,12,‘Regretting You’ and ‘Black Phone 2’ neck-in-neck on slow Halloween box office weekend,https://apnews.com/article/box-office-halloween-e41595f31679ef33f90a93125599ad54
Associated Press,13,Flight delays persist as government shutdown leads to air traffic controller shortages,https://apnews.com/article/airlines-flights-delays-shutdown-538fcee7931eefed1acc50b104a67d1f
Associated Press,14,"Giant, floating pumpkin races draw large crowds to annual event in Oregon",https://apnews.com/article/giant-pumpkin-regatta-race-oregon-tualatin-e51831205b13592259fbd85bc4f29358
Associated Press,15,"Ah, rats! Researchers say some other critter likely created Chicago's 'rat hole' sidewalk landmark",https://apnews.com/article/chicago-rat-hole-study-squirrel-researchers-4a0931f965a0fc5241ea95af2b09859b
Associated Press,16,An elephant family smashed pumpkins at the Oregon Zoo. But this baby just wanted to play ball,https://apnews.com/article/elephant-pumpkin-smash-video-portland-oregon-zoo-1e942f8379ee099847254c6811ba0c29
Associated Press,17,Mysterious googly eyes go viral after appearing on public art in Oregon,https://apnews.com/article/googly-eyes-public-art-sculptures-bend-oregon-2f4fce84569e3b599106199f3b6d66e3
Associated Press,18,Here's what happens to your body when clocks 'fall back' an hour,https://apnews.com/article/daylight-saving-time-health-effects-body-b67f3f0c00774851514c7fc80913c7c4
Associated Press,19,Mistake-filled legal briefs show the limits of relying on AI tools at work,https://apnews.com/article/artificial-intelligence-tools-work-errors-skills-fddcd0a5c86c20a4748dc65ba38f77fa
Associated Press,20,"Nature walks are good for you, but can a city stroll be just as good?",https://apnews.com/article/wellness-urban-walking-cities-ae7c613234590d1cde93ed9793c623a3
