site,rank,title,link
Al Jazeera,1,Iran names successor to security chief killed in US-Israeli attack,https://www.aljazeera.com/news/2026/3/24/mohammad-bagher-zolghadr-succeeds-slain-larijani-as-iran-security-chief?traffic_source=rss
Al Jazeera,2,Afghanistan frees detained US citizen Dennis Coyle as gesture of ‘goodwill’,https://www.aljazeera.com/news/2026/3/24/afghanistan-frees-detained-us-citizen-dennis-coyle-as-gesture-of-goodwill?traffic_source=rss
Al Jazeera,3,Israeli strike lands near Roman ruins in Lebanon,https://www.aljazeera.com/video/newsfeed/2026/3/24/israeli-strike-lands-near-roman-ruins-in-lebanon?traffic_source=rss
Al Jazeera,4,Kim Jong Un says North Korea will never give up on nuclear weapons,https://www.aljazeera.com/video/newsfeed/2026/3/24/kim-jong-un-says-north-korea-will-never-give-up-on-nuclear-weapons?traffic_source=rss
Al Jazeera,5,Anthropic challenges US Pentagon’s ban in San Francisco court showdown,https://www.aljazeera.com/economy/2026/3/24/anthropic-challenges-us-pentagons-ban-in-san-francisco-court-showdown?traffic_source=rss
Al Jazeera,6,Israeli soldiers accused of ‘torturing’ toddler in Gaza,https://www.aljazeera.com/video/newsfeed/2026/3/24/israeli-soldiers-accused-of-torturing-toddler-in-gaza?traffic_source=rss
Al Jazeera,7,"When are UEFA’s World Cup 2026 playoffs, and which nations are involved?",https://www.aljazeera.com/sports/2026/3/24/when-are-uefas-world-cup-2026-playoffs-and-which-nations-are-involved?traffic_source=rss
Al Jazeera,8,Palestinian FA calls for Israeli ban after FIFA discrimination report,https://www.aljazeera.com/sports/2026/3/24/palestine-fa-calls-for-israel-football-ban-after-fifa-discrimination-report?traffic_source=rss
Al Jazeera,9,Israeli defences questioned as Iran continues to cause damage,https://www.aljazeera.com/video/newsfeed/2026/3/24/israeli-defences-questioned-as-iran-continues-to-cause-damage?traffic_source=rss
Al Jazeera,10,Aid flotilla reaches Cuba amid US oil blockade and blackouts,https://www.aljazeera.com/video/newsfeed/2026/3/24/aid-flotilla-reaches-cuba-amid-us-oil-blockade-and-blackouts?traffic_source=rss
Al Jazeera,11,Iranian IRGC’s ties to Hezbollah deepen tensions in Lebanese politics,https://www.aljazeera.com/features/2026/3/24/iranian-irgc-ties-hezbollah-deepen-tensions-lebanese-politics?traffic_source=rss
Al Jazeera,12,Israeli strike hits Tyre during Al Jazeera report,https://www.aljazeera.com/video/newsfeed/2026/3/24/israeli-strike-hits-tyre-during-al-jazeera-report?traffic_source=rss
Al Jazeera,13,Moment rescuers find man alive under the rubble in Tehran,https://www.aljazeera.com/video/newsfeed/2026/3/24/moment-rescuers-find-man-alive-under-the-rubble-in-tehran?traffic_source=rss
Al Jazeera,14,UN experts urge Israel to free Gaza doctor amid reports of ‘severe torture’,https://www.aljazeera.com/news/2026/3/24/un-experts-urge-israel-to-free-gaza-doctor-amid-reports-of-severe-torture?traffic_source=rss
Al Jazeera,15,"Who is Markwayne Mullin, Trump’s new homeland security chief?",https://www.aljazeera.com/video/newsfeed/2026/3/24/who-is-markwayne-mullin-trumps-new-homeland-security-chief?traffic_source=rss
Al Jazeera,16,Keir Starmer’s policy on the Iran war is a recipe for catastrophe,https://www.aljazeera.com/opinions/2026/3/24/keir-starmers-policy-on-the-iran-war-is-a-recipe-for-catastrophe?traffic_source=rss
Al Jazeera,17,QatarEnergy declares force majeure on some LNG contracts due to Iran war,https://www.aljazeera.com/news/2026/3/24/qatarenergy-declares-force-majeure-on-some-lng-contracts?traffic_source=rss
Al Jazeera,18,"Is the US talking to Iran’s Mohammad Bagher Ghalibaf, and who is he?",https://www.aljazeera.com/news/2026/3/24/is-the-us-talking-to-irans-mohammad-bagher-ghalibaf-and-who-is-he?traffic_source=rss
Al Jazeera,19,"Why has India arrested US, Ukrainian nationals under ‘anti-terror’ laws?",https://www.aljazeera.com/news/2026/3/24/why-has-india-arrested-us-ukrainian-nationals-under-anti-terror-laws?traffic_source=rss
Al Jazeera,20,What if humanity meets the unknown?,https://www.aljazeera.com/video/doha-debates/2026/3/24/what-if-humanity-meets-the-unknown?traffic_source=rss
Associated Press,1,"Airstrikes batter Iran as it attacks Israel and Gulf states, while diplomatic efforts gather pace",https://apnews.com/article/iran-us-israel-trump-lebanon-march-24-2026-8bb5e79a98ea72fccc5c50b4931ad778
Associated Press,2,"Military plane crash kills at least 66, head of Colombia's armed forces says",https://apnews.com/article/colombia-military-plane-crash-hercules-troops-defense-minister-putumayo-8357e5d7614bbe1208ec0bf1c280f9e9
Associated Press,3,Fire out and shelter-in-place order is lifted after oil refinery explosion near Texas coast,https://apnews.com/article/refinery-explosion-texas-coast-60ecf6d9a70a2f1d5494fb8e38a84c4a
Associated Press,4,Flight attendant thrown from Air Canada plane survives in a 'total miracle',https://apnews.com/article/air-canada-flight-attendant-survives-4bea55d29d080ca2ebd9aff26d124740
Associated Press,5,"Judge appoints new US attorney for New Jersey after Habba, other officials were disqualified",https://apnews.com/article/us-attorney-new-jersey-robert-frazer-habba-04e3cf07a98832e14fae8393531052ac
Associated Press,6,Pentagon will remove media offices after judge reinstates New York Times press credentials,https://apnews.com/article/pentagon-policy-news-reporters-hegseth-85b3c3cc7c71962d493037e69531d6fd
Associated Press,7,Deal emerges to end Homeland Security budget standoff as TSA disruptions deepen,https://apnews.com/article/homeland-security-funding-ice-airport-security-lines-ed04ac573dfb27e939b7234cc8245b16
Associated Press,8,Trump's claim that US and Iran are talking elicits market cheers and plenty of skepticism,https://apnews.com/article/trump-iran-talks-objectives-e27ba37004edf6dc241417ad11c87760
Associated Press,9,"Robot strike zone will create winners and losers among pitchers, batters who earned human calls",https://apnews.com/article/abs-robot-umpires-who-benefits-23389564b61a52093f4399857f4fc531
Associated Press,10,WNBA players unanimously approve a new 7-year collective bargaining agreement through 2032,https://apnews.com/article/cba-wnba-vote-2b56582d24d56d6cdeb0711e584cc7b9
Associated Press,11,Shiffrin wins World Cup slalom but Aicher's third place puts overall title on hold,https://apnews.com/article/womens-slalom-shiffrin-aicher-a5eca12ad29251d85b440fe4750d7a87
Associated Press,12,Jury finds that Bill Cosby sexually assaulted woman in 1972 and awards her nearly $60 million,https://apnews.com/article/bill-cosby-verdict-sexual-assault-motsinger-83b384df93fd9bf862b553b19b5aa4f9
Associated Press,13,"Now a true pop star, Miley Cyrus returns to her 'Hannah Montana' roots to fete anniversary special",https://apnews.com/article/miley-cyrus-hannah-montana-anniversary-special-27130985d898f0108b7972e16b851cd0
Associated Press,14,Bob Woodward to 'lift the lid' on decades of reporting in new memoir 'Secrets',https://apnews.com/article/bob-woodward-secrets-watergate-reporter-washington-82db1394bb04fd7ce361bdfdba62c563
Associated Press,15,"It's a bad time to hunt for new jobs, most US workers say in new Gallup poll",https://apnews.com/article/jobs-economy-pessimism-498d797131e133585c35cbea8255e9ac
Associated Press,16,OnlyFans owner Leonid Radvinsky dies of cancer at 43,https://apnews.com/article/leonid-radvinsky-dead-obituary-onlyfans-22a78fa6195926a6669531b15630f63b
Associated Press,17,US stocks swing between losses and gains on uncertainty over length of Iran war,https://apnews.com/article/stock-markets-trump-iran-oil-46bf2f12fb7f46c97dfe983f76e938f9
Associated Press,18,CERN runs a delicate test on transporting antimatter,https://apnews.com/article/cern-antiproton-road-test-switzerland-geneva-17369ec3439bf5263d82ca11f0124895
Associated Press,19,El CERN celebra como un éxito científico una delicada prueba para transportar antimateria,https://apnews.com/article/suiza-cern-antiprotones-antimateria-viaje-ciencia-investigacion-eb972b652b06e4ad1bb1ea7b74ab8881
Associated Press,20,People 'bathe' in nature to get respite from chaotic news cycle,https://apnews.com/article/forest-bathing-stress-relief-77807628ff6af6b8925c019b41a125bc
