site,rank,title,link
Al Jazeera,1,Israel capitalises as Gaza fatigue sets in,https://www.aljazeera.com/program/the-listening-post/2025/5/10/israel-capitalises-as-gaza-fatigue-sets-in?traffic_source=rss
Al Jazeera,2,Will the truce between India and Pakistan resolve differences over Kashmir?,https://www.aljazeera.com/video/inside-story/2025/5/10/will-the-truce-between-india-and-pakistan-resolve-differences-over-kashmir?traffic_source=rss
Al Jazeera,3,Israeli protesters in Tel Aviv demand an end to war on Gaza,https://www.aljazeera.com/news/2025/5/10/israeli-protesters-in-tel-aviv-demand-an-end-to-war-on-gaza?traffic_source=rss
Al Jazeera,4,Newark mayor denies trespassing at US immigration centre following arrest,https://www.aljazeera.com/news/2025/5/10/newark-mayor-denies-trespassing-at-immigration-center-following-arrest?traffic_source=rss
Al Jazeera,5,Barcelona vs Real Madrid: Ancelotti coy on future as Alonso link grows,https://www.aljazeera.com/sports/2025/5/10/barcelona-vs-real-madrid-ancelotti-coy-on-future-as-alonso-link-grows?traffic_source=rss
Al Jazeera,6,"Explosions, violations reported after India and Pakistan agree ceasefire",https://www.aljazeera.com/news/2025/5/10/india-and-pakistan-agree-to-an-immediate-ceasefire-after-days-of-escalation?traffic_source=rss
Al Jazeera,7,At least 33 people killed in suspected RSF attacks in Sudan,https://www.aljazeera.com/news/2025/5/10/at-least-33-killed-in-suspected-paramilitary-rsf-strikes-in-sudan?traffic_source=rss
Al Jazeera,8,India and Pakistan agree ceasefire: What does it mean?,https://www.aljazeera.com/news/2025/5/10/india-and-pakistan-agree-ceasefire-what-does-it-mean?traffic_source=rss
Al Jazeera,9,"Iran’s FM visits Saudi Arabia, Qatar before nuclear talks with US in Oman",https://www.aljazeera.com/news/2025/5/10/irans-fm-visits-saudi-arabia-qatar-before-nuclear-talks-with-us-in-oman?traffic_source=rss
Al Jazeera,10,Pope Leo identifies AI as main challenge in first meeting with cardinals,https://www.aljazeera.com/news/2025/5/10/pope-leo-says-ai-is-main-challenge-for-humanity-in-address-to-cardinals?traffic_source=rss
Al Jazeera,11,"Liverpool vs Arsenal: Premier League – Start time, team news, lineups",https://www.aljazeera.com/sports/2025/5/10/liverpool-vs-arsenal-premier-league-team-news-how-to-follow-stream?traffic_source=rss
Al Jazeera,12,"China, US hold talks on tariffs in first bid to de-escalate trade war",https://www.aljazeera.com/news/2025/5/10/us-and-chinese-officials-hold-geneva-talks-to-de-escalate-trade-war?traffic_source=rss
Al Jazeera,13,My nephew asks if he will eat meat only in heaven. I struggle to answer,https://www.aljazeera.com/opinions/2025/5/10/my-nephew-asks-if-he-will-eat-meat-only-in-heaven-i-struggle-to-answer?traffic_source=rss
Al Jazeera,14,US to fast-track investments from Middle East before Trump trip: Report,https://www.aljazeera.com/economy/2025/5/10/us-to-fast-track-investments-from-middle-east-before-trump-trip-report?traffic_source=rss
Al Jazeera,15,Children among 21 killed in Israel’s attacks on Gaza amid aid blockade,https://www.aljazeera.com/news/2025/5/10/israel-kills-in-gaza-as-it-throttles-enclave-under-aid-blockade?traffic_source=rss
Al Jazeera,16,Qatar leads Syria search for bodies of US hostages killed by ISIL: Report,https://www.aljazeera.com/news/2025/5/10/qatari-mission-searches-for-bodies-of-us-hostages-killed-by-isil-in-syria?traffic_source=rss
Al Jazeera,17,Iraq look to former Australia coach Arnold to boost 2026 World Cup hopes,https://www.aljazeera.com/sports/2025/5/10/iraq-look-to-former-australia-coach-arnold-to-boost-2026-world-cup-hopes?traffic_source=rss
Al Jazeera,18,Pakistan launches Operation Bunyan Marsoos: What we know so far,https://www.aljazeera.com/news/2025/5/10/pakistan-launches-operation-bunyan-marsoos-what-we-know-so-far?traffic_source=rss
Al Jazeera,19,Pakistan postpones PSL T20 cricket amid clashes with India,https://www.aljazeera.com/sports/2025/5/10/pakistan-postpones-psl-t20-cricket-amid-clashes-with-india?traffic_source=rss
Al Jazeera,20,Nuggets outlast Thunder in Game 3 overtime thriller in NBA playoffs,https://www.aljazeera.com/sports/2025/5/10/nuggets-outlast-thunder-in-game-3-overtime-thriller-in-nba-playoffs?traffic_source=rss
