site,rank,title,link
Al Jazeera,1,Trump “chipping away at civil liberties” in ban on foreign students,https://www.aljazeera.com/program/quotable/2025/5/30/trump-chipping-away-at-civil-liberties-in-ban-on-foreign-students?traffic_source=rss
Al Jazeera,2,A coalition of conscience must rise to stop Israel’s genocidal war on Gaza,https://www.aljazeera.com/opinions/2025/5/30/a-coalition-of-conscience-must-rise-to-stop-israels-genocidal-war-on-gaza?traffic_source=rss
Al Jazeera,3,Ex-Sinn Fein leader Gerry Adams wins libel case against the BBC,https://www.aljazeera.com/news/2025/5/30/ex-sinn-fein-leader-gerry-adams-wins-libel-case-against-the-bbc?traffic_source=rss
Al Jazeera,4,"Gaza death toll may be much higher than reported, new research shows",https://www.aljazeera.com/video/newsfeed/2025/5/30/gaza-death-toll-may-be-much-higher-than-reported-new-research-shows?traffic_source=rss
Al Jazeera,5,"More than 100 killed in heavy Nigeria flooding, rescue efforts ongoing",https://www.aljazeera.com/news/2025/5/30/at-least-88-killed-in-heavy-nigeria-flooding-rescue-efforts-ongoing?traffic_source=rss
Al Jazeera,6,The rise of Christian nationalism under Trump,https://www.aljazeera.com/program/upfront/2025/5/30/the-rise-of-christian-nationalism-under-trump?traffic_source=rss
Al Jazeera,7,From students to tech: How US-China ties are sliding despite tariff truce,https://www.aljazeera.com/news/2025/5/30/from-students-to-tech-how-us-china-ties-are-sliding-despite-tariff-truce?traffic_source=rss
Al Jazeera,8,ISIL (ISIS) launches first attacks against new Syrian government,https://www.aljazeera.com/news/2025/5/30/isil-isis-launches-first-attacks-against-new-syrian-government?traffic_source=rss
Al Jazeera,9,Trump’s Gulf deals and political promises,https://www.aljazeera.com/program/money-works/2025/5/30/aje-onl-mw-trump-gulf-tour-300525?traffic_source=rss
Al Jazeera,10,What to know about Mexico’s first-of-its-kind judicial elections,https://www.aljazeera.com/video/newsfeed/2025/5/30/what-to-know-about-mexicos-first-of-its-kind-judicial-elections?traffic_source=rss
Al Jazeera,11,Can we reverse the obesity epidemic?,https://www.aljazeera.com/program/the-stream/2025/5/30/can-we-reverse-the-obesity-epidemic?traffic_source=rss
Al Jazeera,12,Israel forces north Gaza’s last functioning hospital to close,https://www.aljazeera.com/video/newsfeed/2025/5/30/israel-forces-north-gazas-last-functioning-hospital-to-close?traffic_source=rss
Al Jazeera,13,Liverpool parade crash driver appears in UK court,https://www.aljazeera.com/news/2025/5/30/liverpool-parade-crash-driver-appears-in-uk-court?traffic_source=rss
Al Jazeera,14,Flash flooding kills dozens in Nigeria,https://www.aljazeera.com/video/newsfeed/2025/5/30/flash-flooding-kills-dozens-in-nigeria?traffic_source=rss
Al Jazeera,15,Ukraine yet to commit to new round of Russia talks in Istanbul,https://www.aljazeera.com/news/2025/5/30/ukraine-yet-to-commit-to-new-round-of-russia-talks-in-istanbul?traffic_source=rss
Al Jazeera,16,From Hunter to Hoover: How clemency became a circus,https://www.aljazeera.com/opinions/2025/5/30/from-hunter-to-hoover-how-clemency-became-a-circus?traffic_source=rss
Al Jazeera,17,Real Madrid announce Alexander-Arnold signing from Liverpool,https://www.aljazeera.com/news/2025/5/30/real-madrid-announce-alexander-arnold-signing-from-liverpool?traffic_source=rss
Al Jazeera,18,Serbia probes arms to Ukraine after Russia alleges ‘stab in the back’,https://www.aljazeera.com/news/2025/5/30/serbia-probes-arms-to-ukraine-after-russia-alleges-stab-in-the-back?traffic_source=rss
Al Jazeera,19,Slovakia’s PM slams judge over conviction of central bank boss,https://www.aljazeera.com/news/2025/5/30/slovakias-pm-slams-judge-over-conviction-of-central-bank-boss?traffic_source=rss
Al Jazeera,20,Knicks-Pacers: Haliburton struggles in Game 5 loss in NBA East finals,https://www.aljazeera.com/sports/2025/5/30/knicks-pacers-haliburton-returns-single-digits-in-111-94-defeat?traffic_source=rss
