site,rank,title,link
Al Jazeera,1,"At least 337 killed in Pakistan floods, gov’t defends emergency response",https://www.aljazeera.com/news/2025/8/17/at-least-337-killed-in-pakistan-floods-govt-defends-emergency-response?traffic_source=rss
Al Jazeera,2,What will the Putin-Trump meeting mean for the war in Ukraine?,https://www.aljazeera.com/video/inside-story/2025/8/17/what-will-the-putin-trump-meeting-mean-for-the-war-in-ukraine?traffic_source=rss
Al Jazeera,3,The upcoming elections will not help stabilise Syria,https://www.aljazeera.com/opinions/2025/8/17/the-upcoming-elections-will-not-help-stabilise-syria?traffic_source=rss
Al Jazeera,4,European leaders to shore up Ukraine’s Zelenskyy for DC talks with Trump,https://www.aljazeera.com/news/2025/8/17/european-leaders-to-shore-up-ukraines-zelenskyy-for-dc-talks-with-trump?traffic_source=rss
Al Jazeera,5,"US shooting kills three at busy Brooklyn, New York City club",https://www.aljazeera.com/news/2025/8/17/us-shooting-kills-three-at-busy-brooklyn-nyc-club?traffic_source=rss
Al Jazeera,6,US cancels visas for medical evacuation patients from Gaza,https://www.aljazeera.com/video/newsfeed/2025/8/17/us-cancels-visas-for-medical-evacuation-patients-from-gaza?traffic_source=rss
Al Jazeera,7,Marc Marquez extends win streak to six with maiden Austrian MotoGP victory,https://www.aljazeera.com/sports/2025/8/17/marc-marquez-extends-win-streak-to-six-with-maiden-austrian-motogp-victory?traffic_source=rss
Al Jazeera,8,Newly obtained video shows Israeli missile hitting Palestinian girl in Gaza,https://www.aljazeera.com/video/newsfeed/2025/8/17/newly-obtained-video-shows-israeli-missile-hitting-palestinian-girl-in-gaza?traffic_source=rss
Al Jazeera,9,Blocking US medical visas for Gaza kids “will be devastating”,https://www.aljazeera.com/video/quotable/2025/8/17/aje-onl-qt_tareq_hailat-170825?traffic_source=rss
Al Jazeera,10,Bolivia heads to the polls as 20 years of leftist rule expected to end,https://www.aljazeera.com/news/2025/8/17/bolivia-heads-to-the-polls-as-20-years-of-leftist-rule-expected-to-end?traffic_source=rss
Al Jazeera,11,Riot police clash with protesters in Serbia,https://www.aljazeera.com/video/newsfeed/2025/8/17/riot-police-clash-with-protesters-in-serbia?traffic_source=rss
Al Jazeera,12,"Israelis hold nationwide protest to end Gaza war, ‘bring back the hostages’",https://www.aljazeera.com/news/2025/8/17/israelis-hold-nationwide-protest-to-end-gaza-war-bring-back-the-hostages?traffic_source=rss
Al Jazeera,13,Huge rally in New York demands end to Gaza starvation,https://www.aljazeera.com/video/newsfeed/2025/8/17/huge-rally-in-new-york-demands-end-to-gaza-starvation?traffic_source=rss
Al Jazeera,14,Flash flooding kills hundreds in northern Pakistan,https://www.aljazeera.com/video/newsfeed/2025/8/17/flash-flooding-kills-hundreds-in-northern-pakistan?traffic_source=rss
Al Jazeera,15,How much aid actually reaches Gaza?,https://www.aljazeera.com/video/by-the-numbers-3/2025/8/17/how-much-aid-actually-reaches-gaza?traffic_source=rss
Al Jazeera,16,The Alaska summit was a spectacular distraction,https://www.aljazeera.com/opinions/2025/8/17/the-alaska-summit-was-a-spectacular-distraction?traffic_source=rss
Al Jazeera,17,Israeli military bombs power plant near Yemeni capital Sanaa,https://www.aljazeera.com/news/2025/8/17/israeli-military-bombs-power-plant-near-yemeni-capital-sanaa?traffic_source=rss
Al Jazeera,18,Antigovernment protesters clash with police in several Serbian cities,https://www.aljazeera.com/gallery/2025/8/17/antigovernment-protesters-clash-with-police-in-several-serbian-cities?traffic_source=rss
Al Jazeera,19,Week in Pictures: From Trump-Putin meeting to flash floods in Pakistan,https://www.aljazeera.com/gallery/2025/8/17/week-in-pictures-from-trump-putin-meeting-to-flash-floods-in-pakistan?traffic_source=rss
Al Jazeera,20,"Erin downgraded to Category 3 hurricane, NHC says",https://www.aljazeera.com/news/2025/8/17/erin-downgraded-to-category-3-hurricane-nhc-says?traffic_source=rss
