site,rank,title,link
Al Jazeera,1,"Trump can keep National Guard in Washington, DC, for now: Appeals court",https://www.aljazeera.com/news/2025/12/5/trump-can-keep-national-guard-in-washington-dc-for-now-appeals-court?traffic_source=rss
Al Jazeera,2,US military kills four in latest strike on boat in the Caribbean,https://www.aljazeera.com/news/2025/12/5/us-military-kills-four-in-latest-strike-on-boat-in-the-caribbean?traffic_source=rss
Al Jazeera,3,"Trump hails ‘great day for the world’ as DRC, Rwanda finalise peace deal",https://www.aljazeera.com/news/2025/12/4/trump-hails-great-day-for-the-world-as-drc-rwanda-finalise-peace-deal?traffic_source=rss
Al Jazeera,4,New York Times sues Pentagon over rules limiting access for media,https://www.aljazeera.com/news/2025/12/4/new-york-times-sues-pentagon-over-rules-limiting-access-for-media?traffic_source=rss
Al Jazeera,5,"Real Betis vs Barcelona: La Liga preview – teams, start, lineups",https://www.aljazeera.com/sports/2025/12/4/real-betis-vs-barcelona-la-liga-teams-start-lineups?traffic_source=rss
Al Jazeera,6,Putin challenges US pressure on India over Russian oil during state visit,https://www.aljazeera.com/news/2025/12/4/putin-challenges-us-pressure-on-india-over-russian-oil-during-state-visit?traffic_source=rss
Al Jazeera,7,US senators unveil bill to keep Trump from allowing AI chip sales to China,https://www.aljazeera.com/economy/2025/12/4/us-senators-unveil-bill-to-keep-trump-from-allowing-ai-chip-sales-to-china?traffic_source=rss
Al Jazeera,8,"Who was Yasser Abu Shabab, Israel-backed militia leader killed in Gaza?",https://www.aljazeera.com/features/2025/12/4/who-was-yasser-abu-shabab-israel-backed-militia-leader-killed-in-gaza?traffic_source=rss
Al Jazeera,9,Gaza war amputees mark International Disabilities Day,https://www.aljazeera.com/video/newsfeed/2025/12/4/gaza-war-amputees-mark-international-disabilities-day?traffic_source=rss
Al Jazeera,10,FIFA World Cup draw to be announced as trophy arrives in Washington,https://www.aljazeera.com/video/newsfeed/2025/12/4/fifa-world-cup-draw-to-be-announced-as-trophy-arrives-in-washington?traffic_source=rss
Al Jazeera,11,Last foreign carriers halt flights to Venezuela after Trump’s airspace ban,https://www.aljazeera.com/news/2025/12/4/last-foreign-carriers-halt-flights-to-venezuela-after-trumps-airspace-ban?traffic_source=rss
Al Jazeera,12,What is at stake in French presidential visit to China?,https://www.aljazeera.com/video/inside-story/2025/12/4/what-is-at-stake-in-french-presidential-visit-to-china?traffic_source=rss
Al Jazeera,13,Four countries to boycott Eurovision 2026 over Israel’s inclusion,https://www.aljazeera.com/news/2025/12/4/spain-ireland-boycott-eurovision-song-contest-over-israels-inclusion?traffic_source=rss
Al Jazeera,14,"Rwanda, DRC presidents sign ‘Washington Accord’ peace deal",https://www.aljazeera.com/video/newsfeed/2025/12/4/rwanda-drc-presidents-sign-washington-accord-peace-deal?traffic_source=rss
Al Jazeera,15,Qatar keep alive FIFA Arab Cup hopes with Syria draw as Palestine top group,https://www.aljazeera.com/sports/2025/12/4/qatar-keep-alive-fifa-arab-cup-hopes-with-syria-draw-as-palestine-top-group?traffic_source=rss
Al Jazeera,16,"US authorities arrest suspect in 2021 Washington, DC, pipe bomb case",https://www.aljazeera.com/news/2025/12/4/us-authorities-arrest-suspect-in-2021-capitol-hill-pipe-bombs?traffic_source=rss
Al Jazeera,17,"From Mogadishu to Minneapolis, Somalis reject Trump’s bigoted remarks",https://www.aljazeera.com/news/2025/12/4/from-mogadishu-to-minneapolis-somalis-reject-trumps-bigoted-remarks?traffic_source=rss
Al Jazeera,18,Can Africa choose economic partners on its own terms?,https://www.aljazeera.com/video/counting-the-cost/2025/12/4/can-africa-choose-economic-partners-on-its-own-terms?traffic_source=rss
Al Jazeera,19,Qalqilya targeted as Israel escalates raids in northern West Bank,https://www.aljazeera.com/news/2025/12/4/qalqilya-targeted-as-israel-escalates-raids-in-northern-west-bank?traffic_source=rss
Al Jazeera,20,Russia’s Putin found ‘morally responsible’ for nerve agent death in UK,https://www.aljazeera.com/news/2025/12/4/russias-putin-found-morally-responsible-for-nerve-agent-death-in-uk?traffic_source=rss
Associated Press,1,Putin says there are points he can't agree to in the US proposal to end Russia's war in Ukraine,https://apnews.com/article/russia-ukraine-war-putin-trump-peace-plan-7e48114f6908ce2657947cfdd633150e
Associated Press,2,Farmers block Mexico's Congress with tractors in protest against new national water law proposal,https://apnews.com/article/mexico-farmers-protest-water-law-a0e4d9f51e4e6d672a9240f4c5237aa8
Associated Press,3,A seal galumphs into a bar. The bartender says 'Grab the salmon!',https://apnews.com/article/seal-bar-new-zealand-pub-richmond-487e2a8207c9f0e69be79ac7eb8045c0
Associated Press,4,Oklahoma university instructor on leave after failing Bible-based essay on gender,https://apnews.com/article/university-oklahoma-gender-bible-essay-demonic-0fd51985c123737cd372ba609b730541
Associated Press,5,NY attorney general challenges authority of acting US attorney investigating her Trump lawsuits,https://apnews.com/article/trump-letitia-james-halligan-sarcone-subpoenas-4308a5f7927d9eecc2c139ee604ef4d6
Associated Press,6,President Trump's contempt shocks the country's largest Somali community,https://apnews.com/article/trump-immigration-minneapolis-somalia-de1187fd703abbc9dc4dc1c5c6a243c5
Associated Press,7,"Admiral says there was no 'kill them all' order in boat attack, but video alarms lawmakers",https://apnews.com/article/pete-hegseth-boat-strike-admiral-congress-521606d39c04dcc040ea232dc9cfeeda
Associated Press,8,Man accused of planting pipe bombs before Jan. 6 Capitol attack is charged with explosives offenses,https://apnews.com/article/pipe-bombs-dc-jan6-40d748385b7b18ece2208c6c6690708b
Associated Press,9,NFL mandates playing surfaces for all stadiums meet new standards by 2028 to enhance player safety,https://apnews.com/article/nfl-fields-3f7fa5681e6d842c3b06f85b93899611
Associated Press,10,Trump's immigration message is colliding with his welcome to World Cup fans,https://apnews.com/article/trump-world-cup-draw-soccer-travel-bans-9a50f48ae28fd61e5e8339a2dedca907
Associated Press,11,Former NBA champion and Clemson player Elden Campbell dies at 57,https://apnews.com/article/elden-campbell-lakers-pistons-dies-ac5930805d90e242e8da75462e73bde6
Associated Press,12,"The best movies of 2025, ranked by AP film writers",https://apnews.com/article/best-movies-of-2025-0e3047cba5c7c61cf9660d9d1878249d
Associated Press,13,A string of awards makes it clear: 'One Battle After Another' is the Oscar front-runner,https://apnews.com/article/one-battle-after-another-awards-frontrunner-163e8acc1c5b9730d09801272ed154f3
Associated Press,14,"Steve Cropper, guitarist and member of Stax Records' Booker T and the M.G.'s, has died at age 84",https://apnews.com/article/steve-cropper-obituary-57fff73cf820438e89fe894cdd3a5995
Associated Press,15,"US filings for jobless benefits fall to 191,000, lowest since September of 2022",https://apnews.com/article/unemployment-benefits-jobless-claims-layoffs-labor-43cb18bdeaad154d3bc87a5e0025b64a
Associated Press,16,Americans gave $4B on GivingTuesday 2025 as donations and volunteering gain big over last year,https://apnews.com/article/givingtuesday-2025-c4d03202aad69ab962eeed43acac5863
Associated Press,17,Salesforce CEO vies to overcome investors' AI skepticism while touting company's quarterly numbers,https://apnews.com/article/salesforce-artificial-intelligence-skepticism-bubble-marc-benioff-0a28ca70c9fb00816b3e5cc4c416a68e
Associated Press,18,FACT FOCUS: Trump says tariffs can eventually replace federal income taxes. Experts disagree,https://apnews.com/article/fact-check-trump-income-tax-eliminate-bc0d35ccee990f5a595b39ef5b93d909
Associated Press,19,Raccoon goes on drunken rampage in Virginia liquor store and passes out on bathroom floor,https://apnews.com/article/drunk-raccoon-liquor-store-bandit-virginia-5109feb2ea9ab9bf8954ec3798689fd0
Associated Press,20,Southern California man gets an unwanted housemate: A black bear in his crawl space,https://apnews.com/article/california-bear-altadena-under-house-1dadcf4b0d16a6860b36c1d71a36759b
