site,rank,title,link
Al Jazeera,1,"Brazil vs Norway: FIFA World Cup last 16 – Vinicius, Haaland and prediction",https://www.aljazeera.com/sports/2026/7/5/brazil-vs-norway-fifa-world-cup-last-16-vinicius-haaland-and-prediction?traffic_source=rss
Al Jazeera,2,Native Americans Resisting ICE,https://www.aljazeera.com/video/witness/2026/7/5/native-americans-resisting-ice?traffic_source=rss
Al Jazeera,3,Trump lauds Americans in storm-delayed 250th anniversary speech,https://www.aljazeera.com/video/newsfeed/2026/7/5/aje-onl-nf_trump-lauds-americans-in-250th-anniversary-speech-050726?traffic_source=rss
Al Jazeera,4,"A name, a document, a future: Cameroon’s fight to register every child",https://www.aljazeera.com/news/2026/7/5/a-name-a-document-a-future-cameroons-fight-to-register-every-child?traffic_source=rss
Al Jazeera,5,Fireworks light up New York City to mark 250 years of US independence,https://www.aljazeera.com/video/newsfeed/2026/7/5/aje-onl-nf_fireworks-light-up-new-york-city-to-mark-250-years-040726?traffic_source=rss
Al Jazeera,6,Severe weather disrupts US’s 250th celebrations,https://www.aljazeera.com/news/2026/7/5/severe-weather-disrupts-uss-250th-celebrations?traffic_source=rss
Al Jazeera,7,This immigrant served in the US military. Now he faces deportation,https://www.aljazeera.com/news/longform/2026/7/5/this-immigrant-served-in-the-us-military-now-he-faces-deportation?traffic_source=rss
Al Jazeera,8,White nationalists march on Washington DC ahead of Freedom 250 celebrations,https://www.aljazeera.com/video/newsfeed/2026/7/5/aje-onl-nf_white-nationalists-march-ahead-of-freedom-250-040726?traffic_source=rss
Al Jazeera,9,"Iran war live: Millions mourn Khamenei, Trump hints at Netanyahu meeting",https://www.aljazeera.com/news/liveblog/2026/7/5/iran-war-live-huge-crowds-mourn-khamenei-trump-vows-calm-during-funeral?traffic_source=rss
Al Jazeera,10,"White nationalists march in Washington, DC, area during July 4 festivities",https://www.aljazeera.com/news/2026/7/4/white-nationalists-march-in-washington-dc-area-during-july-4-festivities?traffic_source=rss
Al Jazeera,11,Ticket prices plunge for USA-Belgium World Cup last-16 match,https://www.aljazeera.com/sports/2026/7/4/ticket-prices-plunge-for-us-belgium-world-cup-last-16-match?traffic_source=rss
Al Jazeera,12,Mbappe draws level with Messi as France beat Paraguay to set up Morocco tie,https://www.aljazeera.com/sports/2026/7/4/mbappe-draws-level-with-messi-as-france-beat-paraguay-to-set-up-morocco-tie?traffic_source=rss
Al Jazeera,13,US influence challenged by changing global order: Paolo von Schirach,https://www.aljazeera.com/video/newsfeed/2026/7/4/us-influence-challenged-by-changing-global-order-paolo-von-schirach?traffic_source=rss
Al Jazeera,14,Masses of Iranians defy heatwave on second day of Khamenei’s funeral,https://www.aljazeera.com/video/newsfeed/2026/7/4/masses-of-iranians-defy-heatwave-on-second-day-of-khameneis-funeral?traffic_source=rss
Al Jazeera,15,Lebanon’s Aoun calls on US to keep ‘always standing beside’ his country,https://www.aljazeera.com/news/2026/7/4/lebanons-aoun-calls-on-us-to-keep-always-standing-beside-his-country?traffic_source=rss
Al Jazeera,16,Ounahi fires Morocco into World Cup quarterfinals with 3-0 win over Canada,https://www.aljazeera.com/sports/2026/7/4/ounahi-fires-morocco-into-world-cup-quarterfinals-with-3-0-win-over-canada?traffic_source=rss
Al Jazeera,17,A politically charged holiday: The US celebrates its 250th anniversary,https://www.aljazeera.com/gallery/2026/7/4/a-politically-charged-holiday-the-us-celebrates-its-250th-anniversary?traffic_source=rss
Al Jazeera,18,America’s Indigenous Legacy,https://www.aljazeera.com/video/newsfeed/2026/7/4/americas-indigenous-legacy?traffic_source=rss
Al Jazeera,19,Has the US reckoned with its own history?,https://www.aljazeera.com/video/upfront/2026/7/4/has-the-us-reckoned-with-its-own-history?traffic_source=rss
Al Jazeera,20,Will economic pressure move the Kremlin towards talks with Kyiv?,https://www.aljazeera.com/video/inside-story/2026/7/4/will-economic-pressure-move-the-kremlin-towards-talks-with-kyiv?traffic_source=rss
Associated Press,1,Ukrainian drones hit St Petersburg oil terminal in latest long-range attack on Russia,https://apnews.com/article/russia-ukraine-war-oil-st-petersburg-c95b97c0ab5ca8d06050f09e54ea69a9
Associated Press,2,"Iran begins dayslong funeral for Supreme Leader Ayatollah Ali Khamenei, killed in war",https://apnews.com/article/khamenei-funeral-supreme-leader-iran-us-war-july-4-2026-f7168b934d457bdb8b8a2da855d1d03a
Associated Press,3,Egypt uncovers lost Byzantine-era city in the western desert,https://apnews.com/article/egypt-antiquities-tourism-desert-oasis-byzantine-3fe1e9fbea2261e372db5ca4e90ea619
Associated Press,4,Trump mixes patriotism with partisanship as he celebrates America's 'joyous' 250th anniversary,https://apnews.com/article/america-250-weekend-heat-united-states-1eeaf21e91ed583595611251649db93e
Associated Press,5,"Paul Pelosi in hit-and-run in California, car left with major damage, authorities say",https://apnews.com/article/paul-pelosi-hit-run-napa-county-nancy-03222e98042228c070971a4d13f8a861
Associated Press,6,Fire breaks out on Brooklyn Bridge during New York's fireworks show,https://apnews.com/article/fireworks-brooklyn-bridge-b33731a50f23433644bd8a879dcffc75
Associated Press,7,150 people from 50 countries become US citizens at Mount Vernon on America's 250th birthday,https://apnews.com/article/america-250-citizenship-george-washington-july-4-c47432ca8830be379c0a07bb6e0df4f7
Associated Press,8,England faces Mexico at ‘monster’ stadium where El Tri has yet to concede a goal at this World Cup,https://apnews.com/article/mexico-england-azteca-stadium-world-cup-6ca0a31a933156e1985cdaaab8449bc1
Associated Press,9,Egypt's coach waved Palestinian flag after winning World Cup game,https://apnews.com/article/egypt-coach-palestinian-flag-world-cup-1cf76bad2adcec0f82bc42d03535afef
Associated Press,10,Brandon Miller storms past 17-year-old Cooper Lutkenhaus to win the 800 at Prefontaine Classic,https://apnews.com/article/prefontaine-classic-track-field-6a8cac1989c014b49005ae6d3b52760f
Associated Press,11,Taylor Swift and Travis Kelce are married. What to know about the wedding,https://apnews.com/article/taylor-swift-travis-kelce-wedding-what-know-640147a06d9bb28c9ac5a7c7b62898bc
Associated Press,12,America In Focus: consumers still gloomy about economy; US hiring falls in June,https://apnews.com/article/inflation-economy-iran-trump-unemployment-da2fcb94594a598d10155ad0c93fc47c
Associated Press,13,Uptick in domestic tourism helps small businesses,https://apnews.com/article/summer-travel-tourism-small-businesses-3979187a94e7712f8d89ad3d3bf05365
Associated Press,14,Viral phenomenon in Argentina has young people identifying themselves as animals,https://apnews.com/article/argentina-teenagers-identifying-as-animals-therians-tiktok-54d158c4842f6515e31d83a260cdf31f
Associated Press,15,"Fatou, the world's oldest gorilla living in captivity, celebrates her 69th birthday at Berlin Zoo",https://apnews.com/article/gorilla-germany-fatou-berlin-zoo-0196b95f3b6d48593bb7c872cab51adf
Associated Press,16,"Nipper, stay! The future of a beloved dog statue on a New York warehouse is up in the air",https://apnews.com/article/nipper-dog-statue-albany-new-york-69a5ca4ec514f837626475b5d5264c1d
Associated Press,17,Raccoon goes on drunken rampage in Virginia liquor store and passes out on bathroom floor,https://apnews.com/article/drunk-raccoon-liquor-store-bandit-virginia-5109feb2ea9ab9bf8954ec3798689fd0
Associated Press,18,Ghana's fantasy coffins are a colorful celebration of life and legacy,https://apnews.com/article/ghana-fantasy-coffins-funerals-accra-tradition-01220db5b2e240a12ae8e4ba8820f993
Associated Press,19,Lettuce introduce you to the live frog found in this grocery store salad bag,https://apnews.com/article/australia-frog-lettuce-salad-esperance-4134acf75e814dedd7789c1423c26ab1
Associated Press,20,"This air conditioning strategy is the sweet spot for saving energy and money, experts say",https://apnews.com/article/air-conditioning-settings-savings-heat-wave-535f0b7d38a2e1e68812d4c23450cef8
