site,rank,title,link
Al Jazeera,1,Poland to close last Russian consulate over ‘unprecedented act of sabotage’,https://www.aljazeera.com/news/2025/11/19/poland-to-close-last-russian-consulate-over-unprecedented-act-of-sabotage?traffic_source=rss
Al Jazeera,2,Israeli air strike on Lebanon refugee camp kills 13 people,https://www.aljazeera.com/video/newsfeed/2025/11/19/israeli-air-strike-on-lebanon-refugee-camp-kills-13-people?traffic_source=rss
Al Jazeera,3,"Epstein files: Who is Clay Higgins, US congressman who voted no on release?",https://www.aljazeera.com/news/2025/11/19/epstein-files-who-is-clay-higgins-us-congressman-who-voted-no-on-release?traffic_source=rss
Al Jazeera,4,"Bangladesh’s test: After Hasina conviction, will it repeat her mistakes?",https://www.aljazeera.com/news/2025/11/19/bangladeshs-test-after-hasina-conviction-will-it-repeat-her-mistakes?traffic_source=rss
Al Jazeera,5,"Which teams are in the FIFA World Cup 2026, and who can still qualify?",https://www.aljazeera.com/sports/2025/11/19/which-teams-are-in-the-fifa-world-cup-2026-and-who-can-still-qualify?traffic_source=rss
Al Jazeera,6,True climate justice demands a reckoning with colonialism,https://www.aljazeera.com/opinions/2025/11/19/true-climate-justice-demands-a-reckoning-with-colonialism?traffic_source=rss
Al Jazeera,7,US sells $700m NASAMS missile system to Taiwan,https://www.aljazeera.com/news/2025/11/19/us-sells-700m-nasams-missile-system-to-taiwan?traffic_source=rss
Al Jazeera,8,Israeli attack on refugee camp in Lebanon opens “very dangerous door”,https://www.aljazeera.com/video/quotable/2025/11/19/israeli-attack-on-refugee-camp-in-lebanon-opens-very-dangerous?traffic_source=rss
Al Jazeera,9,Cooperation not threats: Nigeria wants US alliance to curb violent attacks,https://www.aljazeera.com/features/2025/11/19/cooperation-not-threats-nigeria-wants-us-alliance-to-curb-violent-attacks?traffic_source=rss
Al Jazeera,10,At least 19 killed in Russian attacks across Ukraine,https://www.aljazeera.com/news/2025/11/19/children-among-the-36-wounded-in-russias-overnight-attacks-on-ukraine?traffic_source=rss
Al Jazeera,11,"Ahead of the budget, are the superrich really fleeing the UK due to taxes?",https://www.aljazeera.com/news/2025/11/19/are-the-superrich-really-fleeing-the-uk-due-to-taxes?traffic_source=rss
Al Jazeera,12,China to suspend imports of Japanese seafood amid diplomatic row: Reports,https://www.aljazeera.com/news/2025/11/19/china-to-suspend-imports-of-japanese-seafood-amid-diplomatic-row-reports?traffic_source=rss
Al Jazeera,13,"Myanmar military raids online scam hub, arrests nearly 350 on Thai border",https://www.aljazeera.com/news/2025/11/19/myanmar-military-raids-online-scam-hub-arrests-nearly-350-on-thai-border?traffic_source=rss
Al Jazeera,14,"Trust in AI far higher in China than West, poll shows",https://www.aljazeera.com/economy/2025/11/19/trust-in-ai-far-higher-in-china-than-west-poll-shows?traffic_source=rss
Al Jazeera,15,Philippines ministers resign as flood scandal reaches presidential palace,https://www.aljazeera.com/news/2025/11/19/philippines-ministers-resign-as-flood-scandal-reaches-presidential-palace?traffic_source=rss
Al Jazeera,16,A dangerous tipping point? Anthropic’s AI hacking claims divide experts,https://www.aljazeera.com/economy/2025/11/19/a-dangerous-tipping-point-ai-hacking-claims-prompt-cybersecurity-debate?traffic_source=rss
Al Jazeera,17,LIVE: 14 killed in Israeli air attacks in Lebanon; air strikes in Gaza,https://www.aljazeera.com/news/liveblog/2025/11/19/live-13-killed-in-israeli-air-attack-on-refugee-camp-in-lebanon?traffic_source=rss
Al Jazeera,18,"Saudi Arabia designated major non-NATO ally of US, gets F-35 warplanes deal",https://www.aljazeera.com/news/2025/11/19/saudi-arabia-designated-major-non-nato-ally-of-us-gets-f-35-warplanes-deal?traffic_source=rss
Al Jazeera,19,Scotland beat Denmark 4-2 to book first World Cup spot since 1998,https://www.aljazeera.com/news/2025/11/19/scotland-beats-denmark-4-2-to-book-first-world-cup-spot-since-1998?traffic_source=rss
Al Jazeera,20,Single faulty wire led cargo ship to crash into Baltimore bridge: Report,https://www.aljazeera.com/news/2025/11/19/single-faulty-wire-led-cargo-ship-to-crash-into-baltimore-bridge-report?traffic_source=rss
Associated Press,1,"Germany's Kessler twins, who became dance stars in the 50s and 60s, die at 89",https://apnews.com/article/germany-ellen-alice-kessler-twins-dead-8f94890e1fa5fcbe538a6a22fbc7cccb
Associated Press,2,Rapper Nicki Minaj calls for protections for Christians in Nigeria at UN event,https://apnews.com/article/nicki-minaj-nigeria-christians-trump-be7b03a3f1d4e43747fa26e600be5d3f
Associated Press,3,1 Israeli killed and 3 wounded in West Bank stabbing as UN approves Trump's Gaza plan,https://apnews.com/article/israel-hamas-gaza-trump-11-18-2025-b4cc39532d7f100299ff3aa23c2143f1
Associated Press,4,Judge tosses DOJ lawsuit challenging a New York law barring immigration agents from state courts,https://apnews.com/article/trump-immigration-new-york-court-0fbeadb881da5a4c1a7e871784f09545
Associated Press,5,Federal judges block Texas from using its new US House map in the 2026 midterms,https://apnews.com/article/redistricting-texas-map-blocked-lawsuit-trump-ab4dc519717c6661c63e116c9f26d899
Associated Press,6,The former Marine sniper accused of a mass shooting and the warning signs that came before,https://apnews.com/article/north-carolina-bar-shooting-marine-veteran-0fd0d2cbb0a157ed7da98f7d4ec0358f
Associated Press,7,Trump attacks ABC reporter after question about killing of Saudi journalist Khashoggi,https://apnews.com/article/media-trump-saudi-arabia-epstein-khashoggi-mbs-6cb0300433689c914250e475c4ae8483
Associated Press,8,"Who is Clay Higgins, the only House member to vote against releasing the Epstein files?",https://apnews.com/article/clay-higgins-epstein-files-124f8e8104f7d39b0b57d0e8b8305386
Associated Press,9,Michael Jordan donates $10M to North Carolina medical center in honor of his mother,https://apnews.com/article/michael-jordan-mother-donation-30e0ece0e95d683ea2f5936d3f578261
Associated Press,10,"Warriors' Draymond Green warned by NBA after fan confrontation, AP Source says",https://apnews.com/article/draymond-green-fan-confrontation-warning-1e3634ca6a42a237847acf7b20fb7c40
Associated Press,11,Steelers QB Aaron Rodgers and his broken wrist could still play against the Bears,https://apnews.com/article/aaron-rodgers-pittsburgh-steelers-mason-rudolph-fa023d968d17bacd1475972c6649e540
Associated Press,12,"Movie Review: Sorry, my pretty, ‘Wicked: For Good' doesn’t delight",https://apnews.com/article/wicked-for-good-movie-review-23fe7244c429facf27442cbff470f67f
Associated Press,13,"Movie Review: George Clooney stars in 'Jay Kelly,' a Hollywood tale of self-discovery",https://apnews.com/article/jay-kelly-movie-review-clooney-82cff4184b00ceef38dea7d55dac35ae
Associated Press,14,"Han Kang, Megha Majumdar and Yiyun Li are among finalists for Andrew Carnegie Medals",https://apnews.com/article/nobel-laureate-han-kang-carengie-medal-7ca3228594d7e99cf95007686c7f1034
Associated Press,15,"Cloudflare resolves outage that impacted thousands, ChatGPT, X and more",https://apnews.com/article/cloudflare-outage-x-openai-9335e8e0da2a0027d1fbac5eb97d11ae
Associated Press,16,"Honda recalls 256,600 Accord Hybrids due to software error that may lead to loss of drive power",https://apnews.com/article/honda-accord-hybrid-recall-software-6c73549af1dcf9434e89078180944b92
Associated Press,17,Sharp disagreements over economy threaten Federal Reserve interest rate cut,https://apnews.com/article/economy-jobs-inflation-8a0060c2f52f884ed3489450a66619b8
Associated Press,18,"FACT FOCUS: There's no proof each strike on alleged drug boats saves 25,000 lives, as Trump claims",https://apnews.com/article/trump-boat-strikes-drugs-25000-lives-c6e4c750b0dc6f15d397d598c9bd169f
Associated Press,19,Dog is rescued from a busy Boston tunnel during rush hour,https://apnews.com/article/video-dog-rescued-boston-tunnel-85743eb0ea51dd18dcc40e99dac3ac8c
Associated Press,20,"Giant, floating pumpkin races draw large crowds to annual event in Oregon",https://apnews.com/article/giant-pumpkin-regatta-race-oregon-tualatin-e51831205b13592259fbd85bc4f29358
