site,rank,title,link
Al Jazeera,1,"Sounds familiar: Was this said about Iraq in 2003, or Iran in 2025?",https://www.aljazeera.com/news/2025/6/23/sounds-familiar-was-this-said-about-iraq-in-2003-or-iran-in-2025?traffic_source=rss
Al Jazeera,2,Which teams have qualified for the FIFA Club World Cup round of 16?,https://www.aljazeera.com/sports/2025/6/23/fifa-club-world-cup-which-teams-have-qualified-for-the-round-of-16-scenarios-knockout-matches?traffic_source=rss
Al Jazeera,3,“Will Israel accept” Iran if it’s not a nuclear threat?,https://www.aljazeera.com/video/quotable/2025/6/23/will-israel-accept-iran-if-its-not-a-nuclear-threat?traffic_source=rss
Al Jazeera,4,Mental health meets AI,https://www.aljazeera.com/video/digital-dilemma/2025/6/23/mental-health-meets-ai?traffic_source=rss
Al Jazeera,5,Suicide bombing attack on church in Syria,https://www.aljazeera.com/video/newsfeed/2025/6/23/suicide-bombing-attack-on-church-in-syria?traffic_source=rss
Al Jazeera,6,Israel hits Tehran with massive air attacks,https://www.aljazeera.com/video/newsfeed/2025/6/23/trump-claims-bullseye-after-pictures-of-irans-nuclear-sites-emerge?traffic_source=rss
Al Jazeera,7,Colombia’s army says 57 soldiers kidnapped in restive southwest,https://www.aljazeera.com/news/2025/6/23/colombia-army-says-57-soldiers-kidnapped-in-restive-southwest?traffic_source=rss
Al Jazeera,8,Iran vows response to US strikes as it hits back at Israel,https://www.aljazeera.com/news/2025/6/23/iran-vows-response-to-us-strikes-as-it-hits-back-at-israel?traffic_source=rss
Al Jazeera,9,Dashcam captures huge blast in Ashdod in Israel,https://www.aljazeera.com/video/newsfeed/2025/6/23/dashcam-captures-huge-blast-in-ashdod-in-israel?traffic_source=rss
Al Jazeera,10,Risk of Iran attack on US bases in Gulf likely not “huge”,https://www.aljazeera.com/video/quotable/2025/6/23/risk-of-iran-attack-on-us-bases-in-gulf-likely-not?traffic_source=rss
Al Jazeera,11,IAEA says extent of damage at Fordow still unknown,https://www.aljazeera.com/video/newsfeed/2025/6/23/iaea-says-extent-of-damage-at-fordow-still-unknown?traffic_source=rss
Al Jazeera,12,‘Massive’ Russian air assault kills at least 10 in Ukraine’s capital Kyiv,https://www.aljazeera.com/news/2025/6/23/massive-russian-air-assault-kills-at-least-six-in-ukraines-capital-kyiv?traffic_source=rss
Al Jazeera,13,Mahmoud Khalil leads pro-Palestine rally in New York,https://www.aljazeera.com/video/newsfeed/2025/6/23/mahmoud-khalil-leads-pro-palestine-rally-in-new-york?traffic_source=rss
Al Jazeera,14,Search for survivors after Russian drone and missile barrage hits Kyiv,https://www.aljazeera.com/gallery/2025/6/23/search-for-survivors-after-russian-drone-and-missile-barrage-hits-kyiv?traffic_source=rss
Al Jazeera,15,Manchester City thump Al Ain 6-0 at Club World Cup,https://www.aljazeera.com/sports/2025/6/23/manchester-city-thump-al-ain-6-0-at-club-world-cup?traffic_source=rss
Al Jazeera,16,"Russia-Ukraine war: List of key events, day 1,215",https://www.aljazeera.com/news/2025/6/23/russia-ukraine-war-list-of-key-events-day-1215?traffic_source=rss
Al Jazeera,17,Thunder beat Pacers in Game 7 to win NBA Finals,https://www.aljazeera.com/sports/2025/6/23/okc-thunder-beat-indiana-pacers-103-91-in-game-7-to-win-nba-finals?traffic_source=rss
Al Jazeera,18,History of US-Iran relations: From the 1953 regime change to Trump strikes,https://www.aljazeera.com/news/2025/6/23/history-of-us-iran-relations-from-the-1953-regime-change-to-trump-strikes?traffic_source=rss
Al Jazeera,19,Key players tangle at UNSC at ‘perilous turn’ of US-Israel-Iran conflict,https://www.aljazeera.com/news/2025/6/22/key-players-tangle-at-unsc-at-perilous-turn-of-us-israel-iran-conflict?traffic_source=rss
Al Jazeera,20,Real Madrid beat Pachuca at Club World Cup despite Asencio’s early red card,https://www.aljazeera.com/sports/2025/6/22/real-madrid-beat-pachuca-at-club-world-cup-despite-asencios-early-red-card?traffic_source=rss
