site,rank,title,link
Al Jazeera,1,Iran says US must issue multiple-entry visas for its World Cup squad,https://www.aljazeera.com/sports/2026/5/28/iran-says-us-must-issue-multiple-entry-visas-for-its-world-cup-squad?traffic_source=rss
Al Jazeera,2,"For Gaza, Eid joy is now a form of resistance",https://www.aljazeera.com/opinions/2026/5/28/for-gaza-eid-joy-is-now-a-form-of-resistance?traffic_source=rss
Al Jazeera,3,Al Jazeera journalist’s emotional speech after winning Emmy,https://www.aljazeera.com/video/newsfeed/2026/5/28/al-jazeera-journalists-emotional-speech-after-winning-emmy-2?traffic_source=rss
Al Jazeera,4,"Israel intensifies attacks on southern Lebanon, killing at least 16 people",https://www.aljazeera.com/news/2026/5/28/israel-intensifies-attacks-on-southern-lebanon-killing-at-least-16-people?traffic_source=rss
Al Jazeera,5,The West Bank’s Youth Unemployment Crisis,https://www.aljazeera.com/video/newsfeed/2026/5/28/the-west-banks-youth-unemployment-crisis?traffic_source=rss
Al Jazeera,6,Israel kills children in strikes on Gaza as fear taints Eid joy,https://www.aljazeera.com/video/newsfeed/2026/5/28/israel-kills-children-in-strikes-on-gaza-as-fear-taints-eid-joy?traffic_source=rss
Al Jazeera,7,Ireland football coach urges players to ‘win this war’ against Israel,https://www.aljazeera.com/sports/2026/5/28/ireland-football-coach-urges-players-to-win-this-war-against-israel?traffic_source=rss
Al Jazeera,8,Argentina’s ‘El Loco’ faces Uruguay mutiny ahead of World Cup,https://www.aljazeera.com/sports/2026/5/28/former-chelsea-boss-biesla-facing-world-cup-mutiny-with-uruguay?traffic_source=rss
Al Jazeera,9,Iran says it has a new air defence system. How significant is it?,https://www.aljazeera.com/news/2026/5/28/iran-says-it-has-a-new-air-defence-system-how-significant-is-it?traffic_source=rss
Al Jazeera,10,At least 16 students killed in fire at Kenya girls school dorm,https://www.aljazeera.com/news/2026/5/28/at-least-16-students-killed-in-fire-at-kenya-girls-school-dorm?traffic_source=rss
Al Jazeera,11,Germany’s Voeller urges players to avoid political statements at World Cup,https://www.aljazeera.com/sports/2026/5/28/germany-urge-players-to-avoid-political-statements-at-world-cup?traffic_source=rss
Al Jazeera,12,Children with Down syndrome struggle with devastation of war in Gaza,https://www.aljazeera.com/video/newsfeed/2026/5/28/children-with-down-syndrome-struggle-with-devastation-of-war-in-gaza-2?traffic_source=rss
Al Jazeera,13,China’s secret weapon in AI race with US? Lots of cheap energy,https://www.aljazeera.com/economy/2026/5/28/chinas-secret-weapon-in-ai-race-with-us-lots-of-cheap-energy?traffic_source=rss
Al Jazeera,14,"Israeli attack on Gaza City kills at least 10, including four children",https://www.aljazeera.com/news/2026/5/28/israeli-attack-on-gaza-city-kills-at-least-10-including-four-children?traffic_source=rss
Al Jazeera,15,Neymar injury threatens Brazil forward’s World Cup as scans needed on calf,https://www.aljazeera.com/sports/2026/5/28/neymar-injury-forces-him-out-of-brazils-first-world-cup-training-session?traffic_source=rss
Al Jazeera,16,Bafana Bafana World Cup squad: South Africa names two uncapped players,https://www.aljazeera.com/sports/2026/5/28/bafana-bafana-world-cup-squad-south-africa-names-two-uncapped-players?traffic_source=rss
Al Jazeera,17,"World Cup delegation compliant with US Ebola protocols, DR Congo says",https://www.aljazeera.com/sports/2026/5/28/world-cup-delegation-compliant-with-us-ebola-protocols-dr-congo-says?traffic_source=rss
Al Jazeera,18,Australia charges alleged ISIL-linked woman after return from Syria,https://www.aljazeera.com/news/2026/5/28/australia-charges-alleged-isil-linked-woman-after-return-from-syria?traffic_source=rss
Al Jazeera,19,Iran and US trade attacks after Trump rejects report of Hormuz agreement,https://www.aljazeera.com/news/2026/5/28/iran-and-us-trade-attacks-after-trump-rejects-report-of-hormuz-agreement?traffic_source=rss
Al Jazeera,20,What’s happening on Iran war day 90 as US launches new strikes,https://www.aljazeera.com/news/2026/5/28/whats-happening-on-iran-war-day-90-as-us-launches-new-strikes?traffic_source=rss
Associated Press,1,"Uganda closes its border with Congo, where suspected cases of a rare Ebola type are surging",https://apnews.com/article/ebola-congo-uganda-border-virus-b96734598ea95b1cdb71986c8b1adf43
Associated Press,2,Carney says Canada will buy European surveillance planes over two American options,https://apnews.com/article/canada-carney-radar-planes-saab-sweden-bombardier-7e68f96c26440a1bcbe08a6a5e738b86
Associated Press,3,Divers find 5 villagers alive in a flooded cave in Laos after more than a week trapped in darkness,https://apnews.com/article/laos-cave-xaisomboun-flood-rescue-missing-divers-99c7798c29c620e949d7c60099f23319
Associated Press,4,9 missing after Washington paper mill tank rupture and officials say there's no hope of survivors,https://apnews.com/article/paper-mill-explosion-washington-white-liquor-317b2491baf6e44c0a5f66ef98af31b5
Associated Press,5,US Supreme Court settles long-running water dispute over dwindling Rio Grande,https://apnews.com/article/texas-new-mexico-rio-grande-water-drought-faadff3f94299344f92f2118884384a1
Associated Press,6,Ex-CIA official charged with stealing millions of dollars in gold bars from the federal government,https://apnews.com/article/cia-gold-bars-theft-arrest-689029ef34d6ccb2bb3aaf3f3cc259f4
Associated Press,7,"US will need years to replenish stockpiles of advanced weapons used in Iran war, new analysis finds",https://apnews.com/article/iran-war-weapons-air-defense-csis-analysis-593f866ad4eae4ddbbcfdafa22267329
Associated Press,8,"AP Exclusive: Trump administration tells prosecutors to stand down on Venezuela leader, sources say",https://apnews.com/article/federal-prosecutors-venezuela-rodriguez-avoid-criminal-investigations-07226dea025e16afcf8ca3e39280fd76
Associated Press,9,Rep. Al Green defeated by freshman Rep. Christian Menefee in a generational primary runoff contest,https://apnews.com/article/al-green-christian-menefee-texas-democratic-runoff-crypto-4c607976cabc9fad7b8a3df9439fda31
Associated Press,10,10 players to watch at the World Cup,https://apnews.com/article/world-cup-messi-ronaldo-neymar-3736db3b8d066a81bf358d8fad867b94
Associated Press,11,"Key Sens. Cruz, Cantwell look to break college sports logjam in Congress with a bipartisan bill",https://apnews.com/article/nil-college-congress-cantwell-cruz-b715ea4cb6ffbc302bfc3fd41b00e157
Associated Press,12,IOC President Kirsty Coventry says sports cut from 2032 Brisbane Games could return in future,https://apnews.com/article/ioc-olympics-la-brisbane-coventry-3421b7f188637fcfacee9c69e1d6b645
Associated Press,13,The Chicks announce intimate 'Taking the Long Way' 20th Anniversary Tour. 'This is our lives',https://apnews.com/article/chicks-taking-long-way-anniversary-tour-interview-3f23625edfdd889f5d92eaae8f3529db
Associated Press,14,"Independent bookstores are multiplying, although many people still think they're dying out",https://apnews.com/article/independent-bookstores-expanding-booksellers-association-e1f745e4e431febca8f3e122e6b8f109
Associated Press,15,Movie Review: 'Backrooms' goes from internet meme to the big screen,https://apnews.com/article/backrooms-movie-review-c7481eab3d0f46436730e88a6ccb9b89
Associated Press,16,See how your pay compares to the CEOs of the top US companies,https://apnews.com/article/see-how-your-pay-compares-to-the-ceos-of-the-top-us-companies-0000019e3fbada77a59e7fbffcd20000
Associated Press,17,"These are the five least expensive new cars you can buy in 2026, according to Edmunds",https://apnews.com/article/inexpensive-new-cars-2026-46ce4ffa4d0af0ae6650f67bfd2891ff
Associated Press,18,Chinese online retailer Temu hit with $232 million fine over unsafe toys and electronics,https://apnews.com/article/temu-european-union-brussels-ecommerce-digital-07f53e968da89562e3f032abfa626fa4
Associated Press,19,SpaceX's Starship rockets are grounded pending investigation after test flight,https://apnews.com/article/spacex-starship-faa-investigation-7bc8ecccd1f32fa2b1d2ea204f2b785b
Associated Press,20,"Introducing Argus, a robot with 20 legs and eyes built to move and see in any direction instantly",https://apnews.com/article/robot-duke-argus-6ba9651ba6553ebc4405ffc07a26afed
