site,rank,title,link
Al Jazeera,1,US deploys aircraft carrier amid hardening stance towards Venezuela,https://www.aljazeera.com/news/2025/10/24/us-deploys-aircraft-carrier-amid-hardening-stance-towards-venezuela?traffic_source=rss
Al Jazeera,2,"US sanctions Colombia’s President Gustavo Petro, escalating Trump feud",https://www.aljazeera.com/news/2025/10/24/us-sanctions-colombias-president-gustavo-petro-escalating-trump-feud?traffic_source=rss
Al Jazeera,3,Nigeria replaces top security officials days after coup plot denial,https://www.aljazeera.com/news/2025/10/24/nigeria-replaces-top-security-officials-days-after-coup-plot-denial?traffic_source=rss
Al Jazeera,4,Russian shelling kills at least two people in Kherson,https://www.aljazeera.com/video/newsfeed/2025/10/24/russian-shelling-kills-at-least-two-people-in-kherson?traffic_source=rss
Al Jazeera,5,Indian village celebrates end of Diwali with cow dung fight,https://www.aljazeera.com/video/newsfeed/2025/10/24/indian-village-celebrates-end-of-diwali-with-cow-dung-fight?traffic_source=rss
Al Jazeera,6,"US Justice Department to send election observers to California, New Jersey",https://www.aljazeera.com/news/2025/10/24/us-justice-department-to-send-election-observers-to-california-new-jersey?traffic_source=rss
Al Jazeera,7,Croatia reintroduces mandatory military conscription after 17 years,https://www.aljazeera.com/news/2025/10/24/croatia-reintroduces-mandatory-military-conscription-after-17-years?traffic_source=rss
Al Jazeera,8,What does the US-UK AI deal mean for your data?,https://www.aljazeera.com/video/the-stream/2025/10/24/what-does-the-us-uk-ai-deal-mean-for-your-data?traffic_source=rss
Al Jazeera,9,Are US-Israeli relations experiencing upheaval under Trump?,https://www.aljazeera.com/video/inside-story/2025/10/24/are-us-israeli-relations-experiencing-upheaval-under-trump?traffic_source=rss
Al Jazeera,10,Trump foe Letitia James slams federal charges against her,https://www.aljazeera.com/video/newsfeed/2025/10/24/trump-foe-letitia-james-slams-federal-charges-against-her?traffic_source=rss
Al Jazeera,11,Russia’s top Indian oil buyer to comply with Western sanctions,https://www.aljazeera.com/news/2025/10/24/russias-top-indian-oil-buyer-to-comply-with-western-sanctions?traffic_source=rss
Al Jazeera,12,Trump adversary Letitia James pleads not guilty in mortgage fraud case,https://www.aljazeera.com/news/2025/10/24/trump-adversary-letitia-james-pleads-not-guilty-in-mortgage-fraud-case?traffic_source=rss
Al Jazeera,13,Israeli drone strike targeting Hezbollah kills two in Lebanon,https://www.aljazeera.com/video/newsfeed/2025/10/24/israeli-drone-strike-targeting-hezbollah-kills-two-in-lebanon?traffic_source=rss
Al Jazeera,14,"Activists say Mamdani must counter Trump, starting with how he leads NYPD",https://www.aljazeera.com/news/longform/2025/10/24/activists-say-mamdani-must-counter-trump-starting-with-how-he-leads-nypd?traffic_source=rss
Al Jazeera,15,AWS outage: Are we too dependent on Big Tech?,https://www.aljazeera.com/video/the-take-2/2025/10/24/aje-onl-usa_awsoutage_av_v2-241025?traffic_source=rss
Al Jazeera,16,"Brentford vs Liverpool: Premier League – teams, start, lineups",https://www.aljazeera.com/sports/2025/10/24/brentford-vs-liverpool-english-premier-league-teams-start-lineups?traffic_source=rss
Al Jazeera,17,"US rejects Hamas, UNRWA roles in Gaza as Israeli aid blockade persists",https://www.aljazeera.com/news/2025/10/24/us-rejects-hamas-unrwa-roles-in-gaza-as-israeli-aid-blockade-persists?traffic_source=rss
Al Jazeera,18,‘Can’t control’ US tariffs: Canada ‘stands ready’ to resume trade talks,https://www.aljazeera.com/video/newsfeed/2025/10/24/cant-control-us-tariffs-canada-stands-ready-to-resume-trade-talks?traffic_source=rss
Al Jazeera,19,Bosch warns production at risk as Nexperia dispute hits auto suppliers,https://www.aljazeera.com/economy/2025/10/24/bosch-warns-production-at-risk-as-nexperia-dispute-hits-auto-suppliers?traffic_source=rss
Al Jazeera,20,US consumer prices rise less than expected before Fed decision,https://www.aljazeera.com/economy/2025/10/24/us-consumer-prices-rise-less-than-expected-before-fed-decision?traffic_source=rss
Associated Press,1,Lithuanian president says Russian military planes violated the Baltic country's airspace,https://apnews.com/article/lithuania-russia-military-planes-airspace-f9d31aa920ee91c95103d902967d3b24
Associated Press,2,Men sentenced over London arson attack masterminded by Russia as part of a wider sabotage campaign,https://apnews.com/article/britain-russia-arson-attack-sentences-a40ec6423a118c600469a5d29662060c
Associated Press,3,"How cheaters rigged high-stakes poker games with the mob and sports pros, according to authorities",https://apnews.com/article/betting-arrests-sports-gambling-poker-fa72cd1ced5bdaacfabe1688d873bf45
Associated Press,4,"Trump gives disaster declarations to Alaska and others but denies Illinois, Vermont and Maryland",https://apnews.com/article/fema-trump-disasters-alaska-maryland-illinois-2c7a90956c101db8fe281d669a9cbde2
Associated Press,5,Colorado woman found guilty of voter fraud for casting ballots for late ex-husband and son,https://apnews.com/article/voting-fraud-ballots-colorado-guilty-forgery-6c11a89d629947dc4d76321d5e60cb70
Associated Press,6,Trump ends trade talks with Canada over tariffs ad that Ontario premier now says he'll phase out,https://apnews.com/article/trump-canada-trade-tariffs-a0cfd202ef6f22052827b784be708fd6
Associated Press,7,Satellite images show before and after of demolition of White House East Wing,https://apnews.com/article/satellite-images-white-house-east-wing-fdceec4fcc5b7cb605f176bf7dd10d6a
Associated Press,8,"How Hispanics' views of Trump have changed since January, according to a new AP-NORC poll",https://apnews.com/article/hispanics-trump-popularity-poll-presidential-approval-favorability-6d33973a92db786df0c6a55a8c6872ca
Associated Press,9,Blue Jays manager to Shohei Ohtani: We want our hat back — and your dog's jacket,https://apnews.com/article/ohtani-blue-jays-cap-decoy-43556decfe503dc9e0df328ab60aa816
Associated Press,10,Dodgers LHP Alex Vesia not with team in Toronto on eve of World Series because of family matter,https://apnews.com/article/alex-vesia-los-angeles-dodgers-world-series-71ad26be10a4429ae1068b18797a6998
Associated Press,11,Carney challenges Trump to make a bet on the World Series as Canada's team plays the Dodgers,https://apnews.com/article/carney-trump-world-series-blue-jays-dodgers-4e463dd3b52ae14e7c8aaeac0414a395
Associated Press,12,"Picasso portrait of muse Dora Maar in vivid hat, long hidden from view, sells for 32 million euros",https://apnews.com/article/picasso-auction-dora-maar-ded858e6f38a8c807553e3a4d522619f
Associated Press,13,Emma Stone and Jesse Plemons make the case for the wild ride that is ‘Bugonia’,https://apnews.com/article/bugonia-interview-emma-stone-jesse-plemons-609aecc044987e8f258ddf377ca93c25
Associated Press,14,"Jon Bon Jovi talks first tour since vocal cord surgery, new album and Bruce Springsteen",https://apnews.com/article/bon-jovi-interview-tour-vocal-cord-surgery-7af96990aad6081b0ca8057d33bebfb6
Associated Press,15,Trump says a Canadian ad misstated Ronald Reagan's views on tariffs. Here are the facts and context,https://apnews.com/article/trump-canada-ad-tariff-reagan-trade-talks-f711559b0084b377d82d964893c67c78
Associated Press,16,"Target is eliminating 1,800 corporate jobs as it looks to reclaim its lost luster",https://apnews.com/article/target-corporate-layoffs-minneapolis-india-f4d8100fa2bf4af67e4fb4e388cedf50
Associated Press,17,Alaska Airlines resumes operations after an IT outage grounded its flights for hours,https://apnews.com/article/alaska-airlines-flights-grounded-information-technology-00d9e88694ac850cd568d8ccb67decf5
Associated Press,18,Rare dinosaur mummies help scientists recreate their prehistoric lives,https://apnews.com/article/dinosaur-mummy-wyoming-767580229ba73b0e07cf08c593d87225
Associated Press,19,"Dinosaurs were thriving in North America before the mass-extinction asteroid strike, study suggests",https://apnews.com/article/dinosaur-asteroid-mass-extinction-55cb47773edd0061572cbaac51929ffa
Associated Press,20,Momias de dinosaurios ayudan a científicos a recrear sus vidas prehistóricas,https://apnews.com/article/dinosaurios-ciencia-prehistoria-404b984c260bf928c8106b3d3bf2035d
