site,rank,title,link
Al Jazeera,1,US and Colombia recall envoys as diplomatic rift deepens,https://www.aljazeera.com/news/2025/7/4/us-and-colombia-recall-envoys-as-diplomatic-rift-deepens?traffic_source=rss
Al Jazeera,2,Are Israeli soldiers intentionally firing at aid seekers in Gaza?,https://www.aljazeera.com/video/fact-check/2025/7/4/are-israeli-soldiers-intentionally-firing-at-aid-seekers-in-gaza?traffic_source=rss
Al Jazeera,3,North Korean man crosses heavily fortified DMZ border to South Korea,https://www.aljazeera.com/news/2025/7/4/north-korean-man-crosses-heavily-fortified-dmz-border-to-south-korea?traffic_source=rss
Al Jazeera,4,"Palestine Action: What has the group done, as it faces a ban?",https://www.aljazeera.com/news/2025/7/4/palestine-action-what-has-the-group-done-as-it-faces-a-ban?traffic_source=rss
Al Jazeera,5,"Russia-Ukraine war: List of key events, day 1,226",https://www.aljazeera.com/news/2025/7/4/russia-ukraine-war-list-of-key-events-day-1226?traffic_source=rss
Al Jazeera,6,‘Village of one kidney’: India-Bangladesh organ traffickers rob poor donors,https://www.aljazeera.com/features/2025/7/4/village-of-one-kidney-india-bangladesh-organ-traffickers-rob-poor-donors?traffic_source=rss
Al Jazeera,7,Togo protests signal youth anger at dynastic rule – but is change possible?,https://www.aljazeera.com/news/2025/7/4/togo-protests-signal-youth-anger-at-dynastic-rule-but-is-change-possible?traffic_source=rss
Al Jazeera,8,Football world mourns Diogo Jota following deadly car crash,https://www.aljazeera.com/video/newsfeed/2025/7/3/football-world-mourns-diogo-jota-following-deadly-car-crash?traffic_source=rss
Al Jazeera,9,"Chicago mass shooting leaves four dead, 14 injured outside downtown lounge",https://www.aljazeera.com/news/2025/7/3/chicago-mass-shooting-leaves-four-dead-14-injured-outside-downtown-lounge?traffic_source=rss
Al Jazeera,10,Israel attacks car near Beirut during rush hour,https://www.aljazeera.com/video/newsfeed/2025/7/3/israel-attacks-car-near-beirut-during-rush-hour?traffic_source=rss
Al Jazeera,11,Russia becomes first country to recognise Afghanistan’s Taliban government,https://www.aljazeera.com/news/2025/7/3/russia-becomes-first-country-to-recognise-afghanistans-taliban-government?traffic_source=rss
Al Jazeera,12,US issues first wave of Iran sanctions after ceasefire in 12-day war,https://www.aljazeera.com/news/2025/7/3/us-issues-first-wave-of-iran-sanctions-after-ceasefire-in-12-day-war?traffic_source=rss
Al Jazeera,13,England-India: Gill breaks Tendulkar record in second Test,https://www.aljazeera.com/sports/2025/7/3/england-india-gill-breaks-tendulkar-record-in-second-test?traffic_source=rss
Al Jazeera,14,Is ChatGPT hurting our critical thinking skills?,https://www.aljazeera.com/video/the-take-2/2025/7/3/aje-onl-glb_aicriticalthinking_av_v2-030725?traffic_source=rss
Al Jazeera,15,Trump’s ‘One Big Beautiful Bill’ passes the US House of Representatives,https://www.aljazeera.com/news/2025/7/3/us-house-of-representatives-votes-on-trumps-one-big-beautiful?traffic_source=rss
Al Jazeera,16,Israel strikes Gaza school as over 300 Palestinians killed in 48 hours,https://www.aljazeera.com/video/newsfeed/2025/7/3/israel-strikes-gaza-school-as-over-300-palestinians-killed-in-48-hours?traffic_source=rss
Al Jazeera,17,Will Trump’s ‘Big Beautiful Bill’ help grow the US economy?,https://www.aljazeera.com/video/counting-the-cost/2025/7/3/will-trumps-big-beautiful-bill-help-grow-the-us-economy?traffic_source=rss
Al Jazeera,18,How will the next Dalai Lama be chosen?,https://www.aljazeera.com/video/inside-story/2025/7/3/how-will-the-next-dalai-lama-be-chosen?traffic_source=rss
Al Jazeera,19,"Russia ‘will not back down’ on Ukraine war goals, Putin tells Trump",https://www.aljazeera.com/news/2025/7/3/russia-will-not-back-down-on-ukraine-war-goals-putin-tells-trump?traffic_source=rss
Al Jazeera,20,UN expert outlines how companies profit from Israel’s genocide,https://www.aljazeera.com/video/newsfeed/2025/7/3/un-expert-outlines-how-companies-profit-from-israels-genocide?traffic_source=rss
