site,rank,title,link
Al Jazeera,1,"Drone war, ground offensive continue despite new Russia-Ukraine peace push",https://www.aljazeera.com/news/2025/5/27/drone-war-ground-offensive-continue-despite-new-russia-ukraine-peace-push?traffic_source=rss
Al Jazeera,2,Humanitarian groups slam Gaza’s new US-Israeli aid operation,https://www.aljazeera.com/video/newsfeed/2025/5/27/humanitarian-groups-slam-gazas-new-us-israeli-aid-operation?traffic_source=rss
Al Jazeera,3,Girl tells Al Jazeera how she escaped school inferno,https://www.aljazeera.com/program/newsfeed/2025/5/27/girl-tells-al-jazeera-how-she-escaped-school-inferno?traffic_source=rss
Al Jazeera,4,Teenage Gaza gymnast who lost both legs dreams of walking again,https://www.aljazeera.com/video/newsfeed/2025/5/27/teenage-gaza-gymnast-who-lost-both-legs-dreams-of-walking-again?traffic_source=rss
Al Jazeera,5,UN Security Council must renew the arms embargo on South Sudan,https://www.aljazeera.com/opinions/2025/5/27/un-security-council-must-renew-the-arms-embargo-on-south-sudan?traffic_source=rss
Al Jazeera,6,"US-Israel scheme dispenses Gaza aid as UN says 180,000 displaced in 10 days",https://www.aljazeera.com/news/2025/5/27/us-backed-group-distributes-aid-in-gaza-amid-worsening-displacement?traffic_source=rss
Al Jazeera,7,Naim and Wadee’a,https://www.aljazeera.com/program/digidocs/2025/5/27/aje-onl-digidocs-naim-wadeea-270525?traffic_source=rss
Al Jazeera,8,Nepali breaks world record with 31st summit of Mount Everest,https://www.aljazeera.com/news/2025/5/27/nepali-breaks-world-record-with-31st-summit-of-mount-everest?traffic_source=rss
Al Jazeera,9,Australia dust storm turns town orange,https://www.aljazeera.com/video/newsfeed/2025/5/27/australia-dust-storm-turns-town-orange?traffic_source=rss
Al Jazeera,10,Europe’s “harsh words” for Israel “a positive thing”,https://www.aljazeera.com/program/quotable/2025/5/27/europes-harsh-words-for-israel-a-positive?traffic_source=rss
Al Jazeera,11,Ship carrying oil and hazardous cargo sinks off Kerala coast,https://www.aljazeera.com/program/newsfeed/2025/5/27/ship-carrying-oil-and-hazardous-cargo-sinks-off-kerala-coast?traffic_source=rss
Al Jazeera,12,"More than 800 lawyers, judges call for UK sanctions on Israel over Gaza war",https://www.aljazeera.com/news/2025/5/27/more-than-800-lawyers-judges-call-for-uk-sanctions-on-israel-over-gaza-war?traffic_source=rss
Al Jazeera,13,South Korea bars two former acting presidents from overseas travel,https://www.aljazeera.com/news/2025/5/27/south-korea-bars-two-former-acting-presidents-from-overseas-travel?traffic_source=rss
Al Jazeera,14,Turkiye welcomes PKK pledge to disband. Why now?,https://www.aljazeera.com/gallery/2025/5/27/turkiye-welcomes-pkk-pledge-to-disband?traffic_source=rss
Al Jazeera,15,"Photos: A free clinic for donkeys, vital to Ethiopia’s economy",https://www.aljazeera.com/gallery/2025/5/27/photos-a-free-clinic-for-donkeys-vital-to-ethiopias-economy?traffic_source=rss
Al Jazeera,16,Ronaldo: Al Nassr star hints at Saudi Pro League exit,https://www.aljazeera.com/sports/2025/5/27/ronaldo-al-nassr-split-possible-after-star-hints-at-saudi-pro-league-exit?traffic_source=rss
Al Jazeera,17,Thunder-Timberwolves: SGA scores 40 as OKC win Game 4 in NBA West finals,https://www.aljazeera.com/sports/2025/5/27/thunder-timberwolves-sga-scores-40-as-okc-win-game-4-in-nba-west-finals?traffic_source=rss
Al Jazeera,18,"ASEAN kicks off summits with China, Gulf states amid US tariff threat",https://www.aljazeera.com/news/2025/5/27/asean-kicks-off-summits-with-china-gulf-states-amid-us-tariff-threat?traffic_source=rss
Al Jazeera,19,"Liverpool parade car crash: What happened, and who the victims, suspect are",https://www.aljazeera.com/news/2025/5/27/liverpool-parade-car-crash-what-happened-and-who-the-victims-suspect-are?traffic_source=rss
Al Jazeera,20,‘Attack on country’s soul’: Indian MPs target Pakistan on global trips,https://www.aljazeera.com/news/2025/5/27/attack-on-countrys-soul-indian-mps-target-pakistan-on-global-trips?traffic_source=rss
