site,rank,title,link
Al Jazeera,1,Gaza mothers forced to give babies water as milk and formula run out,https://www.aljazeera.com/video/newsfeed/2025/7/30/gaza-mothers-forced-to-give-babies-water-as-milk-and-formula-run-out?traffic_source=rss
Al Jazeera,2,India join World Cup qualifiers Iran and Uzbekistan in CAFA Cup,https://www.aljazeera.com/sports/2025/7/30/india-join-world-cup-qualifiers-iran-and-uzbekistan-in-cafa-cup?traffic_source=rss
Al Jazeera,3,Myanmar military government sets long prison terms for election protests,https://www.aljazeera.com/news/2025/7/30/myanmar-military-government-sets-long-prison-terms-for-election-protests?traffic_source=rss
Al Jazeera,4,Half a million people in Gaza enduring “famine-like conditions”,https://www.aljazeera.com/video/quotable/2025/7/30/half-a-million-people-in-gaza-enduring-famine-like?traffic_source=rss
Al Jazeera,5,Imam of Southport Mosque reflects one year on from UK race riots,https://www.aljazeera.com/video/newsfeed/2025/7/30/imam-of-southport-mosque-reflects-one-year-on-from-uk-race-riots?traffic_source=rss
Al Jazeera,6,ChatGPT conversations lack “legal privilege”,https://www.aljazeera.com/video/quotable/2025/7/30/chatgpt-conversations-lack-legal?traffic_source=rss
Al Jazeera,7,Thailand-Cambodia truce mostly holds after shaky start in wake of fighting,https://www.aljazeera.com/news/2025/7/30/thailand-cambodia-truce-mostly-holds-after-shaky-start-in-wake-of-fighting-2?traffic_source=rss
Al Jazeera,8,"Tsunami waves hit Hawaii, Japan after Russia quake: What we know so far",https://www.aljazeera.com/news/2025/7/30/tsunami-waves-hit-hawaii-japan-after-russia-quake-what-we-know-so-far?traffic_source=rss
Al Jazeera,9,Japan records highest temperature on record,https://www.aljazeera.com/news/2025/7/30/japan-records-highest-temperature-on-record?traffic_source=rss
Al Jazeera,10,Luis Diaz completes transfer to Bayern Munich from Liverpool,https://www.aljazeera.com/sports/2025/7/30/luis-diaz-bayern-munich-sign-forward-from-liverpool?traffic_source=rss
Al Jazeera,11,Gaza’s starving children face permanent damage from chronic hunger,https://www.aljazeera.com/video/newsfeed/2025/7/30/gazas-starving-children-face-permanent-damage-from-chronic-hunger?traffic_source=rss
Al Jazeera,12,Europe’s deadly border theatre is back,https://www.aljazeera.com/opinions/2025/7/30/europes-deadly-border-theatre-is-back?traffic_source=rss
Al Jazeera,13,‘They chase ambulances:’ Russia’s ‘record’ attacks on Ukraine’s healthcare,https://www.aljazeera.com/features/2025/7/30/they-chase-ambulances-russias-record-attacks-on-ukraines-healthcare?traffic_source=rss
Al Jazeera,14,FIFA 2026 World Cup draw set to be held in Las Vegas in December,https://www.aljazeera.com/sports/2025/7/30/fifa-2026-world-cup-draw-set-to-be-held-in-las-vegas-in-december?traffic_source=rss
Al Jazeera,15,Is ISIL a growing threat in the DR Congo and East Africa?,https://www.aljazeera.com/news/2025/7/30/is-isil-a-growing-threat-in-the-dr-congo-and-east-africa?traffic_source=rss
Al Jazeera,16,Eastern Europe must earn its security in a post-American NATO,https://www.aljazeera.com/opinions/2025/7/30/eastern-europe-must-earn-its-security-in-a-post-american-nato?traffic_source=rss
Al Jazeera,17,Laura Dahlmeier: Climbers attempt rescue of injured Olympian in Pakistan,https://www.aljazeera.com/sports/2025/7/30/laura-dahlmeier-climbers-attempt-rescue-of-injured-olympian-in-pakistan?traffic_source=rss
Al Jazeera,18,"Tsunami waves reach US states of Hawaii, California after Russian quake",https://www.aljazeera.com/news/2025/7/30/tsunami-waves-hit-us-state-of-hawaii-after-russian?traffic_source=rss
Al Jazeera,19,Trump’s approval rating in US drops to lowest level of his second term,https://www.aljazeera.com/news/2025/7/30/trumps-approval-rating-in-us-drops-to-lowest-level-of-his-second-term?traffic_source=rss
Al Jazeera,20,Turkiye’s glaciers fall victim to climate change,https://www.aljazeera.com/gallery/2025/7/30/turkiyes-glaciers-fall-victim-to-climate-change?traffic_source=rss
