site,rank,title,link
Al Jazeera,1,World Athletics gene test introduced for female category,https://www.aljazeera.com/sports/2025/7/30/world-athletics-gene-test-introduced-for-female-category?traffic_source=rss
Al Jazeera,2,US Democrats use obscure law to pressure Trump on Epstein case,https://www.aljazeera.com/news/2025/7/30/democrats-use-obscure-law-to-pressure-trump-on-epstein-case?traffic_source=rss
Al Jazeera,3,US Q2 GDP growth masks broader economic downturn,https://www.aljazeera.com/economy/2025/7/30/us-q2-gdp-growth-masks-broader-economic-downturn?traffic_source=rss
Al Jazeera,4,The War on Truth,https://www.aljazeera.com/video/aljazeerauntangles/2025/7/30/the-war-on-truth-2?traffic_source=rss
Al Jazeera,5,"England vs India: Fifth Test – teams, start, Gambhir, groundsman",https://www.aljazeera.com/sports/2025/7/30/england-vs-india-fifth-test-teams-start-gambhir-groundsman?traffic_source=rss
Al Jazeera,6,UK flights disrupted after air traffic control ‘technical issue’,https://www.aljazeera.com/news/2025/7/30/uk-flights-disrupted-after-air-traffic-control-technical-issue?traffic_source=rss
Al Jazeera,7,UK court rules Palestine Action may challenge ‘antiterrorism’ ban,https://www.aljazeera.com/news/2025/7/30/uk-court-rules-palestine-action-may-challenge-antiterrorism-ban?traffic_source=rss
Al Jazeera,8,"Japan, Hawaii spared as tsunami warnings from 8.8 magnitude quake fade",https://www.aljazeera.com/video/newsfeed/2025/7/30/japan-hawaii-spared-as-tsunami-warnings-from-8-8-magnitude-quake-fade?traffic_source=rss
Al Jazeera,9,Fans and family say goodbye to metal star Ozzy Osbourne,https://www.aljazeera.com/video/newsfeed/2025/7/30/fans-and-family-say-goodbye-to-metal-star-ozzy-osbourne?traffic_source=rss
Al Jazeera,10,Who gets to have nukes? | Start Here,https://www.aljazeera.com/video/start-here/2025/7/30/who-gets-to-have-nukes-start-here?traffic_source=rss
Al Jazeera,11,Man Utd’s Shaw backs Amorim’s challenge of ‘toxic’ dressing room,https://www.aljazeera.com/sports/2025/7/30/shaw-says-amorim-right-to-challenge-toxic-man-utd-dressing-room?traffic_source=rss
Al Jazeera,12,"Trump hits India with 25% tariff, extra ‘penalty’ for Russian oil purchases",https://www.aljazeera.com/news/2025/7/30/trump-hits-india-with-25-tariff-extra-penalty-for-russian-oil-purchases?traffic_source=rss
Al Jazeera,13,‘Exorbitant privilege’: Can the US dollar maintain its global dominance?,https://www.aljazeera.com/economy/2025/7/30/exorbitant-privilege-can-the-us-dollar-maintain-its-global-dominance?traffic_source=rss
Al Jazeera,14,"Border clash between Ugandan, South Sudanese troops kills at least four",https://www.aljazeera.com/news/2025/7/30/border-clash-between-ugandan-south-sudanese-troops-kills-at-least-four?traffic_source=rss
Al Jazeera,15,Questions mount over UK’s ‘Palestinian statehood’ announcement,https://www.aljazeera.com/video/newsfeed/2025/7/30/questions-mount-over-uks-palestinian-statehood-announcement?traffic_source=rss
Al Jazeera,16,‘Dramatic setback’: Will Peru’s new amnesty law put justice out of reach?,https://www.aljazeera.com/features/longform/2025/7/30/dramatic-setback-will-perus-new-amnesty-law-put-justice-out-of-reach?traffic_source=rss
Al Jazeera,17,"The EU and US agree to a trade deal, but who won the negotiations?",https://www.aljazeera.com/video/counting-the-cost/2025/7/30/the-eu-and-us-agree-to-a-trade-deal-but-who-won-the-negotiations?traffic_source=rss
Al Jazeera,18,"How significant is UK’s move to recognise Palestinian state, and why now?",https://www.aljazeera.com/news/2025/7/30/how-significant-is-uks-move-to-recognise-palestinian-state-and-why-now?traffic_source=rss
Al Jazeera,19,"Video: Israel has now killed 60,000 Palestinians in its Gaza genocide",https://www.aljazeera.com/video/newsfeed/2025/7/30/video-israel-has-now-killed-60000-palestinians-in-its-gaza-genocide?traffic_source=rss
Al Jazeera,20,Gaza mothers forced to give babies water as milk and formula run out,https://www.aljazeera.com/video/newsfeed/2025/7/30/gaza-mothers-forced-to-give-babies-water-as-milk-and-formula-run-out?traffic_source=rss
