site,rank,title,link
Al Jazeera,1,"Five years since the murder of George Floyd, what has changed?",https://www.aljazeera.com/video/newsfeed/2025/5/26/five-years-since-the-murder-of-george-floyd-what-has-changed?traffic_source=rss
Al Jazeera,2,Ukraine accuses China of supplying Russian arms industry,https://www.aljazeera.com/news/2025/5/26/ukraine-accuses-china-of-supplying-russian-arms-industry?traffic_source=rss
Al Jazeera,3,Palestinian child filmed trying to escape fires after Israeli attack,https://www.aljazeera.com/video/newsfeed/2025/5/26/palestinian-child-filmed-trying-to-escape-fires-after-israeli-attack?traffic_source=rss
Al Jazeera,4,Romania’s President Dan sworn in amid far-right claims of stolen election,https://www.aljazeera.com/news/2025/5/26/romanias-president-dan-sworn-in-amid-far-right-claims-of-stolen-election?traffic_source=rss
Al Jazeera,5,Kylian Mbappe wins European Golden Shoe award for first time,https://www.aljazeera.com/sports/2025/5/26/kylian-mbappe-wins-european-golden-shoe-award-for-first-time?traffic_source=rss
Al Jazeera,6,Are Palestinian groups in Lebanon about to give up their weapons?,https://www.aljazeera.com/features/2025/5/26/are-palestinian-groups-in-lebanon-about-to-give-up-their-weapons?traffic_source=rss
Al Jazeera,7,Donald Trump condemns Putin after deadly Russian strikes on Ukraine,https://www.aljazeera.com/program/newsfeed/2025/5/26/donald-trump-condemns-putin-after-deadly-russian-strikes-on-ukraine?traffic_source=rss
Al Jazeera,8,Congolese refugees in Burundi face starvation and violence amid aid cuts,https://www.aljazeera.com/gallery/2025/5/26/congolese-refugees-in-burundi-face-starvation-and-violence-amid-aid-cuts?traffic_source=rss
Al Jazeera,9,Iran rules out enrichment break as bait for US nuclear deal,https://www.aljazeera.com/news/2025/5/26/iran-rules-out-enrichment-break-amid-us-talks?traffic_source=rss
Al Jazeera,10,Bear stops play: Japan golf event ended after furry sighting,https://www.aljazeera.com/news/2025/5/26/bear-stops-play-japan-golf-event-ended-after-furry-sighting?traffic_source=rss
Al Jazeera,11,Children’s YouTube star Ms Rachel meets girl from Gaza,https://www.aljazeera.com/program/newsfeed/2025/5/26/childrens-youtube-star-ms-rachel-meets-girl-from-gaza?traffic_source=rss
Al Jazeera,12,Uganda targeting LGBTQ community with hatred and violence: HRW,https://www.aljazeera.com/news/2025/5/26/uganda-targeting-lgbtq-community-with-hatred-and-violence-hrw?traffic_source=rss
Al Jazeera,13,"Venezuela election results: Who lost, won and what next?",https://www.aljazeera.com/news/2025/5/26/venezuela-election-results-who-lost-won-and-what-next?traffic_source=rss
Al Jazeera,14,Democracy in East Africa is retreating. Here is how it can be saved,https://www.aljazeera.com/opinions/2025/5/26/democracy-in-east-africa-is-retreating-here-is-how-it-can-be-saved?traffic_source=rss
Al Jazeera,15,Trump rows back tariff threat to agree EU trade-talk extension,https://www.aljazeera.com/news/2025/5/26/trump-rows-back-tariff-threat-to-agree-eu-trade-talk-extension?traffic_source=rss
Al Jazeera,16,Israeli strikes kill more than 50 as school and housing hit,https://www.aljazeera.com/news/2025/5/26/israel-kills-dozens-overnight-bombed-people-as-they-slept-in-school?traffic_source=rss
Al Jazeera,17,Gaza Humanitarian Foundation to launch aid deliveries despite losing chief,https://www.aljazeera.com/news/2025/5/26/gaza-humanitarian-foundation-to-launch-aid-deliveries-despite-losing-chief?traffic_source=rss
Al Jazeera,18,"Towns, Knicks stun Pacers in Game 3 of NBA East finals",https://www.aljazeera.com/sports/2025/5/26/towns-knicks-stun-pacers-in-game-3-of-nba-east-finals?traffic_source=rss
Al Jazeera,19,US and Iran “do not want” nuclear talks “to collapse”,https://www.aljazeera.com/video/quotable/2025/5/26/us-and-iran-do-not-want-nuclear-talks-to?traffic_source=rss
Al Jazeera,20,Maduro triumphs in Venezuelan election boycotted by opposition,https://www.aljazeera.com/news/2025/5/26/maduro-triumphs-in-venezuelan-election-boycotted-by-opposition?traffic_source=rss
