site,rank,title,link
Al Jazeera,1,‘This time’: The World Cup commercials capturing Egypt’s soaring hopes,https://www.aljazeera.com/news/2026/6/26/this-time-the-world-cup-commercials-capturing-egypts-soaring-hopes?traffic_source=rss
Al Jazeera,2,Hezbollah: Israel must ‘unconditionally’ leave Lebanon,https://www.aljazeera.com/video/newsfeed/2026/6/26/aje-onl-nf_hezbollah_israel-must-unconditionally-leave-lebanon-260626?traffic_source=rss
Al Jazeera,3,Why did these World Cup ads strike a nerve in Egypt?,https://www.aljazeera.com/video/newsfeed/2026/6/26/why-did-these-world-cup-ads-strike-a-nerve-in-egypt?traffic_source=rss
Al Jazeera,4,Norway vs France LIVE: FIFA World Cup 2026,https://www.aljazeera.com/sports/liveblog/2026/6/26/norway-vs-france-live-fifa-world-cup-2026?traffic_source=rss
Al Jazeera,5,EU targets Somalia with visa curbs as president pushes back on returns,https://www.aljazeera.com/news/2026/6/26/eu-targets-somalia-with-visa-curbs-as-president-pushes-back-on-returns?traffic_source=rss
Al Jazeera,6,Why has the UN paused plans to evacuate sailors from the Strait of Hormuz?,https://www.aljazeera.com/news/2026/6/26/why-has-the-un-paused-plans-to-evacuate-sailors-from-the-strait-of-hormuz?traffic_source=rss
Al Jazeera,7,"Morocco jails 29, including politicians and sports figures, in drug trial",https://www.aljazeera.com/news/2026/6/26/morocco-jails-29-including-politicians-and-sports-figures-in-drug-trial?traffic_source=rss
Al Jazeera,8,Ex-Trump adviser Bolton pleads guilty in classified documents case,https://www.aljazeera.com/news/2026/6/26/ex-trump-adviser-bolton-pleads-guilty-in-classified-documents-case?traffic_source=rss
Al Jazeera,9,Iran slams the GCC and the US for ‘interventionist’ statement: What we know,https://www.aljazeera.com/news/2026/6/26/iran-slams-the-gcc-and-the-us-for-interventionist-statement-what-we-know?traffic_source=rss
Al Jazeera,10,South Korean court jails former first lady for seven years in bribery case,https://www.aljazeera.com/news/2026/6/26/south-korean-court-jails-former-first-lady-for-seven-years-in-bribery-case?traffic_source=rss
Al Jazeera,11,"Iraq’s new PM launches anticorruption campaign, but is it enough?",https://www.aljazeera.com/news/2026/6/26/iraqs-new-pm-launches-anticorruption-campaign-but-is-it-enough?traffic_source=rss
Al Jazeera,12,New York’s primaries signal a new force in US politics,https://www.aljazeera.com/opinions/2026/6/26/new-yorks-primaries-signal-a-new-force-in-us-politics?traffic_source=rss
Al Jazeera,13,Aid groups urge swift action to avert ‘atrocities’ in Sudan’s el-Obeid,https://www.aljazeera.com/news/2026/6/26/aid-groups-urge-swift-action-to-avert-atrocities-in-sudans-el-obeid?traffic_source=rss
Al Jazeera,14,Hezbollah demands Israel leave Lebanon ‘unconditionally’ as US talks extend,https://www.aljazeera.com/news/2026/6/26/hezbollah-demands-israel-leave-lebanon-unconditionally-as-us-talks-extend?traffic_source=rss
Al Jazeera,15,Thermal cameras reveal intense heat for outdoor workers in Europe,https://www.aljazeera.com/video/newsfeed/2026/6/26/thermal-cameras-reveal-intense-heat-for-outdoor-workers-in-europe?traffic_source=rss
Al Jazeera,16,Everything we know so far about the deadly earthquakes in Venezuela,https://www.aljazeera.com/video/newsfeed/2026/6/26/everything-we-know-so-far-about-the-deadly-earthquakes-in-venezuela-2?traffic_source=rss
Al Jazeera,17,Which countries have pledged aid to Venezuela after powerful earthquakes?,https://www.aljazeera.com/news/2026/6/26/which-countries-have-pledged-aid-to-venezuela-after-powerful-earthquakes?traffic_source=rss
Al Jazeera,18,"Ukraine decimates Russian logistics, bringing chaos to Crimea",https://www.aljazeera.com/news/2026/6/26/ukraine-decimates-russian-logistics-bringing-chaos-to-crimea?traffic_source=rss
Al Jazeera,19,The Pakistan artisans still hand-stitching the world’s footballs,https://www.aljazeera.com/features/longform/2026/6/26/the-hands-behind-the-beautiful-game?traffic_source=rss
Al Jazeera,20,"New synthetic drugs, cocaine and meth booming, warns UN",https://www.aljazeera.com/news/2026/6/26/new-synthetic-drugs-cocaine-and-meth-booming-warns-un?traffic_source=rss
Associated Press,1,Ukraine unleashes one of its heaviest drone bombardments of Russia,https://apnews.com/article/russia-ukraine-war-biggest-drone-attack-a356e2a119f3cb9422ede6acbedf56f3
Associated Press,2,Venezuelans take search for the missing into their own hands in earthquake aftermath,https://apnews.com/article/venezuela-caracas-guaira-earthquakes-dead-injured-missing-b07aff1cb886cfe616a0e89b3687b8b8
Associated Press,3,Trump blames Iran for a drone strike on a cargo ship in the Strait of Hormuz,https://apnews.com/article/iran-us-israel-war-hormuz-strait-june-26-2026-8c1a77eb82d25f00de814958114c7296
Associated Press,4,Supreme Court clears way for Trump administration to revive restrictive policy for asylum seekers,https://apnews.com/article/supreme-court-immigration-trump-d36d0092617c7115780c06de38e2000f
Associated Press,5,"Florida's 'Alligator Alcatraz' immigration detention center has closed, governor says",https://apnews.com/article/alligator-alcatraz-closure-florida-immigration-detention-3c371f51fe71ed64b7ae9d22d0fab5cb
Associated Press,6,"Supreme Court's ruling to end protections for Haitian, Syrian immigrants could have broader impact",https://apnews.com/article/temporary-legal-protections-supreme-court-haitian-syrian-14d4851b164093e4182e953ae5142edd
Associated Press,7,"Reflecting Pool liner was cut with a sharp knife or razor, National Park Service says",https://apnews.com/article/reflecting-pool-liner-cut-national-park-service-trump-98e11bfcb5899753c79bf55698dc958f
Associated Press,8,The Supreme Court lets the Trump administration end legal protections for Haitians and Syrians,https://apnews.com/article/immigration-supreme-court-haiti-syria-tps-1bbbf8115f984a0d53336656924e989d
Associated Press,9,"Vance, an admirer of Richard Nixon, says Watergate would be 'a 12-hour news story' today",https://apnews.com/article/vance-nixon-watergate-9a82141f1b4f5b2c973a4bdb107812d9
Associated Press,10,WNBA suspends Alyssa Thomas 1 game for hit to Caitlin Clark's throat,https://apnews.com/article/alyssa-thomas-caitlin-clark-suspension-3ffbce6a061e328ab9df17c31ced8300
Associated Press,11,Tennis Hall of Famer Chris Evert says she will miss Wimbledon after recurrence of ovarian cancer,https://apnews.com/article/chris-evert-ovarian-cancer-acfc19fac1fb102eb94170ca745d6611
Associated Press,12,"Curtains go up at AT&T Stadium for the World Cup, a glare-blocking move rejected by Jerry Jones",https://apnews.com/article/att-stadium-curtains-sweden-japan-dallas-cowboys-975dd0c7fc441776cfe6693844dd7887
Associated Press,13,"David Clayton-Thomas, powerhouse lead singer of Blood, Sweat & Tears, dies at 84",https://apnews.com/article/david-clayton-thomas-84-died-singer-62acd793a277ff981d1635b80ed230b4
Associated Press,14,"Happy birthday, 2000 Year Old Man. Mel Brooks is turning 100",https://apnews.com/article/mel-brooks-100-birthday-8fe28c3604f9c7901848c84c23336ffa
Associated Press,15,Movie Review: 'Jackass: Best and Last' is just a clip-job of greatest hits. And we mean hits,https://apnews.com/article/jackass-best-last-movie-review-349e7c760c1a3266aba0078ea3f7d55f
Associated Press,16,"Former executive sues Meta over attempts to 'silence' her memoir, 'Careless People'",https://apnews.com/article/meta-wynnwilliams-lawsuit-silence-book-careless-people-652de34608da69be46f7e679b21da49b
Associated Press,17,Apple hikes prices for Macs and iPads,https://apnews.com/article/apple-mac-ipad-price-increase-neo-fe95fe57dfa9b4a9917d68df5dcfe0e3
Associated Press,18,Questions about resume gaps are expected. Here's how job seekers can address them,https://apnews.com/article/career-gap-layoff-parenting-workforce-reentry-af2d49fab3d5d0d7d78e820989d5295b
Associated Press,19,Get a load of this: Humans and great apes share similar giggles,https://apnews.com/article/great-ape-human-laughter-gorilla-bonobo-d3fc226a0e2aeeb36cb146c5064953bc
Associated Press,20,15 millones de años de risas compartidas: humanos y grandes simios ríen de forma similar: estudio,https://apnews.com/article/simios-humanos-risa-estudio-evolucion-9e2eb3534a852ce2871fe3c79058fffa
