site,rank,title,link
Al Jazeera,1,"An outlier for condemning Israel’s Gaza genocide, Spain says no to Iran war",https://www.aljazeera.com/news/2026/3/4/spain-no-to-israel-us-war-iran?traffic_source=rss
Al Jazeera,2,Is the CIA planning to arm Kurdish forces to spark an uprising in Iran?,https://www.aljazeera.com/news/2026/3/4/is-the-cia-planning-to-arm-kurdish-forces-to-spark-an-uprising-in-iran?traffic_source=rss
Al Jazeera,3,NATO defences destroy missile fired from Iran over Mediterranean: Turkiye,https://www.aljazeera.com/news/2026/3/4/nato-defences-destroy-missile-fired-from-iran-over-mediterranean-turkiye?traffic_source=rss
Al Jazeera,4,At least 100 people missing after Iranian military ship sinks off Sri Lanka,https://www.aljazeera.com/news/2026/3/4/at-least-100-missing-after-iranian-military-ship-sinks-off-sri-lanka-coast?traffic_source=rss
Al Jazeera,5,Drone targets military base in Bahrain,https://www.aljazeera.com/video/newsfeed/2026/3/4/drone-targets-military-base-in-bahrain?traffic_source=rss
Al Jazeera,6,Spanish PM says ‘no to war’ in Middle East,https://www.aljazeera.com/video/newsfeed/2026/3/4/spanish-pm-says-no-to-war-in-middle-east?traffic_source=rss
Al Jazeera,7,Are civilisations destined to fail?,https://www.aljazeera.com/video/doha-debates/2026/3/4/are-civilisations-destined-to-fail?traffic_source=rss
Al Jazeera,8,"Texas Senate race: Democrat Talarico wins; GOP’s Cornyn, Paxton in run-off",https://www.aljazeera.com/news/2026/3/4/texas-senate-race-democrat-talarico-wins-gops-cornyn-paxton-in-run-off?traffic_source=rss
Al Jazeera,9,Iran’s Women’s Asian Cup team have ‘so much concern’ for families back home,https://www.aljazeera.com/sports/2026/3/4/irans-womens-asian-cup-team-have-so-much-concern-for-families-back-home?traffic_source=rss
Al Jazeera,10,"After Iran’s warning, Europe fails to unite on war launched by US, Israel",https://www.aljazeera.com/news/2026/3/4/amid-middle-east-crisis-europe-fumbles-towards-mutual-defence?traffic_source=rss
Al Jazeera,11,Israeli air attack hits Beirut during live report,https://www.aljazeera.com/video/newsfeed/2026/3/4/israeli-air-attack-hits-beirut-during-live-report?traffic_source=rss
Al Jazeera,12,How Iran fights an imposed war,https://www.aljazeera.com/opinions/2026/3/4/how-iran-fights-an-imposed-war?traffic_source=rss
Al Jazeera,13,Iranian missile hits base housing US troops in Qatar,https://www.aljazeera.com/video/newsfeed/2026/3/4/iranian-missile-hits-base-housing-us-troops-in-qatar?traffic_source=rss
Al Jazeera,14,‘We were just praying’: Pakistani students recount escape from war-hit Iran,https://www.aljazeera.com/news/2026/3/4/we-were-just-praying-pakistani-students-recount-escape-from-war-hit-iran?traffic_source=rss
Al Jazeera,15,Huge column of smoke seen over western Tehran,https://www.aljazeera.com/video/newsfeed/2026/3/4/huge-column-of-smoke-seen-over-western-tehran?traffic_source=rss
Al Jazeera,16,Zimbabwean child waste-pickers work ‘hazardous’ jobs to help their families,https://www.aljazeera.com/features/2026/3/4/zimbabwean-child-waste-pickers-work-hazardous-jobs-to-help-their-families?traffic_source=rss
Al Jazeera,17,LIVE: South Africa vs New Zealand – T20 World Cup semifinal,https://www.aljazeera.com/sports/liveblog/2026/3/4/live-south-africa-vs-new-zealand-t20-world-cup?traffic_source=rss
Al Jazeera,18,Iran postpones Khamenei’s farewell as Israel threatens to kill successor,https://www.aljazeera.com/news/2026/3/4/iranians-to-bid-farewell-to-khamenei-as-israel-threatens-to-kill-successor?traffic_source=rss
Al Jazeera,19,"Hundreds of drones target Kuwait, Iraq, Saudi Arabia, UAE amid Iran war",https://www.aljazeera.com/news/2026/3/4/hundreds-of-drones-target-kuwait-iraq-saudi-arabia-uae-amid-iran-war?traffic_source=rss
Al Jazeera,20,Analyst says interest in Epstein files plummeted after war on Iran launched,https://www.aljazeera.com/news/2026/3/4/analyst-says-interest-in-epstein-files-plummeted-after-war-on-iran-launched?traffic_source=rss
Associated Press,1,What China's response to the US attack on Iran says about its foreign policy,https://apnews.com/article/china-position-us-iran-attack-1042fa7295500f90ecd6285d552da349
Associated Press,2,Macron orders France's nuclear-powered aircraft carrier to the Mediterranean,https://apnews.com/article/france-macron-aircraft-carrier-charles-de-gaulle-mediterranean-dd185933de5e5cee87828768c0046fba
Associated Press,3,Father who gave gun to Georgia school shooting suspect for Christmas is guilty of 2nd-degree murder,https://apnews.com/article/georgia-school-shooting-trial-colin-gray-e9afe6e8289f474aa474242ee4bdca67
Associated Press,4,US soldiers who died in Iran war remembered as devoted parents and reservists,https://apnews.com/article/us-soldiers-who-died-iran-war-46f54df716fe1c5290363da0a15f99f3
Associated Press,5,Trump threatens to cut off trade with Spain after it disallowed US use of joint bases in Iran war,https://apnews.com/article/trump-spain-iran-trade-defense-nato-spending-43e0f13e7b1c7e6ebcc4b558474aacdc
Associated Press,6,"Tensions flare as lawmakers question Iran war’s costs, risks and strategy",https://apnews.com/article/iran-war-marco-rubio-middle-east-9b9dfac9c40c8cf171e229e0a0a6980f
Associated Press,7,"Noem defends her portrayal of killed Minneapolis protesters as agitators, in her Senate hearing",https://apnews.com/article/noem-testifies-congress-homeland-security-immigration-enforcement-ebb715699e3f4f6dd6fdd22157b4e1a7
Associated Press,8,A long-shot American dream hits the F1 grid as Cadillac debuts at the Australian GP,https://apnews.com/article/f1-cadillac-perez-bottas-twg-towriss-australian-gp-cd0b6e83e688d6eac94c976b540044ab
Associated Press,9,FIFA puts World Cup playoff tickets on sale for less than $17 for matches in Mexico,https://apnews.com/article/world-cup-playoff-tickets-fifa-89689a8fc89c2e60e277e43b7652eabb
Associated Press,10,Atlanta Braves' Jurickson Profar suspended for 2026 season following second positive drug test,https://apnews.com/article/profar-drug-suspension-braves-b60b2da421060606e45623b379db1aec
Associated Press,11,"Christina Applegate unleashes a raw, probing memoir: 'You with the Sad Eyes'",https://apnews.com/article/christina-applegate-memoir-interview-d33e9bc590e7321b012c97eb6298615f
Associated Press,12,"An Oscar race that looked like a runaway may be a close call, after all",https://apnews.com/article/oscars-one-battle-sinners-0055b63bcdc6cce32ae627ca46eafda1
Associated Press,13,The Guess Who plan the band's first official US tour in over two decades,https://apnews.com/article/guess-who-us-tour-2026-ce158d7ca625dc0d03e543eb10da053d
Associated Press,14,Iranian strikes on Amazon data centers highlight industry's vulnerability to physical disasters,https://apnews.com/article/amazon-aws-data-center-uae-iran-bahrain-71066b0a822c4cfd88b61e3fe79af917
Associated Press,15,Gasoline and diesel prices spike overnight as anxious drivers fill up tanks,https://apnews.com/article/iran-oil-gas-gallon-aaa-e2daee318b8e3e6a1124713909a410e4
Associated Press,16,Pentagon dispute bolsters Anthropic reputation but raises questions about AI readiness in military,https://apnews.com/article/anthropic-pentagon-openai-claude-chatgpt-military-ai-b2bbcf5fda3f27353eae1e0eb7ab07b6
Associated Press,17,Viral phenomenon in Argentina has young people identifying themselves as animals,https://apnews.com/article/argentina-teenagers-identifying-as-animals-therians-tiktok-54d158c4842f6515e31d83a260cdf31f
Associated Press,18,Injured mother manatee and calf are rescued in Florida and taken to SeaWorld,https://apnews.com/article/manatee-rescue-florida-orange-river-89d431ad669f3559d30aa25a9b83d027
Associated Press,19,Otters enjoy a snow day in Maryland during winter storm,https://apnews.com/article/otters-video-snow-storm-slides-baltimore-aquarium-97c075e88a33789e9bf54257eb150f8d
Associated Press,20,Raccoon goes on drunken rampage in Virginia liquor store and passes out on bathroom floor,https://apnews.com/article/drunk-raccoon-liquor-store-bandit-virginia-5109feb2ea9ab9bf8954ec3798689fd0
