site,rank,title,link
Al Jazeera,1,Warner Bros Discovery rejects Paramount’s hostile takeover bid,https://www.aljazeera.com/economy/2025/12/17/warner-bros-discovery-rejects-paramounts-hostile-takeover-bid?traffic_source=rss
Al Jazeera,2,DRC says M23 vow to pull out of Uvira is a ‘distraction’,https://www.aljazeera.com/news/2025/12/17/drc-says-m23-vow-to-pull-out-of-uvira-is-a-distraction-as-forces-remain?traffic_source=rss
Al Jazeera,3,Is Trump about to wage war in Latin America?,https://www.aljazeera.com/video/newsfeed/2025/12/17/is-trump-about-to-wage-war-in-latin-america?traffic_source=rss
Al Jazeera,4,"Faced with Trump’s deportation push, US teachers fear leaving the classroom",https://www.aljazeera.com/news/2025/12/17/faced-with-trumps-deportation-push-us-teachers-fear-leaving-the-classroom?traffic_source=rss
Al Jazeera,5,Winter storms cause war-damaged buildings to collapse in Gaza,https://www.aljazeera.com/video/newsfeed/2025/12/17/winter-storms-cause-war-damaged-buildings-to-collapse-in-gaza?traffic_source=rss
Al Jazeera,6,AFCON 2025: Who are the top players to watch in Morocco?,https://www.aljazeera.com/sports/2025/12/17/afcon-2025-who-are-the-top-players-to-watch-in-morocco?traffic_source=rss
Al Jazeera,7,Venezuela’s Machado leaves Oslo after trip to receive Nobel Peace Prize,https://www.aljazeera.com/news/2025/12/17/venezuelas-machado-leaves-oslo-after-trip-to-receive-nobel-peace-prize?traffic_source=rss
Al Jazeera,8,Susie Wiles: What top Trump aide said in her Vanity Fair interview,https://www.aljazeera.com/news/2025/12/17/susie-wiles-what-top-trump-aide-said-in-her-vanity-fair-interview?traffic_source=rss
Al Jazeera,9,Afghanistan under Taliban a “society of gender apartheid”,https://www.aljazeera.com/video/quotable/2025/12/17/afghanistan-under-taliban-a-society-of-gender?traffic_source=rss
Al Jazeera,10,"What are things like for women, 15 years after the Arab Spring?",https://www.aljazeera.com/video/by-the-numbers-3/2025/12/17/what-are-things-like-for-women-15-years-after-the-arab-spring?traffic_source=rss
Al Jazeera,11,Will Europe use frozen Russian assets to fund Ukraine’s war efforts?,https://www.aljazeera.com/video/newsfeed/2025/12/17/will-europe-use-frozen-russian-assets-to-fund-ukraines-war-efforts?traffic_source=rss
Al Jazeera,12,US dramatically escalates air strikes on Somalia under Trump this year,https://www.aljazeera.com/news/2025/12/17/us-dramatically-escalates-air-strikes-on-somalia-under-trump-this-year?traffic_source=rss
Al Jazeera,13,LIVE: PSG vs Flamengo – FIFA Intercontinental Cup final,https://www.aljazeera.com/sports/liveblog/2025/12/17/live-psg-vs-flamengo-fifa-intercontinental-cup-final?traffic_source=rss
Al Jazeera,14,Seizure of Uvira in DRC “will be a blow” to peace negotiations,https://www.aljazeera.com/video/quotable/2025/12/17/seizure-of-uvira-in-drc-will-be-a-blow-to-peace-negotiations?traffic_source=rss
Al Jazeera,15,Putin slams West’s ‘war hysteria’ as EU mulls Russian assets for Ukraine,https://www.aljazeera.com/news/2025/12/17/putin-slams-wests-war-hysteria-as-eu-mulls-russian-assets-for-ukraine?traffic_source=rss
Al Jazeera,16,Satellite images reveal Israeli demolitions in Gaza during ceasefire,https://www.aljazeera.com/video/newsfeed/2025/12/17/satellite-images-reveal-israeli-demolitions-in-gaza-during-ceasefire?traffic_source=rss
Al Jazeera,17,How can Ukraine rebuild China ties scarred by Russia’s war?,https://www.aljazeera.com/news/2025/12/17/how-can-ukraine-rebuild-china-ties-after-they-were-scarred-by-russias-war?traffic_source=rss
Al Jazeera,18,Video: Thousands of dinosaur footprints discovered in Italy,https://www.aljazeera.com/video/newsfeed/2025/12/17/video-thousands-of-dinosaur-footprints-discovered-in-italy?traffic_source=rss
Al Jazeera,19,"Activists decry state of Tunisia’s democracy, 15 years after Arab Spring",https://www.aljazeera.com/video/newsfeed/2025/12/17/activists-decry-fall-of-tunisias-democracy-15-years-after-arab-spring?traffic_source=rss
Al Jazeera,20,Trump orders naval blockade targeting Venezuelan oil,https://www.aljazeera.com/video/newsfeed/2025/12/17/trump-orders-naval-blockade-targeting-venezuelan-oil?traffic_source=rss
Associated Press,1,"Syrian Australian man, deemed a national hero after stopping gunman, receives millions in donations",https://apnews.com/article/al-ahmed-bondi-shooting-australia-fundraising-hero-c4680d7b8220c212af4fe6d1fac4f07f
Associated Press,2,Brazilian cardinal orders a popular Catholic priest to go offline following right-wing attacks,https://apnews.com/article/brazil-priest-social-media-lancellotti-sao-paulo-b2798414f3a757aeb7737b852f70421a
Associated Press,3,Israel blocks a Canadian delegation from visiting the occupied West Bank,https://apnews.com/article/israel-canada-delegation-west-bank-ba0f39adc9da4e070cfc203879e315c4
Associated Press,4,MIT professor fatally shot at his home near Boston,https://apnews.com/article/mit-professor-shooting-massachusetts-portugal-3ab1e3e7e369de5cef90c7c911995dbb
Associated Press,5,Woman charged after Mississippi Walmart shoppers say they found razor blades in loaves of bread,https://apnews.com/article/razor-blades-bread-walmart-mississippi-texas-woman-e5c801c6b40292c0125c2e47028f7c5b
Associated Press,6,Hyundai and Kia will repair millions of vehicles under a deal to fix anti-theft technology,https://apnews.com/article/minnesota-kia-hyundai-theft-settlement-d2dc13dcee3fa65494d4df9f089dd386
Associated Press,7,"Susie Wiles, White House chief of staff, criticizes Bondi and opines on Trump in Vanity Fair",https://apnews.com/article/trump-wiles-chief-staff-interview-cabinet-bondi-5c995a046318973b1a3dfe8ed89cf3cf
Associated Press,8,Trump expands travel ban and restrictions to include an additional 20 countries,https://apnews.com/article/trump-travel-ban-countries-immigration-visas-border-9dde0aecb3ffe418266700d9eefef937
Associated Press,9,FIFA slashes price of some World Cup tickets to $60 after global fan backlash,https://apnews.com/article/fifa-ticket-prices-slashed-73e7147a8843d07af08fcc88068dce80
Associated Press,10,"Sydney McLaughlin-Levrone, Gabby Thomas among those owed six figures by bankrupt Grand Slam Track",https://apnews.com/article/mclaughlin-levrone-thomas-grand-slam-bankruptcy-0814626a14b53df8fb29e6829de4b7af
Associated Press,11,Mikaela Shiffrin's slalom domination reaching new heights during the Olympic season,https://apnews.com/article/mikaela-shiffrin-skiing-olympics-courchevel-739c9a12be1d642999ae3e624c83b91f
Associated Press,12,Close friends of Rob and Michele Reiner release statement on their lives and work,https://apnews.com/article/rob-michele-reiner-ap-statement-close-friends-a9be43c1748bd6c955744c1fbae12389
Associated Press,13,Movie Review: Paul Feig's 'The Housemaid' is a twisty horror-thriller with nudity and empowerment,https://apnews.com/article/housemaid-movie-review-sweeney-ece46a54d8c8f5d1e8867b25110a18fe
Associated Press,14,Rob Reiner’s son Nick appears in court on 2 counts of murder in killing of his parents,https://apnews.com/article/rob-reiner-wife-killed-a6ed355ff2f54a20497b7492a3ebd4b2
Associated Press,15,Jeff Bezos and Lauren Sánchez Bezos are awarding $5 million to a leader in neurodiversity education,https://apnews.com/article/philanthropy-jeff-bezos-lauren-sanchez-neurodiversity-education-16bdf231503ec127a958942ec7d50584
Associated Press,16,Jared Kushner pulls out of Paramount’s hostile bid for Warner Bros. Discovery,https://apnews.com/article/jared-kushner-paramount-warner-bros-netflix-56886b231c132f6eb7d8990f0ede3e32
Associated Press,17,Phil and Penny Knight's donation tops the Chronicle of Philanthropy's list of 2025's biggest gifts,https://apnews.com/article/phil-penny-knight-2025-top-gifts-2839b5a3941ebf79f1e1d82949a75ede
Associated Press,18,"Saturn's moon Titan may not have a buried ocean as long suspected, new study suggests",https://apnews.com/article/saturn-moon-titan-cassini-nasa-826b80d16af4a5ba7c37726285d6e036
Associated Press,19,Raccoon goes on drunken rampage in Virginia liquor store and passes out on bathroom floor,https://apnews.com/article/drunk-raccoon-liquor-store-bandit-virginia-5109feb2ea9ab9bf8954ec3798689fd0
Associated Press,20,Baltimore cyclist finds joy in collecting lost hubcaps and stringing them into art,https://apnews.com/article/hubcap-artist-bicyclist-joy-wonder-4d1d40064d3853153d931f1a25526d84
