site,rank,title,link
Al Jazeera,1,French surgeon sentenced to 20 years for sex abuse of nearly 300 people,https://www.aljazeera.com/news/2025/5/28/french-surgeon-sentenced-to-20-years-for-sex-abuse-of-nearly-300-people?traffic_source=rss
Al Jazeera,2,‘Tidal wave’: How 75 nations face Chinese debt crisis in 2025,https://www.aljazeera.com/news/2025/5/28/tidal-wave-how-75-nations-face-chinese-debt-crisis-in-2025?traffic_source=rss
Al Jazeera,3,A timeline of Israel’s starvation of Gaza in 2025,https://www.aljazeera.com/video/newsfeed/2025/5/28/a-timeline-of-israels-starvation-of-gaza-in-2025?traffic_source=rss
Al Jazeera,4,What are Germany’s Taurus missiles that Ukraine wants?,https://www.aljazeera.com/news/2025/5/28/what-are-germanys-taurus-missiles-that-ukraine-wants?traffic_source=rss
Al Jazeera,5,UEFA Champions League: Luis Enrique – The manager behind PSG’s run to final,https://www.aljazeera.com/sports/2025/5/28/luis-enrique-the-manager-behind-psgs-run-to-uefa-champions-league-final?traffic_source=rss
Al Jazeera,6,"Boat capsizes on arrival at Spain’s Canary Islands; seven women, girls die",https://www.aljazeera.com/news/2025/5/28/boat-capsizes-on-arrival-at-spains-canary-islands-seven-women-girls-die?traffic_source=rss
Al Jazeera,7,Cultural Appreciation or Cultural Appropriation?,https://www.aljazeera.com/program/the-stream/2025/5/28/cultural-appreciation-or-cultural-appropriation?traffic_source=rss
Al Jazeera,8,Inquiry into deadly chemical plant explosion in China,https://www.aljazeera.com/program/newsfeed/2025/5/28/inquiry-into-deadly-chemical-plant-explosion-in-china?traffic_source=rss
Al Jazeera,9,Preserving Oualata’s fragile manuscript legacy amid desert threats,https://www.aljazeera.com/gallery/2025/5/28/preserving-oualatas-fragile-manuscript-legacy-amid-desert-threats?traffic_source=rss
Al Jazeera,10,"New US plan for Gaza aid is “not just nonsensical, it’s cruel”",https://www.aljazeera.com/video/quotable/2025/5/28/new-us-plan-for-gaza-aid-is-not-just-nonsensical-its?traffic_source=rss
Al Jazeera,11,Gaza aid chaos condemned by humanitarian leaders,https://www.aljazeera.com/video/newsfeed/2025/5/28/gaza-aid-chaos-condemned-by-humanitarian-leaders?traffic_source=rss
Al Jazeera,12,Why millions of people don’t have enough to eat,https://www.aljazeera.com/video/by-the-numbers-3/2025/5/28/why-millions-of-people-dont-have-enough-to-eat?traffic_source=rss
Al Jazeera,13,The cost of conscience: I lost friends for defending Palestinians,https://www.aljazeera.com/opinions/2025/5/28/the-cost-of-conscience-i-lost-friends-for-defending-palestinians?traffic_source=rss
Al Jazeera,14,Gaza’s aid system isn’t broken. It’s working exactly as designed,https://www.aljazeera.com/opinions/2025/5/28/gazas-aid-system-isnt-broken-its-working-exactly-as-designed?traffic_source=rss
Al Jazeera,15,Video: Paris protesters dye fountain red to signify Gaza bloodbath,https://www.aljazeera.com/video/newsfeed/2025/5/28/video-paris-protesters-dye-fountain-red-to-signify-gaza-bloodbath?traffic_source=rss
Al Jazeera,16,US pauses new student visas: What it means and who it will affect,https://www.aljazeera.com/news/2025/5/28/us-pauses-new-student-visas-what-it-means-and-who-it-will-affect?traffic_source=rss
Al Jazeera,17,"‘US, China, India can all fit into Africa’: On a quest to fix the world map",https://www.aljazeera.com/features/2025/5/28/us-china-india-can-all-fit-into-africa-on-a-quest-to-fix-the-world-map?traffic_source=rss
Al Jazeera,18,Harvard students protest Trump’s university crackdown,https://www.aljazeera.com/program/newsfeed/2025/5/28/harvard-students-protest-trumps-university-crackdown?traffic_source=rss
Al Jazeera,19,German court rejects Peruvian farmer’s climate case against RWE,https://www.aljazeera.com/news/2025/5/28/german-court-rejects-peruvian-farmers-climate-case-against-rwe?traffic_source=rss
Al Jazeera,20,"US-backed Gaza aid model ‘distraction from atrocities’, UNRWA chief says",https://www.aljazeera.com/news/2025/5/28/us-backed-gaza-aid-model-distraction-from-atrocities-unrwa-chief-says?traffic_source=rss
