site,rank,title,link
Al Jazeera,1,Afghanistan brands China peace talks with Pakistan ‘useful’,https://www.aljazeera.com/news/2026/4/7/afghanistan-brands-china-peace-talks-with-pakistan-useful?traffic_source=rss
Al Jazeera,2,UK blocks rapper Kanye West from entry over anti-Semitism and Nazi support,https://www.aljazeera.com/news/2026/4/7/uk-blocks-rapper-kanye-west-from-entry-over-anti-semitism-and-nazi-support?traffic_source=rss
Al Jazeera,3,Why JD Vance joined Pakistan’s last-ditch US-Iran mediation efforts,https://www.aljazeera.com/news/2026/4/7/why-jd-vance-joined-pakistans-last-ditch-us-iran-mediation-efforts?traffic_source=rss
Al Jazeera,4,WHO halts Gaza medical evacuations after worker killed,https://www.aljazeera.com/news/2026/4/7/who-halts-gaza-medical-evacuations-after-worker-killed?traffic_source=rss
Al Jazeera,5,"Top university says US-Israel attack targeted Iran’s progress, AI learning",https://www.aljazeera.com/news/2026/4/7/top-university-says-us-israel-attack-targeted-irans-progress-ai-learning?traffic_source=rss
Al Jazeera,6,US denies nuclear plan as deadline on threat to Iran ‘civilisation’ looms,https://www.aljazeera.com/news/2026/4/7/us-denies-nuclear-plan-as-deadline-on-threat-to-iran-civilisation-looms?traffic_source=rss
Al Jazeera,7,Netanyahu: Israel shifting ‘balance of power’ with Iran strikes,https://www.aljazeera.com/video/newsfeed/2026/4/7/netanyahu-israel-shifting-balance-of-power-with-iran-strikes?traffic_source=rss
Al Jazeera,8,Russia confirms 16 Cameroonian soldiers killed in Ukraine war,https://www.aljazeera.com/news/2026/4/7/russia-confirms-16-cameroonian-soldiers-killed-in-ukraine-war?traffic_source=rss
Al Jazeera,9,Fire erupts near industrial site in Saudi Arabia after Iranian strikes,https://www.aljazeera.com/video/newsfeed/2026/4/7/fire-erupts-near-industrial-site-in-saudi-arabia-after-iranian-strikes?traffic_source=rss
Al Jazeera,10,Can Africa tackle the oil shock from the Iran war?,https://www.aljazeera.com/video/counting-the-cost/2026/4/7/can-africa-tackle-the-oil-shock-from-the-iran-war?traffic_source=rss
Al Jazeera,11,LIVE: Real Madrid vs Bayern Munich – Champions League quarterfinal,https://www.aljazeera.com/sports/liveblog/2026/4/7/live-real-madrid-vs-bayern-munich-champions-league-quarterfinal?traffic_source=rss
Al Jazeera,12,Trump threatens Iran: ‘A whole civilisation will die tonight’,https://www.aljazeera.com/video/newsfeed/2026/4/7/trump-threatens-iran-a-whole-civilisation-will-die?traffic_source=rss
Al Jazeera,13,From 9pm shutdowns to remote work: Egypt cuts fuel amid power crisis,https://www.aljazeera.com/economy/2026/4/7/from-9pm-shutdowns-to-remote-work-egypt-cuts-fuel-amid-power-crisis?traffic_source=rss
Al Jazeera,14,India’s nuclear leap: Why its fast breeder reactor success matters,https://www.aljazeera.com/news/2026/4/7/indias-nuclear-leap-why-its-fast-breeder-reactor-success-matters?traffic_source=rss
Al Jazeera,15,Bangladesh appoints Tamim Iqbal as country’s youngest cricket chief,https://www.aljazeera.com/sports/2026/4/7/bangladesh-appoint-tamim-iqbal-as-countrys-youngest-cricket-chief?traffic_source=rss
Al Jazeera,16,Free will: can we really shape our destiny?,https://www.aljazeera.com/video/doha-debates/2026/4/7/free-will-can-we-really-shape-our-destiny?traffic_source=rss
Al Jazeera,17,Trump on Iran: ‘A whole civilisation will die tonight’,https://www.aljazeera.com/news/2026/4/7/trump-on-iran-a-whole-civilisation-will-die-tonight?traffic_source=rss
Al Jazeera,18,ICE says its agents don’t carry guns in Canada as World Cup approaches,https://www.aljazeera.com/sports/2026/4/7/ice-says-its-agents-dont-carry-guns-in-canada-as-world-cup-approaches?traffic_source=rss
Al Jazeera,19,Australian and IPL cricket great David Warner charged with drink-driving,https://www.aljazeera.com/sports/2026/4/7/australian-and-ipl-cricket-great-david-warner-charged-with-drink-driving?traffic_source=rss
Al Jazeera,20,‘Iranians reject idea that US will bring stability’,https://www.aljazeera.com/video/quotable/2026/4/7/iranians-reject-idea-that-us-will-bring?traffic_source=rss
Associated Press,1,Trump warns a 'whole civilization will die tonight' if a deal with Iran isn't reached,https://apnews.com/article/iran-us-israel-trump-lebanon-april-7-2026-421ee64fdc9a5c26460df8119c7d1b3f
Associated Press,2,"Trump has delayed several deadlines for Iran, but Tuesday's nears with his most menacing threat",https://apnews.com/article/trump-iran-deadline-final-strait-hormuz-1c0894ef4a2c2feaabc326cc68571c33
Associated Press,3,West Virginia governor vetoes help for neglected and foster kids after approving tax cuts,https://apnews.com/article/west-virginia-morrisey-vetoes-foster-care-tax-cuts-53d7999ddf3a82d91776669678d6ecf9
Associated Press,4,US soldier trying to halt wife's deportation after she was detained on Louisiana military base,https://apnews.com/article/ice-immigration-military-spouse-deport-59ce5951fb284f95b836d0b07d6b0718
Associated Press,5,DeSantis signs Florida law to label groups as terrorists and expel student supporters,https://apnews.com/article/desantis-florida-terrorist-groups-free-speech-0b5dfb47052a17168919a3ce3c80dead
Associated Press,6,"Risky rescue of US crew downed in Iran relied on dozens of aircraft and subterfuge, Trump says",https://apnews.com/article/iran-war-fighter-jet-rescue-trump-7d8cfb6d0fd400abdc71f8c9d67408fe
Associated Press,7,"Trump's threatened destruction of Iran's power plants could be considered a war crime, experts say",https://apnews.com/article/trump-iran-power-plants-civilian-war-crimes-88b8ca1bc8e5cc8adabaf6c34e93e597
Associated Press,8,Tiger Woods is not at the Masters. Jason Day wonders why he was behind the wheel in DUI arrest,https://apnews.com/article/masters-tiger-woods-augusta-jason-day-9e0253dce1563cb2e0c8c2fd861aa3dd
Associated Press,9,"Michigan muscles its way to program's 2nd national title, beating stubborn UConn 69-63",https://apnews.com/article/michigan-uconn-ncaa-title-game-806339fe73ae4e8d62d69e24c85dcc79
Associated Press,10,Stars ban person who bought tickets for group of 4 seen celebrating a goal with Nazi salute,https://apnews.com/article/stars-fan-nazi-salute-bc7db25f69e170636280d1435aee043c
Associated Press,11,"Kate Jackson, Jaclyn Smith and Cheryl Ladd reunite for 'Charlie's Angels' 50th anniversary",https://apnews.com/article/charlies-angels-reunion-c1f7f77857f3cb94ebbbb971c67e9136
Associated Press,12,Wireless Festival canceled after UK bars rapper Ye over antisemitic remarks,https://apnews.com/article/ye-kanye-west-wireless-festival-london-64601c365e48f43802747ce3b024a5f6
Associated Press,13,Wireless Festival boss stands by Ye headlining concerts as sponsors pull out,https://apnews.com/article/kanye-west-ye-wireless-festival-458d0e3ea9b787f80ad503a269db7ed0
Associated Press,14,"Samsung is discontinuing its texting app, tells impacted users to switch to Google Messages",https://apnews.com/article/samsung-android-messages-google-gemini-823b3eb598611b127e66008ee4390da6
Associated Press,15,Oil prices rise as US stocks fall ahead of Trump's deadline for Iran,https://apnews.com/article/financial-markets-iran-oil-bcd3342cd0b4e60ebedc1e81db08f465
Associated Press,16,The South Pars natural gas complex is an energy lifeline for Iran,https://apnews.com/article/south-pars-natural-gas-field-iran-29e03d9dd5e31c5ea10d2bdc87d68257
Associated Press,17,Artemis II astronauts channel Apollo 8 with a striking Earthset photo,https://apnews.com/article/nasa-artemis-moon-astronauts-earthset-5ca505933a4c22e6859f15cc100858b6
Associated Press,18,"Auto shop owner who paid worker in 91,500 oily pennies ordered to pay nearly $40,000 more",https://apnews.com/article/pennies-paycheck-labor-auto-dce543f0d6fd3ed64fa1e689d2701f17
Associated Press,19,Chesney the kangaroo scales tall fence and flees petting zoo for three days on the lam,https://apnews.com/article/kangaroo-petting-zoo-wisconsin-escape-e5368b274706c2051fab54a73de8c777
Associated Press,20,Viral phenomenon in Argentina has young people identifying themselves as animals,https://apnews.com/article/argentina-teenagers-identifying-as-animals-therians-tiktok-54d158c4842f6515e31d83a260cdf31f
