site,rank,title,link
Al Jazeera,1,How commercial drones turn deadly in Gaza,https://www.aljazeera.com/video/birds-eye-view/2025/5/24/how-commercial-drones-turn-deadly-in-gaza?traffic_source=rss
Al Jazeera,2,"Australia begins cleanup after floods kill 5, strand thousands",https://www.aljazeera.com/news/2025/5/24/australia-begins-clean-up-after-floods-kill-5-strand-thousands?traffic_source=rss
Al Jazeera,3,Syria’s al-Sharaa meets Erdogan in Turkiye as sanctions lifted,https://www.aljazeera.com/news/2025/5/24/syrias-al-sharaa-meets-erdogan-in-turkiye-as-sanctions-lifted?traffic_source=rss
Al Jazeera,4,South Lebanon votes in municipal election seen as test of Hezbollah support,https://www.aljazeera.com/news/2025/5/24/south-lebanon-votes-in-municipal-election-seen-as-test-of-hezbollah-support?traffic_source=rss
Al Jazeera,5,Arson attack probed as Cannes and parts of southern France suffer power cut,https://www.aljazeera.com/news/2025/5/24/arson-attack-probed-as-cannes-and-parts-of-southern-france-suffer-power-cut?traffic_source=rss
Al Jazeera,6,Cristiano Ronaldo could play at FIFA Club World Cup: Infantino,https://www.aljazeera.com/sports/2025/5/24/ronaldo-and-messi-could-be-reunited-at-fifa-club-world-cup?traffic_source=rss
Al Jazeera,7,Cooking in Gaza is now a toxic affair,https://www.aljazeera.com/opinions/2025/5/24/cooking-in-gaza-is-now-a-toxic-affair?traffic_source=rss
Al Jazeera,8,Was ex-Cambodian MP Lim Kimya politically assassinated in Bangkok?,https://www.aljazeera.com/program/101-east/2025/5/24/was-ex-cambodian-mp-lim-kimya-politically-assassinated-in-bangkok?traffic_source=rss
Al Jazeera,9,Israel: ‘Gaza will be entirely destroyed’,https://www.aljazeera.com/program/the-listening-post/2025/5/24/israel-gaza-will-be-entirely-destroyed?traffic_source=rss
Al Jazeera,10,"Ukraine, Russia exchange more prisoners after ‘difficult night’ of attacks",https://www.aljazeera.com/news/2025/5/24/ukraine-calls-for-new-sanctions-as-russia-hits-kyiv-amid-prisoner-exchanges?traffic_source=rss
Al Jazeera,11,Why the future of Bangladesh’s Muhammad Yunus administration is uncertain,https://www.aljazeera.com/features/2025/5/24/why-is-bangladeshs-interim-leader-muhammad-yunus-considering-resigning?traffic_source=rss
Al Jazeera,12,"Pacers-Knicks: Siakam, Indiana win Game 2 in East final",https://www.aljazeera.com/sports/2025/5/24/pacers-knicks-siakam-led-indiana-go-two-from-two-nba-east-final?traffic_source=rss
Al Jazeera,13,Why did rumours of a coup sweep Ivory Coast this week?,https://www.aljazeera.com/news/2025/5/24/why-did-rumours-of-a-coup-sweep-ivory-coast-this-week?traffic_source=rss
Al Jazeera,14,UN chief says Gaza entering ‘cruellest phase’ of war as Palestinians starve,https://www.aljazeera.com/news/2025/5/24/un-chief-says-gaza-entering-cruellest-phase-of-war-as-palestinians-starve?traffic_source=rss
Al Jazeera,15,Palestinians see plan to push them from land as Israel builds national park,https://www.aljazeera.com/features/2025/5/24/palestinians-plan-push-land-israel-builds-national-park?traffic_source=rss
Al Jazeera,16,EU vows to defend interests after Trump threatens 50 percent tariffs,https://www.aljazeera.com/news/2025/5/24/eu-vows-to-defend-interests-after-trump-threatens-50-percent-tariffs?traffic_source=rss
Al Jazeera,17,Over 400 Rohingya feared drowned in two shipwrecks off Myanmar coast: UN,https://www.aljazeera.com/news/2025/5/24/over-400-rohingya-feared-drowned-in-two-shipwrecks-off-myanmar-coast-un?traffic_source=rss
Al Jazeera,18,Trump administration sees US universities as “a hotbed of liberals”,https://www.aljazeera.com/video/quotable/2025/5/24/trump-administration-sees-us-universities-as-a-hotbed-of-liberals?traffic_source=rss
Al Jazeera,19,‘Need answers’: Will Sri Lanka’s Tamils find war closure under Dissanayake?,https://www.aljazeera.com/features/2025/5/24/need-answers-will-sri-lankas-tamils-find-war-closure-under-dissanayake?traffic_source=rss
Al Jazeera,20,Vietnam orders ban on popular messaging app Telegram,https://www.aljazeera.com/news/2025/5/24/vietnam-orders-ban-on-popular-messaging-app?traffic_source=rss
