site,rank,title,link
Al Jazeera,1,"Thunder-Timberwolves: Edwards, Minnesota rout OKC in Game 3 West finals",https://www.aljazeera.com/sports/2025/5/25/thunder-timberwolves-edwards-minnesota-rout-okc-in-game-3-west-finals?traffic_source=rss
Al Jazeera,2,Trump’s treatment of Netanyahu vs other heads of state,https://www.aljazeera.com/program/compare-contrast/2025/5/25/trumps-treatment-of-netanyahu-vs-other-heads-of-state?traffic_source=rss
Al Jazeera,3,"Ukraine under Russian missile, drone attacks for second night, 12 killed",https://www.aljazeera.com/news/2025/5/25/russia-launches-deadly-strikes-on-ukraine-amid-prisoner-swap?traffic_source=rss
Al Jazeera,4,"Russia-Ukraine war: List of key events, day 1,186",https://www.aljazeera.com/news/2025/5/25/russia-ukraine-war-list-of-key-events-day-1186?traffic_source=rss
Al Jazeera,5,Video: Malaysia calls for expanded Myanmar ceasefire at ASEAN Summit,https://www.aljazeera.com/video/newsfeed/2025/5/25/video-malaysia-calls-for-expanded-myanmar-ceasefire-at-asean-summit?traffic_source=rss
Al Jazeera,6,"Ecuador’s Daniel Noboa sworn in for full term, promising a crackdown on gangs",https://www.aljazeera.com/news/2025/5/24/ecuadors-daniel-noboa-sworn-in-for-full-term-promising-a-crackdown-on-gangs?traffic_source=rss
Al Jazeera,7,"Iranian film, It was Just an Accident, wins Palme D’Or at Cannes festival",https://www.aljazeera.com/news/2025/5/24/iranian-film-it-was-just-an-accident-wins-palme-dor-at-cannes?traffic_source=rss
Al Jazeera,8,Arsenal stun Barcelona to win the Women’s Champions League,https://www.aljazeera.com/sports/2025/5/24/arsenal-stun-barcelona-to-win-the-womens-champions-league?traffic_source=rss
Al Jazeera,9,‘How do you go to sleep?’: Israeli captive families slam Netanyahu at rally,https://www.aljazeera.com/news/2025/5/24/families-of-israeli-captives-criticise-netanyahu-amid-large-protests?traffic_source=rss
Al Jazeera,10,Will Trump follow through on his new EU tariff threat?,https://www.aljazeera.com/video/inside-story/2025/5/24/will-trump-follow-through-on-his-new-eu-tariff?traffic_source=rss
Al Jazeera,11,"Outrage, horror after Israeli attack kills nine children of Gaza doctor",https://www.aljazeera.com/news/2025/5/24/outrage-horror-after-israeli-attack-kills-nine-children-of-gaza-doctor?traffic_source=rss
Al Jazeera,12,How commercial drones turn deadly in Gaza,https://www.aljazeera.com/video/birds-eye-view/2025/5/24/how-commercial-drones-turn-deadly-in-gaza?traffic_source=rss
Al Jazeera,13,"Australia begins cleanup after floods kill 5, strand thousands",https://www.aljazeera.com/news/2025/5/24/australia-begins-clean-up-after-floods-kill-5-strand-thousands?traffic_source=rss
Al Jazeera,14,Syria’s al-Sharaa meets Erdogan in Turkiye as sanctions lifted,https://www.aljazeera.com/news/2025/5/24/syrias-al-sharaa-meets-erdogan-in-turkiye-as-sanctions-lifted?traffic_source=rss
Al Jazeera,15,South Lebanon votes in municipal election seen as test of Hezbollah support,https://www.aljazeera.com/news/2025/5/24/south-lebanon-votes-in-municipal-election-seen-as-test-of-hezbollah-support?traffic_source=rss
Al Jazeera,16,Arson attack probed as Cannes and parts of southern France suffer power cut,https://www.aljazeera.com/news/2025/5/24/arson-attack-probed-as-cannes-and-parts-of-southern-france-suffer-power-cut?traffic_source=rss
Al Jazeera,17,Cristiano Ronaldo could play at FIFA Club World Cup: Infantino,https://www.aljazeera.com/sports/2025/5/24/ronaldo-and-messi-could-be-reunited-at-fifa-club-world-cup?traffic_source=rss
Al Jazeera,18,Cooking in Gaza is now a toxic affair,https://www.aljazeera.com/opinions/2025/5/24/cooking-in-gaza-is-now-a-toxic-affair?traffic_source=rss
Al Jazeera,19,Was ex-Cambodian MP Lim Kimya politically assassinated in Bangkok?,https://www.aljazeera.com/program/101-east/2025/5/24/was-ex-cambodian-mp-lim-kimya-politically-assassinated-in-bangkok?traffic_source=rss
Al Jazeera,20,Israel: ‘Gaza will be entirely destroyed’,https://www.aljazeera.com/program/the-listening-post/2025/5/24/israel-gaza-will-be-entirely-destroyed?traffic_source=rss
