site,rank,title,link
Al Jazeera,1,Morocco launches nationwide emergency relief after floods kill dozens,https://www.aljazeera.com/news/2025/12/17/morocco-launches-nationwide-emergency-relief-after-floods-kill-dozens?traffic_source=rss
Al Jazeera,2,Video: Mourners attend funeral of rabbi killed in Bondi shooting,https://www.aljazeera.com/video/newsfeed/2025/12/17/video-mourners-attend-funeral-of-rabbi-killed-in-bondi-shooting?traffic_source=rss
Al Jazeera,3,Rebels advance in eastern DR Congo despite recent peace deal,https://www.aljazeera.com/video/newsfeed/2025/12/17/rebels-advance-in-eastern-dr-congo-despite-recent-peace-deal?traffic_source=rss
Al Jazeera,4,Barcelona beat Guadalajara in Copa del Rey fourth round,https://www.aljazeera.com/sports/2025/12/17/barcelona-beat-guadalajara-in-copa-del-rey-fourth-round?traffic_source=rss
Al Jazeera,5,LIVE: Another Gaza home caves in as Israel keeps blocking shelter supplies,https://www.aljazeera.com/news/liveblog/2025/12/17/live-another-gaza-home-caves-in-as-israel-keeps-blocking-shelter-supplies?traffic_source=rss
Al Jazeera,6,Video: Jane Austen fans celebrate 250th anniversary of her birth,https://www.aljazeera.com/video/newsfeed/2025/12/17/video-jane-austen-fans-celebrate-250th-anniversary-of-her-birth?traffic_source=rss
Al Jazeera,7,Drone attacks kill over 100 civilians across war-torn Sudan’s Kordofan,https://www.aljazeera.com/news/2025/12/17/drone-attacks-kill-over-100-civilians-across-war-torn-sudans-kordofan?traffic_source=rss
Al Jazeera,8,"Knicks rally to beat Spurs, win first NBA Cup final",https://www.aljazeera.com/sports/2025/12/17/knicks-rally-to-beat-spurs-win-first-nba-cup-final?traffic_source=rss
Al Jazeera,9,Arctic sees hottest year since 1900 as climate crisis continues,https://www.aljazeera.com/news/2025/12/17/arctic-sees-hottest-year-since-1900-as-climate-crisis-continues?traffic_source=rss
Al Jazeera,10,Australia police charge surviving Bondi Beach attacker as first funerals held,https://www.aljazeera.com/news/2025/12/17/australian-police-charge-alleged-bondi-beach-gunman-as-first-funerals-held?traffic_source=rss
Al Jazeera,11,"Presidents the Arab Spring toppled, where are they now?",https://www.aljazeera.com/news/2025/12/17/presidents-the-arab-spring-toppled-where-are-they-now?traffic_source=rss
Al Jazeera,12,Myanmar regime claims Aung San Suu Kyi ‘in good health’ despite son’s fears,https://www.aljazeera.com/news/2025/12/17/myanmar-regime-claims-aung-san-suu-kyi-in-good-health-despite-sons-fears?traffic_source=rss
Al Jazeera,13,India’s new suicide crisis: Poll workers take lives amid voter recount rush,https://www.aljazeera.com/news/2025/12/17/indias-new-suicide-crisis-poll-workers-take-lives-amid-voter-recount-rush?traffic_source=rss
Al Jazeera,14,"Trump stands by chief of staff after shock remarks about Vance, Bondi, Musk",https://www.aljazeera.com/news/2025/12/17/trump-stands-by-chief-of-staff-after-shock-remarks-about-vance-bondi-musk?traffic_source=rss
Al Jazeera,15,Ex-Harvard morgue manager who sold body parts sentenced to 8 years in jail,https://www.aljazeera.com/news/2025/12/17/ex-harvard-morgue-manager-who-stole-body-parts-gets-8-years-in-prison?traffic_source=rss
Al Jazeera,16,"Russia-Ukraine war: List of key events, day 1,392",https://www.aljazeera.com/news/2025/12/17/russia-ukraine-war-list-of-key-events-day-1392?traffic_source=rss
Al Jazeera,17,Trump orders naval blockade of sanctioned Venezuelan oil tankers,https://www.aljazeera.com/news/2025/12/17/trump-orders-total-blockade-of-sanctioned-venezuelan-oil-tankers?traffic_source=rss
Al Jazeera,18,Canadian MP blocked from West Bank rejects Israel’s ‘safety concern’ claims,https://www.aljazeera.com/news/2025/12/16/canadian-mp-blocked-from-west-bank-rejects-israels-safety-concern-claims?traffic_source=rss
Al Jazeera,19,Thousands protest in Slovakia against Fico government’s judicial reforms,https://www.aljazeera.com/news/2025/12/16/thousands-protest-in-slovakia-against-fico-governments-judicial-reforms?traffic_source=rss
Al Jazeera,20,"Trump expands US travel ban to include Syria, Palestine",https://www.aljazeera.com/news/2025/12/16/trump-expands-us-travel-ban-to-include-syria-palestine?traffic_source=rss
Associated Press,1,"After a year of Trump, EU leaders begrudgingly learn to live with the reality of an unreliable ally",https://apnews.com/article/europe-trump-ukraine-russia-trade-far-right-74e68902613a7e1697f059521e51f186
Associated Press,2,Zelenskyy says proposals to end the war in Ukraine could be presented to Russia within days,https://apnews.com/article/russia-ukraine-war-peace-proposals-3533b250a9cf423576238a0a58725444
Associated Press,3,Ukraine and 34 other countries approve compensation body for damages from Russia's invasion,https://apnews.com/article/netherlands-zelenskyy-ukraine-claims-commission-russia-6a4c78360c51021bdb8c251bc230de38
Associated Press,4,An MIT professor was fatally shot at his home and police launched a homicide investigation,https://apnews.com/article/mit-professor-shooting-massachusetts-portugal-3ab1e3e7e369de5cef90c7c911995dbb
Associated Press,5,Hyundai and Kia will repair millions of vehicles under a deal to fix anti-theft technology,https://apnews.com/article/minnesota-kia-hyundai-theft-settlement-d2dc13dcee3fa65494d4df9f089dd386
Associated Press,6,"US Capitol unveils statue of teen civil rights icon Barbara Rose Johns, taking Robert E. Lee's spot",https://apnews.com/article/barbara-rose-johns-statue-capitol-7601aed0b9b6a6ab1f307b1ccccd289f
Associated Press,7,"Susie Wiles, White House chief of staff, criticizes Bondi and opines on Trump in Vanity Fair",https://apnews.com/article/trump-wiles-chief-staff-interview-cabinet-bondi-5c995a046318973b1a3dfe8ed89cf3cf
Associated Press,8,Trump expands travel ban and restrictions to include an additional 20 countries,https://apnews.com/article/trump-travel-ban-countries-immigration-visas-border-9dde0aecb3ffe418266700d9eefef937
Associated Press,9,FIFA slashes price of some World Cup tickets to $60 after global fan backlash,https://apnews.com/article/fifa-ticket-prices-slashed-73e7147a8843d07af08fcc88068dce80
Associated Press,10,"Sydney McLaughlin-Levrone, Gabby Thomas among those owed six figures by bankrupt Grand Slam Track",https://apnews.com/article/mclaughlin-levrone-thomas-grand-slam-bankruptcy-0814626a14b53df8fb29e6829de4b7af
Associated Press,11,Mikaela Shiffrin's slalom domination reaching new heights during the Olympic season,https://apnews.com/article/mikaela-shiffrin-skiing-olympics-courchevel-739c9a12be1d642999ae3e624c83b91f
Associated Press,12,Prosecutors charge Rob Reiner’s son Nick with 2 counts of murder in killing of his parents,https://apnews.com/article/rob-reiner-wife-killed-331fa106817847d4d6a1e5db2add056f
Associated Press,13,Movie Review: Paul Feig's 'The Housemaid' is a twisty horror-thriller with nudity and empowerment,https://apnews.com/article/housemaid-movie-review-sweeney-ece46a54d8c8f5d1e8867b25110a18fe
Associated Press,14,Inside Howard Stern's new SiriusXM deal: How he plans to 'have it all',https://apnews.com/article/howard-stern-siriusxm-4986b2affe157c47622c5cef6862ef20
Associated Press,15,"The US gained 64,000 jobs in November but lost 105,000 in October; unemployment rate at 4.6%",https://apnews.com/article/jobs-economy-trump-unemployment-federal-reserve-cf1280a8466d92fbbc1b5ace7b80bffc
Associated Press,16,China puts anti-dumping tariff of up to 19.8% on imports of pork from the EU,https://apnews.com/article/china-eu-pork-tariff-ev-dumping-bc3a5559afb9c2482692d0e78b7fe433
Associated Press,17,Wall Street slips as oil prices keep dropping,https://apnews.com/article/stocks-markets-jobs-trump-ai-3af016aee68a46f9131db0450ed33048
Associated Press,18,Baltimore cyclist finds joy in collecting lost hubcaps and stringing them into art,https://apnews.com/article/hubcap-artist-bicyclist-joy-wonder-4d1d40064d3853153d931f1a25526d84
Associated Press,19,Raccoon goes on drunken rampage in Virginia liquor store and passes out on bathroom floor,https://apnews.com/article/drunk-raccoon-liquor-store-bandit-virginia-5109feb2ea9ab9bf8954ec3798689fd0
Associated Press,20,Mysterious googly eyes go viral after appearing on public art in Oregon,https://apnews.com/article/googly-eyes-public-art-sculptures-bend-oregon-2f4fce84569e3b599106199f3b6d66e3
