site,rank,title,link
Al Jazeera,1,Thousands rally in Kenya to mark anniversary of antitax demonstrations,https://www.aljazeera.com/news/2025/6/25/thousands-rally-in-kenya-to-mark-anniversary-of-antitax-demonstrations?traffic_source=rss
Al Jazeera,2,12 posts from ‘12 day war’: How Trump live-posted Israel-Iran conflict,https://www.aljazeera.com/news/2025/6/25/12-posts-from-12-day-war-how-trump-live-posted-israel-iran-conflict?traffic_source=rss
Al Jazeera,3,UK to buy 12 F-35A fighter jets capable of carrying nuclear weapons,https://www.aljazeera.com/news/2025/6/25/uk-to-buy-12-f-35a-fighter-jets-capable-of-carrying-nuclear-weapons?traffic_source=rss
Al Jazeera,4,Trump insists Iran nuclear sites ‘completely destroyed’ in US strikes,https://www.aljazeera.com/news/2025/6/25/trump-insists-iran-nuclear-sites-destroyed-in-us-strikes-blasts-media?traffic_source=rss
Al Jazeera,5,Zohran Mamdani claims victory in NYC Democratic mayoral primary,https://www.aljazeera.com/video/newsfeed/2025/6/25/zohran-mamdani-claims-victory-in-nyc-democratic-mayoral-primary?traffic_source=rss
Al Jazeera,6,"Vietnam ends death penalty for crimes against the state, bribery, drugs",https://www.aljazeera.com/news/2025/6/25/vietnam-ends-death-penalty-for-crimes-against-the-state-bribery-drugs?traffic_source=rss
Al Jazeera,7,Zohran Mamdani set to become Democratic candidate in New York mayoral race,https://www.aljazeera.com/news/2025/6/25/zohran-mamdani-set-to-become-democratic-candidate-in-new-york-mayoral-race?traffic_source=rss
Al Jazeera,8,"Russia-Ukraine war: List of key events, day 1,217",https://www.aljazeera.com/news/2025/6/25/russia-ukraine-war-list-of-key-events-day-1217?traffic_source=rss
Al Jazeera,9,Gout Gout breaks own 200m record; beats Bolt’s Golden Spike debut time,https://www.aljazeera.com/sports/2025/6/25/gout-gout-breaks-own-200m-record-beats-bolts-golden-spike-debut-time?traffic_source=rss
Al Jazeera,10,"Chelsea beat ES Tunis, Benfica stun Bayern in FIFA Club World Cup",https://www.aljazeera.com/sports/2025/6/25/chelsea-beat-es-tunis-benfica-stun-bayern-in-fifa-club-world-cup?traffic_source=rss
Al Jazeera,11,"India forcibly sterilised 8m men: One village remembers, 50 years later",https://www.aljazeera.com/features/2025/6/25/india-forcibly-sterilised-eight-m-men-one-village-remembers-fifty-years-later?traffic_source=rss
Al Jazeera,12,US sanctions alleged leader of Venezuelan gang Tren de Aragua,https://www.aljazeera.com/news/2025/6/25/us-sanctions-alleged-leader-of-venezuelan-gang-tren-de-aragua?traffic_source=rss
Al Jazeera,13,Boeing failed to provide training to prevent MAX 9 midair emergency: NTSB,https://www.aljazeera.com/economy/2025/6/25/boeing-failed-to-provide-training-to-prevent-max-9-midair-emergency-ntsb?traffic_source=rss
Al Jazeera,14,Heatwave poses risks to US power grid,https://www.aljazeera.com/economy/2025/6/24/heatwave-poses-risks-to-us-power-grid?traffic_source=rss
Al Jazeera,15,Trump is seeking a quick US exit from Israel-Iran conflict. Will it work?,https://www.aljazeera.com/news/2025/6/24/trump-is-seeking-a-quick-us-exit-from-israel-iran-conflict-will-it-work?traffic_source=rss
Al Jazeera,16,US judge allows company to train AI using copyrighted literary materials,https://www.aljazeera.com/news/2025/6/24/us-judge-allows-company-to-train-ai-using-copyrighted-literary-materials?traffic_source=rss
Al Jazeera,17,Dnipro church hit by Russian missile mid-service,https://www.aljazeera.com/video/newsfeed/2025/6/24/dnipro-church-hit-by-russian-missile-mid-service?traffic_source=rss
Al Jazeera,18,"US-Israel-Iran conflict: List of key events, June 24, 2025",https://www.aljazeera.com/news/2025/6/24/us-israel-iran-conflict-list-of-key-events-june-24-2025?traffic_source=rss
Al Jazeera,19,Fragile Iran-Israel ceasefire calms oil markets,https://www.aljazeera.com/economy/2025/6/24/fragile-iran-israel-ceasefire-calms-oil-markets?traffic_source=rss
Al Jazeera,20,"Trump: no ‘regime change’ in Iran, urges calm after strikes",https://www.aljazeera.com/video/newsfeed/2025/6/24/trump-no-regime-change-in-iran-urges-calm-after-strikes?traffic_source=rss
