site,rank,title,link
Al Jazeera,1,Who are Iran’s new top military leaders after Israel’s assassinations?,https://www.aljazeera.com/news/2025/6/15/who-are-irans-new-top-military-leaders-after-israels-assassinations?traffic_source=rss
Al Jazeera,2,"At least one person killed, several injured, after earthquake hits Peru",https://www.aljazeera.com/news/2025/6/15/at-least-one-person-killed-several-injured-after-earthquake-hits-peru?traffic_source=rss
Al Jazeera,3,PSG dismantle Atletico Madrid 4-0 in impressive Club World Cup opener,https://www.aljazeera.com/sports/2025/6/15/psg-dismantle-atletico-madrid-4-0-in-impressive-club-world-cup-opener?traffic_source=rss
Al Jazeera,4,Russell wins F1 Canadian GP as McLaren’s Norris and Piastri collide late,https://www.aljazeera.com/sports/2025/6/15/russell-wins-f1-canadian-gp-as-mclarens-norris-and-piastri-collide-late?traffic_source=rss
Al Jazeera,5,"Israel-Iran conflict: List of key events, June 15, 2025",https://www.aljazeera.com/news/2025/6/15/israel-iran-conflict-list-of-key-events-june-15-2025?traffic_source=rss
Al Jazeera,6,Analysis: What options does Iran have in its conflict against Israel?,https://www.aljazeera.com/news/2025/6/15/analysis-what-options-does-iran-have-in-its-conflict-against-israel?traffic_source=rss
Al Jazeera,7,Thousands attend ‘red line’ protest in The Hague against Israel’s Gaza war,https://www.aljazeera.com/news/2025/6/15/thousands-attend-red-line-protest-in-the-hague-against-israels-gaza-war?traffic_source=rss
Al Jazeera,8,Trump’s changing opinion on military parades costs,https://www.aljazeera.com/program/compare-contrast/2025/6/15/trumps-changing-opinion-on-military-parades-costs?traffic_source=rss
Al Jazeera,9,"Bombardment, strikes, deaths in third day of fierce Israel-Iran conflict",https://www.aljazeera.com/news/2025/6/15/bombardment-strikes-deaths-in-third-day-of-fierce-israel-iran-conflict?traffic_source=rss
Al Jazeera,10,Israeli air attack on Mashhad airport in Iran,https://www.aljazeera.com/program/newsfeed/2025/6/15/israeli-air-attack-on-mashhad-airport-in-iran?traffic_source=rss
Al Jazeera,11,"Russia returns bodies of 1,200 more Ukrainians as part of POW swap",https://www.aljazeera.com/news/2025/6/15/russia-returns-bodies-of-1200-more-ukrainians-as-part-of-pow?traffic_source=rss
Al Jazeera,12,"Will Russia, Turkiye and China provide support to Iran in its conflict?",https://www.aljazeera.com/program/inside-story/2025/6/15/will-russia-turkiye-and-china-provide-support-to-iran-in-its-conflict?traffic_source=rss
Al Jazeera,13,Macron visits Greenland in solidarity amid Trump designs on Arctic island,https://www.aljazeera.com/news/2025/6/15/macron-visits-greenland-in-solidarity-amid-trump-designs-on-arctic-island?traffic_source=rss
Al Jazeera,14,Netanyahu visits site of Iranian missile strike in Israel,https://www.aljazeera.com/program/newsfeed/2025/6/15/netanyahu-visits-site-of-iranian-missile-strike-in-israel?traffic_source=rss
Al Jazeera,15,"US Democrats criticise Trump, but do they have an alternative?",https://www.aljazeera.com/program/the-bottom-line/2025/6/15/us-democrats-criticise-trump-but-do-they-have-an-alternative?traffic_source=rss
Al Jazeera,16,Israel has learned no lessons from Iraq,https://www.aljazeera.com/opinions/2025/6/15/israel-has-learned-no-lessons-from-iraq?traffic_source=rss
Al Jazeera,17,Trump hosts military parade as nationwide ‘No Kings’ protests denounce him,https://www.aljazeera.com/video/newsfeed/2025/6/15/trump-hosts-military-parade-as-nationwide-no-kings-protests-denounce-him?traffic_source=rss
Al Jazeera,18,What is Iran’s IRGC and who has Israel killed?,https://www.aljazeera.com/news/2025/6/15/what-is-irans-irgc-and-who-has-israel-killed?traffic_source=rss
Al Jazeera,19,Why has Israel put West Bank under lockdown as it bombs Iran?,https://www.aljazeera.com/features/2025/6/15/why-has-israel-put-west-bank-under-lockdown-as-it-bombs-iran?traffic_source=rss
Al Jazeera,20,Egypt stops pro-Palestine activists in their March to Gaza,https://www.aljazeera.com/video/newsfeed/2025/6/15/egypt-stops-pro-palestine-activists-in-their-march-to-gaza?traffic_source=rss
