site,rank,title,link
Al Jazeera,1,"Enlightened Americans should stay and fight, not leave",https://www.aljazeera.com/opinions/2025/5/31/enlightened-americans-should-stay-and-fight-not-leave?traffic_source=rss
Al Jazeera,2,"Iran increases stockpile of enriched Uranium by 50 percent, IAEA says",https://www.aljazeera.com/news/2025/5/31/iran-increases-stockpile-of-enriched-uranium-by-50-percent-iaea-says?traffic_source=rss
Al Jazeera,3,Nigeria floods death toll crosses 150 as thousands displaced,https://www.aljazeera.com/news/2025/5/31/nigeria-floods-death-toll-crosses-150-as-thousands-displaced?traffic_source=rss
Al Jazeera,4,The sudden surge of genocide critique in the West,https://www.aljazeera.com/program/the-listening-post/2025/5/31/the-sudden-surge-of-genocide-critique-in-the-west?traffic_source=rss
Al Jazeera,5,Afghanistan welcomes upgraded diplomatic ties with neighbouring Pakistan,https://www.aljazeera.com/news/2025/5/31/afghanistan-welcomes-upgraded-diplomatic-ties-with-neighbouring-pakistan?traffic_source=rss
Al Jazeera,6,Arab ministers condemn Israel’s ‘ban’ on planned West Bank visit,https://www.aljazeera.com/news/2025/5/31/israel-blocks-planned-occupied-west-bank-visit-by-arab-foreign-ministers?traffic_source=rss
Al Jazeera,7,"Gaza ‘hungriest place on Earth’, all its people at risk of famine, UN warns",https://www.aljazeera.com/news/2025/5/31/gaza-hungriest-place-on-earth-all-its-people-at-risk-of-famine-un-warns?traffic_source=rss
Al Jazeera,8,Hegseth warns of China threat as Beijing’s top brass skip Singapore summit,https://www.aljazeera.com/news/2025/5/31/us-defence-chief-warns-of-china-threat-as-beijings-top-brass-skip-summit?traffic_source=rss
Al Jazeera,9,Truck accident unleashes 250 million honeybees in northwestern US,https://www.aljazeera.com/news/2025/5/31/truck-accident-unleashes-250-million-honeybees-in-northwestern-us?traffic_source=rss
Al Jazeera,10,Divided Israel faces internal unrest amid escalating Gaza conflict,https://www.aljazeera.com/news/2025/5/31/divided-israel-faces-internal-unrest-escalating-gaza-conflict?traffic_source=rss
Al Jazeera,11,China’s navy conducts combat patrols near disputed South China Sea shoal,https://www.aljazeera.com/news/2025/5/31/chinas-navy-conducts-combat-patrols-near-disputed-south-china-sea-shoal?traffic_source=rss
Al Jazeera,12,Guatemala jails ex-paramilitaries for 40 years over rapes during civil war,https://www.aljazeera.com/news/2025/5/31/guatemala-jails-ex-paramilitaries-for-40-years-over-rapes-during-civil-war?traffic_source=rss
Al Jazeera,13,India’s latest coffee hub? Beans and brews offer new hope to Nagaland,https://www.aljazeera.com/features/2025/5/31/indias-latest-coffee-hub-beans-and-brews-offer-new-hope-to-nagaland?traffic_source=rss
Al Jazeera,14,Olympic boxing champ Imane Khelif requires gender test to continue fighting,https://www.aljazeera.com/news/2025/5/31/olympic-boxing-champ-imane-khelif-requires-gender-test-to-continue-fighting?traffic_source=rss
Al Jazeera,15,"A least 10 dead, several missing after stone quarry collapses in Indonesia",https://www.aljazeera.com/news/2025/5/31/a-least-10-dead-several-missing-after-stone-quarry-collapses-in-indonesia?traffic_source=rss
Al Jazeera,16,"Trump says China ‘violated’ Geneva deal with US on tariffs, minerals",https://www.aljazeera.com/news/2025/5/31/trump-says-china-violated-geneva-deal-with-us-on-tariffs-minerals?traffic_source=rss
Al Jazeera,17,‘Unfriendly and meddling’: Cuba reprimands US diplomat amid rising tensions,https://www.aljazeera.com/news/2025/5/31/unfriendly-and-meddling-cuba-reprimands-us-diplomat-amid-rising-tensions?traffic_source=rss
Al Jazeera,18,"Russia-Ukraine war: List of key events, day 1,192",https://www.aljazeera.com/news/2025/5/31/russia-ukraine-war-list-of-key-events-day-1192?traffic_source=rss
Al Jazeera,19,Trump says US will raise steel tariffs to 50 percent at Pennsylvania rally,https://www.aljazeera.com/news/2025/5/31/trump-says-us-will-lift-steel-tariffs-to-50-percent-at-pennsylvania-rally?traffic_source=rss
Al Jazeera,20,South Korea’s presidential favourite has plans for new ‘de facto’ capital,https://www.aljazeera.com/news/2025/5/31/south-koreas-presidential-favourite-has-plans-for-new-de-facto-capital?traffic_source=rss
