site,rank,title,link
Al Jazeera,1,What is the Casey report on UK grooming gangs – and why did Labour U-turn?,https://www.aljazeera.com/news/2025/6/17/what-is-the-casey-report-on-uk-grooming-gangs-and-why-did-labour-u-turn?traffic_source=rss
Al Jazeera,2,"Hezbollah watches on as Iran and Israel battle, for now",https://www.aljazeera.com/news/2025/6/17/hezbollah-watches-on-as-iran-and-israel-battle-for-now?traffic_source=rss
Al Jazeera,3,Trump says he won’t ‘waste time’ calling Minnesota governor after slayings,https://www.aljazeera.com/news/2025/6/17/trump-says-he-wont-waste-time-calling-minnesota-governor-after-slayings?traffic_source=rss
Al Jazeera,4,What US interests are at stake in the Israel-Iran conflict?,https://www.aljazeera.com/video/inside-story/2025/6/17/what-us-interests-are-at-stake-in-the-israel-iran?traffic_source=rss
Al Jazeera,5,Brazil’s Bolsonaro accused in spy agency case as coup trial is ongoing,https://www.aljazeera.com/news/2025/6/17/brazils-bolsonaro-accused-in-spy-agency-case-as-coup-trial-is-ongoing?traffic_source=rss
Al Jazeera,6,"Real Madrid vs Al Hilal: FIFA Club World Cup – team news, start, lineups",https://www.aljazeera.com/sports/2025/6/17/real-madrid-vs-al-hilal-fifa-club-world-cup-team-news-start-lineups?traffic_source=rss
Al Jazeera,7,Kyiv hit by deadly wave of Russian drones and missiles,https://www.aljazeera.com/video/newsfeed/2025/6/17/kyiv-hit-by-deadly-wave-of-russian-drones-and-missiles?traffic_source=rss
Al Jazeera,8,Israeli intelligence buildings targeted as Iran claims direct hit,https://www.aljazeera.com/video/newsfeed/2025/6/17/israeli-intelligence-buildings-targeted-as-iran-claims-direct-hit?traffic_source=rss
Al Jazeera,9,Clashes injure 11 as Kenyans protest death of blogger in police custody,https://www.aljazeera.com/news/2025/6/17/one-killed-in-clashes-as-kenyans-protest-death-of-blogger-in-police-custody?traffic_source=rss
Al Jazeera,10,"Indonesia’s Mount Lewotobi Laki-laki volcano erupts, alert at highest level",https://www.aljazeera.com/news/2025/6/17/indonesias-mount-lewotobi-laki-laki-volcano-erupts-alert-at-highest-level?traffic_source=rss
Al Jazeera,11,Does California have lower homicide rates than some southern US states?,https://www.aljazeera.com/news/2025/6/17/does-california-have-lower-homicide-rates-than-some-southern-us-states?traffic_source=rss
Al Jazeera,12,Can Israel really destroy Iran’s nuclear facilities?,https://www.aljazeera.com/video/newsfeed/2025/6/17/can-israel-really-destroy-irans-nuclear-facilities?traffic_source=rss
Al Jazeera,13,Mapping Iran’s oil and gas sites and those attacked by Israel,https://www.aljazeera.com/news/2025/6/17/mapping-irans-oil-and-gas-sites-and-those-attacked-by-israel?traffic_source=rss
Al Jazeera,14,North Korea sending teams to Russia’s Kursk to aid war-hit area’s recovery,https://www.aljazeera.com/news/2025/6/17/north-korea-sending-teams-to-russias-kursk-to-aid-war-hit-areas-recovery?traffic_source=rss
Al Jazeera,15,"In Brazil, a fight over offshore drilling tests Lula’s climate ambitions",https://www.aljazeera.com/news/2025/6/17/in-brazil-a-fight-over-offshore-drilling-tests-lulas-climate-ambitions?traffic_source=rss
Al Jazeera,16,Iranians ‘told to evacuate’ as Israel steps up attacks on Tehran,https://www.aljazeera.com/gallery/2025/6/17/iranians-told-to-evacuate-as-israel-steps-up-attacks-on-tehran?traffic_source=rss
Al Jazeera,17,Israel’s strike on Iran state media part of wider strategy,https://www.aljazeera.com/video/newsfeed/2025/6/17/israels-strike-on-iran-state-media-part-of-wider-strategy?traffic_source=rss
Al Jazeera,18,Trump warns Tehran residents to ‘evacuate immediately’. But can they?,https://www.aljazeera.com/news/2025/6/17/trump-asks-tehran-residents-to-evacuate-immediately-but-can-they?traffic_source=rss
Al Jazeera,19,"Trump seeks ‘real end, not ceasefire’ as Israel-Iran conflict heats up",https://www.aljazeera.com/news/2025/6/17/trump-seeking-real-end-not-ceasefire-as-israel-iran-conflict-heats-up?traffic_source=rss
Al Jazeera,20,Are Gen Z lazy or just unlucky when it comes to money?,https://www.aljazeera.com/video/the-stream/2025/6/17/are-gen-z-lazy-or-just-unlucky-when-it-comes-to?traffic_source=rss
