site,rank,title,link
Al Jazeera,1,Marco Rubio wants to build a ‘new Western century’. Will Europe join?,https://www.aljazeera.com/news/2026/2/16/marco-rubio-wants-to-build-a-new-western-century-will-europe-join?traffic_source=rss
Al Jazeera,2,Tyler Reddick wins NASCAR Daytona 500 in Michael Jordan-owned car,https://www.aljazeera.com/sports/2026/2/16/tyler-reddick-wins-nascar-daytona-500-in-michael-jordan-owned-car?traffic_source=rss
Al Jazeera,3,"India hosts AI Impact Summit, drawing world leaders, tech giants",https://www.aljazeera.com/news/2026/2/16/india-hosts-ai-impact-summit-drawing-world-leaders-tech-giants?traffic_source=rss
Al Jazeera,4,ByteDance pledges fixes to Seedance 2.0 after Hollywood copyright claims,https://www.aljazeera.com/news/2026/2/16/bytedance-pledges-fixes-to-seedance-2-0-after-hollywood-copyright-claims?traffic_source=rss
Al Jazeera,5,Iran’s Araghchi arrives in Geneva for second round of nuclear talks with US,https://www.aljazeera.com/news/2026/2/16/irans-araghchi-arrives-in-geneva-for-second-round-of-nuclear-talks-with-us?traffic_source=rss
Al Jazeera,6,"When is Ramadan 2026, and how is the moon sighted?",https://www.aljazeera.com/news/2026/2/16/when-is-ramadan-2026-and-how-is-the-moon-sighted?traffic_source=rss
Al Jazeera,7,UK’s Starmer announces crackdown on AI chatbots in child safety push,https://www.aljazeera.com/news/2026/2/16/uks-starmer-announces-crackdown-on-ai-chatbots-in-child-safety-push?traffic_source=rss
Al Jazeera,8,Indonesia’s Gaza gamble,https://www.aljazeera.com/opinions/2026/2/16/indonesias-gaza-gamble?traffic_source=rss
Al Jazeera,9,Europe’s growing fight over Israeli goods: Boycott movements mushroom,https://www.aljazeera.com/news/2026/2/16/europes-growing-fight-over-israeli-goods-boycott-movements-mushroom?traffic_source=rss
Al Jazeera,10,US forces board tanker in Indian Ocean that fled Trump’s Venezuela blockade,https://www.aljazeera.com/news/2026/2/16/us-forces-board-tanker-in-indian-ocean-that-fled-blockade-on-venezuela?traffic_source=rss
Al Jazeera,11,Netanyahu calls for dismantling Iran’s nuclear programme in any US deal,https://www.aljazeera.com/news/2026/2/16/netanyahu-calls-for-dismantling-irans-nuclear-programme-in-any-us-deal?traffic_source=rss
Al Jazeera,12,Israel’s move to register land ‘systematises dispossession’ of Palestinians,https://www.aljazeera.com/news/2026/2/16/israels-move-to-register-land-systematises-dispossession-of-palestinians?traffic_source=rss
Al Jazeera,13,"Russia-Ukraine war: List of key events, day 1,453",https://www.aljazeera.com/news/2026/2/16/russia-ukraine-war-list-of-key-events-day-1453?traffic_source=rss
Al Jazeera,14,"Israel bombs Lebanon-Syria border, kills four people",https://www.aljazeera.com/news/2026/2/15/israel-bombs-lebanon-syria-border-kills-four-people?traffic_source=rss
Al Jazeera,15,Can the UN Security Council be reformed?,https://www.aljazeera.com/video/inside-story/2026/2/15/can-the-un-security-council-be-reformed?traffic_source=rss
Al Jazeera,16,Israel kills 11 in Gaza as Trump announces $5bn pledge from Board of Peace,https://www.aljazeera.com/news/2026/2/15/at-least-11-palestinians-killed-in-israeli-attacks-across-gaza?traffic_source=rss
Al Jazeera,17,Gaza mother’s grim ordeal: A search for missing son among mutilated bodies,https://www.aljazeera.com/features/2026/2/15/gaza-mothers-grim-ordeal-a-search-for-missing-son-among-mutilated-bodies?traffic_source=rss
Al Jazeera,18,Is Trumpism losing steam?,https://www.aljazeera.com/video/the-bottom-line/2026/2/15/is-trumpism-losing-steam?traffic_source=rss
Al Jazeera,19,Ukraine’s ex-energy minister arrested while trying to cross border,https://www.aljazeera.com/news/2026/2/15/ukraines-ex-energy-minister-arrested-while-trying-to-cross-border?traffic_source=rss
Al Jazeera,20,India rout bitter rivals Pakistan at T20 World Cup,https://www.aljazeera.com/gallery/2026/2/15/india-rout-bitter-rivals-pakistan-at-t20-world-cup?traffic_source=rss
Associated Press,1,Europeans push back at US over claim they face 'civilizational erasure',https://apnews.com/article/munich-conference-europe-trump-rubio-kallas-0efc0b3d464f118e3e5d6748113c9271
Associated Press,2,North Korea opens a housing district for families of its soldiers killed in Russia-Ukraine war,https://apnews.com/article/north-korea-ukraine-war-dead-kim-jong-un-b589285d79f66900fbc30f9243383cfe
Associated Press,3,‘First feline’ Larry marks 15 years as Britain’s political top cat,https://apnews.com/article/larry-cat-downing-street-anniversary-c5dd5cecf43867c2f53c307031d6717a
Associated Press,4,"DNA recovered from glove found near Guthrie home that appears to match glove worn by suspect, FBI says",https://apnews.com/article/savannah-guthrie-mom-missing-710d3acdef86d1c3935b94f58f763d72
Associated Press,5,What to know about the investigation into Nancy Guthrie's disappearance and the search for clues,https://apnews.com/article/savannah-guthrie-mother-nancy-04be2a6d555109113f525aab0321dfc8
Associated Press,6,Searchers find wreck of luxury steamer lost in Lake Michigan more than 150 years ago,https://apnews.com/article/shipwreck-lake-michigan-c9736b35a5671979b6a0603c46be9020
Associated Press,7,Derek Dooley didn't vote for years. Now he wants Georgia voters to send him to Washington,https://apnews.com/article/derek-dooley-georgia-football-republican-senate-trump-79206ea3f3150a1441c940c4b390b1a4
Associated Press,8,Trump's border czar says 'small' security force will remain in Minnesota after enforcement drawdown,https://apnews.com/article/homan-immigration-agents-minnesota-enforcement-operation-drawdown-5a7940eb9b5100d46efc33a97f524da0
Associated Press,9,US military boards another oil tanker in Indian Ocean after tracking it from the Caribbean,https://apnews.com/article/venezuela-oil-tanker-boarded-sanctions-pentagon-quarantine-682ddfc053bbd54ba3c477929c5b13f2
Associated Press,10,Inside the widening Olympic curling controversy and allegations of cheating,https://apnews.com/article/winter-olympics-curling-controversy-8b7acc54e259344fb3fcfa68343af5ec
Associated Press,11,Jutta Leerdam and Jordan Stolz turn an Olympic rumor into reality by skating together,https://apnews.com/article/leerdam-stolz-olympics-speedskating-247c287585a24e4977f34c5a0f3ce3f8
Associated Press,12,Curling controversy widens as Britain is accused of the same infraction as Canada,https://apnews.com/article/curling-controversy-winter-games-4ceb52bf313a0ce7c2d6ca34e542542e
Associated Press,13,"Powered by women, ‘Wuthering Heights’ digs up $34.8 million at the box office for a No. 1 debut",https://apnews.com/article/wuthering-heights-box-office-d10e1c446826f2ef7b7029953d468875
Associated Press,14,'Adolescence' and 'Train Dreams' win top prizes at Film Independent Spirit Awards,https://apnews.com/article/independent-spirit-awards-2026-c7bbc4945ffa0f84d006fdf57c0fb97a
Associated Press,15,"What to Stream: Emma Thompson, Jennifer Garner, 'The Night Agent,' Dove Cameron and Hilary Duff",https://apnews.com/article/stream-tv-movies-music-feb-2026-agent-594847af5a5d8122f262fd53c204f9fd
Associated Press,16,Tax season is underway. Here's what to know for stress-free filing with the IRS,https://apnews.com/article/tax-season-returns-irs-3392b432dafba153142f6dc3b5b9eab9
Associated Press,17,"Hollywood groups condemn ByteDance's AI video generator, claiming copyright infringement",https://apnews.com/article/ai-seedance-bytedance-hollywood-copyright-7e445388401d172c6bf51d0d42aa4f24
Associated Press,18,Raccoon goes on drunken rampage in Virginia liquor store and passes out on bathroom floor,https://apnews.com/article/drunk-raccoon-liquor-store-bandit-virginia-5109feb2ea9ab9bf8954ec3798689fd0
Associated Press,19,Freezing reptile dubbed 'Lizard in a blizzard' is rescued after being buried in Rhode Island snow,https://apnews.com/article/lizard-rhode-island-weather-snowstorm-df6f03781484eab4797e1b8a4fdf44a7
Associated Press,20,"Chicken wings advertised as 'boneless' can have bones, Ohio Supreme Court decides",https://apnews.com/article/boneless-chicken-wings-lawsuit-ohio-supreme-court-231002ea50d8157aeadf093223d539f8
