site,rank,title,link
Al Jazeera,1,"Israel carries out attacks on Iran’s capital, Tehran: Reports",https://www.aljazeera.com/news/2025/6/13/sounds-of-explosions-heard-in-irans-capital-tehran?traffic_source=rss
Al Jazeera,2,Air India crash refuels Boeing and airline’s problems,https://www.aljazeera.com/economy/2025/6/12/air-india-crash-refuels-boeing-and-airlines-problems?traffic_source=rss
Al Jazeera,3,What happened to the Madleen Gaza boat activists detained by Israel?,https://www.aljazeera.com/news/2025/6/12/explainer-how-is-israel-treating-the-eight-flotilla-activists?traffic_source=rss
Al Jazeera,4,Trump warns of ‘chance of massive conflict’ amid Israel-Iran tensions,https://www.aljazeera.com/news/2025/6/12/trump-warns-of-chance-of-massive-conflict-amid-israel-iran-tensions?traffic_source=rss
Al Jazeera,5,California senator handcuffed during Trump administration news conference,https://www.aljazeera.com/news/2025/6/12/california-senator-handcuffed-during-trump-administration-news-conference?traffic_source=rss
Al Jazeera,6,Marines prepare for deployment in Los Angeles as protests spread across US,https://www.aljazeera.com/news/2025/6/12/marines-prepare-for-deployment-in-los-angeles-as-protests-spread-across-us?traffic_source=rss
Al Jazeera,7,"Analysis: Is Israel planning to strike Iran, or is it bluffing?",https://www.aljazeera.com/news/2025/6/12/analysis-is-israel-planning-to-strike-iran-or-is-it-bluffing?traffic_source=rss
Al Jazeera,8,"In nixing EV standards, Trump strikes at two foes: California and Elon Musk",https://www.aljazeera.com/news/2025/6/12/in-nixing-ev-standards-trump-strikes-at-two-foes-california-and-elon-musk?traffic_source=rss
Al Jazeera,9,A new Iran nuclear crisis looms after IAEA finds rule breaches,https://www.aljazeera.com/program/newsfeed/2025/6/12/a-new-iran-nuclear-crisis-looms-after-iaea-finds-rule-breaches?traffic_source=rss
Al Jazeera,10,"FIFA Club World Cup 2025: Teams, full schedule, prize money, how to stream",https://www.aljazeera.com/sports/2025/6/12/fifa-club-world-cup-2025-teams-format-explainer-venue-final-messi-ronaldo?traffic_source=rss
Al Jazeera,11,"Israel deports six from Gaza aid boat Madleen, two more still in custody",https://www.aljazeera.com/news/2025/6/12/israel-deports-six-from-gaza-bound-aid-boat-madleen-two-more-in-custody?traffic_source=rss
Al Jazeera,12,Police: Air India survivor leapt from crashing plane,https://www.aljazeera.com/program/newsfeed/2025/6/12/police-air-india-survivor-leapt-from-crashing-plane?traffic_source=rss
Al Jazeera,13,Can Israel’s finance minister shut down the Palestinian banking system?,https://www.aljazeera.com/program/inside-story/2025/6/12/can-israels-finance-minister-shut-down-the-palestinian-banking-system?traffic_source=rss
Al Jazeera,14,Judge declares mistrial on Harvey Weinstein rape charge,https://www.aljazeera.com/news/2025/6/12/judge-declares-mistrial-in-harvey-weinstein-rape-charge?traffic_source=rss
Al Jazeera,15,Australia edge South Africa as bowlers dominate at WTC final,https://www.aljazeera.com/sports/2025/6/12/australia-edging-south-africa-as-bowlers-dominate-at-wtc-final?traffic_source=rss
Al Jazeera,16,Israel deports Gaza Freedom Flotilla activist to Germany,https://www.aljazeera.com/video/newsfeed/2025/6/12/israel-deports-gaza-freedom-flotilla-activist-to-germany?traffic_source=rss
Al Jazeera,17,Police fire tear gas on crowds protesting Kenya blogger’s death in custody,https://www.aljazeera.com/news/2025/6/12/police-fire-tear-gas-on-crowds-protesting-kenya-bloggers-death-in-police-custody?traffic_source=rss
Al Jazeera,18,Overnight Israeli raid in southern Syria village kills one person,https://www.aljazeera.com/news/2025/6/12/overnight-israeli-raid-in-southern-syria-village-kills-one-person?traffic_source=rss
Al Jazeera,19,Antigovernment protests in Bolivia leave multiple people dead,https://www.aljazeera.com/news/2025/6/12/antigovernment-protests-in-bolivia-leave-multiple-people-dead?traffic_source=rss
Al Jazeera,20,Iran doubles down as US signals Israel could strike despite nuclear talks,https://www.aljazeera.com/news/2025/6/12/iran-doubles-down-as-us-signals-israel-could-strike-during-nuclear-talks?traffic_source=rss
