site,rank,title,link
Al Jazeera,1,Epstein emails with author Wolff raise journalism ethics questions: Experts,https://www.aljazeera.com/news/2025/11/14/epstein-emails-with-author-wolff-raise-journalism-ethics-questions-experts?traffic_source=rss
Al Jazeera,2,"At least 2 dead, 21 missing in landslides in Indonesia’s Java island",https://www.aljazeera.com/news/2025/11/14/at-least-2-dead-21-missing-in-landslides-in-indonesias-java-island?traffic_source=rss
Al Jazeera,3,"‘Massive enemy attack’: Russia pounds Ukraine’s Kyiv, killing one",https://www.aljazeera.com/news/2025/11/14/massive-enemy-attack-russia-pounds-ukraines-kyiv-killing-one?traffic_source=rss
Al Jazeera,4,South Africa lets 153 Palestinians disembark following 12-hour plane ordeal,https://www.aljazeera.com/news/2025/11/14/south-africa-lets-153-palestinians-disembark-following-12-hour-plane-ordeal?traffic_source=rss
Al Jazeera,5,Ivory Coast boosts border defence due to ‘unusual flow’ of Malian refugees,https://www.aljazeera.com/news/2025/11/14/ivory-coast-boosts-border-defence-due-to-unusual-flow-of-malian-refugees?traffic_source=rss
Al Jazeera,6,"Shohei Ohtani, Aaron Judge make history with back-to-back MVPs",https://www.aljazeera.com/sports/2025/11/14/shohei-ohtani-aaron-judge-make-history-with-back-to-back-mvps?traffic_source=rss
Al Jazeera,7,Will Pakistan’s defence overhaul strengthen or upset its military balance?,https://www.aljazeera.com/news/2025/11/14/will-pakistans-defence-overhaul-strengthen-or-upset-its-military-balance?traffic_source=rss
Al Jazeera,8,Alcaraz secures year-end world number one ranking at ATP Finals,https://www.aljazeera.com/sports/2025/11/14/alcaraz-secures-year-end-world-number-one-ranking-at-atp-finals?traffic_source=rss
Al Jazeera,9,US announces ‘Southern Spear’ mission as forces deploy to South America,https://www.aljazeera.com/news/2025/11/14/us-announces-southern-spear-mission-as-forces-deploy-to-south-america?traffic_source=rss
Al Jazeera,10,Osimhen scores two goals as Nigeria set up World Cup clash with DR Congo,https://www.aljazeera.com/sports/2025/11/14/osimhen-scores-two-goals-as-nigeria-set-up-world-cup-clash-with-dr-congo?traffic_source=rss
Al Jazeera,11,Cuban authorities battle wave of mosquito-borne illnesses,https://www.aljazeera.com/news/2025/11/14/cuban-authorities-battle-wave-of-mosquito-borne-illnesses?traffic_source=rss
Al Jazeera,12,"Russia-Ukraine war: List of key events, day 1,359",https://www.aljazeera.com/news/2025/11/14/russia-ukraine-war-list-of-key-events-day-1359?traffic_source=rss
Al Jazeera,13,Trump administration joins lawsuit against California’s redistricting maps,https://www.aljazeera.com/news/2025/11/13/trump-administration-joins-lawsuit-against-californias-redistricting-maps?traffic_source=rss
Al Jazeera,14,"BBC apologises to Trump over documentary, rejects defamation claim",https://www.aljazeera.com/economy/2025/11/13/bbc-apologises-to-trump-over-documentary-rejects-defamation-claim?traffic_source=rss
Al Jazeera,15,Ronaldo sent off as Ireland stun Portugal to keep World Cup hopes alive,https://www.aljazeera.com/sports/2025/11/13/ronaldo-sent-off-as-ireland-stun-portugal-to-keep-world-cup-hopes-alive?traffic_source=rss
Al Jazeera,16,Israeli settler attack on West Bank mosque draws international condemnation,https://www.aljazeera.com/news/2025/11/13/israeli-settler-attack-on-west-bank-mosque-draws-international-condemnation?traffic_source=rss
Al Jazeera,17,Trump administration targets European antifa groups as ‘global terrorists’,https://www.aljazeera.com/news/2025/11/13/trump-administration-targets-european-antifa-groups-as-global-terrorists?traffic_source=rss
Al Jazeera,18,West Bank mosque torched amid surge in Israeli settler violence,https://www.aljazeera.com/video/newsfeed/2025/11/13/west-bank-mosque-torched-amid-surge-in-israeli-settler-violence?traffic_source=rss
Al Jazeera,19,Authorities recover remains of all killed in Turkish military plane crash,https://www.aljazeera.com/video/newsfeed/2025/11/13/authorities-recover-remains-of-all-killed-in-turkish-military-plane-crash?traffic_source=rss
Al Jazeera,20,Verizon planning its largest layoffs ever: Report,https://www.aljazeera.com/economy/2025/11/13/verizon-planning-its-largest-layoffs-ever-report?traffic_source=rss
Associated Press,1,Trump administration designates 4 left-wing European networks as terrorist organizations,https://apnews.com/article/trump-terror-designations-europe-antifa-a4f0b5f733e9a105101107b0c80d482e
Associated Press,2,"‘I can’t take any more of this,’ then-Prince Andrew wrote during Epstein scandal, emails reveal",https://apnews.com/article/prince-andrew-epstein-emails-mountbatten-08e9298ca7a8ad9c51459c520fc3a405
Associated Press,3,EU renews demand that Ukraine crack down on corruption in wake of major energy scandal,https://apnews.com/article/russia-ukraine-war-corruption-scandal-pokrovsk-a25b76c6c9830baafcf16ac5648bdd4c
Associated Press,4,50-year mortgages? NFL kickoff rules? Here's where some of Trump's latest jaw-dropping musings stand,https://apnews.com/article/trump-outlandish-mortgages-bagram-un-nfl-kickoff-a25df24bf4d4c493bdfac68e31b037f6
Associated Press,5,Oklahoma inmate whose life was spared by governor later found unresponsive in cell,https://apnews.com/article/oklahoma-execution-tremane-wood-96eea36ff43eb7e28f3e69bec3579a63
Associated Press,6,Chicago civil rights leader Jesse Jackson hospitalized for rare neurological disorder,https://apnews.com/article/chicago-jesse-jackson-hospital-c3a34dc716b6d90c61459f226f266f48
Associated Press,7,Top Fannie Mae officials ousted after sounding alarm on sharing confidential housing data,https://apnews.com/article/fannie-mae-freddie-mac-firing-pulte-data-a4f8c53df74fef83ec7fd07e3d524746
Associated Press,8,Takeaways from the newly released Epstein documents,https://apnews.com/article/jefferey-epstein-donald-trump-documents-493aa8b123bbf52970586cf9ce19f498
Associated Press,9,"James Comey and Letitia James press for dismissal of their cases, challenge prosecutor's appointment",https://apnews.com/article/comey-letitia-james-justice-department-ff6435d7bdbcc9e9495844899c7e2c4e
Associated Press,10,Surveillance video shows Titans cornerback driving car minutes before alleged shooting,https://apnews.com/article/titans-ljarius-sneed-indicted-texas-shooting-22a89ad57e28b5e2e25b446a03efc7e1
Associated Press,11,Ohtani is unanimous MVP for 4th time in winning NL honor as Judge edges Raleigh for 3rd AL accolade,https://apnews.com/article/mvp-ohtani-raleigh-judge-b3075edd1277418edc5f695e0e8b23ea
Associated Press,12,HBCUs and female athletes fear being left behind in the new era of college sports,https://apnews.com/article/ncaa-house-settlement-hbcus-50ce432e8a7252de3e71e32cb6e0c6b5
Associated Press,13,"Desert raves and apocalyptic doom collide in 'Sirāt,' one of the year's most talked about films",https://apnews.com/article/sirat-oliver-laxe-interview-796cc412aa00d9fcb114a93bd7f7ce2d
Associated Press,14,"Bad Bunny wins album of the year at the 2025 Latin Grammys, capping an electric night",https://apnews.com/article/latin-grammys-2025-42dc4af01c917740b60fe585c09f6d1b
Associated Press,15,"Now, it’s her story: HBO's steamy 'Seduction’ reimagines ‘Dangerous Liaisons’ with a female gaze",https://apnews.com/article/seduction-tv-dangerous-liaisons-hbo-max-0f9d84fa8a972fa96d49211201474f7a
Associated Press,16,Starbucks workers kick off 65-store US strike on company's busy Red Cup Day,https://apnews.com/article/starbucks-workers-strike-stores-union-6d9a5c8761fb7a251cb9bf7c13908877
Associated Press,17,Workers turn to 'polyworking' to combat frozen salaries and inflation,https://apnews.com/article/work-side-jobs-security-salaries-layoffs-df229576002b9b99cf4149b3978e937c
Associated Press,18,Wall Street drops to one of its worst days since April on worries about AI stocks and interest rates,https://apnews.com/article/stocks-markets-trump-government-shutdown-c388d97a4e4acf5cca538fd901e46b2d
Associated Press,19,Blue Origin launches huge rocket carrying twin NASA spacecraft to Mars,https://apnews.com/article/blue-origin-mars-nasa-new-glenn-bezos-4e3e6c380b8294b557618a6fea92282b
Associated Press,20,Dog is rescued from a busy Boston tunnel during rush hour,https://apnews.com/article/video-dog-rescued-boston-tunnel-85743eb0ea51dd18dcc40e99dac3ac8c
