site,rank,title,link
Al Jazeera,1,Why does the UK want to copy Denmark’s stringent immigration policies?,https://www.aljazeera.com/news/2025/11/9/why-does-the-uk-want-to-copy-denmarks-stringent-immigration-policies?traffic_source=rss
Al Jazeera,2,Israel receives remains of soldier killed in Gaza in 2014,https://www.aljazeera.com/news/2025/11/9/israel-receives-remains-of-soldier-captured-in-gaza-in-2014?traffic_source=rss
Al Jazeera,3,Egyptians set to head to the polls in Parliament vote,https://www.aljazeera.com/news/2025/11/9/egyptians-set-to-head-to-the-polls-in-parliament-vote?traffic_source=rss
Al Jazeera,4,"Kenya’s Ruto on protests, power, and the state of democracy",https://www.aljazeera.com/video/talk-to-al-jazeera/2025/11/9/kenyas-ruto-on-protests-power-and-the-state-of-democracy?traffic_source=rss
Al Jazeera,5,US government shutdown enters 40th day: How is it affecting Americans?,https://www.aljazeera.com/news/2025/11/9/us-government-shutdown-enters-40th-day-how-is-it-affecting-americans?traffic_source=rss
Al Jazeera,6,UK military to help Belgium after drone sightings near airports,https://www.aljazeera.com/news/2025/11/9/uk-military-to-help-belgium-after-drone-sightings-near-airports?traffic_source=rss
Al Jazeera,7,Israeli settlers attack journalists at olive harvest in occupied West Bank,https://www.aljazeera.com/video/newsfeed/2025/11/9/israeli-settlers-attack-journalists-at-olive-harvest-in-occupied-west-bank?traffic_source=rss
Al Jazeera,8,LIVE: Manchester City vs Liverpool – Premier League,https://www.aljazeera.com/sports/liveblog/2025/11/9/live-manchester-city-vs-liverpool-premier-league?traffic_source=rss
Al Jazeera,9,Colombia seeks joint “actions” on drug trade,https://www.aljazeera.com/video/quotable/2025/11/9/aje-onl-qt_jorge_restrepo-091125?traffic_source=rss
Al Jazeera,10,Israeli settlers attack Palestinians “harvesting olives”,https://www.aljazeera.com/video/quotable/2025/11/9/israeli-settlers-attack-palestinians-harvesting?traffic_source=rss
Al Jazeera,11,Nearly one million evacuated as Typhoon Fung-wong nears Philippines,https://www.aljazeera.com/video/newsfeed/2025/11/9/nearly-one-million-evacuated-as-typhoon-fung-wong-nears-philippines?traffic_source=rss
Al Jazeera,12,"Hollywood is “waking up, becoming aware” of Palestinian stories",https://www.aljazeera.com/video/quotable/2025/11/9/aje-onl-qt_cherien-dabis-091125?traffic_source=rss
Al Jazeera,13,It’s not just Israel to blame for the medical evacuation crisis in Gaza,https://www.aljazeera.com/opinions/2025/11/9/its-not-just-israel-to-blame-for-the-medical-evacuation-crisis-in-gaza?traffic_source=rss
Al Jazeera,14,Israeli forces kill Palestinian man during occupied West Bank raid,https://www.aljazeera.com/news/2025/11/9/israel-forces-kill-palestinian-man-during-occupied-west-bank-raid?traffic_source=rss
Al Jazeera,15,Republicans push to strip Zohran Mamdani of US citizenship. Is it possible?,https://www.aljazeera.com/news/2025/11/9/republicans-push-to-strip-zohran-mamdani-of-us-citizenship-is-it-possible?traffic_source=rss
Al Jazeera,16,How social media amplified hate rhetoric against Mamdani,https://www.aljazeera.com/video/by-the-numbers-3/2025/11/9/how-social-media-amplified-hate-rhetoric-against-mamdani?traffic_source=rss
Al Jazeera,17,Why does Israel play in European Football?,https://www.aljazeera.com/video/game-theory/2025/11/9/aje-onl-israeluefa_v7-091125?traffic_source=rss
Al Jazeera,18,Mamdani cites Malcolm X during first Friday prayers after NYC mayoral win,https://www.aljazeera.com/video/newsfeed/2025/11/9/mamdani-cites-malcolm-x-during-first-friday-prayers-after-nyc-mayoral-win?traffic_source=rss
Al Jazeera,19,"As Super Typhoon Fung-wong nears, Philippines on edge",https://www.aljazeera.com/gallery/2025/11/9/as-super-typhoon-fung-wong-nears-philippines-on-the-edge?traffic_source=rss
Al Jazeera,20,Freed Kenyan activists allege mistreatment after month in Ugandan detention,https://www.aljazeera.com/video/newsfeed/2025/11/9/freed-kenyan-activists-allege-mistreatment-after-month-in-ugandan-detention?traffic_source=rss
Associated Press,1,Fedora man unmasked: Meet the teen behind the Louvre mystery photo,https://apnews.com/article/louvre-fedora-man-ap-photo-c0d59847ef5f836a0c5ac49de8bff441
Associated Press,2,"Super Typhoon Fung-wong slams into Philippines, killing 2 and displacing 1 million",https://apnews.com/article/super-typhoon-fungwong-philippines-kalmaegi-evacuations-4c56c28db715e11af779e04893128c63
Associated Press,3,"Powerful quake strikes off the coast of Japan, tsunami advisory lifted after 3 hours",https://apnews.com/article/japan-earthquake-tsunami-62344ef5cc944482343933127ea81312
Associated Press,4,Infant botulism in 10 US states linked to formula being recalled,https://apnews.com/article/infant-botulism-formula-byheart-recall-fda-cdc-91019e385a98a2fceb26a12005ea3fbb
Associated Press,5,"A car fleeing police slams into a bar in Florida, killing 4 and injuring 11",https://apnews.com/article/florida-tampa-police-chase-deadly-crash-cb88187b5d8ae830fbefef0456c6bf82
Associated Press,6,Chicago police respond to report of shots fired at federal agents amid immigration operations,https://apnews.com/article/chicago-federal-immigration-enforcement-protests-3b932b3f6952c8e66fb6f8f7bd0c04f3
Associated Press,7,White House says naming new Washington Commanders stadium after Trump would be 'beautiful',https://apnews.com/article/trump-washington-commanders-stadium-name-nfl-d229beaf321af4fad2f5ae36b8227c34
Associated Press,8,Government shutdown reaches its 40th day as senators work through a crucial weekend,https://apnews.com/article/government-shutdown-congress-trump-641e7e2324f261da72395b604d9540e8
Associated Press,9,Democrats seize on Trump administration's efforts to fight food stamp payments,https://apnews.com/article/trump-snap-food-stamps-court-8bdaf319f25ea0854abb3bbd494b7f90
Associated Press,10,Omar Cooper Jr's toe-tap TD keeps No. 2 Indiana's undefeated season alive vs Penn State in 27-24 win,https://apnews.com/article/indiana-penn-state-score-ce406af152d3a7760ac3347f799ab9e2
Associated Press,11,Virginia QB Chandler Morris will have testing after hit to head and neck area in loss to Wake Forest,https://apnews.com/article/virginia-chandler-morris-injury-bd31789d7febebbbd0358e9d7b221f7b
Associated Press,12,A look at the Rock & Roll Hall of Fame 2025 inductees and how they were honored,https://apnews.com/article/rock-hall-inductees-2025-b299e1cb0ad7d23372ad253605942b6c
Associated Press,13,Flight cuts from government shutdown strain a supply chain that's already stretched thin,https://apnews.com/article/government-shutdown-airlines-shipping-cfeecb272743298e2e522eb351a28e31
Associated Press,14,A crisis at chipmaker Nexperia sent automakers scrambling. Here's what to know,https://apnews.com/article/china-netherlands-nexperia-chips-semiconductors-df33017565dc09cada05b06cc25705dc
Associated Press,15,Pfizer clinches deal for obesity drug developer Metsea after a bidding war with Novo Nordisk,https://apnews.com/article/metsera-pfizer-novo-nordisk-obsesity-7c42edaab3730eac38fa1544ddc1d216
Associated Press,16,Dog is rescued from a busy Boston tunnel during rush hour,https://apnews.com/article/video-dog-rescued-boston-tunnel-85743eb0ea51dd18dcc40e99dac3ac8c
Associated Press,17,An elephant family smashed pumpkins at the Oregon Zoo. But this baby just wanted to play ball,https://apnews.com/article/elephant-pumpkin-smash-video-portland-oregon-zoo-1e942f8379ee099847254c6811ba0c29
Associated Press,18,"Giant, floating pumpkin races draw large crowds to annual event in Oregon",https://apnews.com/article/giant-pumpkin-regatta-race-oregon-tualatin-e51831205b13592259fbd85bc4f29358
Associated Press,19,"Ah, rats! Researchers say some other critter likely created Chicago's 'rat hole' sidewalk landmark",https://apnews.com/article/chicago-rat-hole-study-squirrel-researchers-4a0931f965a0fc5241ea95af2b09859b
Associated Press,20,Mysterious googly eyes go viral after appearing on public art in Oregon,https://apnews.com/article/googly-eyes-public-art-sculptures-bend-oregon-2f4fce84569e3b599106199f3b6d66e3
