site,rank,title,link
Al Jazeera,1,Syria says it dismantled Hezbollah-linked cell plotting assassinations,https://www.aljazeera.com/news/2026/5/6/syrian-authourities-dismantle-hezbollah-linked-cell-plotting-assassinations?traffic_source=rss
Al Jazeera,2,US must not insult IRGC during the World Cup: Iran’s football chief,https://www.aljazeera.com/sports/2026/5/6/us-must-not-insult-irgc-during-the-world-cup-irans-football-chief?traffic_source=rss
Al Jazeera,3,Top tennis players could boycott French Open over prize money: Sabalenka,https://www.aljazeera.com/sports/2026/5/6/top-tennis-players-could-boycott-french-open-over-prize-money-sabalenka?traffic_source=rss
Al Jazeera,4,Iran war day 68: Trump talks about progress in talks; Rubio says war ‘over’,https://www.aljazeera.com/news/2026/5/6/iran-war-day-68-trump-talks-about-progress-in-talks-rubio-says-war-over?traffic_source=rss
Al Jazeera,5,Manipur’s ‘unknown’ killers: Three years of India’s bloody ethnic conflict,https://www.aljazeera.com/news/2026/5/6/manipurs-unknown-killers-three-years-of-indias-bloody-ethnic-conflict?traffic_source=rss
Al Jazeera,6,Syria’s Suwayda: A new hub for the multibillion-dollar Captagon trade?,https://www.aljazeera.com/news/2026/5/6/syrias-suwayda-a-new-hub-for-the-multi-billion-dollar-captagon-trade?traffic_source=rss
Al Jazeera,7,Iranian Foreign Minister Araghchi arrives in China for talks,https://www.aljazeera.com/video/newsfeed/2026/5/6/iranian-foreign-minister-araghchi-arrives-in-china-for-talks?traffic_source=rss
Al Jazeera,8,US military releases video of strike on alleged drug boat,https://www.aljazeera.com/video/newsfeed/2026/5/6/us-military-releases-video-of-strike-on-alleged-drug-boat?traffic_source=rss
Al Jazeera,9,"Airlines hike fares, cut millions of seats as Iran war drives up fuel costs",https://www.aljazeera.com/economy/2026/5/6/airlines-hike-fares-cut-millions-of-seats-as-iran-war-drives-up-fuel-costs?traffic_source=rss
Al Jazeera,10,"In Gaza, the simplest of weddings are barely affordable",https://www.aljazeera.com/features/2026/5/6/in-gaza-the-simplest-of-weddings-are-barely-affordable?traffic_source=rss
Al Jazeera,11,What to know about Israeli President Herzog’s trip to Central America?,https://www.aljazeera.com/news/2026/5/6/what-to-know-about-israeli-president-herzogs-trip-to-central-america?traffic_source=rss
Al Jazeera,12,US president Trump restarts Pope feud ahead of Rubio visit to Vatican,https://www.aljazeera.com/video/newsfeed/2026/5/6/us-president-trump-restarts-pope-feud-ahead-of-rubio-visit-to-vatican?traffic_source=rss
Al Jazeera,13,Iran’s Araghchi holds talks with China’s Wang Yi in Beijing,https://www.aljazeera.com/news/2026/5/6/irans-araghchi-holds-talks-with-chinas-wang-yi-in-beijing?traffic_source=rss
Al Jazeera,14,Romania’s pro-EU government ousted after no-confidence vote,https://www.aljazeera.com/video/newsfeed/2026/5/6/romanias-pro-eu-government-ousted-after-no-confidence-vote?traffic_source=rss
Al Jazeera,15,US pauses plan to guide ships through the Strait of Hormuz,https://www.aljazeera.com/video/newsfeed/2026/5/6/us-pauses-plan-to-guide-ships-through-the-strait-of-hormuz?traffic_source=rss
Al Jazeera,16,Spain agrees to let hantavirus-hit cruise ship dock in Canary Islands,https://www.aljazeera.com/news/2026/5/6/spain-agrees-to-let-hantavirus-hit-cruise-ship-dock-in-canary-islands?traffic_source=rss
Al Jazeera,17,Protesters rally in Louisiana and Tennessee against redistricting,https://www.aljazeera.com/video/newsfeed/2026/5/6/protesters-rally-in-louisiana-and-tennessee-against-redistricting?traffic_source=rss
Al Jazeera,18,"Iran war live: Trump says Hormuz operation paused amid US, Tehran talks",https://www.aljazeera.com/news/liveblog/2026/5/6/iran-war-live-trump-says-hormuz-operation-paused-amid-us-tehran-talks?traffic_source=rss
Al Jazeera,19,Thai temples launch rockets in friendly festival rivalry,https://www.aljazeera.com/video/newsfeed/2026/5/5/thai-temples-launch-rockets-in-friendly-festival-rivalry?traffic_source=rss
Al Jazeera,20,Buses block off roads in Bolivia as transport workers strike over fuel,https://www.aljazeera.com/video/newsfeed/2026/5/5/buses-block-off-roads-in-bolivia-as-transport-workers-strike-over-fuel?traffic_source=rss
Associated Press,1,How a deadly hantavirus outbreak unfolded on a cruise ship for weeks before it was identified,https://apnews.com/article/hantavirus-outbreak-cruise-ship-timeline-a04e0f8097d068a00fe94bf19f840240
Associated Press,2,China's top envoy meets with Iran's in Beijing as Trump pauses US effort in the Strait,https://apnews.com/article/iran-us-war-ceasefire-negotiations-strait-hormuz-b8a77d16945085e5a5039032a55b3a90
Associated Press,3,Inside the cruise ship at the center of a deadly hantavirus outbreak,https://apnews.com/article/hantavirus-ship-cape-verde-mv-hondius-footage-c6b3db5ab10fefbd9ece0b036e47188b
Associated Press,4,Former FedEx driver sentenced to death for killing 7-year-old girl after delivery at her Texas home,https://apnews.com/article/tanner-horner-fedex-driver-sentenced-athena-strand-5248131f1e4eb052afeaab3a8a49f62b
Associated Press,5,Former Patriots receiver Stefon Diggs is found not guilty of assaulting his private chef,https://apnews.com/article/patriots-new-england-stefon-diggs-assault-chef-7128f3d02e1058120d0d5423f0ec72f5
Associated Press,6,"Takeaways from Indiana, Ohio and Michigan: Trump's flex pays off and Democrats win special election",https://apnews.com/article/primaries-indiana-ohio-michigan-takeaways-722f8ee155920578db6964f54e910449
Associated Press,7,"Trump again assails Pope Leo, potentially complicating Rubio's visit to the Vatican this week",https://apnews.com/article/trump-rubio-pope-iran-19fac7bba8f7c9b4d59630b7d5537868
Associated Press,8,Stefon Diggs' acquittal clears path for return to the field but he could still face NFL discipline,https://apnews.com/article/stefon-diggs-acquitted-nfl-discipline-177365c97bb68d4b7e57d983899a88b0
Associated Press,9,Arsenal reaches its first Champions League final in 20 years as Saka's goal seals win over Atletico,https://apnews.com/article/arsenal-atletico-champions-league-semifinal-052bec201214e80c6a3c0b22f4d80227
Associated Press,10,Edwards returns and Timberwolves overcome big game by Wembanyama to beat Spurs 104-102 in Game 1,https://apnews.com/article/timberwolves-wolves-spurs-score-wembanyama-edwards-5c70a8def68dc19713533cefa5edd3eb
Associated Press,11,"Inside the Met Gala, an Olympic champion learns just how famous she's become",https://apnews.com/article/met-gala-2026-behind-scenes-1992bb65151d4b4abff2572d56049bc8
Associated Press,12,Inside the Rolling Stones' exclusive new album event: What we know about 'Foreign Tongues' so far,https://apnews.com/article/rolling-stones-new-album-foreign-tongues-aae39555f9610a5f7d96c431a94bcd41
Associated Press,13,"Mark Zuckerberg 'personally authorized' Meta's copyright infringement, publishers allege",https://apnews.com/article/meta-mark-zuckerberg-ai-publishers-lawsuit-llama-5609846d4d840014974a847b01079c32
Associated Press,14,Wall Street rallies to records after oil prices ease and corporate profits keep topping expectations,https://apnews.com/article/stocks-markets-trump-oil-iran-e1c194b5266c4eb58dc993cc4a9f9b50
Associated Press,15,"Pennsylvania sues AI company, saying its chatbots illegally hold themselves out as licensed doctors",https://apnews.com/article/character-ai-chatbots-medical-advice-pennsylvania-46502067ed5b3cd9f9173f194ad30070
Associated Press,16,Gasoline costs 50% more in the US than it did before the Iran war,https://apnews.com/article/gasoline-oil-war-iran-strait-of-hormuz-0e5b61be4a4c8a8a077ed5ff6f84c0ce
Associated Press,17,"Nipper, stay! The future of a beloved dog statue on a New York warehouse is up in the air",https://apnews.com/article/nipper-dog-statue-albany-new-york-69a5ca4ec514f837626475b5d5264c1d
Associated Press,18,1 million bees make for bumper-to-buzzer traffic on a Tennessee highway ramp,https://apnews.com/article/bees-highway-crash-tennessee-592ae29c23856d6b67bcc7123fe9867a
Associated Press,19,How 2 men claimed an absurd record by driving an old 3-wheel car the length of Africa,https://apnews.com/article/adventure-car-africa-record-reliant-robin-0328f6a9dbcb407d539fe7aabf23a915
Associated Press,20,Viral phenomenon in Argentina has young people identifying themselves as animals,https://apnews.com/article/argentina-teenagers-identifying-as-animals-therians-tiktok-54d158c4842f6515e31d83a260cdf31f
