site,rank,title,link
Al Jazeera,1,Reporting from behind shifting front lines in Myanmar’s civil war,https://www.aljazeera.com/news/2025/5/10/reporting-from-behind-shifting-front-lines-in-myanmars-civil-war?traffic_source=rss
Al Jazeera,2,"Could India, Pakistan use nuclear weapons? Here’s what their doctrines say",https://www.aljazeera.com/news/2025/5/10/could-india-pakistan-use-nuclear-weapons-heres-what-their-doctrines-say?traffic_source=rss
Al Jazeera,3,Newark Mayor Ras Baraka arrested during ICE detention centre protest,https://www.aljazeera.com/news/2025/5/9/newark-mayor-ras-baraka-arrested-during-ice-detention-centre-protest?traffic_source=rss
Al Jazeera,4,"World could be witnessing ‘another Nakba’ in Palestine, UN committee warns",https://www.aljazeera.com/news/2025/5/9/gaza-could-experience-another-nakba-warns-un-committee?traffic_source=rss
Al Jazeera,5,US reports second air traffic control outage at New Jersey airport,https://www.aljazeera.com/news/2025/5/9/us-reports-second-air-traffic-control-outage-at-new-jersey-airport?traffic_source=rss
Al Jazeera,6,"India, Pakistan exchange claims over drone strikes",https://www.aljazeera.com/program/newsfeed/2025/5/9/india-pakistan-exchange-claims-over-drone-strikes?traffic_source=rss
Al Jazeera,7,"Mexico is suing Google over ‘Gulf of America’ label, Sheinbaum says",https://www.aljazeera.com/news/2025/5/9/mexico-is-suing-google-over-gulf-of-america-label-sheinbaum-says?traffic_source=rss
Al Jazeera,8,"Barcelona vs Real Madrid: El Clasico La Liga start time, team news, lineups",https://www.aljazeera.com/sports/2025/5/9/barcelona-vs-real-madrid-la-liga-el-clasico-team-news-how-to-follow?traffic_source=rss
Al Jazeera,9,Mohsen Mahdawi tells Al Jazeera why he refuses to be afraid,https://www.aljazeera.com/video/newsfeed/2025/5/9/mohsen-mahdawi-tells-al-jazeera-why-he-refuses-to-be-afraid?traffic_source=rss
Al Jazeera,10,Gunmen kill 30 during ‘vicious’ attack in southeast Nigeria: Rights group,https://www.aljazeera.com/news/2025/5/9/gunmen-kill-30-during-vicious-attack-in-southeast-nigeria-rights-group?traffic_source=rss
Al Jazeera,11,What might follow from Pope Leo XIV’s election?,https://www.aljazeera.com/program/inside-story/2025/5/9/what-might-follow-from-pope-leo-xivs-election?traffic_source=rss
Al Jazeera,12,Russia celebrates 80th anniversary of Victory Day with grand parade,https://www.aljazeera.com/video/newsfeed/2025/5/9/russia-celebrates-80th-anniversary-of-victory-day-with-grand-parade?traffic_source=rss
Al Jazeera,13,Tufts University student Rumeysa Ozturk ordered released from ICE detention,https://www.aljazeera.com/news/2025/5/9/tufts-university-student-rumeysa-ozturk-ordered-released-from-ice-detention?traffic_source=rss
Al Jazeera,14,‘I don’t have the cash to pay for these tariffs’: US small biz suffers,https://www.aljazeera.com/economy/2025/5/9/i-dont-have-the-cash-to-pay-for-these-tariffs-us-small-biz-suffers?traffic_source=rss
Al Jazeera,15,Israel intercepts missile launched by Yemen’s Houthis,https://www.aljazeera.com/news/2025/5/9/houthis-claim-responsibility-for-missile-attack-on-israel-airport?traffic_source=rss
Al Jazeera,16,Election of an American pope a “shock to many”,https://www.aljazeera.com/program/quotable/2025/5/9/election-of-an-american-pope-a-shock-to?traffic_source=rss
Al Jazeera,17,Pope Leo XIV holds first Mass,https://www.aljazeera.com/program/newsfeed/2025/5/9/pope-leo-xiv-holds-first-mass?traffic_source=rss
Al Jazeera,18,Can India and Pakistan avoid a fourth war over Kashmir?,https://www.aljazeera.com/program/the-take-2/2025/5/9/aje-onl-ind_kashmirupdate_av_v2-090525?traffic_source=rss
Al Jazeera,19,‘I will run right over you’: New FEMA head issues warning to Trump critics,https://www.aljazeera.com/news/2025/5/9/i-will-run-right-over-you-new-fema-head-issues-warning-to-trump-critics?traffic_source=rss
Al Jazeera,20,Who are the armed groups India accuses Pakistan of backing?,https://www.aljazeera.com/news/2025/5/9/who-are-the-armed-groups-india-accuses-pakistan-of-backing?traffic_source=rss
