site,rank,title,link
Al Jazeera,1,LIVE: Europe’s response on Gaza a ‘failure’ as Israel continues attacks,https://www.aljazeera.com/news/liveblog/2025/9/3/live-europes-response-on-gaza-a-failure-as-israel-continues-attacks?traffic_source=rss
Al Jazeera,2,Djokovic to play Alcaraz in US Open semifinal after defeating Fritz,https://www.aljazeera.com/sports/2025/9/3/djokovic-to-play-alcaraz-in-us-open-semifinal-after-defeating-fritz?traffic_source=rss
Al Jazeera,3,Hundreds of US military lawyers to serve as temporary immigration judges,https://www.aljazeera.com/news/2025/9/3/hundreds-of-us-military-lawyers-to-serve-as-temporary-immigration-judges?traffic_source=rss
Al Jazeera,4,OpenAI announces parental controls for ChatGPT after teen’s suicide,https://www.aljazeera.com/economy/2025/9/3/openai-announces-parental-controls-for-chatgpt-after-teens-suicide?traffic_source=rss
Al Jazeera,5,"China’s Xi oversees massive military parade with Putin, Kim in attendance",https://www.aljazeera.com/news/2025/9/3/chinas-xi-oversees-massive-military-parade-with-putin-kim-in-attendance?traffic_source=rss
Al Jazeera,6,Some 400 Indonesian school children fall ill after eating free school meals,https://www.aljazeera.com/news/2025/9/3/some-400-indonesian-school-children-fall-ill-after-eating-free-school-meals?traffic_source=rss
Al Jazeera,7,US Open: Carlos Alcaraz cruises into 2025 semifinals,https://www.aljazeera.com/sports/2025/9/3/us-open-carlos-alcaraz-cruises-into-2025-semifinals?traffic_source=rss
Al Jazeera,8,Trump ‘not concerned’ about China and Russia forming axis against US,https://www.aljazeera.com/news/2025/9/3/trump-not-concerned-about-china-and-russia-forming-axis-against-us?traffic_source=rss
Al Jazeera,9,"US House committee releases over 33,000 pages of Epstein-related records",https://www.aljazeera.com/news/2025/9/3/us-house-committee-releases-over-33000-pages-of-epstein-related-records?traffic_source=rss
Al Jazeera,10,"Russia-Ukraine war: List of key events, day 1,287",https://www.aljazeera.com/news/2025/9/3/russia-ukraine-war-list-of-key-events-day-1287?traffic_source=rss
Al Jazeera,11,Trump says 11 killed in strike on alleged drug-carrying boat from Venezuela,https://www.aljazeera.com/news/2025/9/3/trump-says-11-killed-in-strike-on-alleged-drug-carrying-boat-from-venezuela?traffic_source=rss
Al Jazeera,12,"Children, journalists among 105 killed in Israeli onslaught in Gaza",https://www.aljazeera.com/news/2025/9/2/children-journalists-among-105-killed-in-israeli-onslaught-in-gaza?traffic_source=rss
Al Jazeera,13,‘We’re going in’: Trump doubles down on sending National Guard to Chicago,https://www.aljazeera.com/news/2025/9/2/were-going-in-trump-doubles-down-on-sending-national-guard-to-chicago?traffic_source=rss
Al Jazeera,14,At least 11 killed in explosion at political rally in Pakistan’s Quetta,https://www.aljazeera.com/news/2025/9/2/11-killed-in-bombing-in-quetta-pakistan?traffic_source=rss
Al Jazeera,15,Will resolution on Gaza by genocide scholars make a difference?,https://www.aljazeera.com/video/inside-story/2025/9/2/will-resolution-on-gaza-by-genocide-scholars-make-a-difference?traffic_source=rss
Al Jazeera,16,Cricket: India lose sponsor for T20 Asia Cup after online betting games ban,https://www.aljazeera.com/sports/2025/9/2/india-left-without-sponsor-as-online-betting-games-ban-ends-dream11-deal?traffic_source=rss
Al Jazeera,17,Afghanistan beat Pakistan to lay down T20 Asia Cup cricket marker,https://www.aljazeera.com/sports/2025/9/2/afghanistan-beat-pakistan-to-lay-down-early-t20-asia-cup-marker?traffic_source=rss
Al Jazeera,18,US judge orders Google to share search data with competitors,https://www.aljazeera.com/economy/2025/9/2/us-judge-orders-google-to-share-search-data-with-competitors?traffic_source=rss
Al Jazeera,19,Nigeria’s Asisat Oshoala leaves Bay FC for Saudi Women’s Al-Hilal,https://www.aljazeera.com/sports/2025/9/2/nigerias-asisat-oshoala-leave-bay-fc-for-saudi-womens-al-hilal?traffic_source=rss
Al Jazeera,20,France issues arrest warrant for Syria’s Assad over killing of journalists,https://www.aljazeera.com/news/2025/9/2/france-issues-arrest-warrant-for-syrias-assad-over-killing-of-journalists?traffic_source=rss
