site,rank,title,link
Al Jazeera,1,"UK comic Russell Brand pleads not guilty to new rape, sex assault charges",https://www.aljazeera.com/news/2026/2/24/uk-comic-russell-brand-pleads-not-guilty-to-new-rape-sex-assault-charges?traffic_source=rss
Al Jazeera,2,When the world retreats: Volunteers are filling Sudan’s humanitarian void,https://www.aljazeera.com/features/2026/2/24/when-the-world-retreats-volunteers-are-filling-sudans-humanitarian-void?traffic_source=rss
Al Jazeera,3,Ukraine marks four years of Russia’s war,https://www.aljazeera.com/video/newsfeed/2026/2/24/ukraine-marks-four-years-of-russias-war?traffic_source=rss
Al Jazeera,4,European leaders pray with Ukraine’s Zelenskyy on invasion anniversary,https://www.aljazeera.com/video/newsfeed/2026/2/24/european-leaders-pray-with-ukraines-zelenskyy-on-invasion-anniversary?traffic_source=rss
Al Jazeera,5,Russia-Ukraine four years of war,https://www.aljazeera.com/video/between-us/2026/2/24/russia-ukraine-four-years-of-war?traffic_source=rss
Al Jazeera,6,New Trump tariffs take effect days after Supreme Court ruling,https://www.aljazeera.com/news/2026/2/24/new-trump-tariffs-take-effect-days-after-supreme-court-decision?traffic_source=rss
Al Jazeera,7,Residents raise alarm as violence-hit Guadalajara to host World Cup games,https://www.aljazeera.com/sports/2026/2/24/residents-raise-alarm-as-violence-hit-guadalajara-to-host-world-cup-games?traffic_source=rss
Al Jazeera,8,In Pictures: Four years of Ukraine war,https://www.aljazeera.com/gallery/2026/2/24/four-years-of-war-in-ukraine-in-pictures?traffic_source=rss
Al Jazeera,9,Blast kills policeman in Moscow train station on Ukraine war anniversary,https://www.aljazeera.com/video/2026/2/24/blast-kills-policeman-in-moscow-train-station-on-ukraine-war-anniversary?traffic_source=rss
Al Jazeera,10,LIVE: Pakistan vs England – T20 World Cup,https://www.aljazeera.com/sports/liveblog/2026/2/24/live-pakistan-vs-england-t20-world-cup-today-commentary-score-stream?traffic_source=rss
Al Jazeera,11,Ukrainians were shocked by Russia’s war. Now many are numb and hopeless,https://www.aljazeera.com/news/2026/2/24/ukrainians-were-shocked-by-russias-war-now-many-are-numb-and-hopeless?traffic_source=rss
Al Jazeera,12,Floyd Mayweather and Manny Pacquiao agree to fight rematch in September,https://www.aljazeera.com/sports/2026/2/24/floyd-mayweather-and-manny-pacquiao-agree-to-fight-rematch-in-september?traffic_source=rss
Al Jazeera,13,"Iran army helicopter crashes into market, killing 2 pilots and 2 merchants",https://www.aljazeera.com/news/2026/2/24/army-helicopter-crashes-into-iran-market-killing-2-pilots-and-2-merchants?traffic_source=rss
Al Jazeera,14,What do four years of war in Ukraine add up to?,https://www.aljazeera.com/video/by-the-numbers-3/2026/2/24/what-do-four-years-of-war-in-ukraine-add-up-to?traffic_source=rss
Al Jazeera,15,Mapping Russian attacks and territorial gains across Ukraine,https://www.aljazeera.com/news/2026/2/24/mapping-russian-attacks-and-territorial-gains-across-ukraine?traffic_source=rss
Al Jazeera,16,"Huge northeast US snowstorm forces millions home; disrupts schools, flights",https://www.aljazeera.com/gallery/2026/2/24/huge-northeast-us-snowstorm-forces-millions-home-disrupts-schools-flights?traffic_source=rss
Al Jazeera,17,"Schools shut, troops on streets: Mexico on alert after ‘El Mencho’ killing",https://www.aljazeera.com/news/2026/2/24/schools-shut-troops-on-streets-mexico-on-alert-after-el-mencho-killing?traffic_source=rss
Al Jazeera,18,"With ‘El Mencho’ killed, what’s next for Mexico and the Jalisco cartel?",https://www.aljazeera.com/news/2026/2/24/with-el-mencho-killed-whats-next-for-mexico-and-the-jalisco-cartel?traffic_source=rss
Al Jazeera,19,US women’s ice hockey team declines Trump’s State of the Union invitation,https://www.aljazeera.com/sports/2026/2/24/us-womens-gold-medal-ice-hockey-team-declines-trumps-state-of-the-union?traffic_source=rss
Al Jazeera,20,Nearly 20 countries slam Israel’s ‘de facto annexation’ drive in West Bank,https://www.aljazeera.com/news/2026/2/24/nearly-20-countries-slam-israels-de-facto-annexation-drive-in-west-bank?traffic_source=rss
Associated Press,1,Panama seizes 2 key canal ports from Hong Kong operator following Supreme Court ruling,https://apnews.com/article/panama-canal-port-court-ruling-ck-hutchison-110af98b3782a08c242ecb5edb512614
Associated Press,2,"4 years into Russia's full-scale invasion of Ukraine, a look at the war by the numbers",https://apnews.com/article/russia-ukraine-war-numbers-f023cd82917ccb29ad2dda54ea589249
Associated Press,3,Ontario's premier says 'the walls are closing in' on Trump after Supreme Court tariff decision,https://apnews.com/article/ontario-ford-trump-tariffs-supreme-court-canada-5afcbc221e6cec49d6ffa8729a899e4e
Associated Press,4,Judge says federal court can’t rule on challenge to Orleans sheriff’s ‘sanctuary’ policy,https://apnews.com/article/liz-murrill-louisiana-general-news-courts-janis-van-meerveld-dd0d18daf4c2ffb94a1c49e16005438b
Associated Press,5,Medical influencer Attia resigns post at CBS News after name included in multiple Epstein files,https://apnews.com/article/cbs-news-epstein-files-attia-medical-428aacc5f6ba7dc3f441047e37d351c6
Associated Press,6,Isaac Hayes estate settles lawsuit accusing Trump of unauthorized song use,https://apnews.com/article/isaac-hayes-donald-trump-lawsuit-f3b633d11c80282bc635363c47f59d27
Associated Press,7,State Department orders nonessential US diplomats to leave Lebanon as tensions with Iran soar,https://apnews.com/article/united-states-lebanon-iran-357b906391797294207e11be9d0cd6bd
Associated Press,8,Trump's State of the Union will be delivered to a changed nation and a Congress he has sidelined,https://apnews.com/article/trump-state-of-union-speech-congress-a7231bdbb23532bc949b7f2344f60947
Associated Press,9,Judge blocks release of special counsel Jack Smith's report on Trump classified documents case,https://apnews.com/article/trump-classified-documents-jack-smith-3a86d9c12f18b4dfe648e539925d72a2
Associated Press,10,Lindsey Vonn says surgery saved her from having her left leg amputated following Olympic crash,https://apnews.com/article/winter-olympics-lindsey-vonn-6d6ffee2e52293ba59dae83b6c0cc79b
Associated Press,11,US women's gold medal-winning team declines invitation from Trump to attend State of Union address,https://apnews.com/article/trump-state-of-union-womens-hockey-gold-medal-2311fcc12756a72d8733f0f8c12116f8
Associated Press,12,"Duke rises to No. 1 in AP Top 25 men's hoops poll for record 148th time; Florida, Alabama make leaps",https://apnews.com/article/ap-top-25-poll-duke-39fdb6bef07b4466f0e6140826fdcad5
Associated Press,13,BAFTA and BBC apologize for racial slur during awards show,https://apnews.com/article/bafta-film-awards-racist-slur-tourettes-b602724980eb462818f937f353b84653
Associated Press,14,"‘Scrubs’ revival brings back the old goofy gang, but now they're, gulp, in charge",https://apnews.com/article/scrubs-revival-2026-395e9e6ccedc62c2880439858574e62f
Associated Press,15,Met Gala guests (and the rest of us) learn the next dress code: 'Fashion is Art',https://apnews.com/article/met-gala-fashion-8a13bc6002214c671e888246d3077e1e
Associated Press,16,"US weather, Mexico security concerns and halt of Global Entry take a toll on air travel",https://apnews.com/article/winter-storm-flight-cancellations-us-travel-54feed6ca0fb8e05c3b59326bd7ff24c
Associated Press,17,"Supreme Court decision against Trump's tariffs raises uncertainty, but markets stay calm",https://apnews.com/article/tariffs-trump-china-eu-court-bessent-36c6951422ccd24f475429d4683e7e15
Associated Press,18,Hong Kong protests after Panama takes control of 2 key ports on the Panama Canal,https://apnews.com/article/panama-canal-seizure-hong-kong-response-a1aa9ad15afed0233c85dbaa24b3fece
Associated Press,19,6 planets will parade across the night sky at the end of February,https://apnews.com/article/february-2026-planet-parade-332c4fd23f8c0005ae9bc4ddd5f1d9e3
Associated Press,20,A horse's neigh may be unique in the animal kingdom. Now scientists know how they do it,https://apnews.com/article/horse-neigh-whinny-voice-box-whistle-1cd9c808a07e8dd96afe185774706a0d
