site,rank,title,link
Al Jazeera,1,"Trump, Putin skip questions ahead of Alaska joint press conference",https://www.aljazeera.com/video/newsfeed/2025/8/15/trump-putin-skip-questions-ahead-of-alaska-joint-press-conference?traffic_source=rss
Al Jazeera,2,Israel targets emergency workers trying to help people trapped in Gaza City,https://www.aljazeera.com/news/2025/8/15/israel-targets-emergency-workers-trying-to-help-people-trapped-in-gaza-city?traffic_source=rss
Al Jazeera,3,Trump greets Putin in Alaska for Russia-Ukraine talks,https://www.aljazeera.com/video/newsfeed/2025/8/15/trump-greets-putin-in-alaska-for-russia-ukraine-talks?traffic_source=rss
Al Jazeera,4,"Israel’s aid rules demand “sensitive data, put staff at risk”",https://www.aljazeera.com/video/quotable/2025/8/15/israels-aid-rules-demand-sensitive-data-put-staff-at?traffic_source=rss
Al Jazeera,5,"Verdict, sentencing in coup trial for Brazil’s Bolsonaro set for September",https://www.aljazeera.com/news/2025/8/15/verdict-sentencing-in-coup-trial-for-brazils-bolsonaro-set-for-september?traffic_source=rss
Al Jazeera,6,Israeli police make arrests at rally for slain Al Jazeera journalists,https://www.aljazeera.com/video/newsfeed/2025/8/15/israeli-police-make-arrests-at-rally-for-slain-al-jazeera-journalists?traffic_source=rss
Al Jazeera,7,Why has violence flared up in Serbia – and what’s next?,https://www.aljazeera.com/video/inside-story/2025/8/15/why-has-violence-flared-up-in-serbia-and-whats-next?traffic_source=rss
Al Jazeera,8,"Russia gains in east before Trump-Putin summit, Ukraine says holding off",https://www.aljazeera.com/news/2025/8/15/zelenskyy-decries-russias-attempt-to-gain-edge-ahead-of-summit-with-us?traffic_source=rss
Al Jazeera,9,"Wildfires sweep Spain, Portugal and Greece during unremitting heatwave",https://www.aljazeera.com/news/2025/8/15/wildfires-sweep-spain-portugal-and-greece-during-unremitting-heatwave?traffic_source=rss
Al Jazeera,10,Why is Trump meeting Putin in Alaska?,https://www.aljazeera.com/video/the-take-2/2025/8/15/why-is-trump-meeting-putin-in-alaska?traffic_source=rss
Al Jazeera,11,Taliban marks fourth anniversary of return to power with internal threats,https://www.aljazeera.com/news/2025/8/15/taliban-marks-fourth-anniversary-of-return-to-power-with-internal-threats?traffic_source=rss
Al Jazeera,12,"Hurricane Erin threatens Puerto Rico, Virgin Islands with flooding",https://www.aljazeera.com/news/2025/8/15/hurricane-erin-threatens-puerto-rico-virgin-islands-with-flooding?traffic_source=rss
Al Jazeera,13,Afghans in US mark Taliban Kabul takeover amid Trump immigration crackdown,https://www.aljazeera.com/news/2025/8/15/afghansin-us-mark-withdrawal-anniversary-amid-trump-immigration-crackdown?traffic_source=rss
Al Jazeera,14,A political shift ahead? What to know about Bolivia’s presidential election,https://www.aljazeera.com/news/2025/8/15/a-political-shift-ahead-what-to-know-about-bolivias-presidential-election?traffic_source=rss
Al Jazeera,15,"Nearly 200 people killed in Pakistan in heavy rains, flash floods",https://www.aljazeera.com/news/2025/8/15/more-than-160-people-killed-in-pakistan-in-heavy-rains-flash-floods?traffic_source=rss
Al Jazeera,16,"Mallorca vs Barcelona: La Liga – teams, start, lineups",https://www.aljazeera.com/sports/2025/8/15/mallorca-vs-barcelona-la-liga-teams-start-lineups?traffic_source=rss
Al Jazeera,17,Trump’s takeover of DC police department faces new lawsuit amid crackdown,https://www.aljazeera.com/news/2025/8/15/trumps-takeover-of-dc-police-department-faces-new-lawsuit-amid-crackdown?traffic_source=rss
Al Jazeera,18,How the world is reacting to Israel’s settlement plan in occupied West Bank,https://www.aljazeera.com/news/2025/8/15/how-the-world-is-reacting-to-israels-settlement-plan-in-occupied-west-bank?traffic_source=rss
Al Jazeera,19,Can Putin sway Trump with economic offers in Alaska?,https://www.aljazeera.com/economy/2025/8/15/can-putin-sway-trump-with-economic-offers-in-alaska?traffic_source=rss
Al Jazeera,20,Israel’s Ben Gvir filmed threatening Marwan Barghouti in prison,https://www.aljazeera.com/video/newsfeed/2025/8/15/israels-ben-gvir-filmed-threatening-marwan-barghouti-in-prison?traffic_source=rss
