site,rank,title,link
Al Jazeera,1,Barcelona beat Real Madrid despite Mbappe hat-trick as LaLiga title nears,https://www.aljazeera.com/sports/2025/5/11/barcelona-beat-real-madrid-despite-mbappe-hat-trick-as-la-liga-title-nears?traffic_source=rss
Al Jazeera,2,Merino scores then sees red as Arsenal come back to draw 2-2 at Liverpool,https://www.aljazeera.com/sports/2025/5/11/merino-scores-then-sees-red-as-arsenal-come-back-to-draw-2-2-at-liverpool?traffic_source=rss
Al Jazeera,3,"Fragile truce holds between India, Pakistan after days of fierce exchanges",https://www.aljazeera.com/news/2025/5/11/fragile-truce-holds-between-india-pakistan-after-days-of-fierce-exchanges?traffic_source=rss
Al Jazeera,4,Sudan’s army and RSF paramilitary launch attacks across war-ravaged nation,https://www.aljazeera.com/news/2025/5/11/sudans-army-and-rsf-paramilitary-launch-attacks-across-war-ravaged-nation?traffic_source=rss
Al Jazeera,5,Is due process different for undocumented immigrants as Trump claims?,https://www.aljazeera.com/news/2025/5/11/is-due-process-different-for-undocumented-immigrants-as-trump-claims?traffic_source=rss
Al Jazeera,6,"Israel kills 13, including children, amid dire humanitarian crisis in Gaza",https://www.aljazeera.com/news/2025/5/11/israel-kills13-including-children-amid-dire-humanitarian-crisis-in-gaza?traffic_source=rss
Al Jazeera,7,James Cowan on clearing landmines and the legacy of war,https://www.aljazeera.com/program/talk-to-al-jazeera/2025/5/11/james-cowan-on-clearing-landmines-and-the-legacy-of-war?traffic_source=rss
Al Jazeera,8,The first American Pope,https://www.aljazeera.com/video/between-us/2025/5/11/the-first-american-pope?traffic_source=rss
Al Jazeera,9,"Is Pope Leo XIV, the first US-born pontiff, a registered Republican?",https://www.aljazeera.com/news/2025/5/11/is-pope-leo-xiv-the-first-us-born-pontiff-a-registered-republican?traffic_source=rss
Al Jazeera,10,What percentage of US toys and Christmas goods are imported from China?,https://www.aljazeera.com/news/2025/5/11/what-percentage-of-us-toys-and-christmas-goods-are-imported-from-china?traffic_source=rss
Al Jazeera,11,India tried to project strength but ended up showing weakness,https://www.aljazeera.com/opinions/2025/5/11/india-tried-to-project-strength-but-ended-up-showing-weakness?traffic_source=rss
Al Jazeera,12,"Russia-Ukraine war: List of key events, day 1,172",https://www.aljazeera.com/news/2025/5/11/russia-ukraine-war-list-of-key-events-day-1172?traffic_source=rss
Al Jazeera,13,Thousands of Kashmiris remain displaced despite India-Pakistan ceasefire,https://www.aljazeera.com/video/newsfeed/2025/5/11/thousands-of-kashmiris-remain-displaced-despite-india-pakistan-ceasefire?traffic_source=rss
Al Jazeera,14,Putin proposes Ukraine peace talks after Western leaders threaten sanctions,https://www.aljazeera.com/video/newsfeed/2025/5/11/putin-proposes-ukraine-peace-talks-after-western-leaders-threaten-sanctions?traffic_source=rss
Al Jazeera,15,Pope Leo XIV calls for Gaza ceasefire in first Sunday message,https://www.aljazeera.com/news/2025/5/11/pope-leo-xiv-calls-for-gaza-ceasefire-in-first-sunday-message?traffic_source=rss
Al Jazeera,16,What the Christians of the Holy Land expect from Pope Leo XIV,https://www.aljazeera.com/opinions/2025/5/11/what-the-christians-of-the-holy-land-expect-from-pope-leo-xiv?traffic_source=rss
Al Jazeera,17,"Pope Leo XIV ‘deeply saddened’ by Gaza, calls for aid and a ceasefire",https://www.aljazeera.com/video/newsfeed/2025/5/11/pope-leo-xiv-deeply-saddened-by-gaza-calls-for-aid-and-a-ceasefire?traffic_source=rss
Al Jazeera,18,Iran says fourth round of ‘difficult’ nuclear talks with US ends in Oman,https://www.aljazeera.com/news/2025/5/11/iran-says-nuclear-enrichment-non-negotiable-before-us-talks-in-oman?traffic_source=rss
Al Jazeera,19,"Trump offers to work with India, Pakistan on Kashmir ‘solution’",https://www.aljazeera.com/news/2025/5/11/trump-offers-to-work-with-india-pakistan-on-kashmir?traffic_source=rss
Al Jazeera,20,"Heavy rains cause flooding in Somalia’s Mogadishu, killing seven",https://www.aljazeera.com/gallery/2025/5/11/heavy-rains-cause-flooding-in-somali-capital-killing-seven?traffic_source=rss
