site,rank,title,link
Al Jazeera,1,US factory orders slump in April as spending on tariff anticipation fades,https://www.aljazeera.com/economy/2025/6/3/us-factory-orders-slump-in-april-as-spending-on-tariff-anticipation-fades?traffic_source=rss
Al Jazeera,2,"Ukraine claims attack on Kerch Bridge linking Crimea, Russia",https://www.aljazeera.com/video/newsfeed/2025/6/3/ukraine-claims-attack-on-kerch-bridge-linking-crimea-russia?traffic_source=rss
Al Jazeera,3,Two suspected Ugandan rebels killed in Kampala explosion,https://www.aljazeera.com/news/2025/6/3/two-suspected-uganda-rebels-killed-in-kampala-explosion?traffic_source=rss
Al Jazeera,4,Inzaghi leaves Inter Milan amid Saudi Pro League interest,https://www.aljazeera.com/sports/2025/6/3/inzaghi-leaves-inter-milan-amid-saudi-pro-league-interest?traffic_source=rss
Al Jazeera,5,"South Korea election results 2025: Who won, who lost, what’s next?",https://www.aljazeera.com/news/2025/6/3/south-korea-election-results-2025-who-won-who-lost-whats-next?traffic_source=rss
Al Jazeera,6,Colorado firebombing suspect facing federal hate crime charges,https://www.aljazeera.com/video/newsfeed/2025/6/3/colorado-firebombing-suspect-facing-federal-hate-crime-charges?traffic_source=rss
Al Jazeera,7,"Who’s onboard the Madleen Gaza flotilla, and where has it reached so far?",https://www.aljazeera.com/news/2025/6/3/whos-onboard-the-madleen-gaza-flotilla-and-where-has-it-reached-so-far?traffic_source=rss
Al Jazeera,8,FIFA Club World Cup 2025: Full list of qualified clubs,https://www.aljazeera.com/sports/2025/6/3/fifa-club-world-cup-2025-full-list-of-qualified-clubs?traffic_source=rss
Al Jazeera,9,"More than four million people have fled Sudan amid war, UN says",https://www.aljazeera.com/news/2025/6/3/more-than-four-million-people-have-fled-sudan-amid-war-un-says?traffic_source=rss
Al Jazeera,10,Over 200 inmates escape Pakistani prison after earthquake,https://www.aljazeera.com/video/newsfeed/2025/6/3/over-200-inmates-escape-pakistani-prison-after-earthquake?traffic_source=rss
Al Jazeera,11,The Rwanda-DRC peace deal must include the voices of the voiceless,https://www.aljazeera.com/opinions/2025/6/3/the-rwanda-drc-peace-deal-must-include-the-voices-of-the-voiceless?traffic_source=rss
Al Jazeera,12,De-escalating to escalate: Ceasefire is no longer on the horizon in Ukraine,https://www.aljazeera.com/opinions/2025/6/3/de-escalating-to-escalate-ceasefire-is-no-longer-on-the-horizon-in-ukraine?traffic_source=rss
Al Jazeera,13,The Golan: A Battle For Power,https://www.aljazeera.com/program/al-jazeera-world/2025/6/3/the-golan-a-battle-for-power?traffic_source=rss
Al Jazeera,14,Ukraine claims to have damaged Russia’s bridge to annexed Crimea,https://www.aljazeera.com/news/2025/6/3/ukraine-says-it-struck-russias-bridge-to-crimea-with-underwater-explosives?traffic_source=rss
Al Jazeera,15,‘Corpses rotting in the Nile’ as cholera tears through Sudan,https://www.aljazeera.com/news/2025/6/3/corpses-rotting-in-the-nile-as-cholera-tears-through-sudan?traffic_source=rss
Al Jazeera,16,Dutch Prime Minister Schoof resigns after far-right Wilders quits coalition,https://www.aljazeera.com/news/2025/6/3/dutch-coalition-government-in-crisis-after-far-right-wilders-pulls-support?traffic_source=rss
Al Jazeera,17,"Israel kills Palestinians queueing for aid again, UN calls for probe",https://www.aljazeera.com/video/newsfeed/2025/6/3/israel-kills-palestinians-queueing-for-aid-again-un-calls-for-probe?traffic_source=rss
Al Jazeera,18,Is free speech under attack in the US?,https://www.aljazeera.com/program/the-stream/2025/6/3/is-free-speech-under-attack-in-the-us?traffic_source=rss
Al Jazeera,19,"What’s in Trump’s ‘big, beautiful’ budget bill?",https://www.aljazeera.com/video/newsfeed/2025/6/3/whats-in-trumps-big-beautiful-budget-bill?traffic_source=rss
Al Jazeera,20,Outrage after Matthew Miller says Israel committed war crimes in Gaza,https://www.aljazeera.com/program/newsfeed/2025/6/3/outrage-after-matthew-miller-says-israel-committed-war-crimes-in-gaza?traffic_source=rss
