site,rank,title,link
Al Jazeera,1,Why is Prada facing pro-Israeli backlash?,https://www.aljazeera.com/video/newsfeed/2026/7/2/why-is-prada-facing-pro-israeli-backlash?traffic_source=rss
Al Jazeera,2,What is the Society of St Pius X? Why Pope Leo excommunicated its bishops,https://www.aljazeera.com/news/2026/7/2/what-is-the-society-of-st-pius-x-why-pope-leo-excommunicated-its-bishops?traffic_source=rss
Al Jazeera,3,Spain vs Austria LIVE: FIFA World Cup 2026,https://www.aljazeera.com/sports/liveblog/2026/7/2/spain-vs-austria-live-fifa-world-cup-2026?traffic_source=rss
Al Jazeera,4,Into the Darkness,https://www.aljazeera.com/video/fault-lines/2026/7/2/into-the-darkness?traffic_source=rss
Al Jazeera,5,US job growth slows in June; hospitality sheds roles despite World Cup,https://www.aljazeera.com/economy/2026/7/2/us-job-growth-slows-in-june-hospitality-sheds-roles-despite-world-cup?traffic_source=rss
Al Jazeera,6,UK’s Starmer apologises for the state’s role in decades of forced adoptions,https://www.aljazeera.com/news/2026/7/2/uks-starmer-apologises-for-the-states-role-in-decades-of-forced-adoptions?traffic_source=rss
Al Jazeera,7,Who is Iranian oil tycoon Shamkhani whose ship is stranded in Hormuz?,https://www.aljazeera.com/news/2026/7/2/who-is-iranian-oil-tycoon-shamkhani-whose-ship-is-stranded-in-hormuz?traffic_source=rss
Al Jazeera,8,Man City sign Elliot Anderson from Forest in record British transfer,https://www.aljazeera.com/sports/2026/7/2/man-city-sign-elliot-anderson-from-forest-in-record-british-transfer?traffic_source=rss
Al Jazeera,9,"With Hormuz reopened, has the oil shortage turned into a glut?",https://www.aljazeera.com/news/2026/7/2/with-hormuz-reopened-has-the-oil-shortage-turned-into-a-glut?traffic_source=rss
Al Jazeera,10,Gaza’s first women’s amputee football team reclaims the pitch after war,https://www.aljazeera.com/video/newsfeed/2026/7/2/gazas-first-womens-amputee-football-team-reclaims-the-pitch-after-war?traffic_source=rss
Al Jazeera,11,Explosion in Damascus cafe causes casualties,https://www.aljazeera.com/video/newsfeed/2026/7/2/explosion-in-damascus-cafe-causes-casualties?traffic_source=rss
Al Jazeera,12,"Gaza war’s 1,000 days: 90% of strip ‘destroyed’, 80% ‘seized’ by Israel",https://www.aljazeera.com/news/2026/7/2/gaza-wars-1000-days-90-of-strip-destroyed-80-seized-by-israel?traffic_source=rss
Al Jazeera,13,"Why has Trump refused to renew the USMCA, and what will that mean?",https://www.aljazeera.com/news/2026/7/2/why-has-trump-refused-to-renew-the-usmca-and-what-will-that-mean?traffic_source=rss
Al Jazeera,14,German football has a bigger problem than a World Cup loss: Scapegoating,https://www.aljazeera.com/news/2026/7/2/german-football-has-a-bigger-problem-than-a-world-cup-loss-scapegoating?traffic_source=rss
Al Jazeera,15,From Alabama to Yosemite: 50 US places with Native American origins,https://www.aljazeera.com/features/longform/2026/7/2/from-alabama-to-yosemite-50-us-places-with-native-american-origins?traffic_source=rss
Al Jazeera,16,"What’s China’s new ethnic unity law, and what does it mean for minorities?",https://www.aljazeera.com/news/2026/7/2/whats-chinas-new-ethnic-unity-law-and-what-does-it-mean-for-minorities?traffic_source=rss
Al Jazeera,17,Syria explosion updates: Bomb blast kills 5 people in Damascus,https://www.aljazeera.com/news/liveblog/2026/7/2/syria-explosion-live-blast-rocks-damascus-as-authorities-investigate-cause?traffic_source=rss
Al Jazeera,18,"Portugal vs Croatia: FIFA World Cup – Ronaldo-Modric, prediction, team news",https://www.aljazeera.com/sports/2026/7/2/portugal-vs-croatia-world-cup-last-32-preview-prediction-team-news-ronald-modric?traffic_source=rss
Al Jazeera,19,At least six killed in explosion inside central Damascus cafe,https://www.aljazeera.com/news/2026/7/2/explosion-heard-in-syrias-capital-damascus-state-media?traffic_source=rss
Al Jazeera,20,Controversial penalty ends Senegal’s FIFA World Cup run against Belgium,https://www.aljazeera.com/sports/2026/7/2/controversial-penalty-ends-senegals-fifa-world-cup-run-against-belgium?traffic_source=rss
Associated Press,1,"Vatican excommunicates schismatic bishops and priests, and warns their followers",https://apnews.com/article/vatican-traditionalist-pope-latin-st-pius-6570c6bcc0784f4b9229e20bdec4e5aa
Associated Press,2,"Russia lands heavy strikes on Ukraine's capital, killing at least 21",https://apnews.com/article/russia-ukraine-war-kyiv-missile-drone-attack-384d5b6bcdfc6e7d8c18f25130332ef7
Associated Press,3,"Facing barbs and pressure from Trump, Europe's leaders close ranks",https://apnews.com/article/italy-europe-trump-meloni-iran-war-4567748bf998f158d99158068d978aad
Associated Press,4,"16 kids rescued from horrific conditions in run-down Ohio home, authorities say",https://apnews.com/article/children-abuse-home-deplorable-ohio-099cda8f0014adde4b87a7e86aeefe5f
Associated Press,5,Climber couple arrested after scaling Empire State Building antenna for apparent marriage proposal,https://apnews.com/article/empire-state-building-antenna-stunt-banner-68f02bde462ee033662f3e5939142559
Associated Press,6,"Taylor Swift and Travis Kelce to host their wedding Friday at Madison Square Garden, AP source says",https://apnews.com/article/taylor-swift-travis-kelce-wedding-madison-square-3496ff38f2f929084a62662ed52e471e
Associated Press,7,Trump flies on new Air Force One worth $400 million gifted by Qatar,https://apnews.com/article/trump-air-force-one-plane-qatar-8eb5da68e95d583b14811f85e62cbcd1
Associated Press,8,Ex-CIA Director John Brennan seeks court order requiring records from investigations be preserved,https://apnews.com/article/brennan-cia-russia-justice-department-investigation-0953e358307a391d6f1c0da14b18bf4e
Associated Press,9,Judge orders Pentagon to lift policy that journalists be accompanied by an escort,https://apnews.com/article/pentagon-media-restrictions-new-york-times-escort-51aa91ec706c5866bf1f6ac542a65f7b
Associated Press,10,Why are World Cup refs giving red cards to players covering their mouths when confronting opponents?,https://apnews.com/article/red-card-explainer-world-cup-778b58fe4d48ac2afc56f959fd76412f
Associated Press,11,U.S. beats Bosnia-Herzegovina 2-0 to advance to round of 16 and keep its World Cup dreams alive,https://apnews.com/article/world-cup-usmnt-bosnia-score-b78bdf42bf14d604d7b466aa58d33324
Associated Press,12,IOC says it will not give Olympic team status to Greenland and Faroe Islands,https://apnews.com/article/ioc-olympics-denmark-greenland-faroes-b2e88c1bcf0f4fdfe517013ba5e52b25
Associated Press,13,"Victor Willis, who co-founded the Village People and co-wrote 'Y.M.C.A.,' dies at 74",https://apnews.com/article/victor-willis-dies-0409f2baba4afa338f93ba98273e9539
Associated Press,14,Actor and activist Danny Glover says he has Alzheimer’s disease,https://apnews.com/article/danny-glover-alzheimers-disease-58a18ee4c2145feec17ab394fa355bdd
Associated Press,15,Movie Review: Millie Bobby Brown returns as Sherlock's sister in 'Enola Holmes 3',https://apnews.com/article/enola-holmes-3-review-ba70b583f080fa3aa909f755327c7b7f
Associated Press,16,"Crypto, real estate, watches: How Trump made over $1 billion last year",https://apnews.com/article/trump-finances-real-estate-crypto-bibles-golf-8b8b54fae333d1200f4c1b509991b544
Associated Press,17,US employers still reluctant to add many jobs as hiring slows in June,https://apnews.com/article/jobs-economy-hiring-labor-49c7a993b394e6ae3f801c8e3c0d39dd
Associated Press,18,"Federal Reserve Chair Warsh emphasizes political independence, signals focus on inflation",https://apnews.com/article/warsh-federal-reserve-inflation-interest-rate-18c005515444abd2043ad113c9849407
Associated Press,19,Last-minute launch problem delays satellite rescue mission for NASA,https://apnews.com/article/swift-nasa-katalyst-satellite-rescue-3c3c5858b865064134a480295567f7f6
Associated Press,20,FACT FOCUS: Iran claims a foreign ship got stuck in Strait of Hormuz. But it is tied to Tehran,https://apnews.com/article/iran-war-hormuz-grounded-ship-fact-check-d42c19cab5cfb5e4318732408550b7d6
