site,rank,title,link
Al Jazeera,1,Trump’s hefty tariff on Brazil expected to push the country towards China,https://www.aljazeera.com/economy/2025/7/23/trumps-hefty-tariff-on-brazil-expected-to-push-the-country-towards-china?traffic_source=rss
Al Jazeera,2,What can we expect as fire season ramps up in California?,https://www.aljazeera.com/news/2025/7/23/what-can-we-expect-as-fire-season-ramps-up-in-california?traffic_source=rss
Al Jazeera,3,Video: Iran’s president says country won’t abandon its nuclear programme,https://www.aljazeera.com/video/newsfeed/2025/7/23/video-irans-president-says-country-wont-abandon-its-nuclear-programme?traffic_source=rss
Al Jazeera,4,These countries condemn the Gaza war but have major ties to Israel,https://www.aljazeera.com/video/newsfeed/2025/7/23/these-countries-condemn-the-gaza-war-but-have-major-ties-to-israel?traffic_source=rss
Al Jazeera,5,"‘Unbearable’: Ukrainians deported by Russia, stranded at Georgia border",https://www.aljazeera.com/features/2025/7/23/unbearable-ukrainians-deported-by-russia-stranded-at-georgia-border?traffic_source=rss
Al Jazeera,6,"Sudan’s competing authorities are beholden to militia leaders, say analysts",https://www.aljazeera.com/features/2025/7/23/sudans-competing-authorities-are-beholden-to-militia-leaders?traffic_source=rss
Al Jazeera,7,Greek island residents stop Israeli cruise ship docking,https://www.aljazeera.com/video/newsfeed/2025/7/23/greek-island-residents-stop-israeli-cruise-ship-docking?traffic_source=rss
Al Jazeera,8,World Court hearing says climate change is ‘urgent and existential threat’,https://www.aljazeera.com/news/2025/7/23/world-court-hearing-says-climate-change-is-urgent-and-existential-threat?traffic_source=rss
Al Jazeera,9,Malaysia “calls on world leaders” to restrain Israel,https://www.aljazeera.com/video/quotable/2025/7/23/malaysia-calls-on-world-leaders-to-restrain-israel?traffic_source=rss
Al Jazeera,10,"Yes, The New York Times is committing genocidal journalism",https://www.aljazeera.com/opinions/2025/7/23/yes-the-new-york-times-is-committing-genocidal-journalism?traffic_source=rss
Al Jazeera,11,Aid groups warn of ‘mass starvation’ in Gaza,https://www.aljazeera.com/gallery/2025/7/23/aid-groups-warn-of-mass-starvation-in-gaza?traffic_source=rss
Al Jazeera,12,Palestinians in Gaza react to Israel’s ban on access to the sea,https://www.aljazeera.com/video/newsfeed/2025/7/23/palestinians-in-gaza-react-to-israels-ban-on-access-to-the-sea?traffic_source=rss
Al Jazeera,13,The night Iran struck Qatar,https://www.aljazeera.com/video/birds-eye-view/2025/7/23/the-night-iran-struck-qatar?traffic_source=rss
Al Jazeera,14,Video: Hundreds of Bedouin families evacuated from Syria’s Suwayda,https://www.aljazeera.com/video/newsfeed/2025/7/23/video-hundreds-of-bedouin-families-evacuated-from-syrias-suwayda?traffic_source=rss
Al Jazeera,15,Protesters target UN’s Guterres to stop Israel starving Gaza,https://www.aljazeera.com/video/newsfeed/2025/7/23/protesters-target-uns-guterres-to-stop-israel-starving-gaza?traffic_source=rss
Al Jazeera,16,"Russia set for Ukraine talks in Turkiye, says progress will be ‘difficult’",https://www.aljazeera.com/news/2025/7/23/russia-set-for-ukraine-talks-in-turkiye-says-progress-will-be-difficult?traffic_source=rss
Al Jazeera,17,More than 100 NGOs warn Israel’s forced ‘mass starvation’ stalks all Gaza,https://www.aljazeera.com/news/2025/7/23/more-than-100-ngos-warn-israels-forced-mass-starvation-stalks-all-gaza?traffic_source=rss
Al Jazeera,18,Israel targets women in Gaza “deliberately” to halt reproduction,https://www.aljazeera.com/video/quotable/2025/7/23/israel-targets-women-in-gaza-deliberately-to-halt-reproduction?traffic_source=rss
Al Jazeera,19,Protests in Ukraine as Zelenskyy signs bill curbing anticorruption agencies,https://www.aljazeera.com/gallery/2025/7/23/protests-in-ukraine-as-zelenskyy-signs-bill-curbing-anticorruption-agencies?traffic_source=rss
Al Jazeera,20,Japan’s PM Ishiba vows to stay in office despite election debacle,https://www.aljazeera.com/news/2025/7/23/japans-pm-ishiba-vows-to-stay-in-office-despite-election-debacle?traffic_source=rss
