site,rank,title,link
Al Jazeera,1,"Over 1,500 flights cancelled as winter storm Devin hits US holiday travel",https://www.aljazeera.com/news/2025/12/27/over-1500-flights-cancelled-as-winter-storm-devin-hits-us-holiday-travel?traffic_source=rss
Al Jazeera,2,"N Korea, Russia bound in ‘blood’ of war, Kim tells Putin in New Year note",https://www.aljazeera.com/news/2025/12/27/n-korea-russia-bound-in-blood-of-war-kim-tells-putin-in-new-year-note?traffic_source=rss
Al Jazeera,3,"Russia-Ukraine war: List of key events, day 1,402",https://www.aljazeera.com/news/2025/12/27/russia-ukraine-war-list-of-key-events-day-1402?traffic_source=rss
Al Jazeera,4,"Israeli forces kill Palestinian in Gaza, carry out raids across West Bank",https://www.aljazeera.com/news/2025/12/26/israeli-forces-kill-palestinian-in-gaza-carry-out-raids-across-west-bank?traffic_source=rss
Al Jazeera,5,Has the fight against al-Shabab failed?,https://www.aljazeera.com/video/inside-story/2025/12/26/has-the-fight-against-al-shabab-failed?traffic_source=rss
Al Jazeera,6,Israel attacks press as ‘silencing’ policy: Palestinian journalists union,https://www.aljazeera.com/news/2025/12/26/israel-attacks-press-as-silencing-policy-palestinian-journalists-union?traffic_source=rss
Al Jazeera,7,Keir Starmer says Egyptian-British activist Alaa Abd El-Fattah back in UK,https://www.aljazeera.com/news/2025/12/26/keir-starmer-says-egyptian-british-activist-alaa-abd-el-fattah-back-in-uk?traffic_source=rss
Al Jazeera,8,"Netanyahu pushes for Iran conflict, clashing with Trump’s priorities",https://www.aljazeera.com/news/2025/12/26/netanyahu-pushes-for-iran-conflict-clashing-with-trumps-priorities?traffic_source=rss
Al Jazeera,9,New York to require social media platforms to display mental health labels,https://www.aljazeera.com/news/2025/12/26/new-york-to-require-social-media-platforms-to-display-mental-health-labels?traffic_source=rss
Al Jazeera,10,Marco Rubio congratulates Honduran President-elect Nasry Asfura,https://www.aljazeera.com/news/2025/12/26/marco-rubio-congratulates-honduran-president-elect-nasry-asfura?traffic_source=rss
Al Jazeera,11,Salah seals Egypt qualification with win against South Africa at AFCON 2025,https://www.aljazeera.com/sports/2025/12/26/salah-seals-egypt-qualification-with-win-against-south-africa-at-afcon-2025?traffic_source=rss
Al Jazeera,12,What’s next for the global economy in 2026?,https://www.aljazeera.com/video/counting-the-cost/2025/12/26/whats-next-for-the-global-economy-in-2026?traffic_source=rss
Al Jazeera,13,Zelenskyy to meet Trump in Florida amid diplomatic push to end war,https://www.aljazeera.com/news/2025/12/26/zelenskyy-to-meet-trump-in-florida-amid-diplomatic-push-to-end-war?traffic_source=rss
Al Jazeera,14,"Tajikistan-Taliban border clashes: What’s behind them, why it affects China",https://www.aljazeera.com/news/2025/12/26/tajikistan-taliban-border-clashes-whats-behind-them-why-it-affects-china?traffic_source=rss
Al Jazeera,15,Israel becomes first country to recognise Somaliland,https://www.aljazeera.com/news/2025/12/26/israel-becomes-first-country-to-recognise-somaliland?traffic_source=rss
Al Jazeera,16,"Sabalenka vs Kyrgios: Battle of the Sexes – start time, rules, how to watch",https://www.aljazeera.com/sports/2025/12/26/sabalenka-vs-kyrgios-battle-of-the-sexes-start-time-rules-how-to-watch?traffic_source=rss
Al Jazeera,17,"Stabbing, chemical spray attack injures 15 at Japanese factory",https://www.aljazeera.com/news/2025/12/26/stabbing-chemical-spray-attack-injures-15-at-japanese-factory?traffic_source=rss
Al Jazeera,18,"Two people dead in stabbing, car-ramming attack in Israel",https://www.aljazeera.com/news/2025/12/26/two-people-dead-in-stabbing-car-ramming-attack-in-israel?traffic_source=rss
Al Jazeera,19,US bombs target ISIL in Nigeria: What’s really going on?,https://www.aljazeera.com/news/2025/12/26/us-bombs-target-isil-in-nigeria-whats-really-going-on?traffic_source=rss
Al Jazeera,20,"China sanctions 30 US firms, individuals over Taiwan weapons sales",https://www.aljazeera.com/news/2025/12/26/china-sanctions-30-us-firms-individuals-over-taiwan-weapons-sales?traffic_source=rss
Associated Press,1,Nigerian villagers are rattled by US airstrikes that made their homes shake and the sky glow red,https://apnews.com/article/nigeria-jabo-village-trump-us-airstrikes-d2795bbc099255d71f2c371c60832157
Associated Press,2,What to know about the militants targeted by US airstrikes in northwest Nigeria,https://apnews.com/article/trump-nigeria-military-strikes-sokoto-lakurawa-1fd77ce78e5d72ca776b788a762866fa
Associated Press,3,China sanctions 20 US defense companies and 10 executives over massive arms sales to Taiwan,https://apnews.com/article/china-sanctions-us-companies-arm-sale-taiwan-31e1bdef85a4cae9a765b189497ca3bf
Associated Press,4,US launches strikes against Islamic State group in Nigeria after attacks target Christians,https://apnews.com/article/trump-islamic-state-nigeria-43478823f0562cafc527fad1448a0542
Associated Press,5,Federal judge to hold hearing on whether Kilmar Abrego Garcia is being vindictively prosecuted,https://apnews.com/article/kilmar-abrego-garcia-ice-smuggling-trial-trump-0a19aa571222f3a22a5c5d1b59bb41ee
Associated Press,6,Hawaii's Big Island bans feeding feral cats in an effort to help endangered native species,https://apnews.com/article/hawaii-feral-cats-feeding-ban-native-species-cd69674cb23e0bdf1071d2aa141b8d70
Associated Press,7,Kennedy Center criticizes musician who canceled performance after Trump name added to building,https://apnews.com/article/kennedy-center-jazz-jam-canceled-993fdbcbadb34da635799012e7369452
Associated Press,8,Travis Kelce's emotional night at Arrowhead Stadium may be his last with retirement decision looming,https://apnews.com/article/kansas-city-chiefs-travis-kelce-c1f3237de662ca9f5448b541091ece1b
Associated Press,9,49ers host the Bears in a matchup of NFC playoff teams fighting for home-field advantage,https://apnews.com/article/bears-49ers-preview-91df87ef9b78015faf486e74b6a2a5e5
Associated Press,10,JJ Redick's kids write persuasive essays to earn their biggest Christmas gifts,https://apnews.com/article/jj-redick-lakers-christmas-gifts-28960781ecf39d15f24f7c530a702582
Associated Press,11,‘Heated Rivalry’ series mixes hockey and queer romance and is scoring big audiences,https://apnews.com/article/heated-rivalry-hockey-romance-801f41aec6cc476a12fe1a670ea68a22
Associated Press,12,Tyler Perry sued for sexual assault by 'Boo! A Madea Halloween' actor seeking $77 million,https://apnews.com/article/tyler-perry-sexual-assault-lawsuit-actor-6da2f1833b43fd4192cdac52dc7c3c63
Associated Press,13,New York Knicks star Karl-Anthony Towns and influencer Jordyn Woods are engaged,https://apnews.com/article/jordyn-woods-karlanthony-towns-engaged-b156a871912f3f972bd43f1fff16bd9b
Associated Press,14,"Trump overturned decades of US trade policy in 2025. See the impact of his tariffs, in four charts",https://apnews.com/article/trump-tariffs-economy-liberation-day-d3458da225c1fdfade97ed494b23e868
Associated Press,15,Stocks close slightly lower in quiet post-Christmas trading,https://apnews.com/article/stocks-markets-japan-gold-trump-b7cbbbf8f21baa5079888124a13703e8
Associated Press,16,Trump launched global tariff wars in 2025. Here's a recap of his trade actions this year,https://apnews.com/article/trump-tariffs-timeline-economy-2b10860dfdb2a5d9c3c4527136314992
Associated Press,17,Raccoon goes on drunken rampage in Virginia liquor store and passes out on bathroom floor,https://apnews.com/article/drunk-raccoon-liquor-store-bandit-virginia-5109feb2ea9ab9bf8954ec3798689fd0
Associated Press,18,Baltimore cyclist finds joy in collecting lost hubcaps and stringing them into art,https://apnews.com/article/hubcap-artist-bicyclist-joy-wonder-4d1d40064d3853153d931f1a25526d84
Associated Press,19,A humpback whale briefly swallows kayaker in Chilean Patagonia — and it's all captured on camera,https://apnews.com/article/chile-kayaking-tourism-whale-b0cafde4b640326f20a9da28003d6c26
Associated Press,20,An elephant family smashed pumpkins at the Oregon Zoo. But this baby just wanted to play ball,https://apnews.com/article/elephant-pumpkin-smash-video-portland-oregon-zoo-1e942f8379ee099847254c6811ba0c29
