site,rank,title,link
Al Jazeera,1,"Real Madrid beat Salzburg to meet Juventus, Man City get Al Hilal",https://www.aljazeera.com/sports/2025/6/27/real-madrid-beat-salzburg-to-meet-juventus-man-city-get-al-hilal?traffic_source=rss
Al Jazeera,2,"Russia-Ukraine war: List of key events, day 1,219",https://www.aljazeera.com/news/2025/6/27/russia-ukraine-war-list-of-key-events-day-1219?traffic_source=rss
Al Jazeera,3,Brazil announces compensation for dictatorship victim Vladimir Herzog,https://www.aljazeera.com/news/2025/6/27/brazil-announces-compensation-for-dictatorship-victim-vladimir-herzog?traffic_source=rss
Al Jazeera,4,UN reports uptick in preventable diseases in Gaza due to Israeli blockade,https://www.aljazeera.com/news/2025/6/26/un-reports-uptick-in-preventable-diseases-in-gaza-due-to-israeli-blockade?traffic_source=rss
Al Jazeera,5,‘We wanted to eliminate Khamenei’: Israel’s Defence Minister Katz,https://www.aljazeera.com/news/2025/6/26/we-wanted-to-eliminate-khamenei-israels-defence-minister?traffic_source=rss
Al Jazeera,6,Man City hit Juventus for five at FIFA Club World Cup,https://www.aljazeera.com/sports/2025/6/26/man-city-hit-juventus-for-five-at-fifa-club-world-cup?traffic_source=rss
Al Jazeera,7,US government plans to deport Abrego Garcia to a third country: Prosecutors,https://www.aljazeera.com/news/2025/6/26/us-government-plans-to-deport-abrego-garcia-to-a-third-country-prosecutors?traffic_source=rss
Al Jazeera,8,At least 16 killed during anti-government protests in Kenya,https://www.aljazeera.com/video/newsfeed/2025/6/26/at-least-16-killed-during-anti-government-protests-in-kenya?traffic_source=rss
Al Jazeera,9,Trump administration launches probe into University of California system,https://www.aljazeera.com/news/2025/6/26/trump-administration-launches-probe-into-university-of-california-system?traffic_source=rss
Al Jazeera,10,How big is Zohran Mamdani’s win in New York primary?,https://www.aljazeera.com/video/inside-story/2025/6/26/how-big-is-zohran-mamdanis-win-in-new-york-primary?traffic_source=rss
Al Jazeera,11,"Boxing: Jake Paul vs Chavez Jr: Start time, fight card and how to watch",https://www.aljazeera.com/sports/2025/6/26/boxing-jake-paul-vs-chavez-jr-start-time-fight-card-and-how-to-watch?traffic_source=rss
Al Jazeera,12,"EU calls for Gaza ceasefire, stops short of taking action against Israel",https://www.aljazeera.com/news/2025/6/26/divided-eu-summit-backs-off-from-pressurising-israel-over-gaza?traffic_source=rss
Al Jazeera,13,"‘Feels like heaven’: Iranians return to Tehran, uncertain of future",https://www.aljazeera.com/features/2025/6/26/feels-like-heaven-iranians-return-to-tehran-uncertain-of-future?traffic_source=rss
Al Jazeera,14,US Secretary of Defense attacks media for questioning Iran strikes,https://www.aljazeera.com/video/newsfeed/2025/6/26/us-secretary-of-defense-attacks-media-for-questioning-iran-strikes?traffic_source=rss
Al Jazeera,15,Prosecutors say Diddy used power to abuse women in closing remarks of trial,https://www.aljazeera.com/news/2025/6/26/prosecutors-say-diddy-used-power-to-abuse-women-in-closing-remarks-of-trial?traffic_source=rss
Al Jazeera,16,"Russia, Ukraine confirm prisoner swap after Turkiye talks",https://www.aljazeera.com/news/2025/6/26/russia-ukraine-confirm-prisoner-swap-after-turkiye-talks?traffic_source=rss
Al Jazeera,17,How Israel launched attacks from inside Iran to sow chaos during war,https://www.aljazeera.com/news/2025/6/26/how-israel-launched-attacks-from-inside-iran-to-sow-chaos-during-the-war?traffic_source=rss
Al Jazeera,18,Pope Leo decries ‘shameful’ disregard for international law,https://www.aljazeera.com/news/2025/6/26/pope-leo-decries-shameful-disregard-for-international-law?traffic_source=rss
Al Jazeera,19,"While the world watched Iran and Israel, what happened in Gaza?",https://www.aljazeera.com/video/the-take-2/2025/6/26/pal_gazacontinues_av_v2-260625?traffic_source=rss
Al Jazeera,20,Searching for healing: Inside one of the last hospitals in Haiti’s capital,https://www.aljazeera.com/news/longform/2025/6/26/searching-for-healing-inside-one-of-the-last-hospitals-in-haitis-capital?traffic_source=rss
