site,rank,title,link
Al Jazeera,1,‘A paper city’: New York ‘library’ hosts 3.5 million pages of Epstein files,https://www.aljazeera.com/features/2026/5/24/a-paper-city-new-york-library-hosts-3-5-million-pages-of-epstein-files?traffic_source=rss
Al Jazeera,2,China sends aid to Cuba amid a harsh US blockade,https://www.aljazeera.com/video/newsfeed/2026/5/24/china-sends-aid-to-cuba-amid-a-harsh-us-blockade?traffic_source=rss
Al Jazeera,3,Bahrain jails nine defendants for life for ‘cooperating’ with Iran’s IRGC,https://www.aljazeera.com/news/2026/5/24/bahrain-jails-nine-defendants-for-life-for-cooperating-with-irans-irgc?traffic_source=rss
Al Jazeera,4,France bans Ben-Gvir: Which other Israeli leaders have been penalised?,https://www.aljazeera.com/news/2026/5/24/france-bans-ben-gvir-which-other-israeli-leaders-have-been-penalised?traffic_source=rss
Al Jazeera,5,"For third year in a row, Israel blocks Hajj pilgrimage for Gaza Muslims",https://www.aljazeera.com/news/2026/5/24/for-third-year-in-a-row-israel-blocks-hajj-pilgrimage-for-gaza-muslims?traffic_source=rss
Al Jazeera,6,Syria cannot heal without a rebuilt health system,https://www.aljazeera.com/opinions/2026/5/24/syria-cannot-heal-without-a-rebuilt-health?traffic_source=rss
Al Jazeera,7,‘We won’t know who won until final outcome of US-Iran ceasefire’,https://www.aljazeera.com/video/newsfeed/2026/5/24/we-wont-know-who-won-until-final-outcome-of-us-iran?traffic_source=rss
Al Jazeera,8,Will the Texas primary run-off give Democrats a chance to flip the state?,https://www.aljazeera.com/news/2026/5/24/will-the-texas-primary-run-off-give-democrats-a-chance-to-flip-the-state?traffic_source=rss
Al Jazeera,9,Iran hints US will end war in ‘Persian-style’ peace on Tehran’s terms,https://www.aljazeera.com/video/newsfeed/2026/5/24/iran-hints-us-will-end-war-in-persian-style-peace-on-tehrans-terms?traffic_source=rss
Al Jazeera,10,Suicide car bombing attack on a train in Pakistan kills dozens,https://www.aljazeera.com/video/newsfeed/2026/5/24/suicide-car-bombing-attack-on-a-train-in-pakistan-kills-dozens?traffic_source=rss
Al Jazeera,11,"Blast hits train in Pakistan’s Balochistan, killing at least 24 people",https://www.aljazeera.com/gallery/2026/5/24/blast-hits-train-in-pakistans-balochistan-killing-at-least-24-people?traffic_source=rss
Al Jazeera,12,Clashes in Belgrade as student-led protests demand elections,https://www.aljazeera.com/gallery/2026/5/24/clashes-in-belgrade-as-student-led-protests-demand-elections?traffic_source=rss
Al Jazeera,13,"Israeli attack on Gaza kills three family members, including infant",https://www.aljazeera.com/news/2026/5/24/israeli-attack-on-gaza-kills-three-family-members-including-infant?traffic_source=rss
Al Jazeera,14,The GCC should insure itself against the next Strait of Hormuz crisis,https://www.aljazeera.com/opinions/2026/5/24/the-gcc-should-insure-itself-against-the-next-strait-of-hormuz-crisis?traffic_source=rss
Al Jazeera,15,Cape Verde at World Cup 2026: What to know,https://www.aljazeera.com/sports/2026/5/24/what-to-know-about-cape-verde-at-world-cup-2026?traffic_source=rss
Al Jazeera,16,Iran war day 86: Trump announces potential deal amid ‘cloud of mistrust’,https://www.aljazeera.com/news/2026/5/24/iran-war-day-86-trump-announces-potential-deal-amid-cloud-of-mistrust?traffic_source=rss
Al Jazeera,17,Senegal football fans return home after royal pardon in Morocco,https://www.aljazeera.com/sports/2026/5/24/senegal-football-fans-return-home-after-royal-pardon-in-morocco?traffic_source=rss
Al Jazeera,18,Trump says no rush on Iran deal as Tehran asserts Hormuz ‘legal right’,https://www.aljazeera.com/news/2026/5/24/marco-rubio-says-significant-progress-made-in-us-iran-talks-to-end-war?traffic_source=rss
Al Jazeera,19,"US, Iran inch closer to deal to end the war: What to know",https://www.aljazeera.com/news/2026/5/24/us-iran-inch-closer-to-deal-to-end-the-war-what-to-know?traffic_source=rss
Al Jazeera,20,Russia pounds Ukraine’s capital with hypersonic missile,https://www.aljazeera.com/video/newsfeed/2026/5/24/russia-pounds-ukraines-capital-with-hypersonic-missile?traffic_source=rss
Associated Press,1,Trump says a deal with Iran and opening of Strait of Hormuz are 'largely negotiated',https://apnews.com/article/iran-united-states-war-ceasefire-negotiations-hormuz-1c283f26d037102cc5e6f798546d0e59
Associated Press,2,Details emerge of a potential Iran deal as Trump says not to rush,https://apnews.com/article/iran-us-war-ceasefire-negotiations-hormuz-e603a7759d6cbd70ce5ed01f439a29dc
Associated Press,3,Russia uses hypersonic Oreshnik missile in mass attack on Kyiv,https://apnews.com/article/russia-ukraine-war-kyiv-missile-drone-attack-998aeaab5833ca397290d9ee2737b0e5
Associated Press,4,"Southern California chemical tank at risk of exploding as 40,000 residents are ordered to evacuate",https://apnews.com/article/california-chemical-tank-leak-c1f922cae0ddb142857d12aee08d2d6b
Associated Press,5,Travel industry worries after Trump administration reiterates threat to sanctuary city airports,https://apnews.com/article/sanctuary-cities-mullin-trump-flights-screening-cbp-380519008d0dc995e4c0a6dee0b79033
Associated Press,6,"Southern California chemical tank at risk of exploding as 50,000 residents are ordered to evacuate",https://apnews.com/article/california-chemical-tank-leak-evacuation-8dca2190fef3db508b9aa218e82d2b9e
Associated Press,7,"Suspect dead after opening fire near White House security checkpoint, Secret Service says",https://apnews.com/article/white-house-gunshots-lockdown-secret-service-trump-204c429ab3888b3d0921cf724e0c0474
Associated Press,8,Trump's Justice Department scrubs its website of news releases about Jan. 6 defendants,https://apnews.com/article/justice-department-capitol-riot-news-releases-purged-29c580044a9ed27b643c99feac9e2964
Associated Press,9,This congressman's family was swept up in WWII Japanese detention. He sees a repeat in today's raids,https://apnews.com/article/trump-immigration-deportation-japanese-world-war-ii-efb38637a24fe6c8d20647d660900b06
Associated Press,10,"Kyle Busch died after severe pneumonia progressed into sepsis, his family says",https://apnews.com/article/kyle-busch-cause-of-death-d198c16d4cb7e383b7c7e16f6ba471aa
Associated Press,11,Life of A Basketball Fan: Taylor Swift attends Cavs-Knicks in Cleveland with fiance Travis Kelce,https://apnews.com/article/knicks-cavaliers-taylor-swift-b7bcad6e7a9deff4646b6a19bf256b7f
Associated Press,12,Iran's soccer federation says team's World Cup base camp has been moved to Mexico from the US,https://apnews.com/article/iran-world-cup-mexico-d787422e4f946a25a2a25f45a87b21e8
Associated Press,13,Stephen Colbert is back on TV on community access in Michigan along with rocker Jack White,https://apnews.com/article/stephen-colbert-jack-white-michigan-community-access-eec9f903b2868c251baff9e885dd4c59
Associated Press,14,America In Focus: mortgage rate rises while Wall Street looks to continue its winning ways,https://apnews.com/article/wall-street-retail-consumers-f3cc8d13bb9ccb5457d3e08a2c4d853a
Associated Press,15,Could anything but profit steer AI? The OpenAI trial offered clues but no verdict,https://apnews.com/article/openai-trial-musk-altman-ipo-776743f032d8e5ac4faf85088db8bfc0
Associated Press,16,Lettuce introduce you to the live frog found in this grocery store salad bag,https://apnews.com/article/australia-frog-lettuce-salad-esperance-4134acf75e814dedd7789c1423c26ab1
Associated Press,17,"Nipper, stay! The future of a beloved dog statue on a New York warehouse is up in the air",https://apnews.com/article/nipper-dog-statue-albany-new-york-69a5ca4ec514f837626475b5d5264c1d
Associated Press,18,Viral phenomenon in Argentina has young people identifying themselves as animals,https://apnews.com/article/argentina-teenagers-identifying-as-animals-therians-tiktok-54d158c4842f6515e31d83a260cdf31f
Associated Press,19,A humpback whale briefly swallows kayaker in Chilean Patagonia — and it's all captured on camera,https://apnews.com/article/chile-kayaking-tourism-whale-b0cafde4b640326f20a9da28003d6c26
Associated Press,20,Double-swiping the rewards card led to free gas for months — and a felony theft charge,https://apnews.com/article/gas-pump-glitch-28000-nebraska-29f36cfa9846e18daea309b79145c5b7
