site,rank,title,link
Al Jazeera,1,"Chelsea vs Palmeiras: FIFA Club World Cup – teams, start time, lineup",https://www.aljazeera.com/sports/2025/7/3/chelsea-vs-palmeiras-fifa-club-world-cup-teams-start-time-lineup?traffic_source=rss
Al Jazeera,2,Solid US job numbers mask weakness underneath,https://www.aljazeera.com/economy/2025/7/3/solid-us-job-numbers-mask-weakness-underneath?traffic_source=rss
Al Jazeera,3,"Israeli drone attack near Beirut kills at least one, injures three others",https://www.aljazeera.com/news/2025/7/3/israeli-drone-attack-near-beirut-kills-at-least-one-injures-three-others?traffic_source=rss
Al Jazeera,4,Will Gaza finally get a ceasefire?,https://www.aljazeera.com/video/the-bottom-line/2025/7/3/will-gaza-finally-get-a-ceasefire?traffic_source=rss
Al Jazeera,5,Did Democrat Zohran Mamdani struggle with Black and working-class voters?,https://www.aljazeera.com/news/2025/7/3/did-democrat-zohran-mamdani-struggle-with-black-and-working-class-voters?traffic_source=rss
Al Jazeera,6,Water For Data,https://www.aljazeera.com/video/people-power/2025/7/3/water-for-data?traffic_source=rss
Al Jazeera,7,Fact-checking Trump’s immigration and One Big Beautiful Bill claims,https://www.aljazeera.com/features/2025/7/3/fact-checking-trumps-immigration-and-one-big-beautiful-bill-claims?traffic_source=rss
Al Jazeera,8,"Iran says it is committed to NPT, slams Germany’s support for Israel",https://www.aljazeera.com/news/2025/7/3/iran-says-it-is-committed-to-npt-slams-germanys-support-for-israel?traffic_source=rss
Al Jazeera,9,Diogo Jota: What happened to the Liverpool and Portugal football star?,https://www.aljazeera.com/sports/2025/7/3/diogo-jota-what-happened-to-the-liverpool-and-portugal-football-star?traffic_source=rss
Al Jazeera,10,"After backing Israel, Iran’s self-styled crown prince loses support",https://www.aljazeera.com/features/2025/7/3/son-of-former-shah-loses-credibility-after-justifying-israels-war-on-iran?traffic_source=rss
Al Jazeera,11,Did a humanitarian aid operation turn into a “killing field”?,https://www.aljazeera.com/video/by-the-numbers-3/2025/7/3/did-a-humanitarian-aid-operation-turn-into-a-killing-field?traffic_source=rss
Al Jazeera,12,The victims of Israel’s attack on a Gaza beach cafe,https://www.aljazeera.com/video/newsfeed/2025/7/3/the-victims-of-israels-attack-on-a-gaza-beach-cafe?traffic_source=rss
Al Jazeera,13,"Deputy head of Russian navy killed by Ukraine in Kursk, Moscow says",https://www.aljazeera.com/news/2025/7/3/deputy-head-of-russian-navy-killed-by-ukraine-in-kursk-moscow-says?traffic_source=rss
Al Jazeera,14,US contractors say live rounds are being shot at Gaza aid seekers,https://www.aljazeera.com/video/newsfeed/2025/7/3/us-contractors-say-live-rounds-are-being-shot-at-gaza-aid-seekers?traffic_source=rss
Al Jazeera,15,Iran releases video of Israeli strike on Tehran in June,https://www.aljazeera.com/video/newsfeed/2025/7/3/iran-releases-video-of-israeli-strike-on-tehran-in-june?traffic_source=rss
Al Jazeera,16,Ethiopia’s PM Abiy Ahmed says mega dam GERD on the Nile ‘now complete’,https://www.aljazeera.com/news/2025/7/3/ethiopias-pm-abiy-ahmed-says-mega-dam-gerd-on-the-nile-now-complete?traffic_source=rss
Al Jazeera,17,Video: UN expert rails against ‘economy of genocide’,https://www.aljazeera.com/video/newsfeed/2025/7/3/video-un-expert-rails-against-economy-of?traffic_source=rss
Al Jazeera,18,Sinaloa Cartel member talks to Al Jazeera about faction war,https://www.aljazeera.com/video/newsfeed/2025/7/3/sinaloa-cartel-member-talks-to-al-jazeera-about-faction-war?traffic_source=rss
Al Jazeera,19,US-Japan trade deal – will this one be too tricky for Trump?,https://www.aljazeera.com/economy/2025/7/3/us-japan-trade-deal-will-this-one-be-too-tricky-for-trump?traffic_source=rss
Al Jazeera,20,"Wildfire on Greek island of Crete forces evacuation of 1,500",https://www.aljazeera.com/news/2025/7/3/wildfire-on-greek-island-of-crete-forces-evacuation-of-1500?traffic_source=rss
