site,rank,title,link
Al Jazeera,1,"Ukrainian drone attacks hit multiple Russian targets, including refinery",https://www.aljazeera.com/news/2026/5/31/ukrainian-drone-attacks-hit-multiple-russian-targets-including-refinery?traffic_source=rss
Al Jazeera,2,"Trump tightens terms on Iran war deal, US media say",https://www.aljazeera.com/news/2026/5/31/trump-tightens-terms-on-iran-war-deal-us-media-say?traffic_source=rss
Al Jazeera,3,"Israel issues more displacement orders in Lebanon, seizes strategic castle",https://www.aljazeera.com/news/2026/5/31/israel-issues-more-displacement-orders-in-lebanon-seizes-strategic-castle?traffic_source=rss
Al Jazeera,4,"The strait may reopen, but global confidence may not return",https://www.aljazeera.com/opinions/2026/5/31/the-strait-may-reopen-but-global-confidence-may-not-return?traffic_source=rss
Al Jazeera,5,Iran war day 93: Trump won’t ‘rush’ deal; Israel expands Lebanon invasion,https://www.aljazeera.com/news/2026/5/31/iran-war-day-93-trump-wont-rush-deal-israel-expands-lebanon-invasion?traffic_source=rss
Al Jazeera,6,Holder Gauff beaten by Potapova; Sabalenka solid at French Open,https://www.aljazeera.com/sports/2026/5/31/holder-gauff-beaten-by-potapova-sabalenka-solid-at-french-open?traffic_source=rss
Al Jazeera,7,"Missing Syrian chess champion’s children likely dead, authorities say",https://www.aljazeera.com/news/2026/5/31/missing-syrian-chess-champions-children-likely-dead-authorities-say?traffic_source=rss
Al Jazeera,8,Panic on beach in northern Israel during Hezbollah strikes,https://www.aljazeera.com/video/newsfeed/2026/5/31/panic-on-beach-in-northern-israel-during-hezbollah-strikes?traffic_source=rss
Al Jazeera,9,France arrests hundreds of rioters nationwide as PSG win Champions League,https://www.aljazeera.com/sports/2026/5/31/france-arrests-hundreds-of-rioters-nationwide-as-psg-win-champions-league?traffic_source=rss
Al Jazeera,10,Mexico beat Australia 1-0 before World Cup squad submission deadline,https://www.aljazeera.com/sports/2026/5/31/mexico-beat-australia-1-0-a-day-before-world-cup-squad-submission-deadline?traffic_source=rss
Al Jazeera,11,Wembanyama’s Spurs dethrone Thunder to reach NBA Finals against Knicks,https://www.aljazeera.com/sports/2026/5/31/wembanyamas-spurs-dethrone-thunder-to-reach-nba-finals-against-knicks?traffic_source=rss
Al Jazeera,12,How Nigeria’s ‘algorithmic apothecary’ fuels a surge in risky herbal cures,https://www.aljazeera.com/news/2026/5/31/how-nigerias-algorithmic-apothecary-fuels-a-surge-in-risky-herbal-cures?traffic_source=rss
Al Jazeera,13,The world hit a 44-year high in executions,https://www.aljazeera.com/video/by-the-numbers-3/2026/5/31/the-world-hit-a-44-year-high-in-executions?traffic_source=rss
Al Jazeera,14,Thousands in Peru protest Fujimori presidential run,https://www.aljazeera.com/video/newsfeed/2026/5/31/aje-onl-nf_clip-thousands-in-peru-protest-fujimori-run-300526?traffic_source=rss
Al Jazeera,15,Emotional scenes as more survivors pulled from flooded Laos cave,https://www.aljazeera.com/video/newsfeed/2026/5/31/aje-onl-nf_more-survivors-pulled-from-flooded-laos-cave-300526?traffic_source=rss
Al Jazeera,16,Rescues in eastern Syria after the Euphrates River bursts its banks,https://www.aljazeera.com/video/newsfeed/2026/5/31/rescues-in-eastern-syria-after-the-euphrates-river-bursts-its-banks?traffic_source=rss
Al Jazeera,17,Iran war live: Lebanon slams Israel’s invasion; US-Tehran deal in limbo,https://www.aljazeera.com/news/liveblog/2026/5/31/iran-war-live-lebanon-accuses-israel-of-scorched-earth-policy?traffic_source=rss
Al Jazeera,18,Congress advances US-Israeli military integration plan,https://www.aljazeera.com/news/2026/5/30/us-congress-advances-american-israeli-military-integration-plan?traffic_source=rss
Al Jazeera,19,Al Jazeera exclusive interview with rebel FARC faction in Colombia,https://www.aljazeera.com/video/newsfeed/2026/5/30/al-jazeera-exclusive-interview-with-rebel-farc-faction-in-colombia?traffic_source=rss
Al Jazeera,20,Lebanese army ‘overly stretched’ to fight off latest Israeli invasion,https://www.aljazeera.com/video/newsfeed/2026/5/30/lebanese-army-overly-stretched-to-fight-off-latest-israeli-invasion?traffic_source=rss
Associated Press,1,US says it struck a commercial ship trying to breach blockade and reach Iran,https://apnews.com/article/iran-united-states-war-hormuz-ceasefire-aeea91e1d1682e7e22321512e6e4aa35
Associated Press,2,"Rescuers free 4 men who had been trapped in a flooded Laos cave, search for 2 still missing",https://apnews.com/article/laos-cave-flood-xaisomboun-rescue-7e6012ce69b01d78e0af447f95ed739e
Associated Press,3,"Trump sends senior US diplomat to Haiti and Dominican Republic for talks on security, economy",https://apnews.com/article/haiti-dominican-republic-landau-visit-gangs-4aba5a24664de1e22badaa23b9bb8a1f
Associated Press,4,Crash kills 5 in Virginia including family of 4 traveling to wedding. Bus driver charged,https://apnews.com/article/virginia-bus-crash-family-deaths-c876a390609b6e66cb70020f8f715362
Associated Press,5,DOJ seeks recusal of judge from Georgia election case over reported attendance at Fani Willis event,https://apnews.com/article/atlanta-judge-eleanor-ross-b7cf80120d26fcbf7877f74837071a4b
Associated Press,6,United Airlines flight bound for Minneapolis is diverted because of an unruly passenger,https://apnews.com/article/united-flight-diverted-unruly-passenger-18b7fd62a68e5ab9753e893e5cc1faa8
Associated Press,7,Capitol rioters clamor for payouts from Trump's new 'anti-weaponization' fund despite backlash,https://apnews.com/article/trump-capitol-riot-settlement-fund-payouts-crimes-0a46024bd86b84d12ede1c2e34bb8507
Associated Press,8,Trump vents about judge who blocked the Kennedy Center renovation and fumes over his legal setbacks,https://apnews.com/article/trump-kennedy-center-renovations-closure-fe5ff0982cf44bd71b84dc475f839cbd
Associated Press,9,Trump to headline 'Great American State Fair' for nation's 250th anniversary after artists drop out,https://apnews.com/article/trump-fair-250-anniversary-great-american-musicians-66bae27bc720c6882d8e73ce4a81efe6
Associated Press,10,Thunder to be shorthanded again for Game 7 against Spurs in West finals,https://apnews.com/article/spurs-thunder-nba-playoffs-game-7-f670968cb7500d550242ae4973507092
Associated Press,11,Coco Gauff's French Open title defense ends while Naomi Osaka's fashion show continues in Paris,https://apnews.com/article/french-open-roland-garros-6a334d4f0be059f8bd1ff84f58b05251
Associated Press,12,"Frankie Valli cancels the remainder of the Four Seasons’ farewell tour, citing health concerns",https://apnews.com/article/frankie-valli-four-seasons-farewell-tour-canceled-52860b76a6d00b298c3b2bbd9986f859
Associated Press,13,Trump plans to appeal order allowing all importers that paid struck-down tariffs to seek refunds,https://apnews.com/article/tariff-refunds-trump-court-appeal-7209128eeee29c565c4ea5a6892f73c6
Associated Press,14,America In Focus: Inflation gauge hits multiyear high as American consumer confidence slides,https://apnews.com/article/inflation-economy-gas-trump-mortgage-iran-unemployment-618324105c9f0dc322f54ef8923a3d63
Associated Press,15,"China’s factory activity slows in May, raising questions over its economy",https://apnews.com/article/china-manufacturing-economy-pmi-exports-783cddb4560c1ecf53b1678801cabf34
Associated Press,16,"Meteor over Massachusetts causes explosion reports, sightings from Delaware to Montreal",https://apnews.com/article/meteor-boom-massachusetts-explosion-2b79039c94af28e4b63aaeabf06c6844
Associated Press,17,Lettuce introduce you to the live frog found in this grocery store salad bag,https://apnews.com/article/australia-frog-lettuce-salad-esperance-4134acf75e814dedd7789c1423c26ab1
Associated Press,18,An airport security dog sniffed out something really unusual in a passenger's luggage,https://apnews.com/article/mummified-monkeys-boston-airport-bushmeat-ee8ad474fd9b6462d661cc993675f3bc
Associated Press,19,Viral phenomenon in Argentina has young people identifying themselves as animals,https://apnews.com/article/argentina-teenagers-identifying-as-animals-therians-tiktok-54d158c4842f6515e31d83a260cdf31f
Associated Press,20,Happy is an Asian elephant. But is she also a person?,https://apnews.com/article/bronx-zoo-elephant-personhood-2622a60362cefcedb52680c0f0c72743
