site,rank,title,link
Al Jazeera,1,India launches attacks on several sites in Pakistan,https://www.aljazeera.com/news/2025/5/6/india-launches-attacks-on-several-sites-in-pakistan?traffic_source=rss
Al Jazeera,2,Conclave explained: How is the next pope chosen?,https://www.aljazeera.com/program/newsfeed/2025/5/6/conclave-explained-how-is-the-next-pope-chosen?traffic_source=rss
Al Jazeera,3,Israel says Sanaa airport ‘fully disabled’ in strikes on Yemen’s capital,https://www.aljazeera.com/video/newsfeed/2025/5/6/israel-says-sanaa-airport-fully-disabled-in-strikes-on-yemens-capital?traffic_source=rss
Al Jazeera,4,Key takeaways from Donald Trump’s meeting with Canada’s PM Mark Carney,https://www.aljazeera.com/news/2025/5/6/key-takeaways-from-donald-trumps-meeting-with-canadas-pm-mark-carney?traffic_source=rss
Al Jazeera,5,Canada’s Carney rejects Trump’s ‘51st state’ talk in Oval Office,https://www.aljazeera.com/program/newsfeed/2025/5/6/canadas-carney-rejects-trumps-51st-state-talk-in-oval-office?traffic_source=rss
Al Jazeera,6,Trump says bombing of Yemen to stop as Oman confirms US-Houthi ceasefire,https://www.aljazeera.com/news/2025/5/6/trump-says-bombing-of-yemen-to-stop-as-oman-confirms-us-houthi-ceasefire?traffic_source=rss
Al Jazeera,7,Palestine and the decline of the US empire,https://www.aljazeera.com/opinions/2025/5/6/palestine-and-the-decline-of-the-us-empire?traffic_source=rss
Al Jazeera,8,Pakistan blames India after seven soldiers killed in Balochistan blast,https://www.aljazeera.com/news/2025/5/6/pakistan-blames-india-after-seven-soldiers-killed-in-balochistan-blast?traffic_source=rss
Al Jazeera,9,Canada trade shifts away from US amid trade tensions,https://www.aljazeera.com/economy/2025/5/6/canada-trade-shifts-away-from-us-amid-trade-tensions?traffic_source=rss
Al Jazeera,10,"India, UK agree ‘historic’ trade deal including tariff cuts",https://www.aljazeera.com/news/2025/5/6/india-uk-agree-historic-trade-deal-including-tariff-cuts?traffic_source=rss
Al Jazeera,11,Merz elected German Chancellor by parliament after initial defeat,https://www.aljazeera.com/program/newsfeed/2025/5/6/merz-elected-german-chancellor-by-parliament-after-initial-defeat?traffic_source=rss
Al Jazeera,12,Yemen’s Houthis vow retaliation after Israeli attacks on Sanaa,https://www.aljazeera.com/news/2025/5/6/israeli-strikes-rock-yemens-sanaa-including-international-airport?traffic_source=rss
Al Jazeera,13,‘No safety guarantee’: Could Ukrainian drones target Putin’s Victory Day?,https://www.aljazeera.com/news/2025/5/6/no-safety-guarantee-could-ukrainian-drones-target-putins-victory-day?traffic_source=rss
Al Jazeera,14,"PSG vs Arsenal – UEFA Champions League: Start time, team news, lineups",https://www.aljazeera.com/sports/2025/5/6/psg-vs-arsenal-uefa-champions-league-start-time-team-news-lineups?traffic_source=rss
Al Jazeera,15,Germany’s Merz elected chancellor in second round of voting,https://www.aljazeera.com/news/2025/5/6/germanys-merz-elected-chancellor-in-second-round-vote?traffic_source=rss
Al Jazeera,16,"What are the Piprahwa gems, and why is India trying to stop their auction?",https://www.aljazeera.com/news/2025/5/6/what-are-the-piprahwa-gems-and-why-is-india-trying-to-stop-their?traffic_source=rss
Al Jazeera,17,"Seeking funds to rebuild, Lebanon government works to regain donor trust",https://www.aljazeera.com/news/2025/5/6/lebanon-government-works-to-regain-donor-trust-secure-reconstruction-funds?traffic_source=rss
Al Jazeera,18,How much of what’s inside a US home is actually “Made in America”?,https://www.aljazeera.com/video/by-the-numbers-3/2025/5/6/how-much-of-whats-inside-a-us-home-is-actually-made-in-america?traffic_source=rss
Al Jazeera,19,What we know about Israel’s new plan for Gaza,https://www.aljazeera.com/program/newsfeed/2025/5/6/what-we-know-about-israels-new-plan-for-gaza?traffic_source=rss
Al Jazeera,20,Ugandan activist reportedly held by military chief shows signs of torture,https://www.aljazeera.com/news/2025/5/6/activist-reportedly-held-by-ugandas-military-chief-shows-signs-of-torture?traffic_source=rss
