site,rank,title,link
Al Jazeera,1,Palestinians bury four women killed in Iranian missile attack,https://www.aljazeera.com/video/newsfeed/2026/3/20/palestinians-bury-four-women-killed-in-iranian-missile-attack?traffic_source=rss
Al Jazeera,2,Israel’s messianic political elite ‘does not know any boundaries’,https://www.aljazeera.com/video/quotable/2026/3/20/israels-messianic-political-elite-does-not-know-any-boundaries?traffic_source=rss
Al Jazeera,3,Videos show Iranian missile fragments impacting northern Israel,https://www.aljazeera.com/video/newsfeed/2026/3/20/videos-show-iranian-missile-fragments-impacting-northern-israel?traffic_source=rss
Al Jazeera,4,Iran war live: Tehran warns of intensified strikes if energy sites targeted,https://www.aljazeera.com/news/liveblog/2026/3/20/iran-war-live-tehran-warns-of-intensified-strikes-if-energy-sites-targeted?traffic_source=rss
Al Jazeera,5,US arts commission approves gold coin stamped with Donald Trump’s face,https://www.aljazeera.com/news/2026/3/19/us-arts-commission-approves-gold-coin-stamped-with-donald-trumps-face?traffic_source=rss
Al Jazeera,6,Mexican military says 11 killed in raid targeting Sinaloa cartel leader,https://www.aljazeera.com/news/2026/3/19/mexican-military-says-11-killed-in-raid-targeting-sinaloa-cartel-leader?traffic_source=rss
Al Jazeera,7,"US intelligence chief admits US, Israel not aligned on Iran war goals",https://www.aljazeera.com/video/newsfeed/2026/3/19/us-intelligence-chief-admits-us-israel-not-aligned-on-iran-war-goals?traffic_source=rss
Al Jazeera,8,Senegal and Morocco tied by religion and trade but divided by AFCON fallout,https://www.aljazeera.com/sports/2026/3/19/senegal-and-morocco-tied-by-religion-and-trade-but-divided-by-afcon-fallout?traffic_source=rss
Al Jazeera,9,Netanyahu says Iran’s uranium enrichment abilities destroyed,https://www.aljazeera.com/video/newsfeed/2026/3/19/netanyahu-says-irans-uranium-enrichment-abilities-destroyed?traffic_source=rss
Al Jazeera,10,"Israel continues Gaza attacks amid regional war, kills several Palestinians",https://www.aljazeera.com/news/2026/3/19/israel-continues-gaza-attacks-amid-regional-war-kills-several-palestinians?traffic_source=rss
Al Jazeera,11,FIFA details Infantino’s $6m deal with 33% Club World Cup bonus increase,https://www.aljazeera.com/sports/2026/3/19/fifa-details-infantinos-6m-deal-with-33-club-world-cup-bonus-increase?traffic_source=rss
Al Jazeera,12,Israelis protest in Tel Aviv calling for end to Iran war,https://www.aljazeera.com/video/newsfeed/2026/3/19/israelis-protest-in-tel-aviv-calling-for-end-to-iran-war?traffic_source=rss
Al Jazeera,13,FIFA fines Israel FA citing racism and ‘multiple’ discrimination breaches,https://www.aljazeera.com/sports/2026/3/19/israel-fined-by-fifa-citing-racism-and-multiple-discrimination-breaches?traffic_source=rss
Al Jazeera,14,US states file lawsuit challenging Trump’s revocation of climate finding,https://www.aljazeera.com/news/2026/3/19/us-states-file-lawsuit-challenging-trumps-revocation-of-climate-finding?traffic_source=rss
Al Jazeera,15,How will Israel’s decades-long assassination policy continue?,https://www.aljazeera.com/video/inside-story/2026/3/19/how-will-israels-decades-long-assassination-policy-continue?traffic_source=rss
Al Jazeera,16,US F-35 aircraft makes emergency landing after a combat mission over Iran,https://www.aljazeera.com/news/2026/3/19/us-f-35-aircraft-makes-emergency-landing-after-a-combat-mission-over-iran?traffic_source=rss
Al Jazeera,17,Trump compares Iran strikes to Pearl Harbor as he meets Japan’s PM,https://www.aljazeera.com/video/newsfeed/2026/3/19/trump-compares-iran-strikes-to-pearl-harbor-as-he-meets-japans-pm?traffic_source=rss
Al Jazeera,18,US approves $16.5bn arms deal to Gulf states amid rising Iran tensions,https://www.aljazeera.com/economy/2026/3/19/us-approves-16-5bn-arms-deal-to-gulf-states-amid-rising-iran-tensions?traffic_source=rss
Al Jazeera,19,Why the US Homeland Security shutdown is raising fears of airport delays,https://www.aljazeera.com/economy/2026/3/19/why-the-us-homeland-security-shutdown-is-raising-fears-of-airport-delays?traffic_source=rss
Al Jazeera,20,Iranians shop for Persian New Year essentials despite war,https://www.aljazeera.com/video/newsfeed/2026/3/19/iranians-shop-for-persian-new-year-essentials-despite-war?traffic_source=rss
Associated Press,1,Israel says it will hold off striking key Iranian natural gas field as war rattles energy markets,https://apnews.com/article/iran-iraq-us-israel-trump-march-19-2026-52e94398f2432b3aba9b02b51fbe5000
Associated Press,2,"The body of an American student who went missing in Barcelona has been found, police in Spain say",https://apnews.com/article/spain-illinois-student-missing-barcelona-ec6bc6a9ca00c4d3901c1b65ae634f89
Associated Press,3,Israel is rapidly killing Iran's top leaders. Experts warn the strategy could backfire,https://apnews.com/article/iran-us-israel-killing-leaders-hezbollah-hamas-history-9e9edf108ae8288c673b964c066b59c6
Associated Press,4,Rapper Afroman wins lawsuit against police over mocking their 2022 raid in viral music videos,https://apnews.com/article/afroman-police-raid-lawsuit-ohio-first-amendment-309accc1ce068620e19cfd7d0f70dae1
Associated Press,5,How to monitor airport security lines at US airports while TSA officers go without pay,https://apnews.com/article/tsa-checking-airport-security-wait-times-28b98c06d14f9cd4e27332550e5cba94
Associated Press,6,Former '19 Kids and Counting' star Joseph Duggar is arrested on a child molestation charge,https://apnews.com/article/joseph-duggar-charged-molestation-47710c3a98140c4f2c8f2c075cd93de5
Associated Press,7,"Pentagon seeks $200 billion in additional funds for the Iran war, AP source says",https://apnews.com/article/iran-war-us-pentagon-972ec1bd956a2c3633e6ab7fff389791
Associated Press,8,Democrats storm out of Justice Department leaders' briefing on the Epstein files,https://apnews.com/article/justice-department-epstein-bondi-blanche-d49d96d7a53f4e8f71460a8c34155b3b
Associated Press,9,Japan's Takaichi tries to reaffirm alliance with Trump as he seeks help securing Strait of Hormuz,https://apnews.com/article/trump-takaichi-japan-iran-strait-of-hormuz-0006b848118381786baa837c403e5e13
Associated Press,10,"Pistons guard Cade Cunningham has collapsed lung, will be evaluated in 2 weeks",https://apnews.com/article/pistons-cade-cunningham-hurt-b3902c010af974a3a9f0693fc33f52a7
Associated Press,11,Galatasaray player Noa Lang sustains freak hand injury after colliding with advertising boards,https://apnews.com/article/noa-lang-injury-galatasaray-liverpool-champions-league-311838241523bb2845d14001038b899d
Associated Press,12,North Korea qualifies for the Women’s World Cup for the first time since 2011,https://apnews.com/article/world-cup-asia-philippines-uzbekistan-north-korea-taiwan-d435e3d52e778af357adba8300569465
Associated Press,13,"ABC cancels 'Bachelorette' season with Taylor Frankie Paul, citing 2023 video",https://apnews.com/article/taylor-frankie-paul-bachelorette-canceled-74ac300b0d0925d94aa8b727f87d5388
Associated Press,14,Kevin Spacey settles out of court with 3 men over alleged sexual assaults,https://apnews.com/article/kevin-spacey-sex-assault-claims-settlement-c43f92d60ef860437d0dab3a009bd405
Associated Press,15,"Tina Turner's name, image, likeness and most music catalog rights acquired by Pophouse",https://apnews.com/article/tina-turner-nil-music-catalog-pophouse-sale-3b93e8b5c9b713140d15b96343bb4854
Associated Press,16,"Brent crude briefly tops $119 per barrel, before receding, and shakes stock markets worldwide",https://apnews.com/article/stocks-markets-oil-iran-trump-1abeddf7c4bf19d1dc96b3f23c1de402
Associated Press,17,DOJ investigation into Powell could backfire on Trump and keep Fed chair in office,https://apnews.com/article/powell-trump-federal-reserve-0d1ca1d1850328cee0ddc28e6bc9394d
Associated Press,18,‘Microshifting’ puts a new spin on 9-to-5 schedules,https://apnews.com/article/microshifting-work-time-flexible-schedule-balance-97a98519916b447cd60c73261ffc0b4e
Associated Press,19,New study challenges a site that's key to how humans got to the Americas,https://apnews.com/article/monte-verde-chile-early-humans-b89cc391eadea88578674160152b15a6
Associated Press,20,"A red fox stows away on a cargo ship, traveling from England to the US",https://apnews.com/article/fox-stowaway-ship-england-us-bronx-zoo-fd4c5eaef207d8fffc6408f7671867c0
