site,rank,title,link
Al Jazeera,1,US sanctions Sudan after ruling chemical weapons used during civil war,https://www.aljazeera.com/news/2025/5/23/us-sanctions-sudan-after-ruling-chemical-weapons-used-during-civil-war?traffic_source=rss
Al Jazeera,2,Thunder-Wolves 118-103: MVP SGA sets up 2-0 NBA West final lead,https://www.aljazeera.com/sports/2025/5/23/thunder-wolves-118-103-mvp-sga-sets-up-2-0-nba-west-final-lead?traffic_source=rss
Al Jazeera,3,"Guess who India, Pakistan and Iran are all wooing? The Taliban",https://www.aljazeera.com/news/2025/5/23/guess-who-india-pakistan-and-iran-are-all-wooing-the-taliban?traffic_source=rss
Al Jazeera,4,"Russia-Ukraine war: List of key events, day 1,184",https://www.aljazeera.com/news/2025/5/23/russia-ukraine-war-list-of-key-events-day-1184?traffic_source=rss
Al Jazeera,5,Florida court orders ex-Mexican security chief to pay millions to Mexico,https://www.aljazeera.com/news/2025/5/23/florida-court-orders-ex-mexican-security-chief-to-pay-millions-to-mexico?traffic_source=rss
Al Jazeera,6,Will Donald Trump’s Golden Dome protect America?,https://www.aljazeera.com/program/inside-story/2025/5/22/will-donald-trumps-golden-dome-protect-america?traffic_source=rss
Al Jazeera,7,Suspect charged with murder in shooting of two Israeli embassy workers,https://www.aljazeera.com/news/2025/5/22/suspect-charged-with-murder-in-shooting-of-two-israeli-embassy-workers?traffic_source=rss
Al Jazeera,8,Timeline: Trump’s escalating standoff with Harvard University,https://www.aljazeera.com/news/2025/5/22/timeline-trumps-escalating-standoff-with-harvard-university?traffic_source=rss
Al Jazeera,9,"G7 vows to address global economic ‘imbalances’, considers Russia sanctions",https://www.aljazeera.com/economy/2025/5/22/g7-vows-to-address-global-economic-imbalances-considers-russia-sanctions?traffic_source=rss
Al Jazeera,10,Syrian business owners welcome EU’s lifting of sanctions,https://www.aljazeera.com/news/2025/5/22/syrian-business-owners-welcome-eus-lifting-of-sanctions?traffic_source=rss
Al Jazeera,11,Israeli speculation mounts over potential rift between Trump and Netanyahu,https://www.aljazeera.com/news/2025/5/22/israeli-speculation-mounts-over-potential-rift-between-trump-and-netanyahu?traffic_source=rss
Al Jazeera,12,Vigil held for slain Israeli embassy staffers,https://www.aljazeera.com/program/newsfeed/2025/5/22/vigil-held-for-slain-israeli-embassy-staffers?traffic_source=rss
Al Jazeera,13,Lebanese PM condemns wave of Israeli attacks on southern Lebanon,https://www.aljazeera.com/news/2025/5/22/lebanese-pm-condemns-wave-of-israeli-attacks-on-southern-lebanon?traffic_source=rss
Al Jazeera,14,Damaged homes after small plane crashes into US neighbourhood,https://www.aljazeera.com/program/newsfeed/2025/5/22/damaged-homes-after-small-plane-crashes-into-us-neighbourhood?traffic_source=rss
Al Jazeera,15,Is United States debt becoming unsustainable?,https://www.aljazeera.com/program/counting-the-cost/2025/5/22/is-united-states-debt-becoming-unsustainable?traffic_source=rss
Al Jazeera,16,Desperate crowds scramble for Gaza’s first freshly baked bread in weeks,https://www.aljazeera.com/video/newsfeed/2025/5/22/desperate-crowds-scramble-for-gazas-first-freshly-baked-bread-in-weeks?traffic_source=rss
Al Jazeera,17,Ramaphosa fails to rebut Trump’s false ‘white genocide’ narrative,https://www.aljazeera.com/program/newsfeed/2025/5/22/ramaphosa-fails-to-rebut-trumps-false-white-genocide-narrative?traffic_source=rss
Al Jazeera,18,JPMorgan’s Dimon warns of US stagflation risk: Report,https://www.aljazeera.com/economy/2025/5/22/jpmorgans-dimon-warns-of-us-stagflation-risk-report?traffic_source=rss
Al Jazeera,19,Russia says it received Ukraine’s list of names for major prisoner swap,https://www.aljazeera.com/news/2025/5/22/russia-says-it-received-ukraines-list-of-names-for-major-prisoner-swap?traffic_source=rss
Al Jazeera,20,Trump blocks Harvard’s ability to enrol international students,https://www.aljazeera.com/news/2025/5/22/trump-blocks-harvards-ability-to-enroll-international-students-nyt-report?traffic_source=rss
