site,rank,title,link
Al Jazeera,1,Indian Premier League cricket championship sparks deadly stampede,https://www.aljazeera.com/program/newsfeed/2025/6/4/indian-premier-league-cricket-championship-sparks-deadly-stampede?traffic_source=rss
Al Jazeera,2,Why is Trump cracking down on Chinese students?,https://www.aljazeera.com/program/the-take-2/2025/6/4/aje-onl-tt_aj_tt_usa_chinesestudents_video_v3-040625?traffic_source=rss
Al Jazeera,3,How Israel’s military industry profits from war in Gaza,https://www.aljazeera.com/program/the-take-2/2025/6/4/aje-onl-aj_tt_pal_palestinelabseries_video_v2-030625?traffic_source=rss
Al Jazeera,4,"AI defence expo features latest tech, warnings of potential dangers",https://www.aljazeera.com/video/newsfeed/2025/6/4/ai-defence-expo-features-latest-tech-warnings-of-potential-dangers?traffic_source=rss
Al Jazeera,5,Canadian wildfire smoke spreads across a third of United States,https://www.aljazeera.com/news/2025/6/4/canadian-wildfire-smoke-spreads-across-a-third-of-united-states?traffic_source=rss
Al Jazeera,6,Will Wilders’s gamble to withdraw from governing Dutch coalition pay off?,https://www.aljazeera.com/video/inside-story/2025/6/4/will-wilderss-gamble-to-withdraw-from-governing-dutch-coalition-pay-off?traffic_source=rss
Al Jazeera,7,Sweden tries ISIL member over burning death of Jordanian pilot in 2015,https://www.aljazeera.com/news/2025/6/4/sweden-tries-isil-member-over-burning-death-of-jordanian-pilot-in-2015?traffic_source=rss
Al Jazeera,8,Fight for the Pacific – Episode 3: China’s Pacific Wave,https://www.aljazeera.com/program/featured-documentaries/2025/6/4/fight-for-the-pacific-episode-3-chinas-pacific?traffic_source=rss
Al Jazeera,9,What is the ‘revenge tax’ in the US tax bill?,https://www.aljazeera.com/economy/2025/6/4/what-is-the-revenge-tax-in-the-us-tax-bill?traffic_source=rss
Al Jazeera,10,"Spain plays France in UEFA Nations League: Start time, team news, lineups",https://www.aljazeera.com/sports/2025/6/4/uefa-nations-league-2025-spain-france-semi-start-team-news-lineups?traffic_source=rss
Al Jazeera,11,"Pro-Palestine protesters in UK call for Israel arms embargo, sanctions",https://www.aljazeera.com/news/2025/6/4/pro-palestine-protesters-in-uk-call-for-israel-arms-embargo-sanctions?traffic_source=rss
Al Jazeera,12,Kashmir in the crossfire,https://www.aljazeera.com/video/between-us/2025/6/4/kashmir-in-the-crossfire?traffic_source=rss
Al Jazeera,13,Mapping Israel’s expanding air attacks across Syria,https://www.aljazeera.com/news/2025/6/4/mapping-israels-expanding-air-attacks-across-syria?traffic_source=rss
Al Jazeera,14,Dozens of bodies found in militia-run sites in Libya’s Tripoli; UN alarmed,https://www.aljazeera.com/news/2025/6/4/dozens-of-bodies-found-in-militia-run-sites-in-libyas-tripoli-un-alarmed?traffic_source=rss
Al Jazeera,15,Elon Musk is leaving DOGE with a mixed legacy,https://www.aljazeera.com/video/by-the-numbers-3/2025/6/4/elon-musk-is-leaving-doge-with-a-mixed-legacy?traffic_source=rss
Al Jazeera,16,Why did the Dutch government collapse and what’s next?,https://www.aljazeera.com/news/2025/6/4/why-did-the-dutch-government-collapse-and-whats-next?traffic_source=rss
Al Jazeera,17,At least 11 dead in stampede outside cricket stadium in southern India,https://www.aljazeera.com/news/2025/6/4/several-feared-dead-in-stampede-outside-cricket-stadium-in-india?traffic_source=rss
Al Jazeera,18,Can India become an economic superpower?,https://www.aljazeera.com/program/counting-the-cost/2025/6/4/can-india-become-an-economic-superpower?traffic_source=rss
Al Jazeera,19,UK prepares for war: How much will it cost?,https://www.aljazeera.com/news/2025/6/4/uk-prepares-for-war-how-much-will-it-cost?traffic_source=rss
Al Jazeera,20,Europe’s swing to the right is “deeply worrying”,https://www.aljazeera.com/video/quotable/2025/6/4/europes-swing-to-the-right-is-deeply?traffic_source=rss
