site,rank,title,link
Al Jazeera,1,Indonesia searches for missing plane with at least 10 on board,https://www.aljazeera.com/news/2026/1/17/indonesia-searches-for-missing-plane-with-at-least-10-on-board?traffic_source=rss
Al Jazeera,2,‘Make America Go Away!’: Anti-Trump protests erupt in Denmark,https://www.aljazeera.com/video/newsfeed/2026/1/17/make-america-go-away-anti-trump-protests-erupt-in-denmark?traffic_source=rss
Al Jazeera,3,Trump pledges to slap tariffs on European allies over Greenland,https://www.aljazeera.com/news/2026/1/17/trump-pledges-to-slap-tariffs-on-european-allies-over-greenland?traffic_source=rss
Al Jazeera,4,Thousands join ‘Hands off Greenland’ protests amid Trump’s takeover threats,https://www.aljazeera.com/news/2026/1/17/thousands-join-hands-off-greenland-protests-amid-trumps-takeover-threats?traffic_source=rss
Al Jazeera,5,Senegal hope Morocco final will not be Mane’s AFCON farewell,https://www.aljazeera.com/sports/2026/1/17/senegal-hope-morocco-final-will-not-be-manes-afcon-farewall?traffic_source=rss
Al Jazeera,6,"Trump asks Turkiye’s Erdogan, Egypt’s el-Sisi to join Gaza ‘board of peace’",https://www.aljazeera.com/news/2026/1/17/trump-asks-turkiyes-erdogan-egypts-el-sisi-to-join-gaza-board-of?traffic_source=rss
Al Jazeera,7,Carrick off to perfect start as United beat City 2-0 in Manchester derby,https://www.aljazeera.com/sports/2026/1/17/carrick-off-to-perfect-start-as-united-beat-city-2-0-in-manchester-derby?traffic_source=rss
Al Jazeera,8,Uganda’s President Yoweri Museveni wins seventh term: Electoral Commission,https://www.aljazeera.com/news/2026/1/17/ugandas-president-yoweri-museveni-wins-seventh-term-electoral-commission?traffic_source=rss
Al Jazeera,9,"Senegal vs Morocco: AFCON final – teams, start time, lineups",https://www.aljazeera.com/sports/2026/1/17/senegal-vs-morocco-afcon-final-teams-start-time-lineups?traffic_source=rss
Al Jazeera,10,"Iran: The protests, the blackout and the narrative war",https://www.aljazeera.com/video/the-listening-post/2026/1/17/iran-the-protests-the-blackout-and-the-narrative-war?traffic_source=rss
Al Jazeera,11,Syrian army takes control of east Aleppo towns as Kurdish fighters withdraw,https://www.aljazeera.com/news/2026/1/17/syrian-army-takes-control-of-east-aleppo-towns-as-kurdish-fighters-withdraw?traffic_source=rss
Al Jazeera,12,Uganda’s Bobi Wine says escaped raid on house amid disputed vote,https://www.aljazeera.com/news/2026/1/17/ugandas-wine-says-escaped-raid-on-house-amid-disputed-presidential-vote?traffic_source=rss
Al Jazeera,13,Photos: Gaza ceasefire brings no relief as Israeli bombings continue,https://www.aljazeera.com/gallery/2026/1/17/photos-gaza-ceasefire-brings-no-relief-as-israeli-bombings-continue?traffic_source=rss
Al Jazeera,14,"Iran’s Khamenei says US, Israel links behind ‘thousands killed’ in protests",https://www.aljazeera.com/news/2026/1/17/irans-khamenei-says-us-israel-links-behind-thousands-killed-in-protests?traffic_source=rss
Al Jazeera,15,Australian Open: Djokovic targets Sincaraz to end wait for record 25th slam,https://www.aljazeera.com/sports/2026/1/17/australian-open-djokovic-ready-to-upset-alcaraz-sinner-rivalry?traffic_source=rss
Al Jazeera,16,Iran restores SMS as phased rollback of internet blackout begins,https://www.aljazeera.com/news/2026/1/17/iran-restores-sms-as-phased-rollback-of-internet-blackout-begins?traffic_source=rss
Al Jazeera,17,Ceasefire in Palestine? What ceasefire?,https://www.aljazeera.com/opinions/2026/1/17/ceasefire-in-palestine-what-ceasefire?traffic_source=rss
Al Jazeera,18,AFCON final: Senegal criticises lack of ‘fair play’ ahead of Morocco clash,https://www.aljazeera.com/sports/2026/1/17/afcon-final-senegal-criticizes-lack-of-fair-play-ahead-of-morocco-clash?traffic_source=rss
Al Jazeera,19,Clippers rally past Raptors in OT for fifth straight NBA win,https://www.aljazeera.com/sports/2026/1/17/clippers-rally-past-raptors-in-ot-for-fifth-straight-nba-win?traffic_source=rss
Al Jazeera,20,Sudan: A truce of separation,https://www.aljazeera.com/opinions/2026/1/17/sudan-a-truce-of-separation?traffic_source=rss
Associated Press,1,No sign of new protests in Iran as a hard-line cleric calls for executions and threatens Trump,https://apnews.com/article/iran-protests-us-trump-khatami-0934b4a569a3f6c60c9706b1d8a40287
Associated Press,2,Mexican president highlights 'compelling results' in crackdown of cartels in face of Trump threats,https://apnews.com/article/mexico-us-sheinbaum-trump-cartels-582836f84da21a61ec75d4c7be880fef
Associated Press,3,Cuba launches mass demonstration to decry US attack on Venezuela and demand Maduro's release,https://apnews.com/article/cuba-march-demonstration-killed-venezuela-us-trump-0b348a984cf70186e6b7a98e6ef5a427
Associated Press,4,Judge rules feds in Minneapolis immigration operation can’t detain or tear gas peaceful protesters,https://apnews.com/article/minneapolis-immigration-operation-lawsuit-8805b301ff4a7bfb0058e085ffa8c034
Associated Press,5,ICE says Cuban immigrant died while attempting suicide. A witness says guards pinned and choked him,https://apnews.com/article/ice-immigration-detention-death-texas-2bfb614b2b222803d309f338357d04eb
Associated Press,6,8-year-old girl who went missing on Navajo Nation found dead Friday,https://apnews.com/article/girl-missing-navajo-nation-alert-death-0c2f822a2787a084aa6084e48ca9d5fd
Associated Press,7,Trump says he may punish countries with tariffs if they don’t back the US controlling Greenland,https://apnews.com/article/denmark-greenland-us-trump-tariffs-c8c17c89cbc4ca9819eb728102d0a2b3
Associated Press,8,Are Trump's supporters getting what they want from his second term? Here's what a new poll shows,https://apnews.com/article/poll-trump-republicans-immigration-economy-inflation-costs-634472fc2ee3b4477a7be997bbd0c69e
Associated Press,9,"Trump issues a flurry of pardons, including for a woman whose sentence he commuted in his first term",https://apnews.com/article/trump-pardons-donor-twice-convicted-fraud-99263a04b8a60ce8c081b9c5feaffd2e
Associated Press,10,Has figure skating reached the limits of human performance?,https://apnews.com/article/milan-cortina-olympics-figure-skating-03161624d221db4382ab6bf2618cfa21
Associated Press,11,"Bo Bichette and the New York Mets agree to a $126 million, 3-year contract, AP source says",https://apnews.com/article/bo-bichette-mets-f379b84d43f9394cd8ccc1ab19d32252
Associated Press,12,Ice dance champ Papadakis says she lost Olympic commentary role for NBC over dispute with ex-partner,https://apnews.com/article/papadakis-nbc-book-cizeron-winter-olympics-1864ab50837e00558f989f4914832696
Associated Press,13,Chinese EVs are making inroads in North America. That worries industry experts,https://apnews.com/article/china-electric-vehicles-automakers-canada-tariffs-7d396ab9ab0a7ee6c2c56cda23534918
Associated Press,14,ChatGPT's free ride is ending: Here's what OpenAI plans for advertising on the chatbot,https://apnews.com/article/chatgpt-ads-openai-advertising-83812a066375a805fa2e29b28fc77da1
Associated Press,15,Trump's protectionist trade policies allow China to swoop in,https://apnews.com/article/china-canada-trade-ev-trump-aa2904669445a9ea0b56ebe64f611928
Associated Press,16,NASA's new moon rocket heads to the pad ahead of astronaut launch as early as February,https://apnews.com/article/artemis-nasa-moonshot-921fc1a0a832217fae8b57d2fce2dc66
Associated Press,17,FACT FOCUS: Former Proud Boys leader falsely identified as an ICE officer,https://apnews.com/article/fact-check-ice-enrique-tarrio-proud-boys-656f6f2fb431d37a8be7b2249fc66b53
Associated Press,18,Monkeys are on the loose in St. Louis and AI is complicating efforts to capture them,https://apnews.com/article/monkeys-st-louis-96c55834c7f17854cc4362db891ca8fa
Associated Press,19,Viral '6-7' tops 2025 list of overused words and phrases,https://apnews.com/article/2025-words-slang-phrases-list-university-67-59f896e28b7b16edfdfcc453a8af388a
Associated Press,20,California homeowner rolls out 'unwelcome' mat for black bear living under his house,https://apnews.com/article/black-bear-california-evicted-crawl-space-8126aa9962e99bf1ae4e45e09659630f
