site,rank,title,link
Al Jazeera,1,"US crime rates dropped in 2024, new FBI report shows",https://www.aljazeera.com/news/2025/8/6/us-crime-rates-dropped-in-2024-new-fbi-report-shows?traffic_source=rss
Al Jazeera,2,"Russia-Ukraine war: List of key events, day 1,259",https://www.aljazeera.com/news/2025/8/6/russia-ukraine-war-list-of-key-events-day-1259?traffic_source=rss
Al Jazeera,3,Colombia’s President Petro accuses Peru of annexing disputed Amazon island,https://www.aljazeera.com/news/2025/8/5/colombias-president-petro-accuses-peru-of-annexing-disputed-amazon-island?traffic_source=rss
Al Jazeera,4,Trump says it is ‘up to Israel’ whether to occupy all of Gaza,https://www.aljazeera.com/news/2025/8/5/trump-says-it-is-up-to-israel-whether-to-occupy-all-of-gaza?traffic_source=rss
Al Jazeera,5,Investigating Sheikh Hasina’s final days in Bangladesh,https://www.aljazeera.com/video/the-take-2/2025/8/5/aje-onl-ban_iunitdrop_av_v2-050825?traffic_source=rss
Al Jazeera,6,From Amazon to the Gaza flotilla – the journey of an activist,https://www.aljazeera.com/video/the-take-2/2025/8/5/aje-onl-glb_chrissmalls_av_v2-050825?traffic_source=rss
Al Jazeera,7,"Trump appoints task force to ensure ‘safe, seamless’ LA Olympics",https://www.aljazeera.com/sports/2025/8/5/trump-appoints-taskforce-to-ensure-safe-seamless-la-olympics?traffic_source=rss
Al Jazeera,8,"UN says nearly 60,000 displaced by heavy fighting in northern Mozambique",https://www.aljazeera.com/news/2025/8/5/un-says-nearly-60000-displaced-by-heavy-fighting-in-northern-mozambique?traffic_source=rss
Al Jazeera,9,Son Heung-min makes Los Angeles trip ahead of MLS move from Spurs,https://www.aljazeera.com/sports/2025/8/5/son-heung-min-makes-los-angeles-trip-ahead-of-mls-move-from-spurs?traffic_source=rss
Al Jazeera,10,Nigeria sportswomen dominate again but pay remains an issue,https://www.aljazeera.com/sports/2025/8/5/nigeria-sportswomen-dominate-again-but-pay-remains-an-issue?traffic_source=rss
Al Jazeera,11,"Tourists from Malawi and Zambia are first to face $15,000 visa bonds in US",https://www.aljazeera.com/news/2025/8/5/tourists-from-malawi-and-zambia-are-first-to-face-15000-visa-bonds-in-us?traffic_source=rss
Al Jazeera,12,Israeli forces kill more than 80 people across Gaza as starvation worsens,https://www.aljazeera.com/news/2025/8/5/israeli-forces-kill-more-than-80-people-across-gaza-as-starvation-worsens?traffic_source=rss
Al Jazeera,13,President of Egypt accuses Israel of ‘systematic genocide’,https://www.aljazeera.com/video/newsfeed/2025/8/5/president-of-egypt-accuses-israel-of-systematic?traffic_source=rss
Al Jazeera,14,Major flooding in Hong Kong as highest weather warning issued,https://www.aljazeera.com/video/newsfeed/2025/8/5/major-flooding-in-hong-kong-as-highest-weather-warning-issued?traffic_source=rss
Al Jazeera,15,Tennessee executes Byron Black despite concerns about his defibrillator,https://www.aljazeera.com/news/2025/8/5/tennessee-executes-byron-black-despite-concerns-about-his-defibrillator?traffic_source=rss
Al Jazeera,16,Schoolboy makes Hiroshima bombing personal for Peace Park visitors,https://www.aljazeera.com/video/newsfeed/2025/8/5/schoolboy-makes-hiroshima-bombing-personal-for-peace-park-visitors?traffic_source=rss
Al Jazeera,17,US lawmakers criticise possible AI use in personalised flight ticket prices,https://www.aljazeera.com/economy/2025/8/5/us-lawmakers-criticise-possible-ai-use-in-personalised-flight-ticket-prices?traffic_source=rss
Al Jazeera,18,"How will Gaza care for the 150,000 injured in Israel’s war?",https://www.aljazeera.com/video/inside-story/2025/8/5/how-will-gaza-care-for-the-150000-injured-in-israels-war?traffic_source=rss
Al Jazeera,19,Sri Lanka parliament votes to fire impeached police chief,https://www.aljazeera.com/news/2025/8/5/sri-lanka-parliament-votes-to-fire-impeached-police-chief?traffic_source=rss
Al Jazeera,20,Covering 14 years of Syria,https://www.aljazeera.com/video/between-us/2025/8/5/covering-14-years-of-syria?traffic_source=rss
