site,rank,title,link
Al Jazeera,1,Trump is moving away from aiding Ukraine,https://www.aljazeera.com/video/quotable/2025/9/15/trump-is-moving-away-from-aiding-ukraine?traffic_source=rss
Al Jazeera,2,Duplantis breaks pole vault world record to win gold in Tokyo,https://www.aljazeera.com/sports/2025/9/15/duplantis-breaks-pole-vault-world-record-to-win-gold-in-tokyo?traffic_source=rss
Al Jazeera,3,"Can the EU and NATO impose tariffs on India and China, as Trump wants?",https://www.aljazeera.com/news/2025/9/15/can-the-eu-and-nato-impose-tariffs-on-india-and-china-as-trump-wants?traffic_source=rss
Al Jazeera,4,Israel’s ‘financial stranglehold’ on Palestinian land must end: UN experts,https://www.aljazeera.com/news/2025/9/15/israels-financial-stranglehold-on-palestinian-land-must-end-un-experts?traffic_source=rss
Al Jazeera,5,US focusing on ‘what happens next’ following Israeli strikes on Doha,https://www.aljazeera.com/video/newsfeed/2025/9/15/us-focusing-on-what-happens-next-following-israeli-strikes-on-doha?traffic_source=rss
Al Jazeera,6,Arab and Muslim leaders gather in Doha after Israeli attack,https://www.aljazeera.com/video/newsfeed/2025/9/15/arab-and-muslim-leaders-gather-in-doha-after-israeli-attack?traffic_source=rss
Al Jazeera,7,Gaza City  evacuation order leaves families in “desperate conditions”,https://www.aljazeera.com/video/quotable/2025/9/15/gaza-city-evacuation-order-leaves-families-in-desperate?traffic_source=rss
Al Jazeera,8,Indian cricket’s Pakistan problem: Can you monetise patriotism?,https://www.aljazeera.com/opinions/2025/9/15/indian-crickets-pakistan-problem-can-you-monetise-patriotism?traffic_source=rss
Al Jazeera,9,Nepal’s PM Karki appoints ministers after deadly Gen Z protests,https://www.aljazeera.com/news/2025/9/15/nepals-pm-karki-appoints-ministers-after-deadly-gen-z-protests?traffic_source=rss
Al Jazeera,10,Indonesia’s climate ambitions can’t shine in the dark,https://www.aljazeera.com/opinions/2025/9/15/indonesias-climate-ambitions-cant-shine-in-the-dark?traffic_source=rss
Al Jazeera,11,Charlie Kirk killing: What we know about suspect Tyler Robinson’s motives,https://www.aljazeera.com/news/2025/9/15/charlie-kirk-killing-what-we-know-about-suspect-tyler-robinsons-motives?traffic_source=rss
Al Jazeera,12,Video: Families plead for help after Manila fire displaces thousands,https://www.aljazeera.com/video/newsfeed/2025/9/15/video-families-plead-for-help-after-manila-fire-displaces-thousands?traffic_source=rss
Al Jazeera,13,Artists speak out for Palestine at Emmy Awards,https://www.aljazeera.com/video/newsfeed/2025/9/15/artists-speak-out-for-palestine-at-emmy-awards?traffic_source=rss
Al Jazeera,14,How protests over Israeli team ended Spain’s Vuelta cycling race,https://www.aljazeera.com/video/newsfeed/2025/9/15/how-protests-over-israeli-team-ended-spains-vuelta-cycling-race?traffic_source=rss
Al Jazeera,15,Turkiye court adjourns case challenging CHP opposition party’s congress,https://www.aljazeera.com/news/2025/9/15/turkiye-court-adjourns-case-challenging-chp-opposition-partys-congress?traffic_source=rss
Al Jazeera,16,Netanyahu and Rubio stick to established Israeli-US narrative on Gaza war,https://www.aljazeera.com/news/2025/9/15/netanyahu-and-rubio-stick-to-established-israeli-us-narrative-on-gaza-war?traffic_source=rss
Al Jazeera,17,Shrouded dolls in Stockholm honour Gaza’s killed children,https://www.aljazeera.com/video/newsfeed/2025/9/15/shrouded-dolls-in-stockholm-honour-gazas-killed-children?traffic_source=rss
Al Jazeera,18,Images show destruction of Gaza City by Israeli attacks,https://www.aljazeera.com/gallery/2025/9/15/images-show-destruction-of-gaza-city-by-israeli-attacks?traffic_source=rss
Al Jazeera,19,Russian occupiers brought death and intimidation to Kherson: Ukrainian teen,https://www.aljazeera.com/features/2025/9/15/russian-occupiers-brought-death-and-intimidation-to-kherson-ukrainian-teen?traffic_source=rss
Al Jazeera,20,Europe and US are “partners” in Israel’s killing in Gaza,https://www.aljazeera.com/video/quotable/2025/9/15/europe-and-us-are-partners-in-israels-killing-in-gaza?traffic_source=rss
Associated Press,1,King Charles III to deploy tiara diplomacy as UK prepares to welcome Trump for second state visit,https://apnews.com/article/trump-royals-kate-king-queen-windsor-13c95990ba11d464a216a0d2d29e7ad9
Associated Press,2,British politicians condemn Elon Musk's comments at anti-migrant rally,https://apnews.com/article/elon-musk-britain-migrants-protest-b1f272511ff0c5bc6a8d7bf308063343
Associated Press,3,Qatar denounces Israel before major summit on Israel's attack in Doha targeting Hamas leaders,https://apnews.com/article/qatar-israel-hamas-strike-gaza-war-538e05733e1e05bc0252a5e3b7a78f1c
Associated Press,4,Fox News' Brian Kilmeade apologizes for saying mentally ill homeless people should be executed,https://apnews.com/article/kilmeade-fox-homeless-executed-apology-bffb74e9d672b79853dc6fb8eb29afc8
Associated Press,5,Authorities piece together more information about Kirk assassination suspect,https://apnews.com/article/charlie-kirk-cox-robinson-assassination-aef9fe8dc82d218a36d078536717d95d
Associated Press,6,"2 men arrested after incendiary device found under news media vehicle in Utah, authorities say",https://apnews.com/article/salt-lake-city-utah-bomb-arrests-a3951ebbcdd90e592533ed357ae60a9f
Associated Press,7,After Kirk's killing a growing chorus of conservatives wants his critics ostracized or fired,https://apnews.com/article/kirk-trump-cancel-culture-assassination-4d69649e382ea46d8dcf794150a1d3c9
Associated Press,8,Sugar Coke? Department of War? Where some of Trump's most jaw-dropping promises stand,https://apnews.com/article/trump-promises-ukraine-kennedy-center-war-department-0c2c769ecd5688a21a7aeb2efc2e14c2
Associated Press,9,"Rep. McCaul will retire, but GOP hawk worries about World War III after Russian escalation",https://apnews.com/article/mccaul-ukraine-texas-trump-russia-poland-nato-bbe5fa808569842178879549d6ec2d9c
Associated Press,10,"Texas A&M jumps to No. 10 in the AP Top 25, Notre Dame is the first ranked 0-2 team since 1988",https://apnews.com/article/ap-top-25-football-poll-fd1a383be49e7e666a67962ef945cbc1
Associated Press,11,"Ricky Hatton, former world boxing champion, dies at 46",https://apnews.com/article/ricky-hatton-obit-boxing-e306374b99c884a1005c6aef50cecf32
Associated Press,12,"Bengals seeking opinions on Joe Burrow's toe after injury vs. Jaguars, AP source says",https://apnews.com/article/bengals-qb-joe-burrow-injured-5f287dfefdeeff0683d835e921ccfcfc
Associated Press,13,Emmys host Nate Bargatze pokes fun at the TV industry and fails with gag to keep speeches short,https://apnews.com/article/nate-bargatze-2025-emmy-awards-c1e27164c0723c4b5c2988d4c586d99d
Associated Press,14,"Emmy Awards highlights: Tramell Tillman, Colbert wins and a teen who stepped out of his comfort zone",https://apnews.com/article/2025-key-emmy-awards-highlights-moments-0ad8fba0256f1e0d2acc3a41a94872a8
Associated Press,15,Workers commenting on Kirk's death learn the limits of free speech in and out of their jobs,https://apnews.com/article/charlie-kirk-workplace-speech-firing-29717a8612ccedebabc7cba29e7ef627
Associated Press,16,Trump administration renews push to fire Fed governor Lisa Cook ahead of key vote,https://apnews.com/article/trump-lisa-cook-federal-reserve-85fca8a405faa66e11c9567a193468e3
Associated Press,17,The Fed faces economic uncertainty and political pressure as it decides whether to cut rates,https://apnews.com/article/federal-reserve-inflation-jobs-rates-trump-powell-164fdc130275c0df17562273e1042bfe
Associated Press,18,Ghana's fantasy coffins are a colorful celebration of life and legacy,https://apnews.com/article/ghana-fantasy-coffins-funerals-accra-tradition-01220db5b2e240a12ae8e4ba8820f993
Associated Press,19,Ground squirrels are taking over a North Dakota city and officials are not amused,https://apnews.com/article/minot-city-north-dakota-ground-squirrels-dde22d2fa10140191a168687a5aa4daa
Associated Press,20,"Swastikas still linger on some flags in Finland's air force, but are on the way out",https://apnews.com/article/finland-swastika-air-force-nato-423a764e6e72abde083f6136e06461c0
