site,rank,title,link
Al Jazeera,1,The problem with Bernie Sanders’s ‘it is genocide’ admission,https://www.aljazeera.com/opinions/2025/9/21/the-problem-with-bernie-sanderss-it-is-genocide-admission?traffic_source=rss
Al Jazeera,2,Hong Kong police defuse World War II bomb found at construction site,https://www.aljazeera.com/video/newsfeed/2025/9/21/hong-kong-police-defuse-world-war-ii-bomb-found-at-construction-site?traffic_source=rss
Al Jazeera,3,"US House members make rare China visit amid trade, TikTok tensions",https://www.aljazeera.com/news/2025/9/21/us-house-members-make-rare-china-visit-amid-trade-tiktok-tensions?traffic_source=rss
Al Jazeera,4,"Singer d4vd cancels US, Europe tours amid investigation into teen’s death",https://www.aljazeera.com/news/2025/9/21/singer-d4vd-cancels-us-europe-tours-amid-investigation-into-teens-death?traffic_source=rss
Al Jazeera,5,Cyberattack causes travel chaos at European airports,https://www.aljazeera.com/video/newsfeed/2025/9/21/cyberattack-causes-travel-chaos-at-european-airports?traffic_source=rss
Al Jazeera,6,Bosnia genocide survivors protest in solidarity with Palestinians in Gaza,https://www.aljazeera.com/video/newsfeed/2025/9/21/bosnia-genocide-survivors-protest-in-solidarity-with-palestinians-in-gaza?traffic_source=rss
Al Jazeera,7,Guinea votes on new constitution to move from military to civilian rule,https://www.aljazeera.com/news/2025/9/21/guinea-votes-on-new-constitution-to-move-from-military-to-civilian-rule?traffic_source=rss
Al Jazeera,8,Doctors won’t abandon patients at al-Shifa as Israel destroys Gaza City,https://www.aljazeera.com/news/2025/9/21/doctors-wont-abandon-patients-at-al-shifa-as-israel-destroys-gaza-city?traffic_source=rss
Al Jazeera,9,LIVE: India vs Pakistan – Asia Cup 2025 Super 4 match,https://www.aljazeera.com/sports/liveblog/2025/9/21/live-india-vs-pakistan-asia-cup-2025-super-fours-commentary-stream-score?traffic_source=rss
Al Jazeera,10,Week in Pictures: From forced displacement in Gaza to protests in Peru,https://www.aljazeera.com/gallery/2025/9/21/week-in-pictures-from-forced-displacement-in-gaza-to-protests-in-peru?traffic_source=rss
Al Jazeera,11,"Clashes, arrests as tens of thousands protest corruption in Philippines",https://www.aljazeera.com/news/2025/9/21/thousands-rally-in-philippines-at-anticorruption-protests-in-manila?traffic_source=rss
Al Jazeera,12,UN ‘gravely alarmed’ by deteriorating situation in Sudan’s el-Fasher,https://www.aljazeera.com/news/2025/9/21/un-gravely-alarmed-by-deteriorating-situation-in-sudans-el-fasher?traffic_source=rss
Al Jazeera,13,UK PM Starmer to recognise Palestinian statehood before UNGA meeting,https://www.aljazeera.com/news/2025/9/21/uk-pm-starmer-to-recognise-palestinian-statehood-before-unga-meeting?traffic_source=rss
Al Jazeera,14,Africa’s Cycling Moment,https://www.aljazeera.com/video/game-theory/2025/9/21/africas-cycling-moment?traffic_source=rss
Al Jazeera,15,Video: Jaguar numbers rise in Mexico amid threats of extinction,https://www.aljazeera.com/video/newsfeed/2025/9/21/video-jaguar-numbers-rise-in-mexico-amid-threats-of-extinction?traffic_source=rss
Al Jazeera,16,YouTube account for Venezuela’s Maduro is down as tensions with US escalate,https://www.aljazeera.com/news/2025/9/21/youtube-account-for-venezuelas-maduro-is-down-as-tensions-with-us-escalate?traffic_source=rss
Al Jazeera,17,"LIVE: Israel kills 46 in Gaza since dawn, child dies of malnutrition",https://www.aljazeera.com/news/liveblog/2025/9/21/live-israel-kills-14-palestinians-in-gaza-since-dawn?traffic_source=rss
Al Jazeera,18,Trump warns Afghanistan of ‘bad things’ if it does not return Bagram base,https://www.aljazeera.com/news/2025/9/21/trump-warns-afghanistan-of-bad-things-if-it-does-not-return-bagram-base?traffic_source=rss
Al Jazeera,19,Is Turkiye Israel’s next target in the Middle East?,https://www.aljazeera.com/features/2025/9/21/is-turkiye-israel-next-target-middle-east?traffic_source=rss
Al Jazeera,20,Iran says it will suspend cooperation with UN’s nuclear watchdog,https://www.aljazeera.com/news/2025/9/21/iran-says-e3-move-to-trigger-sanctions-will-halt-cooperation-with-iaea?traffic_source=rss
Associated Press,1,"Russian jets over Estonia ignored signals from NATO pilots, officials say",https://apnews.com/article/russia-jets-estonia-nato-signals-ed46783ac2ce71622a9f3aa8f2ba9ad7
Associated Press,2,Cyberattack disrupts check-in systems at major European airports,https://apnews.com/article/europe-airports-cyberattack-29b6d890baf7ac3a22f0f2b2f169b890
Associated Press,3,Pakistani dating show sparks anger ahead of its debut on YouTube,https://apnews.com/article/pakistan-dating-show-youtube-7c90ce0769f8b636558846dd1a59c4e9
Associated Press,4,California bans most law enforcement officers from wearing masks during operations,https://apnews.com/article/california-ice-agents-immigration-raids-masks-ban-97936f70699b75d8b483a850967c2e42
Associated Press,5,Man is arrested and charged in New Hampshire country club shooting,https://apnews.com/article/country-club-shooting-new-hampshire-nashua-c971a42b7a0cb2eb44a48cade28cff27
Associated Press,6,ICE denies using excessive force as it broadens immigration arrests in Chicago,https://apnews.com/article/trump-immigration-deportation-ice-chicago-arrest-fd6d049fcd293b62f85ffcd5b1a547ee
Associated Press,7,Trump nominates White House aide to be top US prosecutor for office probing Letitia James,https://apnews.com/article/letitia-james-eastern-district-of-virginia-trump-8c84bd8603a4b932f9cb2e451ef057a3
Associated Press,8,Democratic leaders in Congress demand a meeting with Trump as government shutdown looms,https://apnews.com/article/congress-government-shutdown-trump-schumer-jeffries-a214d540f0dbeb86ce776a5f56c382b0
Associated Press,9,Trump administration ends government's annual report on hunger in America,https://apnews.com/article/trump-ending-america-hunger-report-snap-cuts-750f90757f50ab2d8bc97dfca5a917dd
Associated Press,10,"What to know about State Farm Stadium, the venue hosting Charlie Kirk's memorial service Sunday",https://apnews.com/article/charlie-kirk-memorial-state-farm-stadium-ff4815a8ec8f4eb6f4855360a98a04fa
Associated Press,11,Caitlin Clark says she was fined $200 for social media post about referees,https://apnews.com/article/clark-fever-fine-wnba-referees-42e7c64cfac131c7712686516b132026
Associated Press,12,Liverpool's Isak and Wirtz on the bench for Merseyside derby against Everton,https://apnews.com/article/isak-wirtz-liverpool-7bfcdbbd951ecdc037ca806f64390b2a
Associated Press,13,"In battles over free speech, comedians are often center stage",https://apnews.com/article/jimmy-kimmel-free-speech-comedy-censorship-0a1525424a5cf66d7236a39b853c4680
Associated Press,14,Release party for Swift's ‘The Life of a Showgirl’ album is coming to AMC theaters,https://apnews.com/article/taylor-swift-amc-movie-new-album-66c79876aa7049eb965e5b7d6a19ef16
Associated Press,15,"Sonny Curtis, Crickets member who penned ‘Mary Tyler Moore Show’ theme, dies at 88",https://apnews.com/article/sonny-curtis-dies-125a37c527ea4208a762e90aee93c53e
Associated Press,16,White House says $100K H-1B visa fee won't apply to existing holders as Trump move stirs anxiety,https://apnews.com/article/h1b-visa-changes-trump-cbb0995814cf2c9a3c74a6dcf2b31d72
Associated Press,17,Big foundations and nonprofits still flood to the sidelines of a diminished United Nations,https://apnews.com/article/un-general-assembly-cgi-bloomberg-gates-ford-foundation-5d34a749f4b189238f5caf11caf8152a
Associated Press,18,Ghana's fantasy coffins are a colorful celebration of life and legacy,https://apnews.com/article/ghana-fantasy-coffins-funerals-accra-tradition-01220db5b2e240a12ae8e4ba8820f993
Associated Press,19,"Swastikas still linger on some flags in Finland's air force, but are on the way out",https://apnews.com/article/finland-swastika-air-force-nato-423a764e6e72abde083f6136e06461c0
Associated Press,20,Ground squirrels are taking over a North Dakota city and officials are not amused,https://apnews.com/article/minot-city-north-dakota-ground-squirrels-dde22d2fa10140191a168687a5aa4daa
