site,rank,title,link
Al Jazeera,1,Albanian protesters pelt lawmakers’ cars over resort projects,https://www.aljazeera.com/video/newsfeed/2026/7/20/albanian-protesters-pelt-lawmakers-cars-over-resort-projects?traffic_source=rss
Al Jazeera,2,FIFA investigating on-pitch brawl after Spain vs Argentina World Cup final,https://www.aljazeera.com/sports/2026/7/20/fifa-investigating-on-pitch-brawl-after-spain-vs-argentina-world-cup-final?traffic_source=rss
Al Jazeera,3,Trump rejects Mamdani threat to arrest Israel’s Netanyahu for war crimes,https://www.aljazeera.com/news/2026/7/20/trump-rejects-mamdani-threat-to-arrest-israels-netanyahu-for-war-crimes?traffic_source=rss
Al Jazeera,4,King of Spain celebrates World Cup winners in Madrid,https://www.aljazeera.com/video/newsfeed/2026/7/20/king-of-spain-celebrates-world-cup-winners-in-madrid?traffic_source=rss
Al Jazeera,5,Gaza residents weigh in on election of new Hamas leader,https://www.aljazeera.com/video/newsfeed/2026/7/20/gaza-residents-weigh-in-on-election-of-new-hamas-leader?traffic_source=rss
Al Jazeera,6,How will Zelenskyy handle the growing political crisis at home?,https://www.aljazeera.com/video/inside-story/2026/7/20/how-will-zelenskyy-handle-the-growing-political-crisis-at-home?traffic_source=rss
Al Jazeera,7,Ortega insists no more elections for Nicaragua,https://www.aljazeera.com/news/2026/7/20/ortega-insists-no-more-elections-for-nicaragua?traffic_source=rss
Al Jazeera,8,Man arrested after fire outside New York immigration court,https://www.aljazeera.com/video/newsfeed/2026/7/20/man-arrested-after-fire-outside-new-york-immigration-court?traffic_source=rss
Al Jazeera,9,Monsoon-driven flash flooding kills at least 20 in Afghanistan,https://www.aljazeera.com/news/2026/7/20/monsoon-driven-flash-flooding-kills-at-least-20-in-afghanistan?traffic_source=rss
Al Jazeera,10,Indian police attack Cockroach Janta Party’s parliament march,https://www.aljazeera.com/video/newsfeed/2026/7/20/indian-police-attack-cockroach-janta-partys-parliament-march?traffic_source=rss
Al Jazeera,11,Iran condemns US attacks on civilian infrastructure,https://www.aljazeera.com/video/newsfeed/2026/7/20/iran-condemns-us-attacks-on-civilian-infrastructure?traffic_source=rss
Al Jazeera,12,What does Khalil al-Hayya’s election win mean for Gaza?,https://www.aljazeera.com/news/2026/7/20/what-does-khalil-al-hayyas-election-win-mean-for-gaza?traffic_source=rss
Al Jazeera,13,Yemeni women support families through enterprise as economic crisis bites,https://www.aljazeera.com/economy/2026/7/20/yemeni-women-support-families-through-enterprise-as-economic-crisis-bites?traffic_source=rss
Al Jazeera,14,"EU pauses methane penalties amid energy crisis, US pressure",https://www.aljazeera.com/news/2026/7/20/eu-pauses-methane-penalties-amid-energy-crisis-us-pressure?traffic_source=rss
Al Jazeera,15,US judge orders pause on Paramount–Warner Bros merger,https://www.aljazeera.com/economy/2026/7/20/us-judge-orders-pause-on-paramount-warner-bros?traffic_source=rss
Al Jazeera,16,A tournament of contradictions: What did we learn at World Cup 2026?,https://www.aljazeera.com/sports/2026/7/20/a-tournament-of-contradictions-what-did-we-learn-at-world-cup-2026?traffic_source=rss
Al Jazeera,17,Protests in Italy after Moroccan man dies during arrest,https://www.aljazeera.com/news/2026/7/20/protests-in-italy-after-moroccan-man-dies-during-arrest?traffic_source=rss
Al Jazeera,18,Houthis announce maritime blockade on Saudi Arabia,https://www.aljazeera.com/video/newsfeed/2026/7/20/houthis-announce-maritime-blockade-on-saudi-arabia?traffic_source=rss
Al Jazeera,19,Trump vows Iran will ‘pay’ for killing US soldiers,https://www.aljazeera.com/news/2026/7/20/trump-vows-iran-will-pay-for-killing-us-soldiers?traffic_source=rss
Al Jazeera,20,‘Now or never’: Students defy Delhi lockdown to march on India’s parliament,https://www.aljazeera.com/news/2026/7/20/now-or-never-students-defy-delhi-lockdown-to-march-on-indias-parliament?traffic_source=rss
Associated Press,1,US military says it's carrying out its 10th consecutive night of strikes on Iran,https://apnews.com/article/iran-us-hormuz-strait-war-july-20-2026-8b37952906cbec6351fdcc47a0fa6297
Associated Press,2,Ukraine fires 400 drones toward Moscow as Zelenskyy grapples with protests,https://apnews.com/article/russia-ukraine-war-drones-missiles-zelenskyy-f42baa61109fcb43b7efabf5334c4f50
Associated Press,3,Andy Burnham becomes the UK's seventh prime minister in a decade after Starmer resigns,https://apnews.com/article/andy-burnham-uk-prime-minister-labour-starmer-a13602b93d8f045f1cffd2bd05bf8e2b
Associated Press,4,Trial begins for Massachusetts mom who says postpartum issues led her to kill 3 children,https://apnews.com/article/lindsay-clancy-murder-trial-postpartum-psychosis-52e0c06e7e876f0f59799c2e6e27622f
Associated Press,5,Nolan Wells remembered for his gentle spirit as Rev. Al Sharpton demands truth about his death,https://apnews.com/article/nolan-wells-death-funeral-mississippi-boat-trip-4d36193e025efc95f3e82246ad038fd8
Associated Press,6,"5 family members found dead after flash flood in a scenic Utah canyon, authorities say",https://apnews.com/article/utah-canyon-flood-family-killed-b5ef63531a366110169777377757acfd
Associated Press,7,"JD and Usha Vance welcome a baby boy, the first child born to a sitting VP in more than 150 years",https://apnews.com/article/jd-usha-vance-baby-family-b488eb2e698ea2159d15427ad97e1151
Associated Press,8,"The men behind Trump's $3.47 gas: An NFL coach, a GOP fundraiser and two New Jersey brothers",https://apnews.com/article/freedom-fuel-gas-prices-trump-nfl-kicking-coach-4fc52c7ad19bf29790cf618176839447
Associated Press,9,"Shakira, Madonna and many Muppets take the World Cup stage, along with BTS and Bieber",https://apnews.com/article/world-cup-final-performances-halftime-show-0e9e3bc37939c901be92441b73d7b4e6
Associated Press,10,Spain’s World Cup champions return home for royal welcome and parade in front of almost 2 million,https://apnews.com/article/spain-fifa-world-cup-champions-team-cd1705a614f6ffd79da5e217f63faaaa
Associated Press,11,How Ferran Torres scored the World Cup-winning goal for Spain to beat Argentina,https://apnews.com/article/spain-world-cup-winning-goal-torres-29dec8a147cbc2c6fac1ecbb02f87cd1
Associated Press,12,Los Angeles medical examiner pushes for greater transparency in high-profile deaths,https://apnews.com/article/ukpo-d4vd-celeste-autopsy-transparency-095c0d2d76af48f7299fbfc85ad00151
Associated Press,13,Medical examiner outlines how his office handles autopsies of the famous and everyone else,https://apnews.com/article/ukpo-autopsies-perry-overdose-toxicology-a04a2eb9c7557bca3fa78445ad7517dc
Associated Press,14,US gas prices back up to an average of $4 a gallon again as the US and Iran launch attacks,https://apnews.com/article/gas-prices-iran-war-4-gallon-4b82825734ec3ded192351e53a4be69e
Associated Press,15,"Judge says Paramount and Warner must halt merger for at least two weeks, granting states' request",https://apnews.com/article/warner-bros-paramount-injunction-361fa669019e0053cf6d4513e6e275e3
Associated Press,16,Wall Street drifts as AI stocks hold steadier after last week’s losses,https://apnews.com/article/stocks-market-ai-oil-iran-war-15939a01f378bcec5eec2868e8100ca9
Associated Press,17,Raccoon goes on drunken rampage in Virginia liquor store and passes out on bathroom floor,https://apnews.com/article/drunk-raccoon-liquor-store-bandit-virginia-5109feb2ea9ab9bf8954ec3798689fd0
Associated Press,18,Viral phenomenon in Argentina has young people identifying themselves as animals,https://apnews.com/article/argentina-teenagers-identifying-as-animals-therians-tiktok-54d158c4842f6515e31d83a260cdf31f
Associated Press,19,"Fatou, the world's oldest gorilla living in captivity, celebrates her 69th birthday at Berlin Zoo",https://apnews.com/article/gorilla-germany-fatou-berlin-zoo-0196b95f3b6d48593bb7c872cab51adf
Associated Press,20,Ghana's fantasy coffins are a colorful celebration of life and legacy,https://apnews.com/article/ghana-fantasy-coffins-funerals-accra-tradition-01220db5b2e240a12ae8e4ba8820f993
