site,rank,title,link
Al Jazeera,1,Did Trump oversell a broken Iran ceasefire deal?,https://www.aljazeera.com/video/the-take-2/2026/5/26/aje-onl-irn_mou_av_v3-260526?traffic_source=rss
Al Jazeera,2,Children perform ‘mini Hajj’ in Gaza as Israel blocks pilgrims,https://www.aljazeera.com/video/newsfeed/2026/5/26/children-perform-mini-hajj-in-gaza-as-israel-blocks-pilgrims?traffic_source=rss
Al Jazeera,3,White House proposes NDAs for all US federal workers,https://www.aljazeera.com/economy/2026/5/26/white-house-proposes-ndas-for-all-us-federal-workers?traffic_source=rss
Al Jazeera,4,Russia slams US for not granting visa to diplomat for UN meeting,https://www.aljazeera.com/news/2026/5/26/russia-slams-us-for-not-granting-visa-to-diplomat-for-un-meeting?traffic_source=rss
Al Jazeera,5,Former Arsenal midfielder Partey named in Ghana squad ahead of World Cup,https://www.aljazeera.com/sports/2026/5/26/former-arsenal-midfielder-partey-named-in-ghana-squad-ahead-of-world-cup?traffic_source=rss
Al Jazeera,6,Armenia signs strategic partnership deal with US as election approaches,https://www.aljazeera.com/news/2026/5/26/armenia-signs-strategic-partnership-deal-with-us-as-election-approaches?traffic_source=rss
Al Jazeera,7,World Cup broadcast hopes boosted in India as Zee Entertainment in talks,https://www.aljazeera.com/sports/2026/5/26/world-cup-broadcast-hopes-boosted-in-india-as-zee-entertainment-in-talks?traffic_source=rss
Al Jazeera,8,Lebanon latest: Netanyahu vows escalation against Hezbollah,https://www.aljazeera.com/video/newsfeed/2026/5/26/lebanon-latest-netanyahu-vows-escalation-against-hezbollah?traffic_source=rss
Al Jazeera,9,What has Pope Leo warned about AI – and why that’s significant,https://www.aljazeera.com/news/2026/5/26/what-has-pope-leo-warned-about-ai-and-why-thats-significant?traffic_source=rss
Al Jazeera,10,France’s Kouame becomes youngest male Grand Slam match-winner in 17 years,https://www.aljazeera.com/sports/2026/5/26/frances-kouame-becomes-youngest-male-grand-slam-match-winner-in-17-years?traffic_source=rss
Al Jazeera,11,Albert Manifold ousted as BP chair over governance and conduct concerns,https://www.aljazeera.com/economy/2026/5/26/albert-manifold-ousted-as-bp-chair-over-governance-and-conduct-concerns?traffic_source=rss
Al Jazeera,12,Iranian fishermen struggle to survive amid Hormuz blockade,https://www.aljazeera.com/video/newsfeed/2026/5/26/iranian-fishermen-struggle-to-survive-amid-hormuz-blockade?traffic_source=rss
Al Jazeera,13,Scotland fans book 20 school buses for games at ‘inaccessible’ US World Cup,https://www.aljazeera.com/sports/2026/5/26/scotland-fans-book-school-bus-for-matches-at-inaccessible-world-cup?traffic_source=rss
Al Jazeera,14,European countries and EU summon Russian envoys over threats on Kyiv,https://www.aljazeera.com/news/2026/5/26/european-countries-and-eu-summon-russian-envoys-over-threats-on-kyiv?traffic_source=rss
Al Jazeera,15,"Tehran labels US attacks ‘gross violation’, says it is prepared to respond",https://www.aljazeera.com/news/2026/5/26/tehran-labels-us-attacks-gross-violation-says-it-is-prepared-to-respond?traffic_source=rss
Al Jazeera,16,Israel is no longer ‘shooting and crying’,https://www.aljazeera.com/opinions/2026/5/26/israel-is-no-longer-shooting-and-crying?traffic_source=rss
Al Jazeera,17,Hajj pilgrims gather at Mount Arafat under scorching desert sun,https://www.aljazeera.com/gallery/2026/5/26/hajj-pilgrims-gather-at-mount-arafat-under-scorching-desert-sun?traffic_source=rss
Al Jazeera,18,‘Leave Kyiv’: Why Russia’s latest Ukraine threat is a major escalation,https://www.aljazeera.com/news/2026/5/26/leave-kyiv-why-russias-latest-ukraine-threat-is-a-major-escalation?traffic_source=rss
Al Jazeera,19,Iran’s president praises military after US strikes,https://www.aljazeera.com/video/newsfeed/2026/5/26/irans-president-praises-military-after-us-strikes?traffic_source=rss
Al Jazeera,20,"India, US strike critical minerals deal: What’s in it, why does it matter?",https://www.aljazeera.com/economy/2026/5/26/india-us-strike-critical-minerals-deal-whats-in-it-why-does-it-matter?traffic_source=rss
Associated Press,1,Exceptionally early heat wave shatters records and brings deaths in Europe,https://apnews.com/article/europe-heatwave-temperature-records-france-uk-5e08af7830e72ffa9fccdcf48cf4f7b5
Associated Press,2,South Korean Starbucks boss apologizes for ad campaign that evoked massacre,https://apnews.com/article/starbucks-korea-tank-day-chung-shinsegae-34aa15b186bae6e6dc997f9ac8f71e21
Associated Press,3,Carney warns Alberta independence vote from Canada could echo Brexit as a 'dangerous bluff',https://apnews.com/article/canada-alberta-carney-brexit-b9c389bfebc25406b65fccf5238242d8
Associated Press,4,Federal court blocks Alabama plan for new congressional districts that could help Republicans,https://apnews.com/article/redistricting-congress-alabama-voting-rights-trump-b67125657b36e9b915ea9bc5d587d08c
Associated Press,5,South Carolina Senate rejects Trump’s call to redraw congressional map for midterm elections,https://apnews.com/article/redistricting-congress-voting-rights-trump-6d2daecd387cc0ad1dd56e94f621eda5
Associated Press,6,Trump wraps up 3-hour medical visit to Walter Reed and declares 'Everything checked out PERFECTLY',https://apnews.com/article/us-trump-health-doctor-annual-exam-dff4cdb714d42ef860531d345c54e7aa
Associated Press,7,Q&A: Anna Gomez is the sole Democrat on the FCC. She has a warning for big media companies,https://apnews.com/article/fcc-disney-censorship-trump-threats-commissoner-democrat-386b210604373bb19ec6a485b89222b1
Associated Press,8,Cornyn tries to keep his Texas Senate seat in a runoff with Trump-backed Paxton,https://apnews.com/article/texas-senate-cornyn-paxton-trump-talarico-4fa609e7ddb93b47ac4e3398a12a472e
Associated Press,9,"Wander Franco criminally responsible for abuse, judge finds, but spared punishment in Dominican case",https://apnews.com/article/wander-franco-rays-mlb-e02731859a5b9999315aca2483820d7b
Associated Press,10,Mexico's president sees 'no issue' with her country hosting Iran's World Cup team during tournament,https://apnews.com/article/iran-world-cup-mexico-5bdfa21feccf35f0ed955b9dd1ab7244
Associated Press,11,World Cup transit sticker shock hits fans with tickets to matches in some US host cities,https://apnews.com/article/world-cup-transit-new-jersey-boston-prices-f66d51bf1ed1de1bf568ac4fd319b8f8
Associated Press,12,"Sonny Rollins, saxophonist and restless genius of jazz, dead at 95",https://apnews.com/article/sonny-rollins-dead-95-jazz-saxophone-7b36dbf269784f89be45ffa56cc58db7
Associated Press,13,"Daniel Harding, British conductor and pilot, to follow Dudamel as LA Philharmonic music director",https://apnews.com/article/daniel-harding-los-angeles-philharmonic-8bc5e9f41754330ab82ea5bca686c0c1
Associated Press,14,"As US stock market hits new highs, 2 of 3 Americans are cutting back on spending, survey shows",https://apnews.com/article/confidence-inflation-economy-4f681cecfa63fe251f5bb12bb4b949c6
Associated Press,15,Wall Street rises toward records as US stocks catch up to the world's gains from the day before,https://apnews.com/article/stocks-markets-iran-trump-oil-71cc7b49f2ca3462a118878c93c75940
Associated Press,16,Oil giant BP ousts new chairman over 'conduct' and shares slide,https://apnews.com/article/bp-manifold-chairman-a0cf407215f1eb1f7b6051ddb298d94c
Associated Press,17,Lettuce introduce you to the live frog found in this grocery store salad bag,https://apnews.com/article/australia-frog-lettuce-salad-esperance-4134acf75e814dedd7789c1423c26ab1
Associated Press,18,Viral phenomenon in Argentina has young people identifying themselves as animals,https://apnews.com/article/argentina-teenagers-identifying-as-animals-therians-tiktok-54d158c4842f6515e31d83a260cdf31f
Associated Press,19,"Nipper, stay! The future of a beloved dog statue on a New York warehouse is up in the air",https://apnews.com/article/nipper-dog-statue-albany-new-york-69a5ca4ec514f837626475b5d5264c1d
Associated Press,20,A humpback whale briefly swallows kayaker in Chilean Patagonia — and it's all captured on camera,https://apnews.com/article/chile-kayaking-tourism-whale-b0cafde4b640326f20a9da28003d6c26
