site,rank,title,link
Al Jazeera,1,Antigovernment protesters clash with police in several Serbian cities,https://www.aljazeera.com/gallery/2025/8/17/antigovernment-protesters-clash-with-police-in-several-serbian-cities?traffic_source=rss
Al Jazeera,2,Week in Pictures: From Trump-Putin meeting to flash floods in Pakistan,https://www.aljazeera.com/gallery/2025/8/17/week-in-pictures-from-trump-putin-meeting-to-flash-floods-in-pakistan?traffic_source=rss
Al Jazeera,3,"Erin downgraded to Category 3 hurricane, NHC says",https://www.aljazeera.com/news/2025/8/17/erin-downgraded-to-category-3-hurricane-nhc-says?traffic_source=rss
Al Jazeera,4,Israel bombs Gaza City as part of takeover plan,https://www.aljazeera.com/video/newsfeed/2025/8/17/israel-bombs-gaza-city-as-part-of-takeover-plan?traffic_source=rss
Al Jazeera,5,UFC 319: Chimaev dominates Du Plessis to win middleweight championship,https://www.aljazeera.com/sports/2025/8/17/ufc-319-chimaev-dominates-du-plessis-to-win-middleweight-championship?traffic_source=rss
Al Jazeera,6,Luis Diaz scores for Bayern Munich to win German Supercup on debut,https://www.aljazeera.com/sports/2025/8/17/luis-diaz-scores-for-bayern-munich-to-win-german-supercup-on-debut?traffic_source=rss
Al Jazeera,7,"Russia-Ukraine war: List of key events, day 1,270",https://www.aljazeera.com/news/2025/8/17/russia-ukraine-war-list-of-key-events-day-1270?traffic_source=rss
Al Jazeera,8,Lionel Messi scores as Inter Miami wins late against LA Galaxy,https://www.aljazeera.com/sports/2025/8/17/lionel-messi-scores-as-inter-miami-wins-late-against-la-galaxy?traffic_source=rss
Al Jazeera,9,"Manchester United vs Arsenal: Premier League – teams, start, lineups",https://www.aljazeera.com/sports/2025/8/16/manchester-united-vs-arsenal-premier-league-teams-start-lineups?traffic_source=rss
Al Jazeera,10,Barcelona begin La Liga title defence with win at Mallorca,https://www.aljazeera.com/sports/2025/8/16/yamal-and-raphinha-fire-barcelona-to-la-liga-opening-win-in-mallorca?traffic_source=rss
Al Jazeera,11,France says Mali’s arrest of embassy worker on coup charges ‘unfounded’,https://www.aljazeera.com/news/2025/8/16/france-says-malis-arrest-of-embassy-worker-on-coup-charges-unfounded?traffic_source=rss
Al Jazeera,12,Israel preparing to forcibly displace Palestinians to southern Gaza,https://www.aljazeera.com/news/2025/8/16/israeli-attack-kills-baby-girl-in-gaza-as-more-palestinians-die-of-hunger?traffic_source=rss
Al Jazeera,13,US suspends visas for Gaza residents after right-wing social media storm,https://www.aljazeera.com/news/2025/8/16/us-suspends-visas-for-gaza-residents-after-right-wing-social-media-storm?traffic_source=rss
Al Jazeera,14,African courts may pave the way for holding social media giants to account,https://www.aljazeera.com/opinions/2025/8/16/african-courts-may-pave-the-way-for-holding-social-media-giants-to-account?traffic_source=rss
Al Jazeera,15,"The Alaska summit was not a ‘new Munich’, but it could be a ‘new Yalta’",https://www.aljazeera.com/opinions/2025/8/16/the-alaska-summit-was-not-a-new-munich-but-it-could-be-a-new?traffic_source=rss
Al Jazeera,16,‘Will I make it back alive?’: Gaza journalists fear targeting by Israel,https://www.aljazeera.com/news/2025/8/16/will-i-make-it-back-alive-gaza-journalists-fear-targeting-by-israel?traffic_source=rss
Al Jazeera,17,Trump to meet Ukraine’s Zelenskyy after ‘successful’ talks with Putin,https://www.aljazeera.com/news/2025/8/16/trump-set-to-meet-ukraines-zelenskyy-after-successful-talks-with-putin?traffic_source=rss
Al Jazeera,18,A hundred Hiroshimas,https://www.aljazeera.com/video/business-of-war/2025/8/16/a-hundred-hiroshimas?traffic_source=rss
Al Jazeera,19,Indonesia: Selling a Colonial War,https://www.aljazeera.com/video/featured-documentaries/2025/8/16/indonesia-selling-a-colonial-war?traffic_source=rss
Al Jazeera,20,"Arab, Islamic countries condemn Netanyahu’s ‘Greater Israel’ remark",https://www.aljazeera.com/news/2025/8/16/arab-islamic-countries-condemn-netanyahus-greater-israel-remark?traffic_source=rss
