site,rank,title,link
Al Jazeera,1,Jerusalem shooting escalates “collective punishment acts”,https://www.aljazeera.com/video/quotable/2025/9/9/jerusalem-shooting-escalates-collective-punishment?traffic_source=rss
Al Jazeera,2,Video: Al Jazeera reports from near the scene of Israeli strike in Qatar,https://www.aljazeera.com/video/newsfeed/2025/9/9/video-al-jazeera-reports-from-near-the-scene-of-israeli-strike-in-qatar?traffic_source=rss
Al Jazeera,3,Qatar condemns ‘cowardly’ Israeli attack in Doha,https://www.aljazeera.com/news/2025/9/9/qatar-condemns-cowardly-israeli-attack-in-doha?traffic_source=rss
Al Jazeera,4,Video: Explosions in Doha after Israel ‘targets Hamas’ leadership,https://www.aljazeera.com/video/newsfeed/2025/9/9/video-explosions-in-doha-after-israel-targets-hamas-leadership?traffic_source=rss
Al Jazeera,5,What we know about Gaza flotilla ‘drone attack’,https://www.aljazeera.com/video/newsfeed/2025/9/9/what-we-know-about-gaza-flotilla-drone?traffic_source=rss
Al Jazeera,6,Israeli forces keep destroying high-rise residential buildings in Gaza City,https://www.aljazeera.com/video/newsfeed/2025/9/9/israeli-forces-keep-destroying-high-rise-residential-buildings-in-gaza-city?traffic_source=rss
Al Jazeera,7,Israeli military says it attacked Hamas leaders in Qatar’s Doha,https://www.aljazeera.com/news/2025/9/9/israeli-military-says-it-has-attacked-hamas-leadership-in-qatars-doha?traffic_source=rss
Al Jazeera,8,Why a protective force for Gaza could be a dangerous idea,https://www.aljazeera.com/opinions/2025/9/9/why-a-protective-force-for-gaza-could-be-a-dangerous-idea?traffic_source=rss
Al Jazeera,9,Nepali PM Oli resigns amid protests: Why are ‘nepo kids’ angering youth?,https://www.aljazeera.com/news/2025/9/9/nepali-pm-oli-resigns-amid-protests-why-are-nepo-kids-angering-youth?traffic_source=rss
Al Jazeera,10,Protesters torch Nepal parliament as PM resigns amid turmoil,https://www.aljazeera.com/gallery/2025/9/9/protesters-torch-nepal-parliament-as-pm-resigns-amid-turmoil?traffic_source=rss
Al Jazeera,11,At least 60 people killed in DRC after ISIL-linked attack on funeral,https://www.aljazeera.com/news/2025/9/9/at-least-60-people-killed-in-drc-after-isil-linked-attack-on-funeral?traffic_source=rss
Al Jazeera,12,"China leads clean energy revolution, but also CO2 pollution, says report",https://www.aljazeera.com/news/2025/9/9/china-leads-clean-energy-revolution-but-also-co2-pollution-says-report?traffic_source=rss
Al Jazeera,13,LIVE: South Africa vs Nigeria – CAF World Cup qualifier,https://www.aljazeera.com/sports/liveblog/2025/9/9/live-nigeria-vs-south-africa-caf-world-cup-qualifer?traffic_source=rss
Al Jazeera,14,Gaza City residents react to Israel’s forced expulsion orders,https://www.aljazeera.com/video/newsfeed/2025/9/9/gaza-city-residents-react-to-israels-forced-expulsion-orders?traffic_source=rss
Al Jazeera,15,Nepal parliament set ablaze amid anti-corruption protests,https://www.aljazeera.com/video/newsfeed/2025/9/9/nepal-parliament-set-ablaze-amid-anti-corruption-protests?traffic_source=rss
Al Jazeera,16,‘Illusions stripped away’: What to know about the 80th UN General Assembly,https://www.aljazeera.com/news/2025/9/9/illusions-stripped-away-what-to-know-about-the-80th-un-general-assembly?traffic_source=rss
Al Jazeera,17,Japan’s ruling LDP to pick new leader after PM Ishiba resigns,https://www.aljazeera.com/news/2025/9/9/japans-ruling-ldp-to-pick-new-leader-after-pm-ishiba-resigns?traffic_source=rss
Al Jazeera,18,The Battle for Donbas,https://www.aljazeera.com/video/pinch-point/2025/9/9/the-battle-for-donbas?traffic_source=rss
Al Jazeera,19,"From Haile Selassie to crowdfunding, how Ethiopia’s GERD dam was born",https://www.aljazeera.com/features/2025/9/9/from-haile-selassie-to-crowdfunding-how-ethiopias-gerd-dam-was-born?traffic_source=rss
Al Jazeera,20,Video: Nepal leaders’ homes vandalised and in flames during mass protests,https://www.aljazeera.com/video/newsfeed/2025/9/9/video-nepal-leaders-homes-vandalised-and-in-flames-during-mass-protests?traffic_source=rss
