site,rank,title,link
Al Jazeera,1,Pope Leo XIV meets US VP JD Vance,https://www.aljazeera.com/program/newsfeed/2025/5/19/pope-leo-xiv-meets-us-vp-jd-vance?traffic_source=rss
Al Jazeera,2,Measure targeting pro-Palestine NGOs disappears from US tax bill,https://www.aljazeera.com/news/2025/5/19/measure-targeting-pro-palestine-ngos-disappears-from-us-tax-bill?traffic_source=rss
Al Jazeera,3,Regeneron buys 23andMe for $256m after bankruptcy,https://www.aljazeera.com/economy/2025/5/19/regeneron-buys-23andme-for-256m-after-bankruptcy?traffic_source=rss
Al Jazeera,4,Lithuania files case against Belarus at ICJ over alleged people smuggling,https://www.aljazeera.com/news/2025/5/19/lithuania-files-case-against-belarus-at-icj-over-alleged-people-smuggling?traffic_source=rss
Al Jazeera,5,Project Esther and the weaponisation of Zionism,https://www.aljazeera.com/opinions/2025/5/19/project-esther-and-the-weaponisation-of-zionism?traffic_source=rss
Al Jazeera,6,Gaza medical supplies warehouse hit in Israeli attack,https://www.aljazeera.com/video/newsfeed/2025/5/19/gaza-medical-supplies-warehouse-hit-in-israeli-attack?traffic_source=rss
Al Jazeera,7,"What is Israel’s new major ground offensive, Operation Gideon’s Chariots?",https://www.aljazeera.com/features/2025/5/19/what-is-israels-new-major-ground-offensive-operation-gideons-chariots?traffic_source=rss
Al Jazeera,8,Sudan’s army leader al-Burhan appoints former UN official as prime minister,https://www.aljazeera.com/news/2025/5/19/sudans-army-leader-al-burhan-appoints-former-un-official-as-prime-minister?traffic_source=rss
Al Jazeera,9,If the Dead Come Home: Iraq’s Mass Graves,https://www.aljazeera.com/program/witness/2025/5/19/if-the-dead-come-home-iraqs-mass-graves?traffic_source=rss
Al Jazeera,10,"UK, EU reach landmark deal: All you need to know",https://www.aljazeera.com/news/2025/5/19/uk-eu-reach-landmark-deal-all-you-need-to-know?traffic_source=rss
Al Jazeera,11,"Israel should be excluded from Eurovision, Spanish prime minister says",https://www.aljazeera.com/video/newsfeed/2025/5/19/israel-should-be-excluded-from-eurovision-spanish-prime-minister-says?traffic_source=rss
Al Jazeera,12,"Gaza’s Khan Younis latest focus of Israeli forced displacement, bombing",https://www.aljazeera.com/news/2025/5/19/gazas-khan-younis-latest-focus-of-israeli-forced-displacement-bombing?traffic_source=rss
Al Jazeera,13,Moscow outlaws Amnesty International for ‘Russophobia’ amid Ukraine war,https://www.aljazeera.com/news/2025/5/19/moscow-outlaws-amnesty-international-for-russophobia-amid-ukraine-war?traffic_source=rss
Al Jazeera,14,"Gary Lineker leaves BBC amid anti-Semitism row, pro-Palestinian comments",https://www.aljazeera.com/sports/2025/5/19/gary-lineker-leaves-bbc-amid-anti-semitism-row-pro-palestinian-comments?traffic_source=rss
Al Jazeera,15,Chechnya’s Kadyrov wanted to resign. Or did he?,https://www.aljazeera.com/news/2025/5/19/chechnyas-kadyrov-wanted-to-resign-or-did-he?traffic_source=rss
Al Jazeera,16,Tanzanian opposition leader makes defiant appearance at treason trial,https://www.aljazeera.com/news/2025/5/19/tanzanian-opposition-leader-makes-defiant-appearance-at-treason-trial?traffic_source=rss
Al Jazeera,17,What we know so far about Biden’s cancer diagnosis,https://www.aljazeera.com/program/newsfeed/2025/5/19/what-we-know-so-far-about-bidens-cancer-diagnosis?traffic_source=rss
Al Jazeera,18,Car bomb in Pakistan’s restive southwest kills four people,https://www.aljazeera.com/news/2025/5/19/car-bomb-in-pakistans-restive-southwest-kills-four-people?traffic_source=rss
Al Jazeera,19,"Romania, Poland, Portugal election results: Who are the winners and losers?",https://www.aljazeera.com/news/2025/5/19/romania-poland-portugal-election-results-who-are-the-winners-and-losers?traffic_source=rss
Al Jazeera,20,Cat caught smuggling drugs into prison in Costa Rica,https://www.aljazeera.com/video/newsfeed/2025/5/19/cat-caught-smuggling-drugs-into-prison-into-costa-rica?traffic_source=rss
