site,rank,title,link
Al Jazeera,1,CENTCOM: ‘Safe path’ through Hormuz is US priority in ‘Project Freedom’,https://www.aljazeera.com/video/newsfeed/2026/5/5/centcom-safe-path-through-hormuz-is-us-priority-in-project?traffic_source=rss
Al Jazeera,2,Arsenal beat Atletico to reach first Champions League final in 20 years,https://www.aljazeera.com/sports/2026/5/5/arsenal-beat-atletico-to-reach-first-champions-league-final-in-20-years?traffic_source=rss
Al Jazeera,3,"Before Vatican trip, Rubio defends Trump remarks on Pope Leo over Iran",https://www.aljazeera.com/news/2026/5/5/before-vatican-trip-rubio-defends-trump-remarks-on-pope-leo-over-iran?traffic_source=rss
Al Jazeera,4,"Israel kills one boy, injures officers in strike on Gaza police station",https://www.aljazeera.com/video/newsfeed/2026/5/5/israel-kills-one-boy-injures-officers-in-strike-on-gaza-police-station?traffic_source=rss
Al Jazeera,5,US Army says ‘Project Freedom’ in blockaded Hormuz has ‘just begun’,https://www.aljazeera.com/news/2026/5/5/centcom-says-project-freedom-has-just-2?traffic_source=rss
Al Jazeera,6,Could OPEC break lead to era of energy volatility?,https://www.aljazeera.com/video/the-take-2/2026/5/5/aje-onl-tt_uae_opec_video_v1-050526?traffic_source=rss
Al Jazeera,7,Mauritania’s plan to close private schools sparks backlash,https://www.aljazeera.com/video/newsfeed/2026/5/5/mauritanias-plan-to-close-private-schools-sparks-backlash?traffic_source=rss
Al Jazeera,8,US plans to hike tariffs on EU cars to 25% will hit luxury market the most,https://www.aljazeera.com/economy/2026/5/5/us-plans-to-hike-tariffs-on-eu-cars-to-25-will-hit-luxury-market-the-most?traffic_source=rss
Al Jazeera,9,Miscalculation over Strait of Hormuz could ‘bring an all-out war’,https://www.aljazeera.com/video/quotable/2026/5/5/miscalculation-over-strait-of-hormuz-could-bring-an-all-out?traffic_source=rss
Al Jazeera,10,Sudan recalls Ethiopia ambassador after strikes on Khartoum,https://www.aljazeera.com/video/newsfeed/2026/5/5/sudan-recalls-ethiopia-ambassador-after-strikes-on-khartoum?traffic_source=rss
Al Jazeera,11,Video: Trump says Iran should ‘wave the white flag’,https://www.aljazeera.com/video/newsfeed/2026/5/5/video-trump-says-iran-should-wave-the-white-flag?traffic_source=rss
Al Jazeera,12,US push for Lebanon and Israel leaders to meet could inflame tensions,https://www.aljazeera.com/features/2026/5/5/us-push-for-lebanon-and-israel-leaders-to-meet-could-inflame-tensions?traffic_source=rss
Al Jazeera,13,UK convicts four Palestine Action activists over break-in at Israeli firm,https://www.aljazeera.com/news/2026/5/5/uk-convicts-four-palestine-action-activists-over-break-in-at-israeli-firm?traffic_source=rss
Al Jazeera,14,"Microsoft, Google, xAI give US access to AI models for security testing",https://www.aljazeera.com/economy/2026/5/5/microsoft-google-xai-give-us-access-to-ai-models-for-security-testing?traffic_source=rss
Al Jazeera,15,UAE comes under Iranian attacks for second consecutive day: Ministry,https://www.aljazeera.com/news/2026/5/5/uae-intercepts-missiles-and-drones-for-second-day?traffic_source=rss
Al Jazeera,16,"Ukraine, Russia exchange drone strikes ahead of V-Day ‘ceasefire’",https://www.aljazeera.com/video/newsfeed/2026/5/5/ukraine-russia-exchange-drone-strikes-ahead-of-v-day?traffic_source=rss
Al Jazeera,17,West Bengal Chief refuses to resign after ‘dirty’ election,https://www.aljazeera.com/video/newsfeed/2026/5/5/west-bengal-chief-refuses-to-resign-after-dirty-election?traffic_source=rss
Al Jazeera,18,Iran’s judiciary vows action against ‘enemy’s mercenaries’ amid executions,https://www.aljazeera.com/news/2026/5/5/irans-judiciary-vows-action-against-enemys-mercenaries-amid-executions?traffic_source=rss
Al Jazeera,19,Boko Haram attack kills 23 soldiers in Chad’s Lake Chad region,https://www.aljazeera.com/news/2026/5/5/boko-haram-attack-kills-23-soldiers-in-chads-lake-chad-region?traffic_source=rss
Al Jazeera,20,LIVE: Arsenal 1-0 Atletico Madrid (2-1 agg) – Champions League semifinal,https://www.aljazeera.com/sports/liveblog/2026/5/5/live-arsenal-vs-atletico-madrid-champions-league-semifinal?traffic_source=rss
Associated Press,1,Russia declares a truce in Ukraine to mark Victory Day. Kyiv says it'll cease fire two days earlier,https://apnews.com/article/russia-ukraine-war-unilateral-truce-parade-9a686273da1f284230180a7819613719
Associated Press,2,Alberta separatist group says it has enough signatures to trigger referendum on leaving Canada,https://apnews.com/article/alberta-separation-canada-referendum-e93c247ccc2e5f0340a5490d88ab0da2
Associated Press,3,US says ceasefire with Iran is holding despite attacks in the Strait of Hormuz and against the UAE,https://apnews.com/article/iran-us-war-ceasefire-negotiations-strait-hormuz-b8a77d16945085e5a5039032a55b3a90
Associated Press,4,Former Patriots receiver Stefon Diggs is found not guilty of assaulting his private chef,https://apnews.com/article/patriots-new-england-stefon-diggs-assault-chef-7128f3d02e1058120d0d5423f0ec72f5
Associated Press,5,Blake Lively and Justin Baldoni have ended their 'It Ends With Us' dispute in a settlement,https://apnews.com/article/blake-lively-justin-baldoni-lawsuit-settlement-487a0a823349c95c502aa35b3752357b
Associated Press,6,"Trump's retribution? What to watch in today's elections in Indiana, Ohio and Michigan",https://apnews.com/article/primaries-indiana-ohio-michigan-takeaways-722f8ee155920578db6964f54e910449
Associated Press,7,Secret Service says suspect opened fire on them and was shot in exchange near Washington Monument,https://apnews.com/article/officer-shooting-washington-monument-e941546200fa1a2a487b63addf6ced77
Associated Press,8,"El Atlético se muda a hotel ""más barato"" en Londres y avista a  Álvarez en vuelta de semifinales",https://apnews.com/article/atletico-madrid-simeone-ce2d6a269bcde6296a96d2208d438b64
Associated Press,9,Edwards returns and Timberwolves overcome big game by Wembanyama to beat Spurs 104-102 in Game 1,https://apnews.com/article/timberwolves-wolves-spurs-score-wembanyama-edwards-5c70a8def68dc19713533cefa5edd3eb
Associated Press,10,Auriemma says he felt 'dumb' for the way exchange with Staley played out following Final Four game,https://apnews.com/article/geno-auriemma-uconn-269adc37973d692ac7d95e5e37ddb818
Associated Press,11,"Inside the Met Gala, an Olympic champion learns just how famous she's become",https://apnews.com/article/met-gala-2026-behind-scenes-1992bb65151d4b4abff2572d56049bc8
Associated Press,12,Dolly Parton cancels Las Vegas residency due to health issues: 'Everything I have is treatable',https://apnews.com/article/dolly-parton-health-residency-cancellation-14f6d7b1737e4d86d125bc6e04b1bdda
Associated Press,13,Wall Street rallies to records after oil prices ease and corporate profits keep topping expectations,https://apnews.com/article/stocks-markets-trump-oil-iran-e1c194b5266c4eb58dc993cc4a9f9b50
Associated Press,14,"Pennsylvania sues AI company, saying its chatbots illegally hold themselves out as licensed doctors",https://apnews.com/article/character-ai-chatbots-medical-advice-pennsylvania-46502067ed5b3cd9f9173f194ad30070
Associated Press,15,OpenAI president discloses his stake in the company is worth $30B,https://apnews.com/article/brockman-musk-altman-openai-trial-837bdc3fbced2a02f0f93a1899260bdd
Associated Press,16,Astrónomos creen haber hallado diminuto mundo helado más allá de Plutón con atmósfera fina,https://apnews.com/article/ciencia-espacio-cuerpo-sideral-planetas-sol-d3431afc6c13fa4b2e7c051646116b8c
Associated Press,17,"Nipper, stay! The future of a beloved dog statue on a New York warehouse is up in the air",https://apnews.com/article/nipper-dog-statue-albany-new-york-69a5ca4ec514f837626475b5d5264c1d
Associated Press,18,How 2 men claimed an absurd record by driving an old 3-wheel car the length of Africa,https://apnews.com/article/adventure-car-africa-record-reliant-robin-0328f6a9dbcb407d539fe7aabf23a915
Associated Press,19,1 million bees make for bumper-to-buzzer traffic on a Tennessee highway ramp,https://apnews.com/article/bees-highway-crash-tennessee-592ae29c23856d6b67bcc7123fe9867a
Associated Press,20,Viral phenomenon in Argentina has young people identifying themselves as animals,https://apnews.com/article/argentina-teenagers-identifying-as-animals-therians-tiktok-54d158c4842f6515e31d83a260cdf31f
