site,rank,title,link
Al Jazeera,1,"US says more than 1,400 infected by parasitic Cyclospora illness outbreak",https://www.aljazeera.com/news/2026/7/22/us-says-more-than-1400-infected-by-parasitic-cyclospora-illness-outbreak?traffic_source=rss
Al Jazeera,2,Desperate families search rubble weeks after Venezuela earthquakes,https://www.aljazeera.com/video/newsfeed/2026/7/22/desperate-families-search-rubble-weeks-after-venezuela-earthquakes?traffic_source=rss
Al Jazeera,3,Former Biden official can’t see ‘pilot zones’ scheme working in Lebanon,https://www.aljazeera.com/video/newsfeed/2026/7/22/aje-onl-nf_gavito-cant-see-pilot-zones-working-in-lebanon-210726?traffic_source=rss
Al Jazeera,4,"Leopard caught on camera storming into a store in Rajasthan, India",https://www.aljazeera.com/video/newsfeed/2026/7/22/leopard-caught-on-camera-storming-into-a-store-in-rajasthan-india?traffic_source=rss
Al Jazeera,5,Iran war live: US launches new attacks; Hegseth says war has cost $37.5bn,https://www.aljazeera.com/news/liveblog/2026/7/22/iran-war-live-us-launches-new-attacks-hegseth-says-war-has-cost-37-5bn?traffic_source=rss
Al Jazeera,6,US attacks Iran for 11th consecutive night,https://www.aljazeera.com/news/2026/7/21/explosions-in-iran-as-us-launches-new-strikes?traffic_source=rss
Al Jazeera,7,Lebanese army deploys in ‘pilot zones’ under US-backed plan,https://www.aljazeera.com/video/2026/7/21/lebanese-army-deploys-in-pilot-zones-under-us-backed-plan?traffic_source=rss
Al Jazeera,8,"Trump administration attacks US left, alleging Cuba ties: Key takeaways",https://www.aljazeera.com/news/2026/7/21/trump-administration-attacks-us-left-alleging-cuba-ties-key-takeaways?traffic_source=rss
Al Jazeera,9,Moldova chooses new prime minister as it pushes for EU membership,https://www.aljazeera.com/news/2026/7/21/moldova-chooses-new-prime-minister-as-it-pushes-for-eu-membership?traffic_source=rss
Al Jazeera,10,Zelenskyy replaces Ukraine military chief after protests,https://www.aljazeera.com/news/2026/7/21/zelenskyy-replaces-ukraine-military-chief-after-protests?traffic_source=rss
Al Jazeera,11,Drone shows scorched landscape after Spain wildfire,https://www.aljazeera.com/video/newsfeed/2026/7/21/drone-shows-scorched-landscape-after-spain-wildfire?traffic_source=rss
Al Jazeera,12,US defence chief Hegseth puts Iran war cost at $37.5bn so far,https://www.aljazeera.com/news/2026/7/21/hegseth-says-iran-war-has-cost-37-5bn-in-latest-official-us-account?traffic_source=rss
Al Jazeera,13,Iran holds funerals for children killed in Minab school strike,https://www.aljazeera.com/video/newsfeed/2026/7/21/iran-holds-funerals-for-children-killed-in-minab-school-strike?traffic_source=rss
Al Jazeera,14,How will Khalil al-Hayya’s leadership shape Hamas?,https://www.aljazeera.com/video/inside-story/2026/7/21/how-will-khalil-al-hayyas-leadership-shape-hamas?traffic_source=rss
Al Jazeera,15,Guyana reports ferry disaster death toll rises to 41,https://www.aljazeera.com/news/2026/7/21/guyana-reports-ferry-disaster-death-toll-rises-to-41?traffic_source=rss
Al Jazeera,16,Daytime Russian strike kills three in Zaporizhzhia,https://www.aljazeera.com/video/newsfeed/2026/7/21/daytime-russian-strike-kills-three-in-zaporizhzhia?traffic_source=rss
Al Jazeera,17,French parliament passes social media ban for under-15s,https://www.aljazeera.com/news/2026/7/21/french-parliament-passes-social-media-ban-for-under-15s?traffic_source=rss
Al Jazeera,18,US funding cuts deal blow to global HIV treatment: Report,https://www.aljazeera.com/news/2026/7/21/us-funding-cuts-deal-blow-to-global-hiv-treatment-report?traffic_source=rss
Al Jazeera,19,Deposed Turkish opposition leader plans new party,https://www.aljazeera.com/news/2026/7/21/deposed-turkish-opposition-leader-plans-new-party?traffic_source=rss
Al Jazeera,20,Carney says he and Trump have agreed to ‘intensify’ trade negotiations,https://www.aljazeera.com/economy/2026/7/21/carney-says-he-and-trump-have-agreed-to-intensify-trade-negotiations?traffic_source=rss
Associated Press,1,"Israel is building a miles-long earthen barrier inside Gaza, entrenching its division",https://apnews.com/article/israel-gaza-yellow-line-barrier-ceasefire-941ed80f6d4398ce88916f6b08753dd8
Associated Press,2,US military completes 11th night of strikes on Iran as attacks overshadow diplomacy,https://apnews.com/article/iran-us-hormuz-strait-war-july-21-2026-1664f6a4dad005a99771b2ad15213585
Associated Press,3,"Man stabs and wounds tourists near the Acropolis in Athens, Greece",https://apnews.com/article/greece-athens-tourist-stabbings-4bea820db5357c69d5d5d6cb44d7977a
Associated Press,4,US military identifies 3rd service member believed to have been killed in Iranian attack,https://apnews.com/article/iran-war-us-soldier-deaths-jordan-attack-5ec21d4f12fbdee658ec15ed8d3750ee
Associated Press,5,Man tossed by Yellowstone bison says hitting the ground was the worst part,https://apnews.com/article/yellowstone-national-park-bison-attack-63d4f0040a8762f58f8be4e9f3c8856c
Associated Press,6,Appeals court rejects Biden's bid to block release of recordings of ghostwriter interviews,https://apnews.com/article/biden-special-counsel-heritage-foundation-ghostwriter-301b4f2f142dc3490e5d307761210786
Associated Press,7,Trump administration says it's deferring $1B in Medicaid payments to California and Minnesota,https://apnews.com/article/medicaid-fraud-minnesota-california-oz-rfk-trump-24033ef9807b46f8b6fd6614ef5b1169
Associated Press,8,"ESPN starts layoffs tied to NFL Network acquisition, memo says",https://apnews.com/article/espn-layoffs-c5d77a9109f6bb44a162410480412028
Associated Press,9,Messi returns to Argentina for rest after World Cup final loss to Spain,https://apnews.com/article/lionel-messi-argentina-world-cup-e2a0f15bb377ca3831006de8bc4b6735
Associated Press,10,LIV Golf suffers setback with Asian Tour joining new alliance with European and PGA tours,https://apnews.com/article/liv-golf-asian-tour-pga-tour-european-tour-3f9421c125577dac0612d889854afeed
Associated Press,11,"Kaylee Hottle, deaf 'Godzilla' actor, killed in car crash at 18",https://apnews.com/article/kaylee-hottle-dies-godzilla-actor-7971cbb43107772fe4e9a6174ea84111
Associated Press,12,"Detective says D4vd ordered chain saws, body bags in hearing to decide if singer should go to trial",https://apnews.com/article/d4vd-celeste-rivas-hernandez-tesla-f90580c2737575deaaf080f7e5369f80
Associated Press,13,Luke Skywalker's 'Empire Strikes Back' lightsaber with severed hand attached auctioned for $3.75M,https://apnews.com/article/lightsaber-luke-empire-auction-hand-star-wars-a4321b538897ce879561e85bff5f9306
Associated Press,14,US civil rights agency moves to end demographic data collection after 60 years,https://apnews.com/article/eeoc-discrimination-dei-andrea-lucas-2f521d784a9d0376416499066dc9f178
Associated Press,15,OpenAI says its AI technology acted on its own in an 'unprecedented' hack of another company,https://apnews.com/article/openai-gpt56-sol-hugging-face-63ab84fed5612af04d8a160d60f6def3
Associated Press,16,Judge approves a $1.5B Anthropic settlement over pirated books used to train the Claude chatbot,https://apnews.com/article/ai-anthropic-copyright-settlement-claude-books-bartz-74b140444023898aeba8579b6e9f0d63
Associated Press,17,Private mission launches to extend life of out-of-gas communication satellites,https://apnews.com/article/northrop-grumman-spacex-satellite-repair-51e67a9fc4a800a28e2fcb99f0949db2
Associated Press,18,Raccoon goes on drunken rampage in Virginia liquor store and passes out on bathroom floor,https://apnews.com/article/drunk-raccoon-liquor-store-bandit-virginia-5109feb2ea9ab9bf8954ec3798689fd0
Associated Press,19,Viral phenomenon in Argentina has young people identifying themselves as animals,https://apnews.com/article/argentina-teenagers-identifying-as-animals-therians-tiktok-54d158c4842f6515e31d83a260cdf31f
Associated Press,20,"Fatou, the world's oldest gorilla living in captivity, celebrates her 69th birthday at Berlin Zoo",https://apnews.com/article/gorilla-germany-fatou-berlin-zoo-0196b95f3b6d48593bb7c872cab51adf
