site,rank,title,link
Al Jazeera,1,Siraj strikes after Jaiswal helps India set England daunting target,https://www.aljazeera.com/sports/2025/8/2/siraj-strikes-after-jaiswal-helps-india-set-england-daunting-target?traffic_source=rss
Al Jazeera,2,Ukraine says defence sector corruption scheme uncovered,https://www.aljazeera.com/news/2025/8/2/ukraine-says-defence-sector-corruption-scheme-uncovered?traffic_source=rss
Al Jazeera,3,What’s the fallout from Trump’s new batch of tariffs?,https://www.aljazeera.com/video/inside-story/2025/8/2/whats-the-fallout-from-trumps-new-batch-of-tariffs?traffic_source=rss
Al Jazeera,4,"Hamas denies it expressed willingness to disarm, slams Witkoff’s Gaza trip",https://www.aljazeera.com/news/2025/8/2/hamas-denies-it-expressed-willingness-to-disarm-slams-witkoffs-gaza-trip?traffic_source=rss
Al Jazeera,5,"Palestinian boy, 17, dies of Israel-induced starvation in Gaza",https://www.aljazeera.com/news/2025/8/2/palestinian-boy-17-dies-of-israel-induced-starvation-in-gaza?traffic_source=rss
Al Jazeera,6,I may starve to death before I am able to graduate in Gaza,https://www.aljazeera.com/opinions/2025/8/2/i-may-starve-to-death-before-i-am-able-to-graduate-in-gaza?traffic_source=rss
Al Jazeera,7,Why is Trump moving nuclear submarines after spat with Medvedev?,https://www.aljazeera.com/news/2025/8/2/why-is-trump-moving-nuclear-submarines-after-spat-with-medvedev?traffic_source=rss
Al Jazeera,8,"One dead, five trapped after giant Chile copper mine collapses",https://www.aljazeera.com/news/2025/8/2/one-dead-five-trapped-after-giant-chile-copper-mine-collapses?traffic_source=rss
Al Jazeera,9,"Ukraine drone attacks kill three in Russia, cause fire at oil refinery",https://www.aljazeera.com/news/2025/8/2/ukraine-drone-attacks-kill-three-in-russia-cause-fire-at-oil-refinery?traffic_source=rss
Al Jazeera,10,Inside India’s expulsion of Bengali Muslims,https://www.aljazeera.com/video/the-listening-post/2025/8/2/inside-indias-expulsion-of-bengali-muslims?traffic_source=rss
Al Jazeera,11,"DRC, Rwanda agree economic framework outline as part of peace deal",https://www.aljazeera.com/news/2025/8/2/drc-rwanda-agree-economic-framework-outline-as-part-of-peace-deal?traffic_source=rss
Al Jazeera,12,"One in three Palestinians in Gaza going days without food, UNICEF says",https://www.aljazeera.com/news/2025/8/2/one-in-three-palestinians-in-gaza-going-days-without-food-unicef-says?traffic_source=rss
Al Jazeera,13,Trump’s $200m ballroom: A history of home improvements at the White House,https://www.aljazeera.com/news/2025/8/2/trumps-200m-ballroom-a-history-of-home-improvements-at-the-white-house?traffic_source=rss
Al Jazeera,14,How a popular Peruvian soft drink went ‘toe-to-toe’ with Coca-Cola,https://www.aljazeera.com/features/2025/8/2/how-a-popular-peruvian-soft-drink-went-toe-to-toe-with-coca-cola?traffic_source=rss
Al Jazeera,15,Gaza family’s battle for survival as hunger and heat deepen despair,https://www.aljazeera.com/gallery/2025/8/2/gaza-familys-battle-for-survival-as-hunger-and-heat-deepen-despair?traffic_source=rss
Al Jazeera,16,Ex-Mali PM charged over X post supporting jailed critics of military rulers,https://www.aljazeera.com/news/2025/8/2/ex-mali-pm-charged-over-x-post-supporting-jailed-critics-of-military-rulers?traffic_source=rss
Al Jazeera,17,Tottenham captain Son Heung-min to leave Premier League club,https://www.aljazeera.com/sports/2025/8/2/tottenham-captain-son-heung-min-to-leave-premier-league-club?traffic_source=rss
Al Jazeera,18,"Nigeria kills her sun: Death and vindication for Ken Saro-Wiwa, Ogoni Nine",https://www.aljazeera.com/features/2025/8/2/nigeria-kills-her-sun-death-and-vindication-for-ken-saro-wiwa-ogoni-nine?traffic_source=rss
Al Jazeera,19,Manhunt for ex-US soldier suspected of killing 4 in Montana bar,https://www.aljazeera.com/news/2025/8/2/manhunt-for-ex-us-soldier-suspected-of-killing-4-in-montana-bar?traffic_source=rss
Al Jazeera,20,Non-US West lacks “leverage” on Palestine issue,https://www.aljazeera.com/video/quotable/2025/8/2/non-us-west-lacks-leverage-on-palestine-issue?traffic_source=rss
