site,rank,title,link
Al Jazeera,1,"Family, including two daughters, killed in Israeli strikes on Gaza",https://www.aljazeera.com/news/2026/6/20/family-including-two-daughters-killed-in-israeli-strikes-on-gaza?traffic_source=rss
Al Jazeera,2,"World Cup 2026: Netherlands vs Sweden prediction, schedules, key highlights",https://www.aljazeera.com/sports/2026/6/20/world-cup-2026-netherlands-vs-sweden-prediction-schedules-key-highlights?traffic_source=rss
Al Jazeera,3,"Mona Khalil, Lebanon’s turtle advocate, dies after Israeli attack",https://www.aljazeera.com/news/2026/6/20/mona-khalil-lebanons-turtle-advocate-dies-after-israeli-attack?traffic_source=rss
Al Jazeera,4,Australia pledges action on H5N1 after bird flu case confirmed,https://www.aljazeera.com/news/2026/6/20/australia-pledges-action-on-h5n1-after-bird-flu-case-confirmed?traffic_source=rss
Al Jazeera,5,"US envoy headed for Switzerland, Israeli strikes on Lebanon threaten talks",https://www.aljazeera.com/news/2026/6/20/us-envoy-headed-for-switzerland-israeli-strikes-on-lebanon-threaten-talks?traffic_source=rss
Al Jazeera,6,‘We tasted the horrors of war’: Stories of refugees who returned home,https://www.aljazeera.com/features/longform/2026/6/20/we-tasted-the-horrors-of-war-stories-of-refugees-who-returned-home?traffic_source=rss
Al Jazeera,7,Iran war day 113: Tehran presses US over Lebanon ceasefire,https://www.aljazeera.com/news/2026/6/20/iran-war-day-113-tehran-presses-us-over-lebanon-ceasefire?traffic_source=rss
Al Jazeera,8,What pushed the number of displaced people down?,https://www.aljazeera.com/video/by-the-numbers-3/2026/6/20/what-pushed-the-number-of-displaced-people-down?traffic_source=rss
Al Jazeera,9,Turkiye knocked out of World Cup 2026 after 1-0 defeat to 10-man Paraguay,https://www.aljazeera.com/sports/2026/6/20/turkiye-knocked-out-of-world-cup-2026-after-1-0-defeat-to-10-man-paraguay?traffic_source=rss
Al Jazeera,10,Inferno rips through Dominican Republic beach resort,https://www.aljazeera.com/video/newsfeed/2026/6/20/inferno-rips-through-dominican-republic-beach-resort?traffic_source=rss
Al Jazeera,11,Israel fetes Somaliland’s leader as it seeks to expand Red Sea influence,https://www.aljazeera.com/news/2026/6/20/israel-fetes-somalilands-leader-as-it-seeks-to-expand-red-sea-influence?traffic_source=rss
Al Jazeera,12,UN meeting erupts over sexual violence allegations against Israel,https://www.aljazeera.com/video/newsfeed/2026/6/20/un-meeting-erupts-over-sexual-violence-allegations-against-israel?traffic_source=rss
Al Jazeera,13,Mexico City looks to rein in street drinking after massive World Cup party,https://www.aljazeera.com/sports/2026/6/20/mexico-city-looks-to-rein-in-street-drinking-after-massive-world-cup-party?traffic_source=rss
Al Jazeera,14,"Hydration break boos: How FIFA united players, fans, coaches at World Cup",https://www.aljazeera.com/sports/2026/6/20/hydration-break-boos-how-fifa-united-players-fans-coaches-at-world-cup?traffic_source=rss
Al Jazeera,15,"One dead and 89 injured following train collision in Bedford, UK",https://www.aljazeera.com/video/newsfeed/2026/6/20/one-dead-and-89-injured-following-train-collision-in-bedford-uk?traffic_source=rss
Al Jazeera,16,Cunha hits Brazil double against Haiti to seal first World Cup 2026 win,https://www.aljazeera.com/sports/2026/6/20/cunha-hits-brazil-double-against-haiti-to-seal-first-world-cup-2026-win?traffic_source=rss
Al Jazeera,17,Lebanese influencer organises World Cup event amid Israel’s attack on Leban,https://www.aljazeera.com/video/newsfeed/2026/6/20/lebanese-influencer-organises-world-cup-event-amid-israels-attack-on-leban?traffic_source=rss
Al Jazeera,18,Morocco beat Scotland 1–0 as Saibari scores fastest World Cup 2026 goal,https://www.aljazeera.com/sports/2026/6/20/morocco-beat-scotland-1-0-as-saibari-scores-fastest-world-cup-2026?traffic_source=rss
Al Jazeera,19,Iran war live: Tehran says US must ensure Israel ends attacks on Lebanon,https://www.aljazeera.com/news/liveblog/2026/6/20/iran-war-live-tehran-says-us-must-ensure-israel-ends-attacks-on-lebanon?traffic_source=rss
Al Jazeera,20,US judge rejects Joe Biden’s lawsuit asking to withhold memoir recordings,https://www.aljazeera.com/news/2026/6/19/us-judge-rejects-joe-bidens-lawsuit-asking-to-withhold-memoir-recordings?traffic_source=rss
Associated Press,1,"Israel and Hezbollah agree to halt fighting, officials say, as US-Iran talks hang in the balance",https://apnews.com/article/iran-us-israel-lebanon-oil-june-19-2026-635ad6f41610df8355d24cc301a75fc4
Associated Press,2,Meloni slams Trump's claim she 'begged' for a photo with him as Italy's top diplomat cancels US trip,https://apnews.com/article/trump-meloni-italy-us-36d6452879d0d61983802c036cdb7835
Associated Press,3,Pentagon chief's review appears out of step with what NATO allies are already doing,https://apnews.com/article/nato-us-hegseth-pentagon-review-europe-spending-0529a8f0c581ff34a427a70086223c61
Associated Press,4,Barack and Michelle Obama surprise first visitors to newly opened presidential center,https://apnews.com/article/obama-presidential-center-chicago-juneteenth-7f655b125d3cc28dcee91e1645842782
Associated Press,5,Americans celebrate Juneteenth as Obama's presidential center opens to the public,https://apnews.com/article/juneteenth-june-19-holiday-celebration-obama-center-52dcbf757afbf9e43ee71296c440e35f
Associated Press,6,Black bank card program to steer cash payments to single mothers in government housing,https://apnews.com/article/redemption-bank-king-credit-debit-card-poverty-dc3d6603ba570bcd64cd11504afef6d3
Associated Press,7,"What Americans think about Trump's handling of Iran, according to a new AP-NORC poll",https://apnews.com/article/poll-trump-iran-economy-israel-7d7d79150f3da1cc28076604f8659b64
Associated Press,8,"President Donald Trump unveils the new Air Force One, a converted Qatari jet",https://apnews.com/article/trump-air-force-one-qatar-5d6997dba287d70749b736067c8a337b
Associated Press,9,Friction between Trump and Republican senators is growing before the pivotal midterm elections,https://apnews.com/article/trump-senate-republicans-clayton-intelligence-voting-save-577d1ce2b1f039b6788302f3f79dab45
Associated Press,10,World Cup ticket buyers are left stranded as resale purchases fall through,https://apnews.com/article/world-cup-ticket-problems-stubhub-fifa-21c31f5cc33012e7f4619d4bff3b44a1
Associated Press,11,South Africa's no-nonsense coach who shut down Trump question and told critics back home to shut up,https://apnews.com/article/world-cup-hugo-broos-south-africa-71a0041581c159bae1693778ff1cd09d
Associated Press,12,"Morocco star Achraf Hakimi will stand trial in a rape case, French appeals court confirms",https://apnews.com/article/hakimi-world-cup-trial-rape-psg-morocco-23a83548f23d923cc92c5a39080e9c2f
Associated Press,13,"James Burrows, director of classic TV comedies including 'Cheers' and 'Friends,' dies at 85",https://apnews.com/article/james-burrows-obituary-80b0422bd2268e2aa8fb4b47755eda31
Associated Press,14,Anne Hathaway is pregnant with her third child,https://apnews.com/article/anne-hathaway-pregnant-third-child-305cb80044368952bcc2d5929b705b9f
Associated Press,15,"What full-time working moms and dads want, by the numbers",https://apnews.com/article/working-parents-survey-moms-dads-efb84d7c9657c4b706460d2e928a59d6
Associated Press,16,World shares are mixed and US futures fall after a tech-led rally on Wall St,https://apnews.com/article/stocks-markets-rates-iran-oil-24b4d022fb308e6336ac45a2b191c009
Associated Press,17,Sunday is the longest day of the year for half the planet. A guide to the summer solstice,https://apnews.com/article/summer-solstice-equinox-longest-day-5c9aff6d8d0248cf8df490204e1ed73e
Associated Press,18,Viral phenomenon in Argentina has young people identifying themselves as animals,https://apnews.com/article/argentina-teenagers-identifying-as-animals-therians-tiktok-54d158c4842f6515e31d83a260cdf31f
Associated Press,19,Lettuce introduce you to the live frog found in this grocery store salad bag,https://apnews.com/article/australia-frog-lettuce-salad-esperance-4134acf75e814dedd7789c1423c26ab1
Associated Press,20,Raccoon goes on drunken rampage in Virginia liquor store and passes out on bathroom floor,https://apnews.com/article/drunk-raccoon-liquor-store-bandit-virginia-5109feb2ea9ab9bf8954ec3798689fd0
