site,rank,title,link
Al Jazeera,1,Hezbollah holds firm in Lebanon’s municipal elections,https://www.aljazeera.com/features/2025/5/26/hezbollah-holds-firm-in-lebanons-municipal-elections?traffic_source=rss
Al Jazeera,2,ECB’s Lagarde says euro could be viable alternative to US dollar,https://www.aljazeera.com/economy/2025/5/26/ecbs-lagarde-says-euro-could-be-viable-alternative-to-us-dollar?traffic_source=rss
Al Jazeera,3,"More than 95 percent of Gaza’s agricultural land unusable, UN warns",https://www.aljazeera.com/news/2025/5/26/more-than-95-percent-of-gazas-agricultural-land-unusable-un-warns?traffic_source=rss
Al Jazeera,4,Provocative march by right-wing Israelis raises tensions in Jerusalem,https://www.aljazeera.com/gallery/2025/5/26/photos-provocative-march-by-right-wing-israelis-raises-tensions-in-jerusalem?traffic_source=rss
Al Jazeera,5,"Five years since the murder of George Floyd, what has changed?",https://www.aljazeera.com/video/newsfeed/2025/5/26/five-years-since-the-murder-of-george-floyd-what-has-changed?traffic_source=rss
Al Jazeera,6,Ukraine accuses China of supplying Russian arms industry,https://www.aljazeera.com/news/2025/5/26/ukraine-accuses-china-of-supplying-russian-arms-industry?traffic_source=rss
Al Jazeera,7,Palestinian child filmed trying to escape fires after Israeli attack,https://www.aljazeera.com/video/newsfeed/2025/5/26/palestinian-child-filmed-trying-to-escape-fires-after-israeli-attack?traffic_source=rss
Al Jazeera,8,Romania’s President Dan sworn in amid far-right claims of stolen election,https://www.aljazeera.com/news/2025/5/26/romanias-president-dan-sworn-in-amid-far-right-claims-of-stolen-election?traffic_source=rss
Al Jazeera,9,Kylian Mbappe wins European Golden Shoe award for first time,https://www.aljazeera.com/sports/2025/5/26/kylian-mbappe-wins-european-golden-shoe-award-for-first-time?traffic_source=rss
Al Jazeera,10,Are Palestinian groups in Lebanon about to give up their weapons?,https://www.aljazeera.com/features/2025/5/26/are-palestinian-groups-in-lebanon-about-to-give-up-their-weapons?traffic_source=rss
Al Jazeera,11,Donald Trump condemns Putin after deadly Russian strikes on Ukraine,https://www.aljazeera.com/program/newsfeed/2025/5/26/donald-trump-condemns-putin-after-deadly-russian-strikes-on-ukraine?traffic_source=rss
Al Jazeera,12,Congolese refugees in Burundi face starvation and violence amid aid cuts,https://www.aljazeera.com/gallery/2025/5/26/congolese-refugees-in-burundi-face-starvation-and-violence-amid-aid-cuts?traffic_source=rss
Al Jazeera,13,Iran rules out enrichment break as bait for US nuclear deal,https://www.aljazeera.com/news/2025/5/26/iran-rules-out-enrichment-break-amid-us-talks?traffic_source=rss
Al Jazeera,14,Bear stops play: Japan golf event ended after furry sighting,https://www.aljazeera.com/news/2025/5/26/bear-stops-play-japan-golf-event-ended-after-furry-sighting?traffic_source=rss
Al Jazeera,15,Children’s YouTube star Ms Rachel meets girl from Gaza,https://www.aljazeera.com/program/newsfeed/2025/5/26/childrens-youtube-star-ms-rachel-meets-girl-from-gaza?traffic_source=rss
Al Jazeera,16,Uganda targeting LGBTQ community with hatred and violence: HRW,https://www.aljazeera.com/news/2025/5/26/uganda-targeting-lgbtq-community-with-hatred-and-violence-hrw?traffic_source=rss
Al Jazeera,17,"Venezuela election results: Who lost, won and what next?",https://www.aljazeera.com/news/2025/5/26/venezuela-election-results-who-lost-won-and-what-next?traffic_source=rss
Al Jazeera,18,Democracy in East Africa is retreating. Here is how it can be saved,https://www.aljazeera.com/opinions/2025/5/26/democracy-in-east-africa-is-retreating-here-is-how-it-can-be-saved?traffic_source=rss
Al Jazeera,19,Trump rows back tariff threat to agree EU trade-talk extension,https://www.aljazeera.com/news/2025/5/26/trump-rows-back-tariff-threat-to-agree-eu-trade-talk-extension?traffic_source=rss
Al Jazeera,20,"Israeli attacks kill dozens in Gaza, including 36 in school-turned-shelter",https://www.aljazeera.com/news/2025/5/26/israel-kills-dozens-overnight-bombed-people-as-they-slept-in-school?traffic_source=rss
