site,rank,title,link
Al Jazeera,1,Sistine Chapel doors closed as Vatican conclave begins,https://www.aljazeera.com/program/newsfeed/2025/5/7/sistine-chapel-doors-closed-as-vatican-conclave-begins?traffic_source=rss
Al Jazeera,2,"Two-thirds of global warming caused by world’s richest 10%, study finds",https://www.aljazeera.com/news/2025/5/7/two-thirds-of-global-warming-caused-by-worlds-richest-10-study-finds?traffic_source=rss
Al Jazeera,3,‘I wish I could say that the worst is over’: Former Pakistani FM Bhutto,https://www.aljazeera.com/video/newsfeed/2025/5/7/i-wish-i-could-say-that-the-worst-is-over-former-pakistani-fm-bhutto?traffic_source=rss
Al Jazeera,4,"‘It’s not Europe bad, America good’: JD Vance returns to Munich meeting",https://www.aljazeera.com/news/2025/5/7/its-not-europe-bad-america-good-jd-vance-returns-to-munich-meeting?traffic_source=rss
Al Jazeera,5,25 years of Putin: what can we expect next?,https://www.aljazeera.com/program/the-take-2/2025/5/7/aje-onl-rus_putin25_v3-070525?traffic_source=rss
Al Jazeera,6,Why was a Gaza ‘Freedom Flotilla’ ship attacked?,https://www.aljazeera.com/program/the-take-2/2025/5/7/why-was-a-gaza-freedom-flotilla-ship-attacked?traffic_source=rss
Al Jazeera,7,Palestinians turn plastic into diesel amid fuel shortage in Gaza,https://www.aljazeera.com/program/newsfeed/2025/5/7/palestinians-turn-plastic-into-diesel-amid-fuel-shortage-in-gaza?traffic_source=rss
Al Jazeera,8,Libyan authorities reject report they will take in US deportees,https://www.aljazeera.com/news/2025/5/7/libyan-authorities-reject-report-they-will-take-in-us-deportees?traffic_source=rss
Al Jazeera,9,Mali’s military government suspends political parties’ activities,https://www.aljazeera.com/news/2025/5/7/malis-military-government-suspends-political-parties-activities?traffic_source=rss
Al Jazeera,10,"Between borders and bombs, I lost my mum: A daughter’s tribute from Gaza",https://www.aljazeera.com/features/2025/5/7/between-borders-and-bombs-i-lost-my-mum-a-daughters-tribute-from-gaza?traffic_source=rss
Al Jazeera,11,Rohit Sharma announces retirement from Test cricket,https://www.aljazeera.com/sports/2025/5/7/rohit-sharma-announces-test-cricket-retirement?traffic_source=rss
Al Jazeera,12,"Germany to reject undocumented migrants at border, interior minister says",https://www.aljazeera.com/news/2025/5/7/germany-to-reject-undocumented-migrants-at-border-report?traffic_source=rss
Al Jazeera,13,Information war: Are India and Pakistan telling the truth about attacks?,https://www.aljazeera.com/news/2025/5/7/information-war-are-india-or-pakistan-telling-the-truth-about-attacks?traffic_source=rss
Al Jazeera,14,Mosque complex in Pakistani Punjab heavily damaged by Indian missiles,https://www.aljazeera.com/video/newsfeed/2025/5/7/mosque-complex-in-pakistani-punjab-heavily-damaged-by-indian-missiles?traffic_source=rss
Al Jazeera,15,What we know about new India-Pakistan military confrontation,https://www.aljazeera.com/video/newsfeed/2025/5/7/what-we-know-about-new-india-pakistan-military-confrontation?traffic_source=rss
Al Jazeera,16,Eastern Europe bets on Trump – but at what cost?,https://www.aljazeera.com/opinions/2025/5/7/eastern-europe-bets-on-trump-but-at-what-cost?traffic_source=rss
Al Jazeera,17,How Israel’s ‘plan’ for Gaza could turbocharge ethnic cleansing,https://www.aljazeera.com/news/2025/5/7/how-israels-plan-for-gaza-could-turbocharge-ethnic-cleansing?traffic_source=rss
Al Jazeera,18,Video: Deadly Russian missile and drone attack in Kyiv,https://www.aljazeera.com/video/newsfeed/2025/5/7/video-deadly-russian-missile-and-drone-attack-in-kyiv?traffic_source=rss
Al Jazeera,19,Losses from Trump’s film tariffs will “be on the US side”,https://www.aljazeera.com/program/quotable/2025/5/7/losses-from-trumps-film-tariffs-will-be-on-the-us?traffic_source=rss
Al Jazeera,20,"Can Trump reset Iran ties, despite Israel’s best efforts to thwart it?",https://www.aljazeera.com/video/newsfeed/2025/5/7/can-trump-reset-iran-ties-despite-israels-best-efforts-to-thwart-it?traffic_source=rss
