site,rank,title,link
Al Jazeera,1,"“It’s time to end the war.” UN’s Guterres urges US, Israel to cease attacks",https://www.aljazeera.com/video/newsfeed/2026/3/19/its-time-to-end-the-war-uns-guterres-urges-us-israel-to-cease?traffic_source=rss
Al Jazeera,2,Child among survivors pulled from rubble of US-Israeli attack in Iran,https://www.aljazeera.com/video/newsfeed/2026/3/19/child-among-survivors-pulled-from-rubble-of-us-israeli-attack-in-iran?traffic_source=rss
Al Jazeera,3,Drone attack from Sudan kills 17 people in Chad as war spills over border,https://www.aljazeera.com/news/2026/3/19/drone-attack-from-sudan-kills-17-in-chad-as-conflict-spills-over?traffic_source=rss
Al Jazeera,4,China’s silence on Iran reveals its true priorities,https://www.aljazeera.com/opinions/2026/3/19/chinas-silence-on-iran-reveals-its-true-priorities?traffic_source=rss
Al Jazeera,5,Morocco says stripping Senegal of AFCON win ‘upholds rights and integrity’,https://www.aljazeera.com/sports/2026/3/19/morocco-says-striping-senegal-of-afcon-title-upholds-rules?traffic_source=rss
Al Jazeera,6,"Why are Iran’s South Pars gasfield, Qatar’s Ras Laffan, so significant?",https://www.aljazeera.com/economy/2026/3/19/why-are-irans-south-pars-gasfield-qatars-ras-laffan-so-significant?traffic_source=rss
Al Jazeera,7,Video: Why Iran’s attack on Qatar’s gas fields matters,https://www.aljazeera.com/video/newsfeed/2026/3/19/video-why-irans-attack-on-qatars-gas-fields-matters?traffic_source=rss
Al Jazeera,8,The US–Israel war with Iran will not end with a clear victor,https://www.aljazeera.com/opinions/2026/3/19/the-us-israel-war-with-iran-will-not-end-with-a-clear?traffic_source=rss
Al Jazeera,9,Iran’s dilemma in war and peace,https://www.aljazeera.com/opinions/2026/3/19/irans-dilemma-in-war-and-peace?traffic_source=rss
Al Jazeera,10,Nigeria’s Osimhen tried to defy broken arm in Galatasaray loss at Liverpool,https://www.aljazeera.com/sports/2026/3/19/nigerias-osimhen-tried-to-defy-broken-arm-in-galatasaray-loss-at-liverpool?traffic_source=rss
Al Jazeera,11,Could Iran war trigger the next global food shock?,https://www.aljazeera.com/video/counting-the-cost/2026/3/19/could-iran-war-trigger-the-next-global-food-shock?traffic_source=rss
Al Jazeera,12,Conflict shifts to ‘energy war’ as Iran targets Gulf oil and gas,https://www.aljazeera.com/video/newsfeed/2026/3/19/conflict-shifts-to-energy-war-as-iran-targets-gulf-oil-and-gas?traffic_source=rss
Al Jazeera,13,What did Arab and Muslim ministers discuss in Riyadh meeting on Iran?,https://www.aljazeera.com/news/2026/3/19/what-did-arab-and-muslim-ministers-discuss-in-riyadh-meeting-on-iran?traffic_source=rss
Al Jazeera,14,EU leaders slam Hungary’s Orban for blocking Ukraine aid package,https://www.aljazeera.com/news/2026/3/19/eu-leaders-slam-hungarys-orban-for-blocking-ukraine-aid-package?traffic_source=rss
Al Jazeera,15,Are Iran’s athletes political pawns?,https://www.aljazeera.com/video/game-theory/2026/3/19/are-irans-athletes-political-pawns?traffic_source=rss
Al Jazeera,16,"Gabbard says Pakistan missiles a future threat to US, but experts push back",https://www.aljazeera.com/news/2026/3/19/gabbard-says-pakistan-missiles-a-future-threat-to-us-but-experts-push-back?traffic_source=rss
Al Jazeera,17,Iran hits Qatar gas operations in response to Israeli attack,https://www.aljazeera.com/video/newsfeed/2026/3/19/iran-hits-qatar-gas-operations-in-response-to-israeli-attack?traffic_source=rss
Al Jazeera,18,"Strikes kill two PMF fighters in northern Iraq amid wider war, group says",https://www.aljazeera.com/news/2026/3/19/strikes-kill-two-pmf-fighters-in-northern-iraq-amid-wider-war-group-says?traffic_source=rss
Al Jazeera,19,US East Asian allies in legal quandary as Trump seeks help in the Middle East,https://www.aljazeera.com/news/2026/3/19/us-east-asian-allies-in-legal-quandary-as-trump-seeks-help-in-the-middle-east?traffic_source=rss
Al Jazeera,20,Iran to ‘boycott’ World Cup in US but will not withdraw from 2026 event,https://www.aljazeera.com/sports/2026/3/19/iran-to-boycott-world-cup-games-in-us-but-will-not-withdraw-from-2026-event?traffic_source=rss
Associated Press,1,Iran intensifies attacks on Gulf energy sites after Israel struck its key gas field,https://apnews.com/article/iran-iraq-us-israel-trump-march-19-2026-52e94398f2432b3aba9b02b51fbe5000
Associated Press,2,Trump's failed strong-arming of allies on Iran shows that pressure is losing its effect,https://apnews.com/article/iran-us-war-trump-starmer-macron-germany-caff1073f932ddb88c3d75c7c356ebc7
Associated Press,3,A real possum appears among plush toy animals in Australian airport gift shop,https://apnews.com/article/australia-airport-possum-toys-hobart-shop-c75cdac08eded76b93b4a33191fca56b
Associated Press,4,"US to demand bonds of up to $15,000 for visa applications from 12 more countries",https://apnews.com/article/us-state-department-visa-bonds-930417cad95c6dba643b5466966579ba
Associated Press,5,Florida hospital sues to evict a patient who won't leave room 5 months after discharge,https://apnews.com/article/florida-tallahassee-healthcare-hospital-1722512e3e9b6dc2662bcb6c9097ca1d
Associated Press,6,Rapper Afroman wins lawsuit against police over mocking their 2022 raid in viral music videos,https://apnews.com/article/afroman-police-raid-lawsuit-ohio-first-amendment-309accc1ce068620e19cfd7d0f70dae1
Associated Press,7,One 'freaking snake' and no apologies: How the Mullin hearing went off the rails,https://apnews.com/article/rand-paul-markwayne-mullin-dhs-confirmation-hearing-6c05a260b9f2fa4d730749213b3f4663
Associated Press,8,Georgia was going to dump voting machines that Trump hates until things got complicated,https://apnews.com/article/georgia-trump-voting-machines-dominion-code-e76bb73312bb8682d8564acfe8600670
Associated Press,9,US national debt surges past $39 trillion just weeks into war in Iran,https://apnews.com/article/us-national-deficit-hits-39-million-6ff73495bae701b5c009d3da5515ca3a
Associated Press,10,Galatasaray player Noa Lang sustains freak hand injury after colliding with advertising boards,https://apnews.com/article/noa-lang-injury-galatasaray-liverpool-champions-league-311838241523bb2845d14001038b899d
Associated Press,11,MLB teams pressured WBC managers to be careful with pitchers. Venezuela pushed back,https://apnews.com/article/wbc-pitch-limits-derosa-miller-67eb96470be0cbddb94fe3f57452e34e
Associated Press,12,"Rory McIlroy's menu for the Masters taps into Northern Ireland, New York and the Augusta wine cellar",https://apnews.com/article/rory-mcilroy-masters-champion-dinner-menu-f9d15abc48fdac5495c12efb6eb71cbf
Associated Press,13,An AI-rendered Val Kilmer will posthumously appear in a new film,https://apnews.com/article/val-kilmer-ai-movie-5e32b8e3ee65a01b75902bf4d0bf0b98
Associated Press,14,"Cable news network MS NOW shuffles schedule, moving Stephanie Ruhle and Alicia Menendez to daytime",https://apnews.com/article/ms-now-tv-anchors-morning-joe-ef9daad13db27c28366c965081efb231
Associated Press,15,Marc Jacobs let Sofia Coppola film with ‘no off limits’ — and didn’t hate himself after,https://apnews.com/article/marc-jacobs-sofia-coppola-documentary-67d5fe63758feb73f3655e713f9c9a3d
Associated Press,16,South Pars natural gas field is an energy lifeline for Iran,https://apnews.com/article/iran-gas-field-south-pars-attack-5ad45090d3b66444467cc255ee966a37
Associated Press,17,"Brent crude briefly tops $119 per barrel before pulling back, and stocks sink worldwide",https://apnews.com/article/stocks-markets-oil-iran-trump-1abeddf7c4bf19d1dc96b3f23c1de402
Associated Press,18,The advantage of buying a used luxury car rather than a new non-luxury car,https://apnews.com/article/used-luxury-cars-shopping-advantage-f13732de0a3cd24f4a44576ad302258a
Associated Press,19,How common are fireballs streaking across the sky?,https://apnews.com/article/meteor-asteroid-fireball-explosion-42f53f511af6b9e9deafc34633adac99
Associated Press,20,"A red fox stows away on a cargo ship, traveling from England to the US",https://apnews.com/article/fox-stowaway-ship-england-us-bronx-zoo-fd4c5eaef207d8fffc6408f7671867c0
