site,rank,title,link
Al Jazeera,1,Indonesian police use tear gas on university campuses in ongoing protests,https://www.aljazeera.com/news/2025/9/2/indonesian-police-use-tear-gas-on-university-campuses-in-ongoing-protests?traffic_source=rss
Al Jazeera,2,‘It’s all theatre’: How are Europe and the US pulling apart on Ukraine?,https://www.aljazeera.com/news/2025/9/2/its-all-theatre-are-europe-and-the-us-pulling-apart-on-ukraine?traffic_source=rss
Al Jazeera,3,Search for survivors after deadly Afghanistan earthquake,https://www.aljazeera.com/gallery/2025/9/2/search-for-survivors-after-deadly-afghanistan-earthquake?traffic_source=rss
Al Jazeera,4,Xi welcomes ‘old friend’ Putin who lauds ‘unprecedented’ ties in Beijing,https://www.aljazeera.com/news/2025/9/2/xi-welcomes-old-friend-putin-who-lauds-unprecedented-ties-in-beijing?traffic_source=rss
Al Jazeera,5,Australia moves to stamp out ‘nudify’ and stalking apps,https://www.aljazeera.com/news/2025/9/2/australia-moves-to-stamp-out-nudify-and-stalking-apps?traffic_source=rss
Al Jazeera,6,"Sudan landslide ‘kills more than 1,000’",https://www.aljazeera.com/video/newsfeed/2025/9/2/sudan-landslide-kills-more-than?traffic_source=rss
Al Jazeera,7,Rescuers focus on remote mountainous regions after Afghanistan earthquake,https://www.aljazeera.com/news/2025/9/2/rescuers-focus-on-remote-mountainous-regions-after-afghanistan-earthquake?traffic_source=rss
Al Jazeera,8,"China, Russia pledge new global order at Shanghai Cooperation summit",https://www.aljazeera.com/news/2025/9/2/china-russia-pledge-new-global-order-at-shanghai-cooperation-summit?traffic_source=rss
Al Jazeera,9,Afghanistan earthquake live: Search for survivors on after 900 killed,https://www.aljazeera.com/news/liveblog/2025/9/2/afghanistan-earthquake-live-search-for-survivors-on-after-800-killed?traffic_source=rss
Al Jazeera,10,Why Pakistan is rushing to mend fences with Bangladesh,https://www.aljazeera.com/news/2025/9/2/why-pakistan-is-rushing-to-mend-fences-with-bangladesh?traffic_source=rss
Al Jazeera,11,"LIVE: Israel starves 13 more Palestinians to death, kills 40 since dawn",https://www.aljazeera.com/news/liveblog/2025/9/2/live-israel-kills-17-palestinians-in-gaza-since-dawn?traffic_source=rss
Al Jazeera,12,"US Open: Jannik Sinner demolishes Alexander Bublik, advances to quarters",https://www.aljazeera.com/sports/2025/9/2/us-open-jannik-sinner-demolishes-alexander-bublik-advances-to-quarters?traffic_source=rss
Al Jazeera,13,"UK had hottest summer since records began, Met Office says",https://www.aljazeera.com/news/2025/9/2/uk-had-hottest-summer-since-records-began-met-office-says?traffic_source=rss
Al Jazeera,14,Vietnam marks 80th independence anniversary with military parade,https://www.aljazeera.com/news/2025/9/2/vietnam-marks-80th-independence-anniversary-with-military-parade?traffic_source=rss
Al Jazeera,15,Mitchell Starc announces retirement from T20 cricket,https://www.aljazeera.com/sports/2025/9/2/mitchell-starc-announces-retirement-from-t20-cricket?traffic_source=rss
Al Jazeera,16,"Landslide kills more than 1,000 in Sudan’s Darfur region, armed group says",https://www.aljazeera.com/news/2025/9/2/landslide-kills-more-than-1000-in-sudans-darfur-region-armed-group-says?traffic_source=rss
Al Jazeera,17,Naomi Osaka defeats Coco Gauff to reach US Open quarterfinals,https://www.aljazeera.com/sports/2025/9/2/naomi-osaka-defeats-coco-gauff-to-reach-us-open-quarterfinals?traffic_source=rss
Al Jazeera,18,"North Korea’s Kim Jong Un crossed into China via train, state media say",https://www.aljazeera.com/news/2025/9/2/north-koreas-kim-jong-un-crossed-into-china-via-train-state-media-say?traffic_source=rss
Al Jazeera,19,"Belgium to recognise Palestinian statehood, impose sanctions on Israel",https://www.aljazeera.com/news/2025/9/2/belgium-to-recognise-palestine-at-un-general-assembly-foreign-minister?traffic_source=rss
Al Jazeera,20,"Russia-Ukraine war: List of key events, day 1,286",https://www.aljazeera.com/news/2025/9/2/russia-ukraine-war-list-of-key-events-day-1286?traffic_source=rss
