site,rank,title,link
Al Jazeera,1,Texas Senate approves redrawn congressional map favouring Republicans,https://www.aljazeera.com/news/2025/8/23/texas-senate-approves-redrawn-congressional-map-favouring-republicans?traffic_source=rss
Al Jazeera,2,Will Israel choose truce or war?,https://www.aljazeera.com/video/the-bottom-line/2025/8/23/will-israel-choose-truce-or-war?traffic_source=rss
Al Jazeera,3,LIVE: Man City vs Tottenham – Premier League,https://www.aljazeera.com/sports/liveblog/2025/8/23/live-man-city-vs-tottenham-premier-league?traffic_source=rss
Al Jazeera,4,Lyle Menendez denied parole decades after murder of parents,https://www.aljazeera.com/news/2025/8/23/lyle-menendez-denied-parole-decades-after-murder-of-parents?traffic_source=rss
Al Jazeera,5,UK delays ruling on Chinese embassy after Beijing withholds information,https://www.aljazeera.com/news/2025/8/23/uk-delays-ruling-on-chinese-embassy-after-beijing-withholds-information?traffic_source=rss
Al Jazeera,6,What will Uganda gain from accepting US deportees?,https://www.aljazeera.com/economy/2025/8/23/what-will-uganda-gain-from-accepting-us-deportees?traffic_source=rss
Al Jazeera,7,How Nigerians reinvented an Italian tinned tomato brand,https://www.aljazeera.com/features/2025/8/23/how-nigerians-reinvented-an-italian-tinned-tomato-brand?traffic_source=rss
Al Jazeera,8,Why an Indian bill removing jailed leaders from office has sparked outrage,https://www.aljazeera.com/news/2025/8/23/a-new-indian-bill-punishes-jailed-politicians-why-has-it-sparked-outrage?traffic_source=rss
Al Jazeera,9,LIVE: Israel kills over 70 in Gaza as UN warns of famine ‘survival crisis’,https://www.aljazeera.com/news/liveblog/2025/8/23/live-israel-kills-over-70-in-gaza-as-un-warns-of-famine-survival-crisis?traffic_source=rss
Al Jazeera,10,Foreign nationals among 5 killed in New York state tour bus crash,https://www.aljazeera.com/news/2025/8/23/foreign-nationals-among-5-killed-in-new-york-state-tour-bus-crash?traffic_source=rss
Al Jazeera,11,US general whose report on Iran nuclear sites angered Trump fired,https://www.aljazeera.com/news/2025/8/23/us-general-whose-report-on-iran-nuclear-sites-damage-angered-trump-fired?traffic_source=rss
Al Jazeera,12,Can the new India-China bonhomie reshape trade and hurt the US in Asia?,https://www.aljazeera.com/features/2025/8/23/can-the-new-india-china-bonhomie-reshape-trade-and-hurt-the-us-in-asia?traffic_source=rss
Al Jazeera,13,"China, India watch as Myanmar rebels advance on strategic western frontier",https://www.aljazeera.com/features/2025/8/23/china-india-watch-as-myanmar-rebels-advance-on-strategic-western-frontier?traffic_source=rss
Al Jazeera,14,North Korea accuses South Korean troops of firing warning shots near border,https://www.aljazeera.com/news/2025/8/23/north-korea-accuses-south-korean-troops-of-firing-warning-shots-near-border?traffic_source=rss
Al Jazeera,15,"Russia-Ukraine war: List of key events, day 1,276",https://www.aljazeera.com/news/2025/8/23/russia-ukraine-war-list-of-key-events-day-1276?traffic_source=rss
Al Jazeera,16,Chaves Robles becomes first Costa Rican president to face loss of immunity,https://www.aljazeera.com/news/2025/8/22/chaves-robles-becomes-first-costa-rican-president-to-face-loss-of-immunity?traffic_source=rss
Al Jazeera,17,Dutch foreign minister resigns over Israel sanctions deadlock,https://www.aljazeera.com/news/2025/8/22/dutch-foreign-minister-resigns-over-israel-sanctions-deadlock?traffic_source=rss
Al Jazeera,18,Ghislaine Maxwell praises Trump in transcripts released by government,https://www.aljazeera.com/news/2025/8/22/ghislaine-maxwell-praises-trump-in-transcripts-released-by-government?traffic_source=rss
Al Jazeera,19,UN aid chief’s powerful plea to end Israel’s Gaza famine,https://www.aljazeera.com/video/newsfeed/2025/8/22/un-aid-chiefs-powerful-plea-to-end-israels-gaza-famine?traffic_source=rss
Al Jazeera,20,DRC prosecutor seeks death penalty for former leader Joseph Kabila,https://www.aljazeera.com/news/2025/8/22/drc-prosecutor-seeks-death-penalty-for-former-leader-joseph-kabila?traffic_source=rss
