site,rank,title,link
Al Jazeera,1,Dozens killed in Myanmar after armed paraglider attack: Reports,https://www.aljazeera.com/news/2025/10/8/dozens-killed-in-myanmar-after-armed-paraglider-attack-reports?traffic_source=rss
Al Jazeera,2,Hundreds of Everest hikers reach safety after snowstorm in Tibetan valley,https://www.aljazeera.com/news/2025/10/8/hundreds-of-everest-hikers-reach-safety-after-snowstorm-in-tibetan-valley?traffic_source=rss
Al Jazeera,3,White House memo says federal workers may not get automatic backpay: Report,https://www.aljazeera.com/news/2025/10/8/white-house-memo-says-federal-workers-may-not-get-automatic-backpay-report?traffic_source=rss
Al Jazeera,4,Israel intercepts Freedom Flotilla Coalition vessels en route to Gaza,https://www.aljazeera.com/news/2025/10/8/israeli-military-intercepts-gaza-freedom-flotilla-vessels-report?traffic_source=rss
Al Jazeera,5,Burkina Faso’s military gov’t arrests European NGO workers for ‘spying’,https://www.aljazeera.com/news/2025/10/8/burkina-fasos-military-govt-arrests-european-ngo-workers-for-spying?traffic_source=rss
Al Jazeera,6,‘Bangladeshi infiltrator’: Indian Muslims in poll-bound Bihar battle hate,https://www.aljazeera.com/news/2025/10/8/muslims-in-indias-poll-bound-bihar-battle-bangladeshi-infiltrator-tag?traffic_source=rss
Al Jazeera,7,Italy’s Meloni says ICC complaint accuses her of Gaza genocide complicity,https://www.aljazeera.com/news/2025/10/8/italys-meloni-says-icc-complaint-accuses-her-of-gaza-genocide-complicity?traffic_source=rss
Al Jazeera,8,"Russia-Ukraine war: List of key events, day 1,322",https://www.aljazeera.com/news/2025/10/8/russia-ukraine-war-list-of-key-events-day-1322?traffic_source=rss
Al Jazeera,9,How to fix France’s deepening political crisis?,https://www.aljazeera.com/video/inside-story/2025/10/7/how-to-fix-frances-deepening-political-crisis?traffic_source=rss
Al Jazeera,10,US National Guard troops arrive in Illinois as Trump escalates crackdown,https://www.aljazeera.com/news/2025/10/7/us-national-guard-troops-arrive-in-illinois-as-trump-escalates-crackdown?traffic_source=rss
Al Jazeera,11,Ecuadorean President Daniel Noboa unharmed after attack on his car,https://www.aljazeera.com/news/2025/10/7/ecuadorean-president-daniel-noboa-unharmed-after-attack-on-his-car?traffic_source=rss
Al Jazeera,12,‘Not a punchline’: 15 dehumanising quotes on Gaza atrocities by US figures,https://www.aljazeera.com/news/2025/10/7/not-a-punchline-15-dehumanising-quotes-on-gaza-atrocities-by-us-figures?traffic_source=rss
Al Jazeera,13,Hamas wants ‘guarantees’ Israel will end Gaza war as talks on day 2 wrap up,https://www.aljazeera.com/news/2025/10/7/hamas-lays-down-conditions-for-peace-deal-as-israel-continues-bombing-gaza?traffic_source=rss
Al Jazeera,14,Conservative-led US Supreme Court seems wary of ‘conversion therapy’ ban,https://www.aljazeera.com/news/2025/10/7/conservative-led-us-supreme-court-seems-wary-of-conversion-therapy-ban?traffic_source=rss
Al Jazeera,15,Trump: US-Israel ‘very close to making a deal’ on Gaza peace plan,https://www.aljazeera.com/video/newsfeed/2025/10/7/trump-us-israel-very-close-to-making-a-deal-on-gaza-peace-plan?traffic_source=rss
Al Jazeera,16,Argentine President Javier Milei rocks out at concert as economy flounders,https://www.aljazeera.com/video/newsfeed/2025/10/7/argentine-president-javier-milei-rocks-out-at-concert-as-economy-flounders?traffic_source=rss
Al Jazeera,17,Tesla unveils new lower-cost Model Y amid rising competition,https://www.aljazeera.com/economy/2025/10/7/tesla-unveils-new-lower-cost-model-y-amid-rising-competition?traffic_source=rss
Al Jazeera,18,Israelis mark two years since October 7 with tributes to loved ones,https://www.aljazeera.com/video/newsfeed/2025/10/7/israelis-mark-two-years-since-october-7-with-tributes-to-loved-ones?traffic_source=rss
Al Jazeera,19,US activist from Gaza flotilla alleges ‘psychological torture’ by Israel,https://www.aljazeera.com/news/2025/10/7/us-activist-from-gaza-flotilla-alleges-psychological-torture-by-israel?traffic_source=rss
Al Jazeera,20,Witnesses testify defendant ‘fully aware’ he was assaulting Gisele Pelicot,https://www.aljazeera.com/news/2025/10/7/witnesses-testify-defendant-fully-aware-he-was-assaulting-gisele-pelicot?traffic_source=rss
Associated Press,1,Three scientists at US universities win Nobel Prize in physics for advancing quantum technology,https://apnews.com/article/nobel-prize-physics-e74ee2acf652259cf268cc1d48873e14
Associated Press,2,Priscilla nears major hurricane status in Pacific as new tropical storm swirls in the Atlantic,https://apnews.com/article/tropical-weather-hurricane-priscilla-4c12f2b189e76d9035b585fa6b5b75f1
Associated Press,3,California fire captain enlists motorists to lift downed chopper after hearing trapped medic groan,https://apnews.com/article/helicopter-crash-sacramento-highway-50-f56e68307f94a54e60488f6a844c5b78
Associated Press,4,A judge has blocked a Trump administration effort to change teen pregnancy prevention programs,https://apnews.com/article/teen-pregnancy-prevention-grant-ruling-d9975d48e6df123abb7b5d8a30a38812
Associated Press,5,National Guard members from Texas are in Illinois in Trump's latest move to send troops to cities,https://apnews.com/article/national-guard-chicago-portland-trump-5c8666818de9f18e9e26860aab814d17
Associated Press,6,Trump administration threatens no back pay for federal workers in shutdown,https://apnews.com/article/trump-federal-workers-back-bay-shutdown-785eb776d2312d1f68f7e91961d0a93a
Associated Press,7,Supreme Court seems skeptical about state bans on 'conversion therapy' for LGBTQ+ kids,https://apnews.com/article/supreme-court-lgbtq-conversation-therapy-transgender-1b10b8e959e2e9284724f4f65efe5f7d
Associated Press,8,Truck driver sues Mark Sanchez and Fox after violent fight over parking space,https://apnews.com/article/mark-sanchez-stabbing-lawsuit-fox-3b1baf3a3bd68770857fbcbfcd6e478b
Associated Press,9,LeBron James teased 'the decision of all decisions' announcement. It was an ad,https://apnews.com/article/lebron-james-decision-nba-ecfcfad6c58717aa0cbd4f3cd6b38bb3
Associated Press,10,"NFL fines Jerry Jones $250,000 for obscene MetLife gesture he says was inadvertent",https://apnews.com/article/jerry-jones-obscene-gesture-62c19efc56175670da4514ea220cbbfa
Associated Press,11,Bob Ross paintings to be auctioned to support public TV stations after federal funding cuts,https://apnews.com/article/bob-ross-auction-public-television-1029c1e91ac55d8030e6847310cebc59
Associated Press,12,"No, Taylor Swift did not turn down the 2026 Super Bowl halftime show",https://apnews.com/article/taylor-swift-super-bowl-bad-bunny-life-of-a-showgirl-nfl-8fef71f7c56416588179fea9840c82e3
Associated Press,13,‘Roofman' tells a stranger-than-fiction story with rigorous accuracy and a whole lot of toys,https://apnews.com/article/roofman-channing-tatum-kirsten-dunst-cianfrance-52ba0ad04416ba71b100d2bd30f6982f
Associated Press,14,Tesla offers cheaper versions of 2 electric vehicles in bid to win back market share in tough year,https://apnews.com/article/tesla-model-y-cheaper-musk-7dd6213c456fa2c16a676176081a3227
Associated Press,15,"Gold futures rise above $4,000 per ounce for the first time",https://apnews.com/article/gold-record-price-silver-shutdown-fbe2b3c43780923569a7b5db1a55f06b
Associated Press,16,"Toyota recalls nearly 400,000 Tundras and Sequoias due to malfunctioning rearview camera",https://apnews.com/article/toyota-recall-sequoia-tundra-hybrid-camera-9a3a60bff8f9acdc72a92ee0bc4e274b
Associated Press,17,El Nobel de Física reconoce a 3 científicos cuyo trabajo avanzó la tecnología cuántica,https://apnews.com/article/fisica-mecanica-cuantica-efecto-tunel-noble-a5c4631b36b0522131b01826ab49d6f7
Associated Press,18,Ground squirrels are taking over a North Dakota city and officials are not amused,https://apnews.com/article/minot-city-north-dakota-ground-squirrels-dde22d2fa10140191a168687a5aa4daa
Associated Press,19,Half a house for half a million dollars: Home crushed by tree hits market near Los Angeles,https://apnews.com/article/monrovia-california-crushed-house-for-sale-half-million-ee5184233a20e5e957c3abdbfa8d5753
Associated Press,20,"Whale surfaces, capsizes fishing boat off New Hampshire coast",https://apnews.com/article/whale-breach-boat-capsize-new-hampshire-efe8cbfae49b93f6325c4331db8999ae
