site,rank,title,link
Al Jazeera,1,US House passes tax and spending bill by single vote,https://www.aljazeera.com/news/2025/5/22/us-house-passes-tax-and-spending-bill-by-single-vote?traffic_source=rss
Al Jazeera,2,Iran says will hold US responsible for any Israeli attack on nuclear sites,https://www.aljazeera.com/news/2025/5/22/iran-says-will-hold-us-responsible-for-any-israeli-attack-on-nuclear-sites?traffic_source=rss
Al Jazeera,3,Trump’s Ramaphosa ‘ambush’: Key takeaways from heated White House meeting,https://www.aljazeera.com/news/2025/5/22/trumps-ramaphosa-ambush-key-takeaways-from-heated-white-house-meeting?traffic_source=rss
Al Jazeera,4,Can minimal aid avoid famine in Gaza?,https://www.aljazeera.com/video/by-the-numbers-3/2025/5/22/can-minimal-aid-avoid-famine-in-gaza?traffic_source=rss
Al Jazeera,5,Man Utd’s defeat by Tottenham sharpens focus on financial woes,https://www.aljazeera.com/sports/2025/5/22/man-utds-defeat-by-tottenham-sharpens-focus-on-financial-woes?traffic_source=rss
Al Jazeera,6,Fact check: Do Trump’s ‘white genocide’ claims to Ramaphosa hold up?,https://www.aljazeera.com/news/2025/5/22/fact-check-do-trumps-white-genocide-claims-to-ramaphosa-hold-up?traffic_source=rss
Al Jazeera,7,Member of Irish rap band Kneecap charged with ‘terrorism’ offence,https://www.aljazeera.com/program/newsfeed/2025/5/22/member-of-irish-rap-band-kneecap-charged-with-terrorism-offence-2?traffic_source=rss
Al Jazeera,8,China and the Philippines trade accusations over ship collision,https://www.aljazeera.com/video/newsfeed/2025/5/22/china-and-the-philippines-trade-accusations-over-ship-collision?traffic_source=rss
Al Jazeera,9,Napoli vs Cagliari: Serie A title preview – chance of Inter Milan playoff,https://www.aljazeera.com/sports/2025/5/22/napoli-vs-cagliari-serie-a-preview-what-is-inter-milans-title-hope?traffic_source=rss
Al Jazeera,10,This US university student is on a hunger strike over Gaza,https://www.aljazeera.com/video/newsfeed/2025/5/22/this-us-university-student-is-on-a-hunger-strike-over-gaza?traffic_source=rss
Al Jazeera,11,"EU backs tariffs on fertiliser imports from Russia, Belarus",https://www.aljazeera.com/news/2025/5/22/eu-backs-tariffs-on-fertiliser-imports-from-russia-belarus?traffic_source=rss
Al Jazeera,12,‘Refuge to all African Americans’ – What Ramaphosa should have told Trump,https://www.aljazeera.com/opinions/2025/5/22/refuge-to-all-african-americans-what-ramaphosa-should-have-told-trump?traffic_source=rss
Al Jazeera,13,Video: Palestinians in Gaza unload flour as limited aid finally arrives,https://www.aljazeera.com/video/newsfeed/2025/5/22/video-palestinians-in-gaza-unload-flour-as-limited-aid-finally-arrives?traffic_source=rss
Al Jazeera,14,Deadly floods in Eastern Australia as torrential rains continue,https://www.aljazeera.com/video/newsfeed/2025/5/22/deadly-floods-in-eastern-australia-as-torrential-rains-continue?traffic_source=rss
Al Jazeera,15,What we know about the killing of two Israeli embassy staff in DC,https://www.aljazeera.com/video/newsfeed/2025/5/22/what-we-know-about-the-killing-of-two-israeli-embassy-staff-in-dc?traffic_source=rss
Al Jazeera,16,Israeli strikes kill 51 in Gaza as aid groups collect limited supplies,https://www.aljazeera.com/news/2025/5/22/israeli-strikes-kill-47-in-gaza-as-aid-groups-collect-limited-supplies?traffic_source=rss
Al Jazeera,17,Philippines accuses China of ‘aggressive’ tactics in South China Sea,https://www.aljazeera.com/news/2025/5/22/philippines-accuses-china-of-aggressive-tactics-in-south-china-sea?traffic_source=rss
Al Jazeera,18,Indianapolis Colts owner Jim Irsay dead at 65,https://www.aljazeera.com/sports/2025/5/22/indianapolis-colts-owner-jim-irsay-dead-at-65?traffic_source=rss
Al Jazeera,19,Pakistan recommits to China bond amid Trump shadow over India ceasefire,https://www.aljazeera.com/news/2025/5/22/pakistan-recommits-to-china-bond-amid-trump-shadow-over-india-ceasefire?traffic_source=rss
Al Jazeera,20,Julian Assange’s t-shirt tribute to Gaza victims at Cannes Festival,https://www.aljazeera.com/video/newsfeed/2025/5/22/julian-assanges-t-shirt-tribute-to-gaza-victims-at-cannes-festival?traffic_source=rss
