site,rank,title,link
Al Jazeera,1,UN sounds alarm over rising hunger crisis in eastern DR Congo,https://www.aljazeera.com/news/2025/11/7/un-sounds-alarm-over-rising-hunger-crisis-in-eastern-dr-congo?traffic_source=rss
Al Jazeera,2,What if … the United Nations was disbanded next Friday?,https://www.aljazeera.com/features/2025/11/7/what-if-the-united-nations-was-disbanded-next-friday?traffic_source=rss
Al Jazeera,3,Honda profits tumble as Trump tariffs weigh on the carmaker,https://www.aljazeera.com/economy/2025/11/7/honda-profits-tumble-as-trump-tariffs-weigh-on-the-carmaker?traffic_source=rss
Al Jazeera,4,United States skips UN review of its human rights record,https://www.aljazeera.com/news/2025/11/7/united-states-skips-un-review-of-its-human-rights-record?traffic_source=rss
Al Jazeera,5,Gaza ‘reduced to dust’ as world commits in Doha to eradicate poverty,https://www.aljazeera.com/news/2025/11/7/gaza-reduced-dust-world-commits-doha-eradicate-poverty?traffic_source=rss
Al Jazeera,6,"Schools by day, shelters by night: Students return to Gaza classrooms",https://www.aljazeera.com/video/newsfeed/2025/11/7/schools-by-day-shelters-by-night-students-return-to-gaza-classrooms?traffic_source=rss
Al Jazeera,7,Silenced: The War on Journalism,https://www.aljazeera.com/video/featured-documentaries/2025/11/7/silenced-the-war-on-journalism?traffic_source=rss
Al Jazeera,8,Hungarian leader Viktor Orban to meet US President Donald Trump,https://www.aljazeera.com/news/2025/11/7/hungarian-leader-viktor-orban-to-meet-us-president-donald-trump?traffic_source=rss
Al Jazeera,9,Tanzania charges dozens with treason over election protests,https://www.aljazeera.com/news/2025/11/7/tanzania-charges-dozens-with-treason-over-election-protests?traffic_source=rss
Al Jazeera,10,Sudanese army intercepts drone attacks on cities after RSF agrees to truce,https://www.aljazeera.com/news/2025/11/7/sudanese-army-intercepts-drone-attacks-after-rsf-agrees-to-truce?traffic_source=rss
Al Jazeera,11,What’s in Elon Musk’s bumper $878bn pay package?,https://www.aljazeera.com/economy/2025/11/7/whats-in-elon-musks-bumper-878bn-pay-package?traffic_source=rss
Al Jazeera,12,Why is former House Speaker Nancy Pelosi retiring from US Congress?,https://www.aljazeera.com/news/2025/11/7/why-is-former-house-speaker-nancy-pelosi-retiring-from-us-congress?traffic_source=rss
Al Jazeera,13,Sami Hamdi’s wife warns his detention is threat to all Americans,https://www.aljazeera.com/video/newsfeed/2025/11/7/sami-hamdis-wife-warns-his-detention-is-threat-to-all-americans?traffic_source=rss
Al Jazeera,14,Spanish police arrest suspected members of Venezuelan gang targeted by US,https://www.aljazeera.com/news/2025/11/7/spanish-police-arrest-suspected-members-of-venezuelan-gang-targeted-by-us?traffic_source=rss
Al Jazeera,15,What has 30 years of COP achieved?,https://www.aljazeera.com/video/newsfeed/2025/11/7/what-has-30-years-of-cop-achieved?traffic_source=rss
Al Jazeera,16,Israeli bureaucracy is “deliberate attempt” to limit Gaza aid,https://www.aljazeera.com/video/quotable/2025/11/7/israeli-bureaucracy-is-deliberate-attempt-to-limit-gaza-aid?traffic_source=rss
Al Jazeera,17,Serbia’s Vucic angers Russia with comments about selling ammo to EU,https://www.aljazeera.com/news/2025/11/7/serbias-vucic-angers-russia-with-comments-about-selling-ammo-to-eu?traffic_source=rss
Al Jazeera,18,Which airports in the US are cancelling flights?,https://www.aljazeera.com/news/2025/11/7/why-have-hundreds-of-flights-been-cancelled-in-the-us?traffic_source=rss
Al Jazeera,19,EU naval force secures tanker after pirate attack off coast of Somalia,https://www.aljazeera.com/news/2025/11/7/eu-naval-force-nears-ship-seized-by-pirates-off-somali-coast?traffic_source=rss
Al Jazeera,20,"Founded as a refuge from US racism, Liberia must not help enforce it now",https://www.aljazeera.com/opinions/2025/11/7/founded-as-a-refuge-from-us-racism-liberia-must-not-help-enforce-it-now?traffic_source=rss
Associated Press,1,"Trump has accused boat crews of being narco-terrorists. The truth, AP found, is more nuanced",https://apnews.com/article/trump-venezuela-boat-strikes-drugs-cocaine-trafficking-95b54a3a5efec74f12f82396a79617ea
Associated Press,2,What a reporter found when she investigated US military strikes on Venezuelan drug boats,https://apnews.com/article/trump-venezuela-boat-strikes-drugs-cocaine-trafficking-e4fcf945e48e36bf2c510f9f111e031c
Associated Press,3,Andrew Mountbatten Windsor officially no longer a prince after king formally removes his title,https://apnews.com/article/uk-royals-andrew-prince-title-removed-c1538b68893cb1395073e1ca6b9468f4
Associated Press,4,These are the airports that will reduce flights during the government shutdown,https://apnews.com/article/faa-government-shutdown-flight-cuts-airports-list-a11237fe6d6e14bed0935930dffed72e
Associated Press,5,Ex-NFL star Antonio Brown arrested on attempted murder charge in Miami shooting,https://apnews.com/article/nfl-antonio-brown-shooting-arrest-44f9296ec7ea6b2a235dd6e285f59fe8
Associated Press,6,Federal judge orders Trump administration to fully fund SNAP benefits in November,https://apnews.com/article/snap-benefit-november-shutdown-086c15b0818e0cafae85090b34f44ba3
Associated Press,7,Supreme Court lets Trump block transgender and nonbinary people from choosing passport sex markers,https://apnews.com/article/trump-transgender-nonbinary-passport-sex-marker-5040c6412e06a072889af30cfae97462
Associated Press,8,Democrats consider prolonging the shutdown as Republicans prepare new bills without health care fix,https://apnews.com/article/government-shutdown-democrats-trump-senate-7cc1938d861b396fab07b5d2b7b28e62
Associated Press,9,Man who threw sandwich at federal agent in Washington is found not guilty of assault charge,https://apnews.com/article/sandwich-throwing-trial-justice-department-a2776c568a1ea4b8ce5b6af606669b63
Associated Press,10,"Cowboys' Marshawn Kneeland found dead of apparent suicide at 24 after evading officers, police say",https://apnews.com/article/cowboys-marshawn-kneeland-dies-9fcdc1bf7cba9cc2d88c78b647e57c11
Associated Press,11,The world's tallest teenager becomes the tallest player in college basketball history,https://apnews.com/article/olivier-rioux-debut-tallest-teenager-e5ffa5837fc989abde233fa2bdc8f555
Associated Press,12,Fire destroys Miami Heat coach Erik Spoelstra's home. Nobody was hurt,https://apnews.com/article/heat-spoelstra-house-fire-fab6188f53e94b438ff16a5e04e699c3
Associated Press,13,"Movie Review: Jennifer Lawrence goes for broke in 'Die, My Love'",https://apnews.com/article/die-my-love-review-jennifer-lawrence-robert-pattinson-34914445ea735c8b328a8a01eb6a09aa
Associated Press,14,On the set of the first Agatha Christie show where mysteries are solved with the internet,https://apnews.com/article/agatha-christie-tommy-tuppence-show-56574bcba8607193b6959a1aedf8a416
Associated Press,15,"Kendrick Lamar leads 2026 Grammy nominations, followed by Lady Gaga, Jack Antonoff and Cirkut",https://apnews.com/article/grammy-award-nominations-2026-06dc098491bebb8460c5e70ef300e172
Associated Press,16,Trump unveils deal to expand coverage and lower costs on obesity drugs,https://apnews.com/article/trump-wegovy-zepbound-drug-prices-15b24e03d558aa6bbcf37e52ba2d354e
Associated Press,17,Musk could become history's first trillionaire as Tesla shareholders approve giant pay package,https://apnews.com/article/musk-tesla-electric-trillion-pay-stock-f2140db92e8032121f4c114234059165
Associated Press,18,'No hire' job market leaves unemployed in limbo as threats to economy multiply,https://apnews.com/article/jobs-hiring-economy-c48fd84dfaa71eee962feb3a88fd8575
Associated Press,19,Northern lights may be visible in parts of the US due to solar storms,https://apnews.com/article/northern-lights-aurora-forecast-d902060f09341468bcc3ef1459c50bdc
Associated Press,20,"All roads in ancient Rome stretched far longer than previously known, study shows",https://apnews.com/article/ancient-rome-roads-discovered-satellite-photos-ee51c5dbc8d4912bf5b8a7895bf1d440
