site,rank,title,link
Al Jazeera,1,"UN says famine stalks all in Gaza; Israel shoots, wounds aid seekers",https://www.aljazeera.com/news/2025/5/30/un-says-famine-stalks-all-in-gaza-israel-shoots-wounds-aid-seekers?traffic_source=rss
Al Jazeera,2,‘Not really leaving’: Trump bids goodbye to Elon Musk at White House event,https://www.aljazeera.com/news/2025/5/30/not-really-leaving-trump-bids-goodbye-to-elon-musk-at-white-house-event?traffic_source=rss
Al Jazeera,3,UN Arab Group: Israel weaponising starvation in Gaza,https://www.aljazeera.com/program/newsfeed/2025/5/30/un-arab-group-israel-weaponising-starvation-in-gaza?traffic_source=rss
Al Jazeera,4,Pakistan beat Bangladesh by 57 runs to lead T20I cricket series,https://www.aljazeera.com/sports/2025/5/30/pakistan-beat-bangladesh-by-57-runs-to-lead-t20i-cricket-series?traffic_source=rss
Al Jazeera,5,Trump gives Musk key to White House as he leaves administration,https://www.aljazeera.com/video/newsfeed/2025/5/30/trump-gives-musk-key-to-white-house-as-he-leaves-administration?traffic_source=rss
Al Jazeera,6,US government investigates attempt to impersonate Trump’s chief of staff,https://www.aljazeera.com/news/2025/5/30/us-government-investigates-attempt-to-impersonate-trumps-chief-of-staff?traffic_source=rss
Al Jazeera,7,Macron: Israel risks sanctions if Gaza blockade continues,https://www.aljazeera.com/video/newsfeed/2025/5/30/macron-israel-risks-sanctions-if-gaza-blockade-continues?traffic_source=rss
Al Jazeera,8,US gov’t and Google face off in search monopoly case,https://www.aljazeera.com/economy/2025/5/30/us-govt-and-google-face-off-in-search-monopoly-case?traffic_source=rss
Al Jazeera,9,Is a Palestinian state being derailed by Israel’s illegal settlements?,https://www.aljazeera.com/video/inside-story/2025/5/30/is-a-palestinian-state-being-derailed-by-israels-illegal-settlements?traffic_source=rss
Al Jazeera,10,Despite Gaza plan “many Israelis” hoping their govt is “over”,https://www.aljazeera.com/video/quotable/2025/5/30/despite-gaza-plan-many-israelis-hoping-their-govt-is-over?traffic_source=rss
Al Jazeera,11,"Supreme Court allows Trump to revoke humanitarian parole for 530,000",https://www.aljazeera.com/news/2025/5/30/supreme-court-allows-trump-to-revoke-humanitarian-parole-for-530000?traffic_source=rss
Al Jazeera,12,Pakistan to designate an ambassador to neighbouring Taliban-run Afghanistan,https://www.aljazeera.com/news/2025/5/30/pakistan-to-designate-an-ambassador-to-neighbouring-taliban-run-afghanistan?traffic_source=rss
Al Jazeera,13,Israeli air strikes hit homes in Gaza City,https://www.aljazeera.com/video/newsfeed/2025/5/30/israeli-air-strikes-hit-homes-in-gaza-city?traffic_source=rss
Al Jazeera,14,Displaced civilians turn reluctant opium farmers in Myanmar,https://www.aljazeera.com/video/newsfeed/2025/5/30/displaced-civilians-turn-reluctant-opium-farmers-in-myanmar?traffic_source=rss
Al Jazeera,15,UN: ‘100 percent’ of Gazans on brink of famine,https://www.aljazeera.com/program/newsfeed/2025/5/30/un-100-percent-of-gazans-on-brink-of-famine?traffic_source=rss
Al Jazeera,16,Confusion and concern loom over Mexico’s historic judicial election,https://www.aljazeera.com/news/longform/2025/5/30/confusion-and-concern-loom-over-mexicos-historic-judicial-election?traffic_source=rss
Al Jazeera,17,Six killed as RSF attack devastates Sudanese hospital in North Kordofan,https://www.aljazeera.com/news/2025/5/30/six-killed-as-rsf-attack-devastates-sudanese-hospital-in-north-kordofan?traffic_source=rss
Al Jazeera,18,Trump “chipping away at civil liberties” in ban on foreign students,https://www.aljazeera.com/program/quotable/2025/5/30/trump-chipping-away-at-civil-liberties-in-ban-on-foreign-students?traffic_source=rss
Al Jazeera,19,A coalition of conscience must rise to stop Israel’s genocidal war on Gaza,https://www.aljazeera.com/opinions/2025/5/30/a-coalition-of-conscience-must-rise-to-stop-israels-genocidal-war-on-gaza?traffic_source=rss
Al Jazeera,20,Ex-Sinn Fein leader Gerry Adams wins libel case against the BBC,https://www.aljazeera.com/news/2025/5/30/ex-sinn-fein-leader-gerry-adams-wins-libel-case-against-the-bbc?traffic_source=rss
