site,rank,title,link
Al Jazeera,1,The cleaner: One woman’s mission to help Britain’s hoarders,https://www.aljazeera.com/features/2026/1/18/the-cleaner-one-womans-mission-to-help-britains-hoarders?traffic_source=rss
Al Jazeera,2,Anti-ICE rally chases off US far-right influencer Jake Lang in Minneapolis,https://www.aljazeera.com/news/2026/1/18/anti-ice-rally-chases-off-us-far-right-influencer-jake-lang-in-minneapolis?traffic_source=rss
Al Jazeera,3,Anti-ICE protesters chase anti-Islam ‘influencer’ Jake Lang in Minneapolis,https://www.aljazeera.com/video/newsfeed/2026/1/18/anti-ice-protesters-chase-anti-islam-influencer-jake-lang-in-minneapolis?traffic_source=rss
Al Jazeera,4,Iran’s Supreme Leader Ali Khamenei blames Trump for deadly protests,https://www.aljazeera.com/video/newsfeed/2026/1/18/irans-supreme-leader-ali-khamenei-blames-trump-for-deadly-protests?traffic_source=rss
Al Jazeera,5,"Syrian forces capture Tabqa, nation’s largest dam amid swift push on Raqqa",https://www.aljazeera.com/news/2026/1/18/syrian-forces-capture-tabqa-and-dam-amid-swift-raqqa-offensive?traffic_source=rss
Al Jazeera,6,Deadly fire rips through Karachi shopping mall,https://www.aljazeera.com/video/newsfeed/2026/1/18/deadly-fire-rips-through-karachi-shopping-mall?traffic_source=rss
Al Jazeera,7,‘Enormous pain in my heart’: Palestinian evictions mount in East Jerusalem,https://www.aljazeera.com/features/2026/1/18/enormous-pain-in-my-heart-palestinian-evictions-mount-in-east-jerusalem?traffic_source=rss
Al Jazeera,8,Thousands rally in Serbia as students continue fight against corruption,https://www.aljazeera.com/news/2026/1/18/thousands-rally-in-serbia-as-students-continue-fight-against-corruption?traffic_source=rss
Al Jazeera,9,Indonesian rescuers find wreckage of plane that had 11 people on board,https://www.aljazeera.com/news/2026/1/18/indonesian-rescuers-find-wreckage-of-plane-that-had-11-people-on-board?traffic_source=rss
Al Jazeera,10,Syria fighting live: SDF braces for Raqqa assault as gov’t troops march on,https://www.aljazeera.com/news/liveblog/2026/1/18/syria-fighting-live-sdf-braces-for-raqqa-assault-as-govt-troops-march-on?traffic_source=rss
Al Jazeera,11,US-backed Palestinian committee shares mission statement on Gaza governance,https://www.aljazeera.com/news/2026/1/18/us-backed-palestinian-committee-shares-mission-statement-on-gaza-governance?traffic_source=rss
Al Jazeera,12,Guatemala prisoners take workers hostages in riots across three facilities,https://www.aljazeera.com/news/2026/1/18/guatemala-prisoners-take-workers-hostages-in-riots-across-three-facilities?traffic_source=rss
Al Jazeera,13,Military leader Doumbouya sworn in as Guinea’s president,https://www.aljazeera.com/news/2026/1/18/military-leader-doumbouya-sworn-in-as-guineas-president?traffic_source=rss
Al Jazeera,14,Trump’s ‘board of peace’ appears to seek wider mandate beyond Gaza,https://www.aljazeera.com/news/2026/1/18/trumps-board-of-peace-appears-to-seek-wider-mandate-beyond-gaza?traffic_source=rss
Al Jazeera,15,"Russia-Ukraine war: List of key events, day 1,424",https://www.aljazeera.com/news/2026/1/18/russia-ukraine-war-list-of-key-events-day-1424?traffic_source=rss
Al Jazeera,16,US says it killed al-Qaeda-affiliated leader tied to deadly Syria ambush,https://www.aljazeera.com/news/2026/1/17/us-says-it-killed-al-qaeda-affiliated-leader-tied-to-deadly-syria-ambush?traffic_source=rss
Al Jazeera,17,US urges de-escalation as Syrian army advances on Kurdish-held territory,https://www.aljazeera.com/news/2026/1/17/us-urges-de-escalation-as-syrian-army-advances-on-kurdish-territory?traffic_source=rss
Al Jazeera,18,"Uganda’s Museveni wins 7th term, opponent calls results ‘fake’",https://www.aljazeera.com/video/newsfeed/2026/1/17/ugandas-museveni-wins-7th-term-opponent-calls-results?traffic_source=rss
Al Jazeera,19,"EU, Mercosur bloc sign free trade deal after 25 years of negotiations",https://www.aljazeera.com/news/2026/1/17/eu-mercosur-bloc-sign-free-trade-deal-after-25-years-of-negotiations?traffic_source=rss
Al Jazeera,20,Nigeria beat Egypt on penalties to claim AFCON bronze medal,https://www.aljazeera.com/sports/2026/1/17/nigeria-beat-egypt-on-penalties-to-claim-afcon-bronze-medal?traffic_source=rss
Associated Press,1,Trump says 8 European countries will face 10% tariff for opposing US control of Greenland,https://apnews.com/article/denmark-greenland-us-trump-4ad99ea3975a8b62d37bd04961feda55
Associated Press,2,European Union and Mercosur bloc of South American nations sign landmark free trade agreement,https://apnews.com/article/mercosur-european-union-trade-agreement-south-america-b779460da4b7ecb6aa15d322976fa70d
Associated Press,3,"Analysis: Canada's leader leaves China pronouncing success, but Trump lurks in the background",https://apnews.com/article/china-canada-us-xi-carney-trump-404596761e826bbdc1e0313062902137
Associated Press,4,Counter protesters chase off conservative influencer during Minneapolis immigration crackdown,https://apnews.com/article/minnesota-immigration-crackdown-51a05ca22098e07fa0499e59e49e6b22
Associated Press,5,Abigail Spanberger sworn in as Virginia's first woman governor,https://apnews.com/article/abigail-spanberger-virginia-governor-inauguration-5a0da64bf53f8e800783fa428cb99d50
Associated Press,6,Why US cities are reverting 1-way streets back to their original 2-way design,https://apnews.com/article/one-way-streets-safety-indianapolis-louisville-lynchburg-6ca9c3610c44772665bc0de467d14c40
Associated Press,7,AP obtains documents showing Venezuelan leader Delcy Rodríguez has been on DEA's radar for years,https://apnews.com/article/delcy-rodriguez-donald-trump-venezuela-drugs-maduro-70ffbe17378fe0fa9b7f12a40e07b2f3
Associated Press,8,Here's where Trump's most jaw-dropping promises stand a year into his second term,https://apnews.com/article/trump-promises-second-term-greenland-alcatraz-canada-858c0f1d3ec934dc696a70a5b38eace3
Associated Press,9,"Sen. Thom Tillis takes on the White House, but not Trump",https://apnews.com/article/tillis-senate-trump-greenland-powell-miller-fd1a1123b1998b2a8be45e0fb9da52d5
Associated Press,10,Roger Federer steals the show at Australian Open's first formal opening ceremony,https://apnews.com/article/federer-agassi-australian-open-tennis-f9188d4c0c2cc4cba335a84410f561a8
Associated Press,11,A champion will be crowned but college football chaos will linger beyond Indiana-Miami title game,https://apnews.com/article/college-football-indiana-miami-transfer-portal-e31951b18380a07d2883aa70a325d35d
Associated Press,12,"Bo Nix breaks his right ankle late in Broncos' playoff win, will have surgery",https://apnews.com/article/broncos-bo-nix-broken-ankle-nfl-playoffs-b61840b6221f3ece7efb33814b00c6b4
Associated Press,13,"Kianna Underwood, former Nickelodeon star, killed in hit-and-run",https://apnews.com/article/kianna-underwood-killed-new-york-57937ccad0ca47b0bcacd1180489dccc
Associated Press,14,Thousands of fans celebrate life of legendary Grateful Dead guitarist Bob Weir in San Francisco,https://apnews.com/article/bob-weir-grateful-dead-9a0e427a62c3ad77d22870fdaac5d2ae
Associated Press,15,Trump's protectionist trade policies allow China to swoop in,https://apnews.com/article/china-canada-trade-ev-trump-aa2904669445a9ea0b56ebe64f611928
Associated Press,16,"As Trump's deadline for a cap on credit card rates looms, banks have only questions and no answers",https://apnews.com/article/trump-credit-cards-interest-rate-jpmorgan-banks-002ddd40b706d503af9d74940f441dcf
Associated Press,17,NASA's new moon rocket moves to the pad ahead of astronaut launch as early as February,https://apnews.com/article/artemis-nasa-moonshot-921fc1a0a832217fae8b57d2fce2dc66
Associated Press,18,Nuevo cohete lunar de NASA se dirige a plataforma para lanzamiento programado para febrero,https://apnews.com/article/nasa-artemis-cohete-lunar-63bdd76c1c1c68b768a87814128d5b82
Associated Press,19,Monkeys are on the loose in St. Louis and AI is complicating efforts to capture them,https://apnews.com/article/monkeys-st-louis-96c55834c7f17854cc4362db891ca8fa
Associated Press,20,Raccoon goes on drunken rampage in Virginia liquor store and passes out on bathroom floor,https://apnews.com/article/drunk-raccoon-liquor-store-bandit-virginia-5109feb2ea9ab9bf8954ec3798689fd0
