site,rank,title,link
Al Jazeera,1,Alcaraz secures year-end world number one ranking at ATP Finals,https://www.aljazeera.com/sports/2025/11/14/alcaraz-secures-year-end-world-number-one-ranking-at-atp-finals?traffic_source=rss
Al Jazeera,2,US announces ‘Southern Spear’ mission as forces deploy to South America,https://www.aljazeera.com/news/2025/11/14/us-announces-southern-spear-mission-as-forces-deploy-to-south-america?traffic_source=rss
Al Jazeera,3,Osimhen scores two goals as Nigeria set up World Cup clash with DR Congo,https://www.aljazeera.com/sports/2025/11/14/osimhen-scores-two-goals-as-nigeria-set-up-world-cup-clash-with-dr-congo?traffic_source=rss
Al Jazeera,4,Cuban authorities battle wave of mosquito-borne illnesses,https://www.aljazeera.com/news/2025/11/14/cuban-authorities-battle-wave-of-mosquito-borne-illnesses?traffic_source=rss
Al Jazeera,5,"Russia-Ukraine war: List of key events, day 1,359",https://www.aljazeera.com/news/2025/11/14/russia-ukraine-war-list-of-key-events-day-1359?traffic_source=rss
Al Jazeera,6,Trump administration joins lawsuit against California’s redistricting maps,https://www.aljazeera.com/news/2025/11/13/trump-administration-joins-lawsuit-against-californias-redistricting-maps?traffic_source=rss
Al Jazeera,7,"BBC apologises to Trump over documentary, rejects defamation claim",https://www.aljazeera.com/economy/2025/11/13/bbc-apologises-to-trump-over-documentary-rejects-defamation-claim?traffic_source=rss
Al Jazeera,8,Ronaldo sent off as Ireland stun Portugal to keep World Cup hopes alive,https://www.aljazeera.com/sports/2025/11/13/ronaldo-sent-off-as-ireland-stun-portugal-to-keep-world-cup-hopes-alive?traffic_source=rss
Al Jazeera,9,Israeli settler attack on West Bank mosque draws international condemnation,https://www.aljazeera.com/news/2025/11/13/israeli-settler-attack-on-west-bank-mosque-draws-international-condemnation?traffic_source=rss
Al Jazeera,10,Trump administration targets European antifa groups as ‘global terrorists’,https://www.aljazeera.com/news/2025/11/13/trump-administration-targets-european-antifa-groups-as-global-terrorists?traffic_source=rss
Al Jazeera,11,West Bank mosque torched amid surge in Israeli settler violence,https://www.aljazeera.com/video/newsfeed/2025/11/13/west-bank-mosque-torched-amid-surge-in-israeli-settler-violence?traffic_source=rss
Al Jazeera,12,Authorities recover remains of all killed in Turkish military plane crash,https://www.aljazeera.com/video/newsfeed/2025/11/13/authorities-recover-remains-of-all-killed-in-turkish-military-plane-crash?traffic_source=rss
Al Jazeera,13,Verizon planning its largest layoffs ever: Report,https://www.aljazeera.com/economy/2025/11/13/verizon-planning-its-largest-layoffs-ever-report?traffic_source=rss
Al Jazeera,14,"James Comey, Letitia James argue US attorney in their cases hired illegally",https://www.aljazeera.com/news/2025/11/13/james-comey-letitia-james-argue-us-attorney-in-their-cases-hired-illegally?traffic_source=rss
Al Jazeera,15,France marks 10 years since Paris attacks upended country,https://www.aljazeera.com/video/newsfeed/2025/11/13/france-marks-10-years-since-paris-attacks-upended-country?traffic_source=rss
Al Jazeera,16,Colombia to maintain US intelligence-sharing to fight drug trafficking,https://www.aljazeera.com/news/2025/11/13/colombia-says-will-maintain-intelligence-sharing-to-fight-drug-trafficking?traffic_source=rss
Al Jazeera,17,Unionised Starbucks workers begin ‘open-ended’ US strike,https://www.aljazeera.com/economy/2025/11/13/unionised-starbucks-workers-begin-open-ended-us-strike?traffic_source=rss
Al Jazeera,18,Medical experts say Africa faces worst cholera outbreak in 25 years,https://www.aljazeera.com/news/2025/11/13/medical-experts-say-africa-faces-worst-cholera-outbreak-in-25-years?traffic_source=rss
Al Jazeera,19,Should the US fund health insurance or leave it to the market?,https://www.aljazeera.com/video/counting-the-cost/2025/11/13/should-the-us-fund-health-insurance-or-leave-it-to-the-market?traffic_source=rss
Al Jazeera,20,Ireland vs Portugal 2-0: World Cup 2026 qualifier – as it happened,https://www.aljazeera.com/sports/liveblog/2025/11/13/live-ireland-vs-portugal-world-cup-2026-qualifier?traffic_source=rss
Associated Press,1,Trump administration designates 4 left-wing European networks as terrorist organizations,https://apnews.com/article/trump-terror-designations-europe-antifa-a4f0b5f733e9a105101107b0c80d482e
Associated Press,2,"‘I can’t take any more of this,’ then-Prince Andrew wrote during Epstein scandal, emails reveal",https://apnews.com/article/prince-andrew-epstein-emails-mountbatten-08e9298ca7a8ad9c51459c520fc3a405
Associated Press,3,EU renews demand that Ukraine crack down on corruption in wake of major energy scandal,https://apnews.com/article/russia-ukraine-war-corruption-scandal-pokrovsk-a25b76c6c9830baafcf16ac5648bdd4c
Associated Press,4,50-year mortgages? NFL kickoff rules? Here's where some of Trump's latest jaw-dropping musings stand,https://apnews.com/article/trump-outlandish-mortgages-bagram-un-nfl-kickoff-a25df24bf4d4c493bdfac68e31b037f6
Associated Press,5,Oklahoma inmate whose life was spared by governor later found unresponsive in cell,https://apnews.com/article/oklahoma-execution-tremane-wood-96eea36ff43eb7e28f3e69bec3579a63
Associated Press,6,FAA says flight cuts will stay at 6% because more air traffic controllers are coming to work,https://apnews.com/article/government-shutdown-airlines-staffing-c927b8031ee2454924486b0ddde875f5
Associated Press,7,Takeaways from the newly released Epstein documents,https://apnews.com/article/jefferey-epstein-donald-trump-documents-493aa8b123bbf52970586cf9ce19f498
Associated Press,8,"James Comey and Letitia James press for dismissal of their cases, challenge prosecutor's appointment",https://apnews.com/article/comey-letitia-james-justice-department-ff6435d7bdbcc9e9495844899c7e2c4e
Associated Press,9,Top Fannie Mae officials ousted after sounding alarm on sharing confidential housing data,https://apnews.com/article/fannie-mae-freddie-mac-firing-pulte-data-a4f8c53df74fef83ec7fd07e3d524746
Associated Press,10,Pirates ace Paul Skenes wins first Cy Young Award and Tigers star Tarik Skubal goes back-to-back,https://apnews.com/article/cy-young-award-tarik-skubal-paul-skenes-c4e112b92d19e8f8b5825e14452610a5
Associated Press,11,HBCUs and female athletes fear being left behind in the new era of college sports,https://apnews.com/article/ncaa-house-settlement-hbcus-50ce432e8a7252de3e71e32cb6e0c6b5
Associated Press,12,Bernie Kosar undergoes 'aggressive procedures' as he awaits liver transplant,https://apnews.com/article/kosar-liver-transplant-browns-cowboys-dolphins-8bc673b7dae80e2e138b1c1f3913103f
Associated Press,13,"Desert raves and apocalyptic doom collide in 'Sirāt,' one of the year's most talked about films",https://apnews.com/article/sirat-oliver-laxe-interview-796cc412aa00d9fcb114a93bd7f7ce2d
Associated Press,14,"Bad Bunny wins big at the 2025 Latin Grammys, Raphael warms hearts everywhere",https://apnews.com/article/latin-grammys-2025-42dc4af01c917740b60fe585c09f6d1b
Associated Press,15,"Now, it’s her story: HBO's steamy 'Seduction’ reimagines ‘Dangerous Liaisons’ with a female gaze",https://apnews.com/article/seduction-tv-dangerous-liaisons-hbo-max-0f9d84fa8a972fa96d49211201474f7a
Associated Press,16,Starbucks workers kick off 65-store US strike on company's busy Red Cup Day,https://apnews.com/article/starbucks-workers-strike-stores-union-6d9a5c8761fb7a251cb9bf7c13908877
Associated Press,17,Workers turn to 'polyworking' to combat frozen salaries and inflation,https://apnews.com/article/work-side-jobs-security-salaries-layoffs-df229576002b9b99cf4149b3978e937c
Associated Press,18,Wall Street drops to one of its worst days since April on worries about AI stocks and interest rates,https://apnews.com/article/stocks-markets-trump-government-shutdown-c388d97a4e4acf5cca538fd901e46b2d
Associated Press,19,Blue Origin launches huge rocket carrying twin NASA spacecraft to Mars,https://apnews.com/article/blue-origin-mars-nasa-new-glenn-bezos-4e3e6c380b8294b557618a6fea92282b
Associated Press,20,Dog is rescued from a busy Boston tunnel during rush hour,https://apnews.com/article/video-dog-rescued-boston-tunnel-85743eb0ea51dd18dcc40e99dac3ac8c
