site,rank,title,link
Al Jazeera,1,Travellers panic as US attacks Iran-Iraq border crossing,https://www.aljazeera.com/video/newsfeed/2026/7/23/travellers-panic-as-us-attacks-iran-iraq-border-crossing?traffic_source=rss
Al Jazeera,2,India’s Modi promises fast-track courts for exam fraud fuelling protests,https://www.aljazeera.com/news/2026/7/23/indias-modi-promises-fast-track-courts-for-exam-fraud-fuelling-protests?traffic_source=rss
Al Jazeera,3,Top US and Russian diplomats discuss Ukraine war in Manila,https://www.aljazeera.com/news/2026/7/23/top-us-and-russian-diplomats-discuss-ukraine-war-in-manila?traffic_source=rss
Al Jazeera,4,Arsenal defender Saliba sidelined for ‘extended period’ due to back injury,https://www.aljazeera.com/sports/2026/7/23/william-saliba-back-injury-arsenal-france-world-cup?traffic_source=rss
Al Jazeera,5,Between hope and fear: Yemenis react to Houthi blockade on Saudi Arabia,https://www.aljazeera.com/features/2026/7/23/between-hope-and-fear-yemenis-react-to-houthi-blockade-on-saudi-arabia?traffic_source=rss
Al Jazeera,6,Will the war on Iran affect ASEAN’s efforts to tackle regional issues?,https://www.aljazeera.com/video/inside-story/2026/7/23/will-the-war-on-iran-affect-aseans-efforts-to-tackle-regional-issues?traffic_source=rss
Al Jazeera,7,Thousands forced to evacuate as wildfires sweep across southern France,https://www.aljazeera.com/video/newsfeed/2026/7/23/aje-onl-nf_france-battles-massive-wildfires-amid-extreme-heat-230726?traffic_source=rss
Al Jazeera,8,US attacks Iran for 12th night as the House approves defence spending,https://www.aljazeera.com/video/newsfeed/2026/7/23/us-attacks-iran-for-12th-night-as-the-house-approves-defence-spending?traffic_source=rss
Al Jazeera,9,Saudi Arabia and US agree to landmark nuclear deal for civilian purposes,https://www.aljazeera.com/video/newsfeed/2026/7/23/saudi-arabia-and-us-agree-to-landmark-nuclear-deal-for-civilian-purposes?traffic_source=rss
Al Jazeera,10,Indian police accused of using pellet guns in crackdown on India’s protests,https://www.aljazeera.com/video/newsfeed/2026/7/23/indian-police-accused-of-using-pellet-guns-in-crackdown-on-indias-protests?traffic_source=rss
Al Jazeera,11,Israel building earthen barrier in Gaza to entrench division of the enclave,https://www.aljazeera.com/news/2026/7/23/israel-building-earthen-barrier-in-gaza-to-entrench-division-of-the-enclave?traffic_source=rss
Al Jazeera,12,Guyana ferry disaster: families demand answers as around 100 feared dead,https://www.aljazeera.com/news/2026/7/23/guyana-ferry-disaster-families-demand-answers-as-around-100-feared-dead?traffic_source=rss
Al Jazeera,13,Jailed opposition leader Ghannouchi faints in Tunisian prison due to heat,https://www.aljazeera.com/news/2026/7/23/jailed-opposition-leader-ghannouchi-faints-in-tunisian-prison-due-to-heat?traffic_source=rss
Al Jazeera,14,Five soldiers killed in southern Thailand checkpoint attack,https://www.aljazeera.com/news/2026/7/23/five-soldiers-killed-in-southern-thailand-checkpoint-attack?traffic_source=rss
Al Jazeera,15,Calls for Moroccan rapper’s release outside a Casablanca court,https://www.aljazeera.com/video/newsfeed/2026/7/23/calls-for-moroccan-rappers-release-outside-a-casablanca-court?traffic_source=rss
Al Jazeera,16,Armed attackers kill more than 20 in northwest Nigeria,https://www.aljazeera.com/news/2026/7/23/armed-attackers-kill-more-than-20-in-northwest-nigeria?traffic_source=rss
Al Jazeera,17,"In Gaza, a long path to recovery for one woman who lost eye, and daughter",https://www.aljazeera.com/features/2026/7/23/in-gaza-a-long-path-to-recovery-for-one-woman-who-lost-eye-and-daughter?traffic_source=rss
Al Jazeera,18,Abderrahim Fakir’s death has reignited Italy’s police accountability debate,https://www.aljazeera.com/news/2026/7/23/why-abderrahim-fakirs-death-reignited-italys-police-accountability-debate?traffic_source=rss
Al Jazeera,19,"Spain and France battle raging wildfires, face high risk of more",https://www.aljazeera.com/news/2026/7/23/spain-and-france-battle-raging-wildfires-face-high-risk-of-more?traffic_source=rss
Al Jazeera,20,US tariffs ‘strengthen’ Lula against Bolsonaro’s son in upcoming elections,https://www.aljazeera.com/news/2026/7/23/us-tariffs-strengthen-lula-against-bolsonaros-son-in-upcoming-elections?traffic_source=rss
Associated Press,1,US military carries out strikes on Iran as both sides threaten civilian infrastructure,https://apnews.com/article/iran-us-hormuz-strait-war-july-22-2026-42ff3de8d135ad72ff3ba4d94cc0921d
Associated Press,2,"Iran's demands over the Strait of Hormuz would set a dangerous precedent, Rubio warns Asian leaders",https://apnews.com/article/asean-rubio-south-china-sea-iran-war-12b3a257be0b6af9d96356dd78be3cfd
Associated Press,3,"What to know about Iran's Pickaxe Mountain, home to an underground nuclear site threatened by Trump",https://apnews.com/article/iran-us-war-pickaxe-mountain-nuclear-underground-what-to-know-2df2cbdbab7e21ba26e41cacdfa84e7c
Associated Press,4,AP Exclusive: A boater's photo may be 'the last picture' of group drowned in an Ohio river,https://apnews.com/article/ohio-river-drowning-group-honduras-327dd0e5d6cd3a346dc000551eabd53e
Associated Press,5,Special prosecutor drops all felony criminal charges against Louisiana Attorney General Murrill,https://apnews.com/article/louisiana-attorney-general-liz-murrill-charges-d481ca6adba8232a7cbf450a46e5b6b3
Associated Press,6,Tropical Storm Bertha makes landfall on southern Louisiana with threatening winds,https://apnews.com/article/tropical-storm-bertha-gulf-florida-alabama-louisiana-6052f6812cf03558fcbd08c4444a72a1
Associated Press,7,House Republicans adopt $95 billion package for the Iran war and Trump's priorities,https://apnews.com/article/gop-95-billion-iran-war-trump-johnson-f9dea5ef800bfeb0e343256e841af38f
Associated Press,8,House votes for Department of War renaming as part of an annual defense bill,https://apnews.com/article/defense-pentagon-congress-iran-spending-trump-de65f6e0ee4f4d69699fb9f1f647083e
Associated Press,9,Olympic rowing great Olaf Tufte who competed at seven Summer Games has died at age 50,https://apnews.com/article/olympics-rowing-norway-olaf-tufte-e643964f6a7722de43eaa1b6a023b76e
Associated Press,10,"Red Sox win 15th straight, matching longest in club history, with 6-3 victory over Orioles",https://apnews.com/article/orioles-red-sox-score-streak-70de33c882eb9b53d06e090d6b674714
Associated Press,11,Chiefs unveil first renderings of new $3 billion domed stadium set to open in 2031,https://apnews.com/article/kansas-city-chiefs-new-stadium-238b9de803c963055fa23b0525cf8c46
Associated Press,12,"Madonna, BTS and more World Cup halftime performers see jump in song streams, Justin Bieber up 110%",https://apnews.com/article/world-cup-halftime-justin-bieber-madonna-bts-6c6a045f28ea1e884199abac7750b785
Associated Press,13,Prosecutors zoom in on blood stains to show singer D4vd should be tried in killing of 14-year-old,https://apnews.com/article/d4vd-celeste-rivas-hernandez-killing-burke-32ca2cc61ca6b7db8e3170888d3dacd4
Associated Press,14,OpenAI blamed a hacking event on its AI models going rogue. Here are some things to know,https://apnews.com/article/openai-rogue-ai-hack-hugging-face-67b151f1ca59851a9234bee110699f05
Associated Press,15,"Oil prices rise another 3%, while Wall Street drifts in mixed trading",https://apnews.com/article/stocks-markets-iran-ai-trump-207dfa55d180fcc565420454178168c5
Associated Press,16,Raccoon goes on drunken rampage in Virginia liquor store and passes out on bathroom floor,https://apnews.com/article/drunk-raccoon-liquor-store-bandit-virginia-5109feb2ea9ab9bf8954ec3798689fd0
Associated Press,17,Ghana's fantasy coffins are a colorful celebration of life and legacy,https://apnews.com/article/ghana-fantasy-coffins-funerals-accra-tradition-01220db5b2e240a12ae8e4ba8820f993
Associated Press,18,Viral phenomenon in Argentina has young people identifying themselves as animals,https://apnews.com/article/argentina-teenagers-identifying-as-animals-therians-tiktok-54d158c4842f6515e31d83a260cdf31f
Associated Press,19,"Fatou, the world's oldest gorilla living in captivity, celebrates her 69th birthday at Berlin Zoo",https://apnews.com/article/gorilla-germany-fatou-berlin-zoo-0196b95f3b6d48593bb7c872cab51adf
Associated Press,20,Lettuce introduce you to the live frog found in this grocery store salad bag,https://apnews.com/article/australia-frog-lettuce-salad-esperance-4134acf75e814dedd7789c1423c26ab1
