site,rank,title,link
Al Jazeera,1,Netanyahu says Israeli forces have crossed Lebanon’s Litani River,https://www.aljazeera.com/video/newsfeed/2026/5/29/netanyahu-says-israeli-forces-have-crossed-lebanons-litani-river?traffic_source=rss
Al Jazeera,2,"Israel, Russia among new additions on UN sexual violence ‘blacklist’",https://www.aljazeera.com/news/2026/5/29/israel-russia-un-conflict-related-sexual-violence-report?traffic_source=rss
Al Jazeera,3,Trump heads into Situation Room to potentially finalise Iran deal,https://www.aljazeera.com/video/newsfeed/2026/5/29/trump-heads-into-situation-room-to-potentially-finalise-iran-deal?traffic_source=rss
Al Jazeera,4,What’s next after scrapping the ‘Black Code’ in France?,https://www.aljazeera.com/video/inside-story/2026/5/29/whats-next-after-scrapping-the-black-code-in-france?traffic_source=rss
Al Jazeera,5,Russian rate of losses in Ukraine almost triples in one year,https://www.aljazeera.com/news/2026/5/29/russian-rate-of-losses-in-ukraine-almost-triples-in-one-year?traffic_source=rss
Al Jazeera,6,Romania to expel Russian consul after residential drone strike,https://www.aljazeera.com/video/newsfeed/2026/5/29/romania-to-expel-russian-consul-after-residential-drone-strike?traffic_source=rss
Al Jazeera,7,Israeli fighter jets strike village in south Lebanon,https://www.aljazeera.com/video/newsfeed/2026/5/29/israeli-fighter-jets-strike-village-in-south-lebanon?traffic_source=rss
Al Jazeera,8,‘A landmark’: Brazil’s prosecutors hail court ruling to preserve Fordlandia,https://www.aljazeera.com/news/2026/5/29/a-landmark-brazils-prosecutors-hail-court-ruling-to-preserve-fordlandia?traffic_source=rss
Al Jazeera,9,Eight students arrested in deadly Kenyan school dorm fire,https://www.aljazeera.com/video/newsfeed/2026/5/29/eight-students-arrested-in-deadly-kenyan-school-dorm-fire?traffic_source=rss
Al Jazeera,10,EU to release billions in frozen funds for Hungary amid Magyar reforms,https://www.aljazeera.com/news/2026/5/29/eu-to-release-billions-in-frozen-funds-for-hungary-amid-magyar-reforms?traffic_source=rss
Al Jazeera,11,Trump says ‘final determination’ to be made on possible Iran deal,https://www.aljazeera.com/news/2026/5/29/trump-says-final-determination-to-be-made-on-possible-iran-deal?traffic_source=rss
Al Jazeera,12,Will the AI race fuel another boom or another bubble?,https://www.aljazeera.com/video/counting-the-cost/2026/5/29/will-the-ai-race-fuel-another-boom-or-another-bubble?traffic_source=rss
Al Jazeera,13,"Vance says US, Iran have made “a lot of progress” towards deal",https://www.aljazeera.com/video/newsfeed/2026/5/29/vance-says-us-iran-have-made-a-lot-of-progress-towards-deal?traffic_source=rss
Al Jazeera,14,Five killed in Lebanon as Israeli forces advance across key Litani River,https://www.aljazeera.com/news/2026/5/29/five-killed-in-lebanon-as-israeli-forces-advance-across-key-litani-river?traffic_source=rss
Al Jazeera,15,Israel strikes building in Gaza’s Shati refugee camp,https://www.aljazeera.com/video/newsfeed/2026/5/29/israel-strikes-building-in-gazas-shati-refugee-camp?traffic_source=rss
Al Jazeera,16,Eid and sacrifice in Gaza,https://www.aljazeera.com/video/newsfeed/2026/5/29/eid-and-sacrifice-in-gaza?traffic_source=rss
Al Jazeera,17,"On the road to Rogun Dam, Tajikistan’s ‘greatest dream’",https://www.aljazeera.com/news/2026/5/29/on-the-road-to-rogun-dam-tajikistans-greatest-dream?traffic_source=rss
Al Jazeera,18,Colombia’s ‘Total Peace’ plan: A failure or unfinished business for Petro?,https://www.aljazeera.com/news/longform/2026/5/29/colombias-total-peace-plan-a-failure-or-unfinished-business-for-petro?traffic_source=rss
Al Jazeera,19,US judge temporarily blocks Trump’s $1.8bn ‘anti-weaponisation fund’,https://www.aljazeera.com/news/2026/5/29/us-federal-judge-temporarily-blocks-trumps-anti-weaponisation-fund?traffic_source=rss
Al Jazeera,20,"PSG vs Arsenal: Champions League final – teams, start time, lineups",https://www.aljazeera.com/sports/2026/5/29/psg-vs-arsenal-champions-league-final-teams-start-time-lineups-kickoff?traffic_source=rss
Associated Press,1,"With a stalemate in Ukraine and discontent at home, Putin seems ready to escalate his war",https://apnews.com/article/russia-putin-ukraine-war-zelenskyy-0c31bbbf0d06c457c00d046bc7ba99f7
Associated Press,2,"Russian drone targeting Ukraine hits apartment building in Romania, injuring 2, officials say",https://apnews.com/article/russia-ukraine-war-romania-drone-aa90986c237b8fa1d9116685c8c32f95
Associated Press,3,"When Sue Tilley met Lucian Freud, it changed her life. Now a painting of her could fetch $47 million",https://apnews.com/article/lucian-freud-sue-tilley-model-auction-09137b80bb718e67ba9d57023689af80
Associated Press,4,"Bus hits cars in Virginia, killing 5 people and injuring 34, state police say",https://apnews.com/article/virginia-bus-crash-interstate-95-69a5cfdcfc5af71318422152365ad96e
Associated Press,5,"Federal judge had sex in chambers with police officer and lied about it, investigation found",https://apnews.com/article/federal-judge-police-officer-sex-reprimand-a1caf9894fce24596321c41f600072a9
Associated Press,6,"Shrey Parikh bounces back, battles nerves and dominates spell-off to win the National Spelling Bee",https://apnews.com/article/scripps-national-spelling-bee-2026-champion-70adb231a3b8635e76c0c2f9eb57e3cb
Associated Press,7,Bondi refuses to answer lawmakers' questions about Trump's involvement in Epstein files release,https://apnews.com/article/pam-bondi-jeffrey-epstein-trump-9ca5612e397ff8365dfb212a214c97c9
Associated Press,8,Judge temporarily blocks payouts from Trump's $1.776 billion 'anti-weaponization' settlement fund,https://apnews.com/article/trump-settlement-fund-antiweaponization-8baaee6aa8d83f0ad2905f5f8d457dec
Associated Press,9,"Claude Lemieux, the feisty four-time Stanley Cup champion for Avalanche, Devils and Habs, dies at 60",https://apnews.com/article/claude-lemieux-dies-8a00667a54fc8f09839d19da2f90c891
Associated Press,10,The vibes in Canada feel much different than the US as the World Cup arrives,https://apnews.com/article/world-cup-canada-6c47ec259026a6b437b0e5b06aed1af5
Associated Press,11,"Ben Stiller welcomes a photo with Mike Brown's wife, after Knicks coach said she was afraid to ask",https://apnews.com/article/knicks-ben-stiller-mike-brown-6b5b52244f7897b147eee80879098392
Associated Press,12,"Martina McBride, Morris Day among wave of cancellations at Trump-linked Freedom 250 concerts",https://apnews.com/article/freedom-250-milli-vanilli-young-mc-bb9c58cb68d3af91cd8aeb5c5c5d26a1
Associated Press,13,"Calling for 'new approach,' CBS News leader Bari Weiss replaces executive producer at '60 Minutes'",https://apnews.com/article/cbs-60-minutes-bari-weiss-bilton-0afb86888cccd9e47a3e103a88984bba
Associated Press,14,What to know about the artists backing out of the Trump-linked Freedom 250 concerts,https://apnews.com/article/freedom-250-concerts-cancellations-what-to-know-8f506ad99fc1aee7413514e37ce59604
Associated Press,15,Tomatoes become latest symbol of America’s affordability squeeze,https://apnews.com/article/tomatoes-inflation-prices-groceries-mexico-tariffs-trump-1176fd9d4213f2b568181809937c2170
Associated Press,16,"USPS, DHL partner in a $10 billion 'last-mile' delivery agreement",https://apnews.com/article/usps-dhl-package-delivery-1a9e7442873e77f37b2cc01ce1b08de8
Associated Press,17,Google employee charged with using confidential search data to make $1.2 million on Polymarket,https://apnews.com/article/google-employee-insider-trading-polymarket-0a16656cd72f1694bf16a781a5b73b8e
Associated Press,18,Blue Origin rocket explodes on the launch pad during an engine-firing test,https://apnews.com/article/blue-origin-rocket-explosion-bezos-ecdb38828fac02e3a33cc4fd4e61543e
Associated Press,19,Blue Origin investigates rocket explosion as public is warned about possible wreckage washing ashore,https://apnews.com/article/blue-origin-new-glenn-rocket-explosion-a69e249784c277b0d08ac8c246b21a6d
Associated Press,20,"Pigeons may be navigating with their liver, study suggests",https://apnews.com/article/pigeon-navigation-magnetic-field-macrophage-liver-cdf06cf03a589f472f4ba2d649a8b897
