site,rank,title,link
Al Jazeera,1,Venezuela struggles to respond to devastating twin earthquakes,https://www.aljazeera.com/video/newsfeed/2026/6/25/venezuela-struggles-to-respond-to-devastating-twin-earthquakes?traffic_source=rss
Al Jazeera,2,Rubio: Gulf countries don’t support Strait of Hormuz tolls,https://www.aljazeera.com/video/newsfeed/2026/6/25/rubio-gulf-countries-dont-support-strait-of-hormuz-tolls?traffic_source=rss
Al Jazeera,3,"Israeli forces shoot and kill Palestinians in occupied West Bank, Gaza",https://www.aljazeera.com/news/2026/6/25/israeli-forces-shoot-and-kill-palestinians-in-occupied-west-bank-gaza?traffic_source=rss
Al Jazeera,4,US Supreme Court paves way for government to block asylum seekers at border,https://www.aljazeera.com/news/2026/6/25/us-supreme-court-paves-way-for-government-to-block-asylum-seekers-at-border?traffic_source=rss
Al Jazeera,5,Escaping Darfur: Mothers face starvation under trees in Chad,https://www.aljazeera.com/features/2026/6/25/escaping-darfur-mothers-face-starvation-under-trees-in-chad?traffic_source=rss
Al Jazeera,6,"Spain vs Uruguay at World Cup 2026: match prediction, knockouts and lineups",https://www.aljazeera.com/sports/2026/6/25/world-cup-2026-uruguay-vs-spain-knockouts-prediction-lineups?traffic_source=rss
Al Jazeera,7,"They fled war as child refugees, now they’re playing at World Cup 2026",https://www.aljazeera.com/sports/2026/6/25/they-fled-war-as-child-refugees-now-theyre-playing-at-world-cup-2026?traffic_source=rss
Al Jazeera,8,Israel kills three in Lebanon as Rubio praises progress in Washington talks,https://www.aljazeera.com/news/2026/6/25/israel-kills-three-in-lebanon-as-rubio-praises-progress-in-washington-talks?traffic_source=rss
Al Jazeera,9,"Lebanon Latest: Peace talks between Lebanon and Israel, people return south",https://www.aljazeera.com/video/newsfeed/2026/6/25/lebanon-latest-peace-talks-between-lebanon-and-israel-people-return-south?traffic_source=rss
Al Jazeera,10,Iran accuses NATO of ‘complicity’ in US war: What role did EU nations play?,https://www.aljazeera.com/news/2026/6/25/iran-accuses-nato-of-complicity-in-us-war-what-role-did-eu-nations-play?traffic_source=rss
Al Jazeera,11,IRGC warns against new Hormuz route for ships: What we know,https://www.aljazeera.com/news/2026/6/25/irgc-warns-against-new-hormuz-route-for-ships-what-we-know?traffic_source=rss
Al Jazeera,12,Iran negotiator Ghalibaf rejects claim unfrozen funds will buy US goods,https://www.aljazeera.com/news/2026/6/25/iran-negotiator-ghalibaf-rejects-claim-unfrozen-funds-will-buy-us-goods?traffic_source=rss
Al Jazeera,13,UK’s hottest June: ‘The population should have been prepared for this’,https://www.aljazeera.com/news/2026/6/25/uks-hottest-june-the-population-should-have-been-prepared-for?traffic_source=rss
Al Jazeera,14,Deconfliction and disarmament: Can both be pursued in Lebanon?,https://www.aljazeera.com/news/2026/6/25/deconfliction-and-disarmament-can-both-be-pursued-in-lebanon?traffic_source=rss
Al Jazeera,15,"Norway vs France at World Cup 2026: Mbappe vs Haaland, team news, lineups",https://www.aljazeera.com/sports/2026/6/25/norway-vs-france-at-world-cup-2026-mbappe-vs-haaland-team-news-lineups?traffic_source=rss
Al Jazeera,16,Haitians reflect on first World Cup experience in 52 years,https://www.aljazeera.com/video/newsfeed/2026/6/25/haitians-reflect-on-first-world-cup-experience-in-52-years?traffic_source=rss
Al Jazeera,17,Venezuela earthquakes devastate country,https://www.aljazeera.com/video/newsfeed/2026/6/25/venezuela-earthquakes-devastate-country?traffic_source=rss
Al Jazeera,18,"Iran, Israel and the Bomb",https://www.aljazeera.com/video/featured-documentaries/2026/6/25/iran-israel-and-the-bomb?traffic_source=rss
Al Jazeera,19,"For Haitians in the US, the pride and joy of the World Cup comes with fear",https://www.aljazeera.com/sports/2026/6/25/for-haitians-in-the-us-the-pride-and-joy-of-the-world-cup-comes-with-fear?traffic_source=rss
Al Jazeera,20,Venezuela earthquakes: How will sanctions impact aid operations?,https://www.aljazeera.com/news/2026/6/25/venezuela-quakes-how-will-sanctions-impact-aid-operations?traffic_source=rss
Associated Press,1,"Back-to-back powerful earthquakes hit Venezuela, causing widespread damage",https://apnews.com/article/venezuela-earthquake-caracas-7179acaee70a9c543f953852f15d4814
Associated Press,2,Venezuelans search rubble for survivors after 2 strong quakes kill at least 164,https://apnews.com/article/venezuela-earthquake-caracas-rodriguez-aid-0a62e6fc9feb5202a750c4fbb11a6aec
Associated Press,3,Supreme Court clears way for Trump administration to revive restrictive policy for asylum seekers,https://apnews.com/article/supreme-court-immigration-trump-d36d0092617c7115780c06de38e2000f
Associated Press,4,Rural area in Northern California jolted by its biggest quake since 1940,https://apnews.com/article/earthquake-northern-california-d49d72ec80d149b2fcd4c9b9ae84b37d
Associated Press,5,What to know about the push to make Bible stories required reading in Texas public schools,https://apnews.com/article/texas-curriculum-bible-board-vote-06530403ff91c10462382422003e109f
Associated Press,6,Senate Republicans reject war powers resolution after Trump berates them at Capitol meeting,https://apnews.com/article/senate-republicans-trump-vote-reject-war-powers-0f1fa8189c275188a71ed02cc8c3270d
Associated Press,7,Federal judge bars Trump from implementing proof of citizenship requirement to vote,https://apnews.com/article/trump-elections-judge-358912bcb6c7223b3d2d36465156fde9
Associated Press,8,Pentagon restores mandatory flu shots for all recruits as boot camp outbreak sickens nearly 300,https://apnews.com/article/pentagon-flu-shot-requirement-boot-camp-outbreak-4255f063ef99ea2d00cb24fec8793c32
Associated Press,9,Homophobic chant returns in Mexico's World Cup match against the Czech Republic,https://apnews.com/article/mexico-world-cup-chant-3a37becc5d7f4ed5832dcf982a303401
Associated Press,10,Qatar's Assim Madibo banned for 5 games after breaking the leg of Canada's Ismaël Koné at World Cup,https://apnews.com/article/world-cup-qatar-assim-madibo-ban-ismael-kone-4248ee7bc37385731ec8b9b96fd632a2
Associated Press,11,No entry for folk hero Merlín the duck at Mexico match,https://apnews.com/article/merlin-duck-mexico-world-cup-match-96ff5406779ee8b54a98e0b59681d818
Associated Press,12,"Movie Review: Supergirl is a blast, but the movie doesn't match her punk-rock spirit",https://apnews.com/article/supergirl-movie-review-332acfc623b84c1512a319f70fb5c6d5
Associated Press,13,Charlie Brown's longtime pen pal is finally revealed in new Apple TV 'Peanuts' movie,https://apnews.com/article/charlie-brown-pen-pal-snoopy-mia-d276f913825176666709378cd48237f7
Associated Press,14,Movie Review: Sex is on the menu in Olivia Wilde's dinner party comedy of manners 'The Invite',https://apnews.com/article/invite-olivia-wilde-movie-review-15fc7189f95b58125fb14b3a59de3a6c
Associated Press,15,What Trump's refusal to sign a bipartisan housing bill means for you,https://apnews.com/article/housing-costs-congress-affordable-trump-85db7cc9fead2730dda9cfa7706f8189
Associated Press,16,"Despite Trump's frustration, experts say it’s normal for gas prices to fall slower than oil",https://apnews.com/article/iran-war-gasoline-oil-high-prices-trump-8cc519eca4ef31243155a44c75c8d19c
Associated Press,17,Key inflation gauge jumps to 3-year high in latest sign of affordability challenges,https://apnews.com/article/inflation-federal-reserve-spending-d9348cc01b41c8de31051acf1b39268f
Associated Press,18,Astronomers find biggest super-puff planets yet that are lighter than cotton candy,https://apnews.com/article/super-puffs-cotton-candy-giant-light-planets-db1ebf1cb946e1c0bba67a5040bfc8a9
Associated Press,19,Get a load of this: Humans and great apes share similar giggles,https://apnews.com/article/great-ape-human-laughter-gorilla-bonobo-d3fc226a0e2aeeb36cb146c5064953bc
Associated Press,20,Astrónomos hallan planetas gigantes más ligeros que el algodón de azúcar,https://apnews.com/article/planetas-gigantes-esponjosos-ligeros-f02afef503fdd2314af6d964a891a624
