site,rank,title,link
Al Jazeera,1,Europol busts Europe-wide drug ring in ‘largest-ever’ operation,https://www.aljazeera.com/news/2026/1/21/europol-busts-europe-wide-drug-ring-in-largest-ever-op?traffic_source=rss
Al Jazeera,2,Trump live news: US president in Davos as Greenland threats spark outrage,https://www.aljazeera.com/news/liveblog/2026/1/21/trump-live-news-us-president-in-davos-as-greenland-threats-spark-outrage?traffic_source=rss
Al Jazeera,3,AI’s growing thirst for water is becoming a public health risk,https://www.aljazeera.com/opinions/2026/1/21/ais-growing-thirst-for-water-is-becoming-a-public-health-risk?traffic_source=rss
Al Jazeera,4,UN condemns Israel’s demolition of UNRWA HQ in occupied East Jerusalem,https://www.aljazeera.com/video/newsfeed/2026/1/21/un-condemns-israels-demolition-of-unrwa-hq-in-occupied-east-jerusalem?traffic_source=rss
Al Jazeera,5,Killer of Japan’s former PM Shinzo Abe sentenced to life in prison,https://www.aljazeera.com/video/newsfeed/2026/1/21/killer-of-japans-former-pm-shinzo-abe-sentenced-to-life-in-prison?traffic_source=rss
Al Jazeera,6,The US attack on Venezuela and the collapse of international law,https://www.aljazeera.com/opinions/2026/1/21/the-us-attack-on-venezuela-and-the-collapse-of-international-law?traffic_source=rss
Al Jazeera,7,"‘Barbaric new era’: Palestinians, UN slam Israeli demolition of UNRWA HQ",https://www.aljazeera.com/news/2026/1/21/barbaric-new-era-palestinians-un-slam-israeli-demolition-of-unrwa-hq?traffic_source=rss
Al Jazeera,8,US allies unite against Trump’s threats to take over Greenland at Davos,https://www.aljazeera.com/video/newsfeed/2026/1/21/us-allies-unite-against-trumps-threats-to-take-over-greenland-at-davos?traffic_source=rss
Al Jazeera,9,Syrian forces make gains against SDF: What it means for country’s Kurds,https://www.aljazeera.com/features/2026/1/21/syrian-forces-makes-gains-against-sdf-what-it-means-for-countrys-kurds?traffic_source=rss
Al Jazeera,10,Live: Israel launches strikes as Netanyahu joins Gaza ‘board of peace’,https://www.aljazeera.com/news/liveblog/2026/1/21/live-israel-launches-strikes-as-netanyahu-joins-gaza-board-of-peace?traffic_source=rss
Al Jazeera,11,Japan to restart world’s biggest nuclear plant after 15-year shutdown,https://www.aljazeera.com/news/2026/1/21/japan-to-restart-worlds-biggest-nuclear-plant-after-15-year-shutdown?traffic_source=rss
Al Jazeera,12,Syrian government and SDF agree on four-day ceasefire,https://www.aljazeera.com/video/newsfeed/2026/1/21/syrian-government-sdf-agree-on-four-day-ceasefire?traffic_source=rss
Al Jazeera,13,Luka Doncic records triple-double as Lakers rally past Nuggets,https://www.aljazeera.com/sports/2026/1/21/luka-doncic-records-triple-double-as-lakers-rally-past-nuggets?traffic_source=rss
Al Jazeera,14,Bangladesh-India T20 World Cup dispute unresolved as ICC deadline looms,https://www.aljazeera.com/sports/2026/1/21/bangladesh-india-t20-world-cup-dispute-unresolved-as-icc-deadline-looms?traffic_source=rss
Al Jazeera,15,"Alcaraz, Sabalenka cruise into Australian Open third round",https://www.aljazeera.com/sports/2026/1/21/alcaraz-sabalenka-gauff-cruise-into-australian-open-third-round?traffic_source=rss
Al Jazeera,16,"US, Iran exchange threats of broadscale war in latest sabre rattling",https://www.aljazeera.com/news/2026/1/21/us-iran-threaten-broadscale-wars-in-heated-exchange-of-threats?traffic_source=rss
Al Jazeera,17,"S Korea’s former PM found guilty of insurrection, given 23 years in prison",https://www.aljazeera.com/news/2026/1/21/s-koreas-former-pm-found-guilty-of-insurrection-given-23-years-in?traffic_source=rss
Al Jazeera,18,"US approves $2.3bn sale of torpedoes, air defences, aircraft to Singapore",https://www.aljazeera.com/news/2026/1/21/us-approves-2-3bn-sale-of-torpedoes-air-defences-aircraft-to-singapore?traffic_source=rss
Al Jazeera,19,Air Force One turned back as it carried Trump to Davos,https://www.aljazeera.com/news/2026/1/21/air-force-one-turned-back-as-it-carried-trump-to-davos?traffic_source=rss
Al Jazeera,20,Israel’s wanted war criminal Netanyahu joins Gaza ‘board of peace’,https://www.aljazeera.com/news/2026/1/21/israels-netanyahu-to-join-board-of?traffic_source=rss
Associated Press,1,Trump's Greenland threats spark outrage from EU and test longtime NATO alliance,https://apnews.com/article/denmark-greenland-trump-bessent-davos-ab05ebfaae6a413d1f8125cb9726a4c5
Associated Press,2,In their words: Trump’s threats over Greenland draw warnings and profanities at global forum,https://apnews.com/article/davos-greenland-trump-macron-newsom-wef-leyen-ee1791fd72153cef9bd428e2d37cc354
Associated Press,3,"Despite Greenland, France's Macron and NATO's head make nice with Trump behind the scenes",https://apnews.com/article/trump-macron-greenland-rutte-nato-82b855f0acd7d1a1d28cfa91acf66131
Associated Press,4,Forecasters warn of a 'potentially catastrophic' storm from Texas to the Carolinas,https://apnews.com/article/winter-weather-snow-ice-weekend-storm-ba67d30f05cbe14e9568907f09d2f13f
Associated Press,5,'West Wing' actor Timothy Busfield released from New Mexico jail pending trial,https://apnews.com/article/timothy-busfield-child-sex-abuse-charges-d35a83ab57dc0e7a37c25a92ffc63a11
Associated Press,6,Justice Department subpoenas Walz and others in immigration enforcement obstruction investigation,https://apnews.com/article/minnesota-immigration-crackdown-trump-5e2f40582b62687fd9bc70640382f034
Associated Press,7,Donald Trump thanks you for your attention to these matters in his second term,https://apnews.com/article/trump-one-year-anniversary-attention-ec07936f45c67821b9b55f244195a626
Associated Press,8,Trump's ICE force is sweeping America. Billions in his tax and spending cuts bill are paying for it,https://apnews.com/article/congress-immigration-ice-deportation-budget-be983b14f60a5cdfc17af7cf0307f1c9
Associated Press,9,Naomi Osaka makes grand entrance and big fashion statement at Australian Open,https://apnews.com/article/naomi-osaka-costume-tennis-australian-open-b3dbbb2afd43d062cafa5d2bbe8908e3
Associated Press,10,Alberto Mendoza announces transfer from Indiana to Georgia Tech following national title,https://apnews.com/article/mendoza-indiana-georgia-tech-transfer-portal-ce7f9089350c95e21f1be77429215c08
Associated Press,11,Sean McDermott disparages call that led to Bills' loss and his firing,https://apnews.com/article/nfl-playoffs-broncos-bills-mcmillian-cooks-16fcfaf69b34591294e16a0e1cb0c79f
Associated Press,12,Brooklyn Beckham accuses David and Victoria of putting branding before family and sabotaging wedding,https://apnews.com/article/brooklyn-beckham-david-victoria-feud-fb386d4ef5cde9fa55b97604482e8ff0
Associated Press,13,Music Review: Megadeth is going out on top with ferocious self-titled final album,https://apnews.com/article/megadeth-dave-mustaine-music-review-eefefa8a64f89d6ad6c8f1123642c559
Associated Press,14,"Channing Tatum to bring his dancing, ab-heavy 'Magic Mike Live' to New York City",https://apnews.com/article/magic-mike-live-new-york-97b6e93ce195e1fd7bee384196947f25
Associated Press,15,The new ‘Be The People’ campaign wants to unite hundreds of millions of Americans to solve problems,https://apnews.com/article/be-people-250th-anniversary-27b16603cfe7fd0caa5d22f539cea3da
Associated Press,16,Netflix intensifies bid for Warner Bros making its $72 billion offer all cash,https://apnews.com/article/warner-bros-discovery-netflix-paramount-skydance-c6ec8766efc851fd2859b666bce5e14d
Associated Press,17,US futures climb and gold hits another record as markets steady ahead of Trump's speech at Davos,https://apnews.com/article/stocks-markets-trump-bonds-gold-82e0341ef60b2719d79e1631e006bfed
Associated Press,18,NASA astronaut who was stuck at the space station for months retires within a year of returning,https://apnews.com/article/stuck-astronaut-nasa-suni-williams-59b361c3a823ac0dbbf6c63eb403776e
Associated Press,19,FACT FOCUS: Trump highlights familiar false claims as he reviews his first year back in office,https://apnews.com/article/fact-check-trump-rigged-election-eight-wars-inflation-220f515728383d5205c3748259b2cc0f
Associated Press,20,Monkeys are on the loose in St. Louis and AI is complicating efforts to capture them,https://apnews.com/article/monkeys-st-louis-96c55834c7f17854cc4362db891ca8fa
