site,rank,title,link
Al Jazeera,1,"Russia-Ukraine war: List of key events, day 1,244",https://www.aljazeera.com/news/2025/7/22/russia-ukraine-war-list-of-key-events-day-1244?traffic_source=rss
Al Jazeera,2,US police officer in Breonna Taylor death sentenced to 33 months in prison,https://www.aljazeera.com/news/2025/7/21/us-police-officer-in-breonna-taylor-death-sentenced-to-33-months-in-prison?traffic_source=rss
Al Jazeera,3,US to deport Haitian legal permanent residents with alleged gang ties,https://www.aljazeera.com/news/2025/7/21/us-to-deport-haitian-legal-permanent-residents-with-alleged-gang-ties?traffic_source=rss
Al Jazeera,4,Israel says it has attacked Houthi targets in Yemen’s Hodeidah port,https://www.aljazeera.com/news/2025/7/21/israel-says-it-has-attacked-houthi-targets-in-yemens-hodeidah-port?traffic_source=rss
Al Jazeera,5,What are the implications of the UK ban on Palestine Action?,https://www.aljazeera.com/video/inside-story/2025/7/21/what-are-the-implications-of-the-uk-ban-on-palestine-action?traffic_source=rss
Al Jazeera,6,Trump administration declassifies Martin Luther King Jr assassination files,https://www.aljazeera.com/news/2025/7/21/trump-administration-declassifies-martin-luther-king-jr-assassination-files?traffic_source=rss
Al Jazeera,7,IMF says Gita Gopinath leaving at end of August to return to Harvard,https://www.aljazeera.com/economy/2025/7/21/imf-says-gita-gopinath-leaving-at-end-of-august-to-return-to-harvard?traffic_source=rss
Al Jazeera,8,Will Zohran Mamdani help or hurt New York’s economy?,https://www.aljazeera.com/economy/2025/7/21/will-zohran-mamdani-help-or-hurt-new-yorks-economy?traffic_source=rss
Al Jazeera,9,"UK, France and 23 other nations demand Israel’s war on Gaza ‘must end now’",https://www.aljazeera.com/news/2025/7/21/uk-france-and-other-countries-demand-israels-war-on-gaza-must-end-now?traffic_source=rss
Al Jazeera,10,"As Trump’s tariff deadline looms, economists see calm before the storm",https://www.aljazeera.com/economy/2025/7/21/as-trumps-tariff-deadline-looms-economists-see-calm-before-the-storm?traffic_source=rss
Al Jazeera,11,"Microsoft cyberattack hits 100 organisations, security firms say",https://www.aljazeera.com/economy/2025/7/21/microsoft-cyberattack-hits-100-organisations-security-firms-say?traffic_source=rss
Al Jazeera,12,Moment Israeli strike hits Gaza building housing displaced,https://www.aljazeera.com/video/newsfeed/2025/7/21/moment-israeli-strike-hits-gaza-building-housing-displaced?traffic_source=rss
Al Jazeera,13,Vietnam on high alert ahead of Typhoon Wipha,https://www.aljazeera.com/video/newsfeed/2025/7/21/vietnam-on-high-alert-ahead-of-typhoon-wipha?traffic_source=rss
Al Jazeera,14,Gaza health official detained by Israeli undercover force,https://www.aljazeera.com/video/newsfeed/2025/7/21/gaza-health-official-detained-by-israeli-undercover-force?traffic_source=rss
Al Jazeera,15,Italy cancels concert by Putin ally Gergiev,https://www.aljazeera.com/news/2025/7/21/italy-cancels-concert-by-putin-ally-gergiev?traffic_source=rss
Al Jazeera,16,Western foreign ministers denounce Israeli attacks on Gaza aid seekers,https://www.aljazeera.com/video/newsfeed/2025/7/21/western-foreign-ministers-denounce-israeli-attacks-on-gaza-aid-seekers?traffic_source=rss
Al Jazeera,17,Lawyers ask that Kilmar Abrego Garcia stay in jail to avoid US deportation,https://www.aljazeera.com/news/2025/7/21/lawyers-ask-that-kilmar-abrego-garcia-stay-in-jail-to-avoid-us-deportation?traffic_source=rss
Al Jazeera,18,Hearing begins in Harvard’s case against the Trump administration,https://www.aljazeera.com/news/2025/7/21/hearing-begins-in-harvards-case-against-the-trump-administration?traffic_source=rss
Al Jazeera,19,"In Gaza, death seems easier than amputation",https://www.aljazeera.com/opinions/2025/7/21/in-gaza-death-seems-easier-than-amputation?traffic_source=rss
Al Jazeera,20,Russia launches major aerial attacks on Kyiv,https://www.aljazeera.com/video/newsfeed/2025/7/21/russia-launches-major-aerial-attacks-on-kyiv?traffic_source=rss
