site,rank,title,link
Al Jazeera,1,Death toll rises after Pakistan hit by flash floods and heavy rains,https://www.aljazeera.com/news/2025/6/28/death-toll-rises-after-pakistan-hit-by-flash-floods-and-heavy-rains?traffic_source=rss
Al Jazeera,2,Southern Europe roasts as first heatwave of the summer scorches continent,https://www.aljazeera.com/news/2025/6/28/southern-europe-roasts-as-first-heatwave-of-the-summer-scorches-continent?traffic_source=rss
Al Jazeera,3,What is Canada’s digital tax and why is Trump killing trade talks over it?,https://www.aljazeera.com/economy/2025/6/28/what-is-canadas-digital-tax-and-why-is-trump-killing-trade-talks-over-it?traffic_source=rss
Al Jazeera,4,"What is Thimerosal, vaccine preservative called ‘toxic’ by US health chief?",https://www.aljazeera.com/news/2025/6/28/what-is-thimerosal-vaccine-preservative-called-toxic-by-us-health-chief?traffic_source=rss
Al Jazeera,5,At least 13 soldiers killed in suicide bombing in northwestern Pakistan,https://www.aljazeera.com/news/2025/6/28/at-least-13-soldiers-killed-in-suicide-bombing-in-northwestern-pakistan?traffic_source=rss
Al Jazeera,6,Sanctions must force Israel to end the “death traps” tactic,https://www.aljazeera.com/video/quotable/2025/6/28/sanctions-must-force-israel-to-end-the-death-traps-tactic?traffic_source=rss
Al Jazeera,7,Trump battles for credit for his Iran intervention,https://www.aljazeera.com/video/the-listening-post/2025/6/28/trump-battles-for-credit-for-his-iran-intervention?traffic_source=rss
Al Jazeera,8,Record attendance expected at Budapest Pride march despite Orban warning,https://www.aljazeera.com/news/2025/6/28/record-attendance-expected-at-budapest-pride-march-despite-orban-warning?traffic_source=rss
Al Jazeera,9,Spain’s Bonmati hospitalised with meningitis ahead of Euro 2025,https://www.aljazeera.com/sports/2025/6/28/spains-bonmati-hospitalized-with-meningitis-ahead-of-euro-2025?traffic_source=rss
Al Jazeera,10,Nowhere to run: The Afghan refugees caught in Israel’s war on Iran,https://www.aljazeera.com/features/2025/6/28/nowhere-to-run-the-afghan-refugees-caught-in-israels-war-on-iran?traffic_source=rss
Al Jazeera,11,Thailand protesters demand PM’s resignation over leaked call with Hun Sen,https://www.aljazeera.com/news/2025/6/28/thailand-protesters-demand-pms-resignation-over-leaked-call-with-hun-sen?traffic_source=rss
Al Jazeera,12,"Wimbledon 2025: Schedule, seeds, prize money and how to watch",https://www.aljazeera.com/sports/2025/6/28/wimbledon-2025-schedule-seeds-prize-money-and-how-to-watch?traffic_source=rss
Al Jazeera,13,"Iran holds state funeral for top commanders, scientists killed by Israel",https://www.aljazeera.com/news/2025/6/28/thousands-mourn-top-iranian-army-commanders-scientists-killed-by-israel?traffic_source=rss
Al Jazeera,14,‘Like a wastepaper basket’: Life as a child refugee fleeing home,https://www.aljazeera.com/features/longform/2025/6/28/like-a-wastepaper-basket-life-as-a-child-refugee-fleeing-home?traffic_source=rss
Al Jazeera,15,India’s lion numbers soar: Why are some conservationists worried?,https://www.aljazeera.com/news/2025/6/28/indias-lion-numbers-soar-why-are-some-conservationists-worried?traffic_source=rss
Al Jazeera,16,US funeral home owner who stashed 191 bodies sentenced to 20 years,https://www.aljazeera.com/news/2025/6/28/us-funeral-home-owner-who-stashed-over-190-bodies-sentenced-to-20-years?traffic_source=rss
Al Jazeera,17,The ruin left behind by 12 days of the Israel-Iran war,https://www.aljazeera.com/video/by-the-numbers-3/2025/6/28/the-ruin-left-behind-by-12-days-of-the-israel-iran-war?traffic_source=rss
Al Jazeera,18,"Trump says Gaza ceasefire possible ‘within the next week’, gives no details",https://www.aljazeera.com/news/2025/6/28/trump-says-gaza-ceasefire-possible-within-the-next-week-gives-no-details?traffic_source=rss
Al Jazeera,19,Teen labourers among 19 killed in horrific road collision in Egypt,https://www.aljazeera.com/news/2025/6/28/teen-labourers-among-19-killed-in-horrific-road-collision-in-egypt?traffic_source=rss
Al Jazeera,20,"Russia-Ukraine war: List of key events, day 1,220",https://www.aljazeera.com/news/2025/6/28/russia-ukraine-war-list-of-key-events-day-1220?traffic_source=rss
