site,rank,title,link
Al Jazeera,1,Gul Plaza fire: How a deadly inferno exposed Karachi’s safety failures,https://www.aljazeera.com/news/2026/1/20/gul-plaza-fire-how-a-deadly-inferno-exposed-karachis-safety-failures?traffic_source=rss
Al Jazeera,2,Key moments from Trump’s first year back as US president,https://www.aljazeera.com/video/newsfeed/2026/1/20/key-moments-from-trumps-first-year-back-as-us-president?traffic_source=rss
Al Jazeera,3,"Sharp rise in malnutrition cases, preventable diseases in Somalia: MSF",https://www.aljazeera.com/news/2026/1/20/sharp-rise-in-malnutrition-cases-preventable-diseases-in-somalia-msf?traffic_source=rss
Al Jazeera,4,Uganda’s Bobi Wine: ‘We have evidence’ of election fraud in Museveni win,https://www.aljazeera.com/news/2026/1/20/ugandas-bobi-wine-we-have-evidence-of-election-fraud-in-museveni-win?traffic_source=rss
Al Jazeera,5,"Sanctions request against Netanyahu filed by UK lawyers, rights group",https://www.aljazeera.com/news/2026/1/20/sanctions-request-against-netanyahu-filed-by-uk-lawyers-rights-group?traffic_source=rss
Al Jazeera,6,Israel bulldozes UNRWA buildings in occupied East Jerusalem,https://www.aljazeera.com/video/newsfeed/2026/1/20/israel-bulldozes-unrwa-buildings-in-occupied-east-jerusalem-2?traffic_source=rss
Al Jazeera,7,How the Syrian army pushed Kurdish-led forces out of oil-rich territory,https://www.aljazeera.com/video/newsfeed/2026/1/20/how-the-syrian-army-pushed-kurdish-led-forces-out-of-oil-rich-territory?traffic_source=rss
Al Jazeera,8,Bobi Wine tells Al Jazeera he escaped police raid amid Uganda elections,https://www.aljazeera.com/video/newsfeed/2026/1/20/bobi-wine-tells-al-jazeera-he-escaped-police-raid-amid-uganda-elections?traffic_source=rss
Al Jazeera,9,Who hacked Iranian state TV?,https://www.aljazeera.com/video/newsfeed/2026/1/20/who-hacked-iranian-state-tv?traffic_source=rss
Al Jazeera,10,Have global justice institutions failed?,https://www.aljazeera.com/video/doha-debates/2026/1/20/have-global-justice-institutions-failed?traffic_source=rss
Al Jazeera,11,Trump’s Greenland tariffs: What’s Europe’s ‘bazooka’ option to hit back?,https://www.aljazeera.com/economy/2026/1/20/trumps-greenland-tariffs-whats-europes-bazooka-option-to-hit-back?traffic_source=rss
Al Jazeera,12,"Naomi Osaka’s outfit, entrance and win headline Australian Open day three",https://www.aljazeera.com/sports/2026/1/20/naomi-osakas-outfit-entrance-and-win-headline-australian-open-day-three?traffic_source=rss
Al Jazeera,13,ISIL claims Kabul attack on Chinese restaurant that killed seven people,https://www.aljazeera.com/news/2026/1/20/isil-claims-kabul-attack-on-chinese-restaurant-that-killed-7-people?traffic_source=rss
Al Jazeera,14,How a year of Trump reshaped the world in seven charts,https://www.aljazeera.com/news/2026/1/20/how-a-year-of-trump-reshaped-the-world-in-seven-charts?traffic_source=rss
Al Jazeera,15,"Israeli prisons are akin to ‘torture camps’, Israeli rights group finds",https://www.aljazeera.com/news/2026/1/20/israeli-prisons-are-akin-to-torture-camps-israeli-rights-group-finds?traffic_source=rss
Al Jazeera,16,Video: More than 100 vehicles involved in pile-up during US snowstorm,https://www.aljazeera.com/video/newsfeed/2026/1/20/video-more-than-100-vehicles-involved-in-pile-up-during-us-snowstorm?traffic_source=rss
Al Jazeera,17,Trump undermines key allies UK and France before Davos visit,https://www.aljazeera.com/news/2026/1/20/trump-undermines-key-allies-uk-and-france-ahead-of-davos-visit?traffic_source=rss
Al Jazeera,18,Trump’s first year back live: US president ramps up pressure on allies,https://www.aljazeera.com/news/liveblog/2026/1/20/trump-first-year-back-live-us-president-ramps-up-pressure-on-allies?traffic_source=rss
Al Jazeera,19,"Syria’s war-ravaged oil sector faces tough road to recovery, analysts say",https://www.aljazeera.com/economy/2026/1/20/syrias-war-ravaged-oil-sector-faces-tough-road-to-recovery-analysts-say?traffic_source=rss
Al Jazeera,20,How a year of Trump has reshaped the US and the world,https://www.aljazeera.com/video/by-the-numbers-3/2026/1/20/how-a-year-of-trump-has-reshaped-the-us-and-the-world?traffic_source=rss
Associated Press,1,Sheinbaum reassures Mexico after US military movements spark concern,https://apnews.com/article/mexico-us-sheinbaum-trump-military-a8e3382b52e181489f75097aba7cbd36
Associated Press,2,"As faith in the US fades a year into Trump 2.0, Europe tries to end a reliance on American security",https://apnews.com/article/trump-europe-nato-greenland-security-8d31b28bb7076f534fba25b80aa3a59f
Associated Press,3,Top EU official questions Trump’s trustworthiness over Greenland tariff threat,https://apnews.com/article/denmark-greenland-trump-bessent-davos-ab05ebfaae6a413d1f8125cb9726a4c5
Associated Press,4,US citizen says ICE removed him from his Minnesota home in his underwear after warrantless search,https://apnews.com/article/minnesota-immigration-us-citizen-detained-hmong-d009590a491c0c8243ef21ef24db7182
Associated Press,5,100 vehicles pile up in Michigan crash as snowstorm moves across the country,https://apnews.com/article/winter-weather-snow-pileup-michigan-cfb7f2d1ad0355b917c1eb972e5c90c6
Associated Press,6,ICE says an immigrant who died in a sprawling Texas detention facility killed himself,https://apnews.com/article/ice-detention-immigrant-death-texas-416a2374d9c1547f0360344424101fa9
Associated Press,7,Judge refuses to block new DHS policy limiting Congress members' access to ICE facilities,https://apnews.com/article/minneapolis-shooting-congress-visit-ice-5eb6749b18d59ed8c47b5eeab9784432
Associated Press,8,"Surrounded by billionaires in Davos, Trump plans to lay out how he'll make housing more affordable",https://apnews.com/article/trump-anniversary-davos-billionaires-housing-90f2e691725539c8d5cba6131baccb3f
Associated Press,9,Donald Trump thanks you for your attention to these matters in his second term,https://apnews.com/article/trump-one-year-anniversary-attention-ec07936f45c67821b9b55f244195a626
Associated Press,10,Bills fire coach Sean McDermott after 9 seasons of falling short of reaching the Super Bowl,https://apnews.com/article/bills-mcdermott-fired-17cfca2546dfd971c40d4a2da0b96484
Associated Press,11,"Indiana completes undefeated season and wins first national title, beating Miami 27-21 in CFP final",https://apnews.com/article/miami-indiana-college-football-final-8b4fb15e43e10c890e16b57551b48523
Associated Press,12,"The Sundance Film Festival prepares to bid farewell to Park City, and Robert Redford",https://apnews.com/article/sundance-film-festival-2026-preview-81c2a03be019d185418832a49089799b
Associated Press,13,Giorgio Armani launches new era with iridescent colors and a star-studded front row,https://apnews.com/article/fashion-giorgio-armani-succession-milan-dellorco-menswear-f52d2549b52f129dc142651a34ebaa56
Associated Press,14,AP Source: Fed Chair Powell to attend Supreme Court argument on Cook case,https://apnews.com/article/federal-reserve-jerome-powell-lisa-cook-supreme-court-7f135bd222013d4fe61eb8f03c663676
Associated Press,15,Wall Street slumps after Trump threatens 8 NATO members with punishing tariffs over Greenland,https://apnews.com/article/stock-markets-trump-greenland-inflation-58a6fed13a1e04afd57f0a22a2c9cfb0
Associated Press,16,NYSE working on a new platform for trading digital tokens around the clock,https://apnews.com/article/nyse-tokenization-trading-platform-588b84ea6d3b4745da42d58bb80bd718
Associated Press,17,Monkeys are on the loose in St. Louis and AI is complicating efforts to capture them,https://apnews.com/article/monkeys-st-louis-96c55834c7f17854cc4362db891ca8fa
Associated Press,18,Viral '6-7' tops 2025 list of overused words and phrases,https://apnews.com/article/2025-words-slang-phrases-list-university-67-59f896e28b7b16edfdfcc453a8af388a
Associated Press,19,California homeowner rolls out 'unwelcome' mat for black bear living under his house,https://apnews.com/article/black-bear-california-evicted-crawl-space-8126aa9962e99bf1ae4e45e09659630f
Associated Press,20,Raccoon goes on drunken rampage in Virginia liquor store and passes out on bathroom floor,https://apnews.com/article/drunk-raccoon-liquor-store-bandit-virginia-5109feb2ea9ab9bf8954ec3798689fd0
