site,rank,title,link
Al Jazeera,1,G7 threatens further sanctions if Russia fails to agree Ukraine ceasefire,https://www.aljazeera.com/news/2025/5/23/g7-threatens-further-sanctions-if-russia-fails-to-agree-ukraine-ceasefire?traffic_source=rss
Al Jazeera,2,‘Red lines’ stalk fifth round of Iran-US nuclear talks,https://www.aljazeera.com/news/2025/5/23/red-lines-stalk-fifth-round-of-iran-us-nuclear-talks?traffic_source=rss
Al Jazeera,3,Trump administration blocks Harvard from enrolling international students,https://www.aljazeera.com/video/newsfeed/2025/5/23/trump-administration-blocks-harvard-from-enrolling-international-students?traffic_source=rss
Al Jazeera,4,Japan faces a ‘rice crisis’ as price nearly doubles for food staple,https://www.aljazeera.com/news/2025/5/23/japan-faces-a-rice-crisis-as-price-nearly-doubles-for-food-staple?traffic_source=rss
Al Jazeera,5,Record floods kill four and devastate eastern Australia,https://www.aljazeera.com/news/2025/5/23/record-floods-kill-four-and-devastate-eastern-australia?traffic_source=rss
Al Jazeera,6,"EU membership, seizing Russia’s money needed to rebuild Ukraine: Analysts",https://www.aljazeera.com/news/2025/5/23/eu-membership-seizing-russias-money-needed-to-rebuild-ukraine-analysts?traffic_source=rss
Al Jazeera,7,US sanctions Sudan after ruling chemical weapons used during civil war,https://www.aljazeera.com/news/2025/5/23/us-sanctions-sudan-after-ruling-chemical-weapons-used-during-civil-war?traffic_source=rss
Al Jazeera,8,Thunder-Wolves 118-103: MVP SGA sets up 2-0 NBA West final lead,https://www.aljazeera.com/sports/2025/5/23/thunder-wolves-118-103-mvp-sga-sets-up-2-0-nba-west-final-lead?traffic_source=rss
Al Jazeera,9,"Guess who India, Pakistan and Iran are all wooing? The Taliban",https://www.aljazeera.com/news/2025/5/23/guess-who-india-pakistan-and-iran-are-all-wooing-the-taliban?traffic_source=rss
Al Jazeera,10,"Russia-Ukraine war: List of key events, day 1,184",https://www.aljazeera.com/news/2025/5/23/russia-ukraine-war-list-of-key-events-day-1184?traffic_source=rss
Al Jazeera,11,Florida court orders ex-Mexican security chief to pay millions to Mexico,https://www.aljazeera.com/news/2025/5/23/florida-court-orders-ex-mexican-security-chief-to-pay-millions-to-mexico?traffic_source=rss
Al Jazeera,12,Will Donald Trump’s Golden Dome protect America?,https://www.aljazeera.com/program/inside-story/2025/5/22/will-donald-trumps-golden-dome-protect-america?traffic_source=rss
Al Jazeera,13,Suspect charged with murder in shooting of two Israeli embassy workers,https://www.aljazeera.com/news/2025/5/22/suspect-charged-with-murder-in-shooting-of-two-israeli-embassy-workers?traffic_source=rss
Al Jazeera,14,Timeline: Trump’s escalating standoff with Harvard University,https://www.aljazeera.com/news/2025/5/22/timeline-trumps-escalating-standoff-with-harvard-university?traffic_source=rss
Al Jazeera,15,"G7 vows to address global economic ‘imbalances’, considers Russia sanctions",https://www.aljazeera.com/economy/2025/5/22/g7-vows-to-address-global-economic-imbalances-considers-russia-sanctions?traffic_source=rss
Al Jazeera,16,Syrian business owners welcome EU’s lifting of sanctions,https://www.aljazeera.com/news/2025/5/22/syrian-business-owners-welcome-eus-lifting-of-sanctions?traffic_source=rss
Al Jazeera,17,Israeli speculation mounts over potential rift between Trump and Netanyahu,https://www.aljazeera.com/news/2025/5/22/israeli-speculation-mounts-over-potential-rift-between-trump-and-netanyahu?traffic_source=rss
Al Jazeera,18,Vigil held for slain Israeli embassy staffers,https://www.aljazeera.com/program/newsfeed/2025/5/22/vigil-held-for-slain-israeli-embassy-staffers?traffic_source=rss
Al Jazeera,19,Lebanese PM condemns wave of Israeli attacks on southern Lebanon,https://www.aljazeera.com/news/2025/5/22/lebanese-pm-condemns-wave-of-israeli-attacks-on-southern-lebanon?traffic_source=rss
Al Jazeera,20,Damaged homes after small plane crashes into US neighbourhood,https://www.aljazeera.com/program/newsfeed/2025/5/22/damaged-homes-after-small-plane-crashes-into-us-neighbourhood?traffic_source=rss
