site,rank,title,link
Al Jazeera,1,Ben & Jerry’s cofounder arrested at US Senate after protesting war in Gaza,https://www.aljazeera.com/news/2025/5/15/ben-jerrys-cofounder-arrested-at-us-senate-after-protesting-war-in-gaza?traffic_source=rss
Al Jazeera,2,Incumbent Luis Arce quits Bolivia’s presidential race amid slumping support,https://www.aljazeera.com/news/2025/5/15/president-luis-arce-quits-bolivias-presidential-race-amid-slumping-support?traffic_source=rss
Al Jazeera,3,"In Taiwan, AI boom prompts doubts about ditching nuclear power",https://www.aljazeera.com/economy/2025/5/15/in-taiwan-ai-boom-prompts-doubts-about-ditching-nuclear-power?traffic_source=rss
Al Jazeera,4,How will the lifting of US sanctions help Syrians rebuild their country?,https://www.aljazeera.com/program/inside-story/2025/5/14/how-will-the-lifting-of-us-sanctions-help-syrians-rebuild-their-country?traffic_source=rss
Al Jazeera,5,Qatar says recent Israeli Gaza attacks show lack of interest in ceasefire,https://www.aljazeera.com/news/2025/5/14/qatar-says-recent-israeli-gaza-attacks-show-lack-of-interest-in-ceasefire?traffic_source=rss
Al Jazeera,6,Real Madrid keep Barcelona waiting for La Liga by beating Mallorca,https://www.aljazeera.com/sports/2025/5/14/real-madrid-keep-barcelona-waiting-for-la-liga-by-beating-mallorca?traffic_source=rss
Al Jazeera,7,Pezeshkian says Iran will ‘not bow’ to bullying from Trump,https://www.aljazeera.com/news/2025/5/14/pezeshkian-says-iran-will-not-bow-to-bullying-from-trump?traffic_source=rss
Al Jazeera,8,Trump arrives at Lusail Palace for Qatari state dinner,https://www.aljazeera.com/video/newsfeed/2025/5/14/trump-arrives-at-lusail-palace-for-qatari-state-dinner?traffic_source=rss
Al Jazeera,9,Israeli army fire hits UN south Lebanon base for first time since ceasefire,https://www.aljazeera.com/news/2025/5/14/israeli-army-fire-hits-un-south-lebanon-base-for-first-time-since-ceasefire?traffic_source=rss
Al Jazeera,10,Singer Cassie describes abusive relationship with Diddy in court testimony,https://www.aljazeera.com/news/2025/5/14/singer-cassie-describes-abusive-relationship-with-diddy-in-court-testimony?traffic_source=rss
Al Jazeera,11,Donald Trump’s Israel snub marks end of an era | #AJOPINION,https://www.aljazeera.com/program/newsfeed/2025/5/14/donald-trumps-israel-snub-marks-end-of-an-era-ajopinion?traffic_source=rss
Al Jazeera,12,How could Pope Leo XIV reshape the Catholic Church?,https://www.aljazeera.com/program/the-take-2/2025/5/14/aje-onl-glb_newpope_av_v3-140525?traffic_source=rss
Al Jazeera,13,Delivery driver pleads guilty to stealing $2.5m from DoorDash,https://www.aljazeera.com/economy/2025/5/14/delivery-driver-pleads-guilty-to-stealing-2-5m-from-doordash?traffic_source=rss
Al Jazeera,14,"Peace talks, Boeing jets headline Trump state visit to Qatar",https://www.aljazeera.com/video/newsfeed/2025/5/14/peace-talks-boeing-jets-headline-trump-state-visit-to-qatar?traffic_source=rss
Al Jazeera,15,Toddler separated from mother deported from the US returned to Venezuela,https://www.aljazeera.com/news/2025/5/14/toddler-separated-from-mother-deported-from-the-us-returned-to-venezuela?traffic_source=rss
Al Jazeera,16,Qatar Airways inks 96B Boeing jet deal during Trump visit,https://www.aljazeera.com/news/2025/5/14/qatar-airways-inks-96b-boeing-jet-deal-during-trump-visit?traffic_source=rss
Al Jazeera,17,What does the PKK’s disarming mean for its regional allies?,https://www.aljazeera.com/features/2025/5/14/what-does-the-pkks-disarming-mean-for-its-regional-allies?traffic_source=rss
Al Jazeera,18,US judge orders release of Badar Khan Suri from immigration custody,https://www.aljazeera.com/news/2025/5/14/us-judge-orders-release-of-badar-khan-suri-from-immigration-custody?traffic_source=rss
Al Jazeera,19,Video shows moment Israeli missile hits Gaza hospital,https://www.aljazeera.com/program/newsfeed/2025/5/14/video-shows-moment-israeli-missile-hits-gaza-hospital?traffic_source=rss
Al Jazeera,20,Trump-al-Sharaa meeting illustrates Gulf geopolitical shift,https://www.aljazeera.com/video/newsfeed/2025/5/14/trump-al-sharaa-meeting-illustrates-gulf-geopolitical-shift?traffic_source=rss
