site,rank,title,link
Al Jazeera,1,Brazil wins first gold medal for South America at Winter Olympics,https://www.aljazeera.com/video/newsfeed/2026/2/15/brazil-wins-first-gold-medal-for-south-america-at-winter-olympics?traffic_source=rss
Al Jazeera,2,Nigeria’s Argungu fishing contest returns after years of pause,https://www.aljazeera.com/gallery/2026/2/15/nigerias-argungu-fishing-contest-marks-return-after-years-of-pause?traffic_source=rss
Al Jazeera,3,The Palestinian cause cannot speak only to the left,https://www.aljazeera.com/opinions/2026/2/15/the-palestinian-cause-cannot-speak-only-to-the-left?traffic_source=rss
Al Jazeera,4,LIVE: India vs Pakistan – T20 World Cup,https://www.aljazeera.com/sports/liveblog/2026/2/15/live-india-vs-pakistan-t20-world-cup?traffic_source=rss
Al Jazeera,5,"What is the ‘dart frog’ toxin, said to be linked to Alexey Navalny’s death?",https://www.aljazeera.com/news/2026/2/15/what-is-the-dart-frog-toxin-said-to-be-linked-to-alexey-navalnys-death?traffic_source=rss
Al Jazeera,6,"US says over 5,700 suspected ISIL detainees relocated from Syria to Iraq",https://www.aljazeera.com/news/2026/2/15/us-says-over-5700-suspected-isil-detainees-relocated-from-syria-to-iraq?traffic_source=rss
Al Jazeera,7,‘Clown show’: Obama reacts to Trump sharing racist monkey video,https://www.aljazeera.com/news/2026/2/15/clown-show-obama-reacts-to-trump-sharing-racist-monkey-video?traffic_source=rss
Al Jazeera,8,"Zelenskyy says US ‘too often’ pushes Ukraine, not Russia, for concessions",https://www.aljazeera.com/news/2026/2/15/zelenskyy-says-us-too-often-pushes-ukraine-not-russia-for-concessions?traffic_source=rss
Al Jazeera,9,LIVE: Israel kills 10 Palestinians in Gaza in 24 hours,https://www.aljazeera.com/news/liveblog/2026/2/15/live-israel-kills-at-least-nine-palestinians-in-gaza-since-dawn?traffic_source=rss
Al Jazeera,10,Cyclone Gezani kills four in Mozambique as Madagascar assesses damage,https://www.aljazeera.com/news/2026/2/15/cyclone-gezani-kills-four-in-mozambique-as-madagascar-assesses-damage?traffic_source=rss
Al Jazeera,11,"Israeli forces kill nine Palestinians in Gaza, attack southern Lebanon",https://www.aljazeera.com/news/2026/2/15/israeli-forces-kill-eight-palestinians-in-attacks-across-gaza?traffic_source=rss
Al Jazeera,12,"Gunmen kill at least 32 people in northern Nigeria, residents say",https://www.aljazeera.com/news/2026/2/15/gunmen-kill-at-least-32-people-in-northern-nigeria-residents-say?traffic_source=rss
Al Jazeera,13,"Russia-Ukraine war: List of key events, day 1,452",https://www.aljazeera.com/news/2026/2/15/russia-ukraine-war-list-of-key-events-day-1452?traffic_source=rss
Al Jazeera,14,US army launches retaliatory strikes on dozens of ISIL targets in Syria,https://www.aljazeera.com/news/2026/2/14/us-army-launches-retaliatory-strikes-on-dozens-of-isil-targets-in-syria?traffic_source=rss
Al Jazeera,15,Real Madrid thrash Real Sociedad 4-1 to move top of La Liga,https://www.aljazeera.com/sports/2026/2/14/real-madrid-thrash-real-sociedad-4-1-to-move-top-of-la-liga?traffic_source=rss
Al Jazeera,16,Onsite gunmen force MSF to stop work at Gaza’s Nasser Hospital,https://www.aljazeera.com/news/2026/2/14/gunmen-onsite-force-msf-to-stop-work-at-gazas-nasser-hospital?traffic_source=rss
Al Jazeera,17,Over 100 artists for Palestine back UN’s Albanese after resignation calls,https://www.aljazeera.com/news/2026/2/14/over-100-artists-for-palestine-back-uns-albanese-after-resignation-calls?traffic_source=rss
Al Jazeera,18,Hungary’s Orban says EU bigger threat than Russia before April elections,https://www.aljazeera.com/news/2026/2/14/hungarys-orban-says-eu-bigger-threat-than-russia-ahead-of-april-election?traffic_source=rss
Al Jazeera,19,Helicopter triggers avalanche amid maximum alert across French Alps,https://www.aljazeera.com/video/newsfeed/2026/2/14/helicopter-triggers-avalanche-amid-maximum-alert-across-french-alps?traffic_source=rss
Al Jazeera,20,Palestinian protester Leqaa Kordia calls ICE custody ‘dehumanising’,https://www.aljazeera.com/video/newsfeed/2026/2/14/palestinian-protester-leqaa-kordia-calls-ice-custody?traffic_source=rss
Associated Press,1,Rubio's speech to European allies takes a softer tone but sticks to Trump's firm stance,https://apnews.com/article/munich-security-conference-rubio-4a26cfa8ebb54643be98405e896433d1
Associated Press,2,"Russia poisoned Alexei Navalny with dart frog toxin, European nations say",https://apnews.com/article/russia-navalny-poisoned-europe-4d92cd67f29d37b74b0d4842ea686b03
Associated Press,3,Protests draw more than half a million worldwide as Iran’s exiled crown prince urges more pressure,https://apnews.com/article/iran-munich-protests-reza-pahlavi-53d2448dd26d28a1206ecefdfde168f2
Associated Press,4,Hundreds of agents search for Nancy Guthrie as her case spotlights other families left behind,https://apnews.com/article/nancy-guthrie-abductions-families-left-behind-be6b94e750dbedfa902ef7b8d87c2c90
Associated Press,5,TSA agents are working without pay at US airports due to another shutdown,https://apnews.com/article/dhs-shutdown-tsa-travel-airports-delays-ff8b225c6ff8d57172fd301a550057b3
Associated Press,6,"Mandatory driver impairment sensors clear a funding hurdle, but are they ready?",https://apnews.com/article/federal-law-impairment-detection-car-dui-062d40e885a0e32c6cad0ba70163aef8
Associated Press,7,US military reports a series of airstrikes against Islamic State targets in Syria,https://apnews.com/article/syria-islamic-state-group-us-airstrikes-retaliation-463c9b7a1ddfd32e85bd1131ff593ee8
Associated Press,8,"In battleground Michigan, 3 Democrats test vision of affordability in the Senate primary",https://apnews.com/article/michigan-senate-democratic-primary-affordability-campaign-test-b92fc9d903a5ccbf35ec9227015804bc
Associated Press,9,More conflict in curling as Canadian women are accused of the same violation as men,https://apnews.com/article/curling-winter-olympics-milan-cortina-75752a3048e2058fce6fee22ab076ad8
Associated Press,10,Double trouble as Canadian curlers accused of illegal touches at Winter Olympics,https://apnews.com/article/winter-olympics-curling-cheating-canada-sweden-735816f27d50143512d30af021c469fb
Associated Press,11,Eileen Gu says she's disappointed she can't get help with her packed Olympic schedule,https://apnews.com/article/eileen-gu-freestyle-big-air-winter-olympics-40a12b3ec0b41c36bf009645bb766601
Associated Press,12,Soaring coffee prices rewrite some Americans' daily routines,https://apnews.com/article/coffee-inflation-prices-starbucks-1a809b2d3e650d5e92e2c0f5a5f4f85b
Associated Press,13,Four new astronauts arrive at the International Space Station to replace NASA's evacuated crew,https://apnews.com/article/nasa-spacex-docking-astronauts-3bbcd406388a80468bb85d9c3e300ea2
Associated Press,14,Raccoon goes on drunken rampage in Virginia liquor store and passes out on bathroom floor,https://apnews.com/article/drunk-raccoon-liquor-store-bandit-virginia-5109feb2ea9ab9bf8954ec3798689fd0
Associated Press,15,Freezing reptile dubbed 'Lizard in a blizzard' is rescued after being buried in Rhode Island snow,https://apnews.com/article/lizard-rhode-island-weather-snowstorm-df6f03781484eab4797e1b8a4fdf44a7
Associated Press,16,California homeowner rolls out 'unwelcome' mat for black bear living under his house,https://apnews.com/article/black-bear-california-evicted-crawl-space-8126aa9962e99bf1ae4e45e09659630f
Associated Press,17,"Chicken wings advertised as 'boneless' can have bones, Ohio Supreme Court decides",https://apnews.com/article/boneless-chicken-wings-lawsuit-ohio-supreme-court-231002ea50d8157aeadf093223d539f8
Associated Press,18,Viral '6-7' tops 2025 list of overused words and phrases,https://apnews.com/article/2025-words-slang-phrases-list-university-67-59f896e28b7b16edfdfcc453a8af388a
Associated Press,19,Monkeys are on the loose in St. Louis and AI is complicating efforts to capture them,https://apnews.com/article/monkeys-st-louis-96c55834c7f17854cc4362db891ca8fa
Associated Press,20,Colorectal cancer is rising in younger adults. Here's who is most at risk and symptoms to watch for,https://apnews.com/article/colon-cancer-young-adults-boseman-van-der-beek-7200285f2060145b8369de9ed8db9c17
