site,rank,title,link
Al Jazeera,1,Rizza in Indian-administered Kashmir,https://www.aljazeera.com/video/on-the-ground/2025/5/28/rizza-in-indian-administered-kashmir?traffic_source=rss
Al Jazeera,2,Was the shooting of Israeli embassy staff at Jewish museum a false flag?,https://www.aljazeera.com/news/2025/5/28/was-the-shooting-of-israeli-embassy-staff-at-jewish-museum-a-false-flag?traffic_source=rss
Al Jazeera,3,Life expectancy in Gaza,https://www.aljazeera.com/program/compare-contrast/2025/5/28/life-expectancy-in-gaza?traffic_source=rss
Al Jazeera,4,Israel launches attack on Yemen’s Sanaa airport,https://www.aljazeera.com/news/2025/5/28/israel-launches-attack-on-yemens-sanaa-airport?traffic_source=rss
Al Jazeera,5,"Haliburton, Pacers defeat Knicks in Game 4 of NBA East finals",https://www.aljazeera.com/sports/2025/5/28/haliburton-pacers-defeat-knicks-in-game-4-of-nba-east-finals?traffic_source=rss
Al Jazeera,6,Why are we still hiding periods in 2025?,https://www.aljazeera.com/opinions/2025/5/28/why-are-we-still-hiding-periods-in-2025?traffic_source=rss
Al Jazeera,7,"Ukraine’s Zelenskyy to meet Germany’s Merz in Berlin, seeks more support",https://www.aljazeera.com/news/2025/5/28/ukraines-zelenskyy-to-meet-germanys-merz-in-berlin-seeks-more-support?traffic_source=rss
Al Jazeera,8,Video: SpaceX Starship launch fails as spacecraft spirals out of control,https://www.aljazeera.com/video/newsfeed/2025/5/28/video-spacex-starship-launch-fails-as-spacecraft-spirals-out-of-control?traffic_source=rss
Al Jazeera,9,How has Bitcoin performed since Trump took office?,https://www.aljazeera.com/news/2025/5/28/how-has-bitcoin-performed-since-trump-took-office?traffic_source=rss
Al Jazeera,10,"China hosts Pacific Island nations in bid to bolster diplomatic, trade ties",https://www.aljazeera.com/news/2025/5/28/china-hosts-pacific-island-nations-in-bid-to-bolster-diplomatic-trade-ties?traffic_source=rss
Al Jazeera,11,‘She’s the queen’: Sri Lanka bids farewell to film legend Malini Fonseka,https://www.aljazeera.com/features/2025/5/28/shes-the-queen-sri-lanka-bids-farewell-to-film-legend-malini-fonseka?traffic_source=rss
Al Jazeera,12,"Trump says Canada will pay $61bn for Golden Dome, or become 51st state",https://www.aljazeera.com/news/2025/5/28/trump-says-canada-will-pay-61bn-for-golden-dome-or-become-51st-state?traffic_source=rss
Al Jazeera,13,No death penalty for son of Mexican drug boss ‘El Chapo’: US prosecutors,https://www.aljazeera.com/news/2025/5/28/no-death-penalty-for-son-of-mexican-drug-boss-el-chapo-us-prosecutors?traffic_source=rss
Al Jazeera,14,War of words: Russia’s Medvedev rebukes Trump over Putin social media post,https://www.aljazeera.com/news/2025/5/28/war-of-words-russias-medvedev-rebukes-trump-over-putin-social-media-post?traffic_source=rss
Al Jazeera,15,"UN, aid groups slam US-Israel-backed initiative after deadly rush in Gaza",https://www.aljazeera.com/news/2025/5/28/un-aid-groups-slam-us-israel-backed-initiative-after-deadly-rush-in-gaza?traffic_source=rss
Al Jazeera,16,SpaceX’s Starship test flight loses control 30 minutes after launch,https://www.aljazeera.com/news/2025/5/28/spacexs-starship-test-flight-loses-control-30-minutes-after-launch?traffic_source=rss
Al Jazeera,17,"Russia-Ukraine war: List of key events, day 1,189",https://www.aljazeera.com/news/2025/5/28/russia-ukraine-war-list-of-key-events-day-1189?traffic_source=rss
Al Jazeera,18,Argentinian judge withdraws from a negligence trial about Maradona’s death,https://www.aljazeera.com/news/2025/5/27/argentinian-judge-withdraws-from-negligence-case-over-maradonas-death?traffic_source=rss
Al Jazeera,19,Brazilian prosecutors sue Chinese carmaker BYD over labour conditions,https://www.aljazeera.com/news/2025/5/27/brazilian-prosecutors-sue-chinese-carmaker-byd-over-labour-conditions?traffic_source=rss
Al Jazeera,20,Lamine Yamal signs Barcelona contract extension,https://www.aljazeera.com/sports/2025/5/27/barcelona-reveal-lamine-yamals-new-six-year-contract?traffic_source=rss
