site,rank,title,link
Al Jazeera,1,"Malaysia’s ‘fish hunters’ target invasive species, one catch at a time",https://www.aljazeera.com/news/2025/5/17/malaysias-fish-hunters-target-invasive-species-one-catch-at-a-time?traffic_source=rss
Al Jazeera,2,The US announces first ‘terrorism’ charges for supporting a Mexican cartel,https://www.aljazeera.com/news/2025/5/17/the-us-announces-first-terrorism-charges-for-supporting-a-mexican-cartel?traffic_source=rss
Al Jazeera,3,Moody’s strips US government of top credit rating,https://www.aljazeera.com/economy/2025/5/16/moodys-strips-us-government-of-top-credit-rating?traffic_source=rss
Al Jazeera,4,US Supreme Court blocks the Trump administration’s use of Alien Enemies Act,https://www.aljazeera.com/news/2025/5/16/us-supreme-court-blocks-the-trump-administrations-use-of-alien-enemies-act?traffic_source=rss
Al Jazeera,5,Has Donald Trump taken US-Gulf relations to a new era?,https://www.aljazeera.com/video/inside-story/2025/5/16/has-donald-trump-taken-us-gulf-relations-to-a-new-era?traffic_source=rss
Al Jazeera,6,European leaders consult Trump to align response to Russia-Ukraine talks,https://www.aljazeera.com/news/2025/5/16/europe-and-us-closely-align-in-bid-to-push-russia-towards-ukraine-truce?traffic_source=rss
Al Jazeera,7,‘I cannot stand by’: Former ambassador denounces Ukraine shift under Trump,https://www.aljazeera.com/news/2025/5/16/i-cannot-stand-by-former-ambassador-denounces-ukraine-shift-under-trump?traffic_source=rss
Al Jazeera,8,"‘No soap, no morphine’: Gaza volunteer on life under intensified bombing",https://www.aljazeera.com/video/newsfeed/2025/5/16/no-soap-no-morphine-gaza-aide-worker-describes-life-under-intensified-b?traffic_source=rss
Al Jazeera,9,"Ukraine, Russia agree to mass POW swap",https://www.aljazeera.com/program/newsfeed/2025/5/16/ukraine-russia-agree-to-mass-pow-swap?traffic_source=rss
Al Jazeera,10,FA Cup Final 2025: Guardiola sees win as ‘massively important’ to Man City,https://www.aljazeera.com/sports/2025/5/16/fa-cup-final-2025-guardiola-sees-win-as-massively-important-to-man-city?traffic_source=rss
Al Jazeera,11,World Bank says Syria eligible for new loans after debts cleared,https://www.aljazeera.com/economy/2025/5/16/world-bank-says-syria-eligible-for-new-loans-after-debts-cleared?traffic_source=rss
Al Jazeera,12,"Trump’s ‘big, beautiful bill’ at a crucial juncture",https://www.aljazeera.com/economy/2025/5/16/trumps-big-beautiful-bill-at-a-crucial-juncture?traffic_source=rss
Al Jazeera,13,Five key takeaways from US President Donald Trump’s Middle East trip,https://www.aljazeera.com/news/2025/5/16/five-key-takeaways-from-us-president-donald-trumps-middle-east-trip?traffic_source=rss
Al Jazeera,14,Can Trump end birthright citizenship? The US Supreme Court could decide,https://www.aljazeera.com/video/2025/5/16/can-trump-end-birthright-citizenship-the-us-supreme-court-could-decide?traffic_source=rss
Al Jazeera,15,Malcolm X at 100: Ibram X Kendi looks to the future,https://www.aljazeera.com/program/the-take-2/2025/5/16/aje-onl-usa_ibramxkendi_av_v2-160525?traffic_source=rss
Al Jazeera,16,Israel launches strikes on two Yemen ports,https://www.aljazeera.com/news/2025/5/16/israel-vows-to-kill-houthi-leader-after-striking-yemeni-ports?traffic_source=rss
Al Jazeera,17,Breaking down a deadly week in Gaza as Israel kills hundreds,https://www.aljazeera.com/news/2025/5/16/breaking-down-a-deadly-week-in-gaza-as-israel-kills-hundreds?traffic_source=rss
Al Jazeera,18,NJ Transit workers go on strike after wage increase talks stall,https://www.aljazeera.com/economy/2025/5/16/nj-transit-workers-go-on-strike-after-wage-increase-talks-stall?traffic_source=rss
Al Jazeera,19,Slain Mexican TikTok influencer remembered at funeral,https://www.aljazeera.com/program/newsfeed/2025/5/16/slain-mexican-tiktok-influencer-remembered-at-funeral?traffic_source=rss
Al Jazeera,20,Attacker who stabbed author Salman Rushdie sentenced to 25 years in prison,https://www.aljazeera.com/news/2025/5/16/suspect-in-attack-on-author-salman-rushdie-sentenced-to-25-years-in-prison?traffic_source=rss
