site,rank,title,link
Al Jazeera,1,US National Guard ‘expecting a ramp-up’ in immigration protests: official,https://www.aljazeera.com/news/2025/6/12/national-guard-expecting-a-ramp-up-in-immigration-protests-says-official?traffic_source=rss
Al Jazeera,2,FIFA Club World Cup 2025: Why Real Madrid are joint favourites,https://www.aljazeera.com/sports/2025/6/11/fifa-club-world-cup-2025-the-contenders-series-real-madrid?traffic_source=rss
Al Jazeera,3,Judge rules Trump cannot use foreign policy claim to deport Mahmoud Khalil,https://www.aljazeera.com/news/2025/6/11/judge-rules-trump-cannot-use-foreign-policy-claim-to-deport-mahmoud-khalil?traffic_source=rss
Al Jazeera,4,Unarmed Palestinian brothers killed in Israeli raid on West Bank’s Nablus,https://www.aljazeera.com/news/2025/6/11/unarmed-palestinian-brothers-killed-in-israeli-raid-on-west-banks-nablus?traffic_source=rss
Al Jazeera,5,Pulse massacre survivors in Florida to revisit nightclub before it is razed,https://www.aljazeera.com/news/2025/6/11/pulse-massacre-survivors-in-florida-to-revisit-nightclub-before-it-is-razed?traffic_source=rss
Al Jazeera,6,Fashion brands accused of shortcuts on climate pledges overlooking workers,https://www.aljazeera.com/economy/2025/6/11/fashion-brands-accused-of-shortcuts-on-climate-pledges-overlooking?traffic_source=rss
Al Jazeera,7,What do we know about the US-China trade deal?,https://www.aljazeera.com/economy/2025/6/11/what-do-we-know-about-the-us-china-trade-deal?traffic_source=rss
Al Jazeera,8,Police: Austrian school gunman planned bomb attack,https://www.aljazeera.com/program/newsfeed/2025/6/11/police-austrian-school-gunman-planned-bomb-attack?traffic_source=rss
Al Jazeera,9,"Israeli gunfire, strikes kill 120 Palestinians in Gaza, many at aid sites",https://www.aljazeera.com/news/2025/6/11/israeli-gunfire-strikes-kill-120-palestinians-in-gaza-many-at-aid-sites?traffic_source=rss
Al Jazeera,10,Why Trump’s attempts to make peace in Ukraine will fail,https://www.aljazeera.com/program/the-bottom-line/2025/6/11/why-trumps-attempts-to-make-peace-in-ukraine-will-fail?traffic_source=rss
Al Jazeera,11,20 Palestinian children evacuated by WHO from Gaza,https://www.aljazeera.com/program/newsfeed/2025/6/11/20-palestinian-children-evacuated-by-who-from-gaza?traffic_source=rss
Al Jazeera,12,Large protests in Colombia in support of President Petro’s labour reforms,https://www.aljazeera.com/news/2025/6/11/large-protests-in-colombia-in-support-of-president-petros-labour-reforms?traffic_source=rss
Al Jazeera,13,WTC final: Australia-South Africa – Rabada rebounds with five-for,https://www.aljazeera.com/sports/2025/6/11/wtc-final-australia-south-africa-rabada-rebounds-with-5-wickets?traffic_source=rss
Al Jazeera,14,Disgraced movie mogul Harvey Weinstein guilty of sex crimes in NYC retrial,https://www.aljazeera.com/news/2025/6/11/disgraced-movie-mogul-harvey-weinstein-guilty-of-sex-crimes-in-nyc-retrial?traffic_source=rss
Al Jazeera,15,Shot Colombian presidential candidate shows small signs of improvement,https://www.aljazeera.com/video/newsfeed/2025/6/11/shot-colombian-presidential-candidate-shows-small-signs-of-improvement?traffic_source=rss
Al Jazeera,16,Beach Boys visionary leader Brian Wilson dies at age 82,https://www.aljazeera.com/news/2025/6/11/beach-boys-visionary-leader-brian-wilson-dies-at-age-82?traffic_source=rss
Al Jazeera,17,Was hope of aid for Gaza seized with the Freedom Flotilla?,https://www.aljazeera.com/program/the-take-2/2025/6/11/aj_tt_glb_madleen_video_v4?traffic_source=rss
Al Jazeera,18,UK sanctions Israeli ministers for “inciting violence”,https://www.aljazeera.com/program/quotable/2025/6/11/uk-sanctions-israeli-ministers-for-inciting?traffic_source=rss
Al Jazeera,19,"‘Save what we can’: Economic uncertainty, Trump rhetoric hits US travel",https://www.aljazeera.com/economy/2025/6/11/save-what-we-can-economic-uncertainty-trump-rhetoric-hits-us-travel?traffic_source=rss
Al Jazeera,20,"At least 49 dead in South Africa flooding, students washed away in bus",https://www.aljazeera.com/news/2025/6/11/at-least-49-dead-in-south-africa-flooding-students-washed-away-in-bus?traffic_source=rss
