site,rank,title,link
Al Jazeera,1,Hundreds of bodies pulled from Darfur landslides as many remain trapped,https://www.aljazeera.com/news/2025/9/4/hundreds-of-bodies-pulled-from-darfur-landslides-as-many-remain-trapped?traffic_source=rss
Al Jazeera,2,"In besieged Sudan city, civilians face death if they try to escape",https://www.aljazeera.com/features/2025/9/4/the-rsf-targets-young-men-civilians-speak-out-from-sudans-besieged-city?traffic_source=rss
Al Jazeera,3,"Ukraine vs France: World Cup qualifiers – teams, start, lineups",https://www.aljazeera.com/sports/2025/9/4/ukraine-vs-france-world-cup-qualifiers-teams-start-lineups?traffic_source=rss
Al Jazeera,4,More than 1.5 million displaced by Pakistan floods,https://www.aljazeera.com/video/newsfeed/2025/9/4/more-than-1-5-million-displaced-by-pakistan-floods?traffic_source=rss
Al Jazeera,5,DR Congo announces new Ebola outbreak,https://www.aljazeera.com/news/2025/9/4/dr-congo-announces-new-ebola-outbreak?traffic_source=rss
Al Jazeera,6,"Afghanistan earthquake death toll rises to 2,200",https://www.aljazeera.com/news/2025/9/4/afghanistan-earthquake-death-toll-rises-to-2200?traffic_source=rss
Al Jazeera,7,Judge blocks Trump’s bid to cut $4bn in US foreign aid,https://www.aljazeera.com/news/2025/9/4/judge-blocks-trumps-bid-to-cut-4bn-in-us-foreign-aid?traffic_source=rss
Al Jazeera,8,Can Syria revive its oil wealth to help rebuild the nation?,https://www.aljazeera.com/video/counting-the-cost/2025/9/4/can-syria-revive-its-oil-wealth-to-help-rebuild-the-nation?traffic_source=rss
Al Jazeera,9,US Justice Department launches fraud probe into Fed Gov Lisa Cook: Report,https://www.aljazeera.com/economy/2025/9/4/us-justice-department-launches-fraud-probe-into-fed-gov-lisa-cook-report?traffic_source=rss
Al Jazeera,10,"In boat strike, Trump repurposes ‘war on terror’ for Latin American crime",https://www.aljazeera.com/news/2025/9/4/in-boat-strike-trump-repurposes-war-on-terror-for-latin-american-crime?traffic_source=rss
Al Jazeera,11,LIVE: Bulgaria vs Spain – UEFA World Cup qualifying,https://www.aljazeera.com/sports/liveblog/2025/9/4/live-bulgaria-vs-spain-uefa-world-cup-qualifying?traffic_source=rss
Al Jazeera,12,US accused of ‘illegal massacre’ after strike on Venezuelan boat,https://www.aljazeera.com/video/newsfeed/2025/9/4/us-accused-of-illegal-massacre-after-strike-on-venezuelan-boat-2?traffic_source=rss
Al Jazeera,13,"Washington, DC, files lawsuit to stop Trump deployment of National Guard",https://www.aljazeera.com/news/2025/9/4/washington-dc-files-lawsuit-to-stop-trump-deployment-of-national-guard?traffic_source=rss
Al Jazeera,14,Trump says he has pressured Putin for Ukraine truce: So what has he done?,https://www.aljazeera.com/news/2025/9/4/trump-says-he-has-pressured-putin-for-ukraine-truce-so-what-has-he-done?traffic_source=rss
Al Jazeera,15,Venezuela has the world’s most oil: Why doesn’t it earn more from exports?,https://www.aljazeera.com/news/2025/9/4/venezuela-has-the-worlds-most-oil-why-doesnt-it-earn-more-from-exports?traffic_source=rss
Al Jazeera,16,"Nepal moves to block Facebook, X, YouTube and others",https://www.aljazeera.com/news/2025/9/4/nepal-moves-to-block-facebook-x-youtube-and-others?traffic_source=rss
Al Jazeera,17,Asia Cup 2025: Full squads list of teams and players,https://www.aljazeera.com/sports/2025/9/4/asia-cup-2025-full-squads-list-of-teams-and-players?traffic_source=rss
Al Jazeera,18,Italian fashion icon Giorgio Armani passes away at 91,https://www.aljazeera.com/news/2025/9/4/italian-fashion-icon-giorgio-armani-passes-away-at-91?traffic_source=rss
Al Jazeera,19,Film recounting Hind Rajab’s final plea breaks record at premiere,https://www.aljazeera.com/video/newsfeed/2025/9/4/film-recounting-hind-rajabs-final-plea-breaks-record-at-premiere?traffic_source=rss
Al Jazeera,20,Video: Mandela’s grandson says joining Gaza flotilla is ‘family legacy’,https://www.aljazeera.com/video/newsfeed/2025/9/4/video-mandelas-grandson-says-joining-gaza-flotilla-is-family?traffic_source=rss
