site,rank,title,link
Al Jazeera,1,Iran’s authorities warn against protests as Israel threatens Basij forces,https://www.aljazeera.com/news/2026/3/12/irans-authorities-warn-against-protests-as-israel-threatens-basij-forces?traffic_source=rss
Al Jazeera,2,Qatar PM urges resilience and unity amid Iran strikes,https://www.aljazeera.com/video/newsfeed/2026/3/12/qatar-pm-urges-resilience-and-unity-amid-iran-strikes?traffic_source=rss
Al Jazeera,3,"Eight Arab, Islamic countries condemn Israeli closure of Al-Aqsa Mosque",https://www.aljazeera.com/news/2026/3/12/eight-arab-islamic-countries-condemn-israeli-closure-of-al-aqsa-mosque?traffic_source=rss
Al Jazeera,4,"Iran war live: Oil tankers hit in Iraq, Tehran sets 3 conditions for peace",https://www.aljazeera.com/news/liveblog/2026/3/12/iran-war-live-oil-tankers-hit-in-iraq-tehran-sets-3-conditions-for-peace?traffic_source=rss
Al Jazeera,5,‘Proud as a Qatari’: Country’s PM salutes resilience amid Iranian attacks,https://www.aljazeera.com/news/2026/3/11/proud-as-a-qatari-countrys-pm-salutes-resilience-amid-iranian-attacks?traffic_source=rss
Al Jazeera,6,Massive fires on two oil tankers after attack in Iraqi waters,https://www.aljazeera.com/video/newsfeed/2026/3/11/massive-fires-on-two-oil-tankers-after-attack-in-iraqi-waters?traffic_source=rss
Al Jazeera,7,New files show British PM warned of ‘reputational risks’ with Mandelson,https://www.aljazeera.com/news/2026/3/11/new-files-show-british-pm-warned-of-reputational-risks-with-mandelson?traffic_source=rss
Al Jazeera,8,Trump: ‘I don’t know’ about report US at fault in school strike,https://www.aljazeera.com/video/newsfeed/2026/3/11/trump-i-dont-know-about-report-us-at-fault-in-school-strike?traffic_source=rss
Al Jazeera,9,South Africa summons new US ambassador over ‘undiplomatic remarks’,https://www.aljazeera.com/news/2026/3/11/south-africa-summons-new-us-ambassador-over-undiplomatic-remarks?traffic_source=rss
Al Jazeera,10,Iran-linked hackers hit medical giant Stryker in retaliatory cyberattack,https://www.aljazeera.com/news/2026/3/11/iran-linked-hackers-hit-medical-giant-stryker-in-retaliatory-cyberattack?traffic_source=rss
Al Jazeera,11,Valverde hat-trick gives Real Madrid 3-0 Champions League win over Man City,https://www.aljazeera.com/sports/2026/3/11/valverde-hat-trick-gives-real-madrid-3-0-champions-league-win-over-man-city?traffic_source=rss
Al Jazeera,12,How Trump has addressed the deadly Iran school bombing,https://www.aljazeera.com/news/2026/3/11/how-trump-has-addressed-the-deadly-iran-school-bombing?traffic_source=rss
Al Jazeera,13,UN Security Council adopts Gulf countries’ draft resolution,https://www.aljazeera.com/video/newsfeed/2026/3/11/un-security-council-adopts-gulf-countries-draft-resolution-2?traffic_source=rss
Al Jazeera,14,Ecuador prepares for attack on ‘criminal economy’ with Trump backing,https://www.aljazeera.com/news/2026/3/11/ecuador-prepares-for-attack-on-criminal-economy-with-trump-backing?traffic_source=rss
Al Jazeera,15,Displaced Lebanese families seek refuge in school shelter,https://www.aljazeera.com/video/newsfeed/2026/3/11/displaced-lebanese-families-seek-refuge-in-school-shelter?traffic_source=rss
Al Jazeera,16,Why does Iran war pose more dilemmas for Europe?,https://www.aljazeera.com/video/inside-story/2026/3/11/why-does-the-iran-war-pose-more-dilemmas-for-europe?traffic_source=rss
Al Jazeera,17,Two killed as tornadoes sweep across US Midwest in latest extreme weather,https://www.aljazeera.com/news/2026/3/11/two-killed-as-tornadoes-sweep-across-us-midwest-in-latest-extreme-weather?traffic_source=rss
Al Jazeera,18,UN’s failure to stop Iranian attacks sending ‘dangerous signal’: Qatar,https://www.aljazeera.com/news/2026/3/11/uns-failure-to-stop-iranian-attacks-sending-dangerous-signal-qatar?traffic_source=rss
Al Jazeera,19,Three brothers arrested in Norway over bomb attack on US embassy in Oslo,https://www.aljazeera.com/news/2026/3/11/three-brothers-arrested-in-norway-over-bomb-attack-on-us-embassy-in-oslo?traffic_source=rss
Al Jazeera,20,Six die in Swiss bus fire after man thought to have set himself alight,https://www.aljazeera.com/news/2026/3/11/six-die-in-swiss-bus-fire-after-man-thought-to-have-set-himself-alight?traffic_source=rss
Associated Press,1,Lords a-leaving: Britain is ejecting hereditary nobles from Parliament after 700 years,https://apnews.com/article/uk-house-of-lords-hereditary-peers-expelled-535df8781dd01e8970acda1dca99d3d4
Associated Press,2,Analysis: Iran war becomes a contest of who can take the most pain,https://apnews.com/article/iran-us-israel-war-attrition-analysis-5d7e50c3a6da57414bbf4a5e255e4a7e
Associated Press,3,"Tornadoes kill 2 in northwestern Indiana and raze buildings in Kankakee, Illinois",https://apnews.com/article/tornado-severe-weather-illinois-indiana-midwest-dce09b60816c498aad9c2a79c18285c1
Associated Press,4,Some states are reviving a push to tax the rich,https://apnews.com/article/millionaires-tax-states-democrats-f2562529db02531d1bd30ee2312da649
Associated Press,5,"Severe storms whip up tornadoes in Illinois and Indiana, leveling homes",https://apnews.com/article/tornado-severe-damage-chicago-illinois-state-9f1e92dfa41e20a99fa5789a1804cde0
Associated Press,6,Pentagon blocks photographers from Hegseth's briefings on the Iran war,https://apnews.com/article/hegseth-pentagon-briefings-photographers-ad0cc21ad17d299c90284788fba62b5a
Associated Press,7,Trump has one prescription for midterms. House Republicans have another,https://apnews.com/article/election-2026-house-republicans-trump-65b222e909729f3f1b619be353e6deb9
Associated Press,8,Jill Biden opens up in memoir about Joe Biden's decision to end his 2024 reelection bid,https://apnews.com/article/jill-biden-memoir-joe-2024-presidential-campaign-1b262b2148a945f101c6268e0d568ac4
Associated Press,9,"MLB report settles World Series Game 7 plate drama: IKF was out by feet, not inches",https://apnews.com/article/isiah-kiner-falefa-world-series-lead-c2ff4ce64859f63a62fbb1e13e290f35
Associated Press,10,"Bam! Heat's Adebayo scores 83 points, 2nd only to Wilt Chamberlain in NBA history",https://apnews.com/article/bam-adebayo-heat-scoring-f867bb9f002c075d25e5fb3fc718d6db
Associated Press,11,"Ravens nix trade for Raiders' Crosby after he fails physical, pivot to Hendrickson, AP source says",https://apnews.com/article/raiders-ravens-maxx-crosby-trade-agreement-abe432e2db31c4bc9432e18832c2b20f
Associated Press,12,Famed conductor says Chalamet shows ignorance in claiming 'no one cares' about opera and ballet,https://apnews.com/article/chalamet-dudamel-opera-ballet-dd06c4ca0709f878817001c28c34d975
Associated Press,13,"Ken Follett's next epic heads to Victorian Britain, where strict morals meet secret passions",https://apnews.com/article/ken-follett-novel-victorian-historical-374b11e3b10587dbdef13257673f9e68
Associated Press,14,"As another shutdown impacts travelers, some see eliminating TSA agents as a solution",https://apnews.com/article/tsa-screening-airports-private-security-government-shutdown-dab3734d194d03a29e4b16fcbea3b0db
Associated Press,15,"Cyberattack disrupts Stryker's global networks, US medical equipment company says",https://apnews.com/article/stryker-cyberattack-iran-medical-equipment-products-8dd418618a3bd4fa4c97caf7978c11ee
Associated Press,16,New drone maker partly owned by Trump sons hopes to win Pentagon contracts,https://apnews.com/article/drones-eric-donald-trump-powerus-iran-defense-089bff3892f921a10ef4ec785308e716
Associated Press,17,Old NASA science satellite plunges back to Earth,https://apnews.com/article/nasa-van-allen-probe-satellite-galapagos-0588d312ed0af15316a4c25a85500aca
Associated Press,18,FACT FOCUS: The Trump administration is falsely claiming Jimmy Carter was against mail-in voting,https://apnews.com/article/fact-check-trump-jimmy-carter-mail-absentee-ballots-fraud-c5ae733c697d0b440f37b632d9b4caea
Associated Press,19,"A red fox stows away on a cargo ship, traveling from England to US",https://apnews.com/article/fox-stowaway-ship-england-us-bronx-zoo-fd4c5eaef207d8fffc6408f7671867c0
Associated Press,20,Viral phenomenon in Argentina has young people identifying themselves as animals,https://apnews.com/article/argentina-teenagers-identifying-as-animals-therians-tiktok-54d158c4842f6515e31d83a260cdf31f
